[
  {
    "patient_id": "P0000",
    "basic_info": {
      "age": 62,
      "gender": "Female",
      "admission_date": "2024-10-24"
    },
    "vitals": {
      "temperature": 38.7,
      "heart_rate": 119,
      "respiratory_rate": 25,
      "blood_pressure": "131/90",
      "oxygen_saturation": 88
    },
    "symptoms": [
      "wheezing",
      "tachypnea",
      "sputum production",
      "chills",
      "muscle aches"
    ],
    "medications": [
      {
        "name": "Ibuprofen",
        "dosage": "400mg",
        "frequency": "every 6 hours as needed"
      },
      {
        "name": "Guaifenesin",
        "dosage": "400mg",
        "frequency": "every 4 hours as needed"
      }
    ],
    "comorbidities": [
      "COPD",
      "Coronary Artery Disease"
    ],
    "diagnosis": "Normal",
    "note_text": "\nCLINICAL NOTE\n============\nPatient ID: P0000\nDate: 2024-10-24\n\nPATIENT INFORMATION\n------------------\nAge: 62\nGender: Female\nAdmission Date: 2024-10-24\n\nVITAL SIGNS\n----------\nTemperature: 38.7\u00b0C\nHeart Rate: 119 bpm\nRespiratory Rate: 25 /min\nBlood Pressure: 131/90 mmHg\nO2 Saturation: 88%\n\nPRESENTING SYMPTOMS\n-----------------\n- wheezing\n- tachypnea\n- sputum production\n- chills\n- muscle aches\n\nMEDICAL HISTORY\n-------------\nComorbidities: COPD, Coronary Artery Disease\n\nMEDICATIONS\n----------\n- Ibuprofen 400mg every 6 hours as needed\n- Guaifenesin 400mg every 4 hours as needed\n\nASSESSMENT\n---------\nChest X-ray shows no active pulmonary disease.\n\nPLAN\n----\n1. Symptomatic treatment as needed\n2. Return if symptoms worsen\n3. Regular health maintenance\n",
    "image_path": "demo_dataset\\NORMAL\\IM-0009-0001.jpeg"
  },
  {
    "patient_id": "P0001",
    "basic_info": {
      "age": 81,
      "gender": "Male",
      "admission_date": "2024-10-17"
    },
    "vitals": {
      "temperature": 37.5,
      "heart_rate": 105,
      "respiratory_rate": 25,
      "blood_pressure": "121/63",
      "oxygen_saturation": 91
    },
    "symptoms": [
      "tachypnea",
      "sputum production",
      "fever"
    ],
    "medications": [
      {
        "name": "Ibuprofen",
        "dosage": "400mg",
        "frequency": "every 6 hours as needed"
      }
    ],
    "comorbidities": [
      "Diabetes Type 2"
    ],
    "diagnosis": "Normal",
    "note_text": "\nCLINICAL NOTE\n============\nPatient ID: P0001\nDate: 2024-10-17\n\nPATIENT INFORMATION\n------------------\nAge: 81\nGender: Male\nAdmission Date: 2024-10-17\n\nVITAL SIGNS\n----------\nTemperature: 37.5\u00b0C\nHeart Rate: 105 bpm\nRespiratory Rate: 25 /min\nBlood Pressure: 121/63 mmHg\nO2 Saturation: 91%\n\nPRESENTING SYMPTOMS\n-----------------\n- tachypnea\n- sputum production\n- fever\n\nMEDICAL HISTORY\n-------------\nComorbidities: Diabetes Type 2\n\nMEDICATIONS\n----------\n- Ibuprofen 400mg every 6 hours as needed\n\nASSESSMENT\n---------\nChest X-ray shows no active pulmonary disease.\n\nPLAN\n----\n1. Symptomatic treatment as needed\n2. Return if symptoms worsen\n3. Regular health maintenance\n",
    "image_path": "demo_dataset\\NORMAL\\IM-0011-0001-0001.jpeg"
  },
  {
    "patient_id": "P0002",
    "basic_info": {
      "age": 71,
      "gender": "Female",
      "admission_date": "2024-10-26"
    },
    "vitals": {
      "temperature": 38.8,
      "heart_rate": 98,
      "respiratory_rate": 27,
      "blood_pressure": "126/61",
      "oxygen_saturation": 90
    },
    "symptoms": [
      "tachypnea",
      "fatigue",
      "sweating"
    ],
    "medications": [
      {
        "name": "Ibuprofen",
        "dosage": "400mg",
        "frequency": "every 6 hours as needed"
      }
    ],
    "comorbidities": [
      "Obesity",
      "Diabetes Type 2",
      "Chronic Kidney Disease"
    ],
    "diagnosis": "Normal",
    "note_text": "\nCLINICAL NOTE\n============\nPatient ID: P0002\nDate: 2024-10-26\n\nPATIENT INFORMATION\n------------------\nAge: 71\nGender: Female\nAdmission Date: 2024-10-26\n\nVITAL SIGNS\n----------\nTemperature: 38.8\u00b0C\nHeart Rate: 98 bpm\nRespiratory Rate: 27 /min\nBlood Pressure: 126/61 mmHg\nO2 Saturation: 90%\n\nPRESENTING SYMPTOMS\n-----------------\n- tachypnea\n- fatigue\n- sweating\n\nMEDICAL HISTORY\n-------------\nComorbidities: Obesity, Diabetes Type 2, Chronic Kidney Disease\n\nMEDICATIONS\n----------\n- Ibuprofen 400mg every 6 hours as needed\n\nASSESSMENT\n---------\nChest X-ray shows no active pulmonary disease.\n\nPLAN\n----\n1. Symptomatic treatment as needed\n2. Return if symptoms worsen\n3. Regular health maintenance\n",
    "image_path": "demo_dataset\\NORMAL\\IM-0017-0001.jpeg"
  },
  {
    "patient_id": "P0003",
    "basic_info": {
      "age": 36,
      "gender": "Female",
      "admission_date": "2024-10-25"
    },
    "vitals": {
      "temperature": 37.9,
      "heart_rate": 81,
      "respiratory_rate": 20,
      "blood_pressure": "130/69",
      "oxygen_saturation": 89
    },
    "symptoms": [
      "chest pain",
      "wheezing",
      "dyspnea",
      "muscle aches",
      "fatigue"
    ],
    "medications": [
      {
        "name": "Acetaminophen",
        "dosage": "650mg",
        "frequency": "every 6 hours as needed"
      }
    ],
    "comorbidities": [
      "COPD",
      "Asthma",
      "Diabetes Type 2"
    ],
    "diagnosis": "Normal",
    "note_text": "\nCLINICAL NOTE\n============\nPatient ID: P0003\nDate: 2024-10-25\n\nPATIENT INFORMATION\n------------------\nAge: 36\nGender: Female\nAdmission Date: 2024-10-25\n\nVITAL SIGNS\n----------\nTemperature: 37.9\u00b0C\nHeart Rate: 81 bpm\nRespiratory Rate: 20 /min\nBlood Pressure: 130/69 mmHg\nO2 Saturation: 89%\n\nPRESENTING SYMPTOMS\n-----------------\n- chest pain\n- wheezing\n- dyspnea\n- muscle aches\n- fatigue\n\nMEDICAL HISTORY\n-------------\nComorbidities: COPD, Asthma, Diabetes Type 2\n\nMEDICATIONS\n----------\n- Acetaminophen 650mg every 6 hours as needed\n\nASSESSMENT\n---------\nChest X-ray shows no active pulmonary disease.\n\nPLAN\n----\n1. Symptomatic treatment as needed\n2. Return if symptoms worsen\n3. Regular health maintenance\n",
    "image_path": "demo_dataset\\NORMAL\\IM-0019-0001.jpeg"
  },
  {
    "patient_id": "P0004",
    "basic_info": {
      "age": 48,
      "gender": "Female",
      "admission_date": "2024-10-21"
    },
    "vitals": {
      "temperature": 38.1,
      "heart_rate": 92,
      "respiratory_rate": 27,
      "blood_pressure": "139/74",
      "oxygen_saturation": 93
    },
    "symptoms": [
      "shallow breathing",
      "wheezing",
      "fever",
      "muscle aches"
    ],
    "medications": [
      {
        "name": "Acetaminophen",
        "dosage": "650mg",
        "frequency": "every 6 hours as needed"
      },
      {
        "name": "Ibuprofen",
        "dosage": "400mg",
        "frequency": "every 6 hours as needed"
      }
    ],
    "comorbidities": [
      "Obesity"
    ],
    "diagnosis": "Normal",
    "note_text": "\nCLINICAL NOTE\n============\nPatient ID: P0004\nDate: 2024-10-21\n\nPATIENT INFORMATION\n------------------\nAge: 48\nGender: Female\nAdmission Date: 2024-10-21\n\nVITAL SIGNS\n----------\nTemperature: 38.1\u00b0C\nHeart Rate: 92 bpm\nRespiratory Rate: 27 /min\nBlood Pressure: 139/74 mmHg\nO2 Saturation: 93%\n\nPRESENTING SYMPTOMS\n-----------------\n- shallow breathing\n- wheezing\n- fever\n- muscle aches\n\nMEDICAL HISTORY\n-------------\nComorbidities: Obesity\n\nMEDICATIONS\n----------\n- Acetaminophen 650mg every 6 hours as needed\n- Ibuprofen 400mg every 6 hours as needed\n\nASSESSMENT\n---------\nChest X-ray shows no active pulmonary disease.\n\nPLAN\n----\n1. Symptomatic treatment as needed\n2. Return if symptoms worsen\n3. Regular health maintenance\n",
    "image_path": "demo_dataset\\NORMAL\\IM-0021-0001.jpeg"
  },
  {
    "patient_id": "P0005",
    "basic_info": {
      "age": 80,
      "gender": "Male",
      "admission_date": "2024-10-16"
    },
    "vitals": {
      "temperature": 38.0,
      "heart_rate": 112,
      "respiratory_rate": 29,
      "blood_pressure": "133/81",
      "oxygen_saturation": 94
    },
    "symptoms": [
      "tachypnea",
      "dyspnea",
      "fatigue",
      "sweating"
    ],
    "medications": [
      {
        "name": "Acetaminophen",
        "dosage": "650mg",
        "frequency": "every 6 hours as needed"
      }
    ],
    "comorbidities": [],
    "diagnosis": "Normal",
    "note_text": "\nCLINICAL NOTE\n============\nPatient ID: P0005\nDate: 2024-10-16\n\nPATIENT INFORMATION\n------------------\nAge: 80\nGender: Male\nAdmission Date: 2024-10-16\n\nVITAL SIGNS\n----------\nTemperature: 38.0\u00b0C\nHeart Rate: 112 bpm\nRespiratory Rate: 29 /min\nBlood Pressure: 133/81 mmHg\nO2 Saturation: 94%\n\nPRESENTING SYMPTOMS\n-----------------\n- tachypnea\n- dyspnea\n- fatigue\n- sweating\n\nMEDICAL HISTORY\n-------------\nComorbidities: None\n\nMEDICATIONS\n----------\n- Acetaminophen 650mg every 6 hours as needed\n\nASSESSMENT\n---------\nChest X-ray shows no active pulmonary disease.\n\nPLAN\n----\n1. Symptomatic treatment as needed\n2. Return if symptoms worsen\n3. Regular health maintenance\n",
    "image_path": "demo_dataset\\NORMAL\\IM-0023-0001.jpeg"
  },
  {
    "patient_id": "P0006",
    "basic_info": {
      "age": 30,
      "gender": "Female",
      "admission_date": "2024-10-23"
    },
    "vitals": {
      "temperature": 37.7,
      "heart_rate": 89,
      "respiratory_rate": 21,
      "blood_pressure": "129/66",
      "oxygen_saturation": 93
    },
    "symptoms": [
      "chest pain",
      "decreased appetite",
      "muscle aches"
    ],
    "medications": [
      {
        "name": "Acetaminophen",
        "dosage": "650mg",
        "frequency": "every 6 hours as needed"
      },
      {
        "name": "Ibuprofen",
        "dosage": "400mg",
        "frequency": "every 6 hours as needed"
      }
    ],
    "comorbidities": [
      "COPD"
    ],
    "diagnosis": "Normal",
    "note_text": "\nCLINICAL NOTE\n============\nPatient ID: P0006\nDate: 2024-10-23\n\nPATIENT INFORMATION\n------------------\nAge: 30\nGender: Female\nAdmission Date: 2024-10-23\n\nVITAL SIGNS\n----------\nTemperature: 37.7\u00b0C\nHeart Rate: 89 bpm\nRespiratory Rate: 21 /min\nBlood Pressure: 129/66 mmHg\nO2 Saturation: 93%\n\nPRESENTING SYMPTOMS\n-----------------\n- chest pain\n- decreased appetite\n- muscle aches\n\nMEDICAL HISTORY\n-------------\nComorbidities: COPD\n\nMEDICATIONS\n----------\n- Acetaminophen 650mg every 6 hours as needed\n- Ibuprofen 400mg every 6 hours as needed\n\nASSESSMENT\n---------\nChest X-ray shows no active pulmonary disease.\n\nPLAN\n----\n1. Symptomatic treatment as needed\n2. Return if symptoms worsen\n3. Regular health maintenance\n",
    "image_path": "demo_dataset\\NORMAL\\IM-0027-0001.jpeg"
  },
  {
    "patient_id": "P0007",
    "basic_info": {
      "age": 39,
      "gender": "Female",
      "admission_date": "2024-10-20"
    },
    "vitals": {
      "temperature": 38.1,
      "heart_rate": 116,
      "respiratory_rate": 29,
      "blood_pressure": "120/62",
      "oxygen_saturation": 90
    },
    "symptoms": [
      "dyspnea",
      "tachypnea",
      "decreased appetite"
    ],
    "medications": [
      {
        "name": "Acetaminophen",
        "dosage": "650mg",
        "frequency": "every 6 hours as needed"
      },
      {
        "name": "Ibuprofen",
        "dosage": "400mg",
        "frequency": "every 6 hours as needed"
      }
    ],
    "comorbidities": [],
    "diagnosis": "Normal",
    "note_text": "\nCLINICAL NOTE\n============\nPatient ID: P0007\nDate: 2024-10-20\n\nPATIENT INFORMATION\n------------------\nAge: 39\nGender: Female\nAdmission Date: 2024-10-20\n\nVITAL SIGNS\n----------\nTemperature: 38.1\u00b0C\nHeart Rate: 116 bpm\nRespiratory Rate: 29 /min\nBlood Pressure: 120/62 mmHg\nO2 Saturation: 90%\n\nPRESENTING SYMPTOMS\n-----------------\n- dyspnea\n- tachypnea\n- decreased appetite\n\nMEDICAL HISTORY\n-------------\nComorbidities: None\n\nMEDICATIONS\n----------\n- Acetaminophen 650mg every 6 hours as needed\n- Ibuprofen 400mg every 6 hours as needed\n\nASSESSMENT\n---------\nChest X-ray shows no active pulmonary disease.\n\nPLAN\n----\n1. Symptomatic treatment as needed\n2. Return if symptoms worsen\n3. Regular health maintenance\n",
    "image_path": "demo_dataset\\NORMAL\\IM-0028-0001.jpeg"
  },
  {
    "patient_id": "P0008",
    "basic_info": {
      "age": 82,
      "gender": "Male",
      "admission_date": "2024-10-23"
    },
    "vitals": {
      "temperature": 37.8,
      "heart_rate": 111,
      "respiratory_rate": 23,
      "blood_pressure": "130/60",
      "oxygen_saturation": 94
    },
    "symptoms": [
      "dyspnea",
      "cough",
      "chest pain",
      "muscle aches",
      "sweating"
    ],
    "medications": [
      {
        "name": "Guaifenesin",
        "dosage": "400mg",
        "frequency": "every 4 hours as needed"
      },
      {
        "name": "Acetaminophen",
        "dosage": "650mg",
        "frequency": "every 6 hours as needed"
      }
    ],
    "comorbidities": [
      "Coronary Artery Disease",
      "Chronic Kidney Disease"
    ],
    "diagnosis": "Normal",
    "note_text": "\nCLINICAL NOTE\n============\nPatient ID: P0008\nDate: 2024-10-23\n\nPATIENT INFORMATION\n------------------\nAge: 82\nGender: Male\nAdmission Date: 2024-10-23\n\nVITAL SIGNS\n----------\nTemperature: 37.8\u00b0C\nHeart Rate: 111 bpm\nRespiratory Rate: 23 /min\nBlood Pressure: 130/60 mmHg\nO2 Saturation: 94%\n\nPRESENTING SYMPTOMS\n-----------------\n- dyspnea\n- cough\n- chest pain\n- muscle aches\n- sweating\n\nMEDICAL HISTORY\n-------------\nComorbidities: Coronary Artery Disease, Chronic Kidney Disease\n\nMEDICATIONS\n----------\n- Guaifenesin 400mg every 4 hours as needed\n- Acetaminophen 650mg every 6 hours as needed\n\nASSESSMENT\n---------\nChest X-ray shows no active pulmonary disease.\n\nPLAN\n----\n1. Symptomatic treatment as needed\n2. Return if symptoms worsen\n3. Regular health maintenance\n",
    "image_path": "demo_dataset\\NORMAL\\IM-0031-0001.jpeg"
  },
  {
    "patient_id": "P0009",
    "basic_info": {
      "age": 20,
      "gender": "Female",
      "admission_date": "2024-10-15"
    },
    "vitals": {
      "temperature": 39.0,
      "heart_rate": 98,
      "respiratory_rate": 26,
      "blood_pressure": "131/76",
      "oxygen_saturation": 91
    },
    "symptoms": [
      "chest pain",
      "tachypnea",
      "malaise"
    ],
    "medications": [
      {
        "name": "Guaifenesin",
        "dosage": "400mg",
        "frequency": "every 4 hours as needed"
      },
      {
        "name": "Acetaminophen",
        "dosage": "650mg",
        "frequency": "every 6 hours as needed"
      }
    ],
    "comorbidities": [],
    "diagnosis": "Normal",
    "note_text": "\nCLINICAL NOTE\n============\nPatient ID: P0009\nDate: 2024-10-15\n\nPATIENT INFORMATION\n------------------\nAge: 20\nGender: Female\nAdmission Date: 2024-10-15\n\nVITAL SIGNS\n----------\nTemperature: 39.0\u00b0C\nHeart Rate: 98 bpm\nRespiratory Rate: 26 /min\nBlood Pressure: 131/76 mmHg\nO2 Saturation: 91%\n\nPRESENTING SYMPTOMS\n-----------------\n- chest pain\n- tachypnea\n- malaise\n\nMEDICAL HISTORY\n-------------\nComorbidities: None\n\nMEDICATIONS\n----------\n- Guaifenesin 400mg every 4 hours as needed\n- Acetaminophen 650mg every 6 hours as needed\n\nASSESSMENT\n---------\nChest X-ray shows no active pulmonary disease.\n\nPLAN\n----\n1. Symptomatic treatment as needed\n2. Return if symptoms worsen\n3. Regular health maintenance\n",
    "image_path": "demo_dataset\\NORMAL\\IM-0033-0001-0001.jpeg"
  },
  {
    "patient_id": "P0010",
    "basic_info": {
      "age": 77,
      "gender": "Male",
      "admission_date": "2024-10-20"
    },
    "vitals": {
      "temperature": 37.9,
      "heart_rate": 82,
      "respiratory_rate": 30,
      "blood_pressure": "118/70",
      "oxygen_saturation": 90
    },
    "symptoms": [
      "shallow breathing",
      "fever",
      "malaise"
    ],
    "medications": [
      {
        "name": "Acetaminophen",
        "dosage": "650mg",
        "frequency": "every 6 hours as needed"
      }
    ],
    "comorbidities": [
      "Coronary Artery Disease",
      "COPD"
    ],
    "diagnosis": "Normal",
    "note_text": "\nCLINICAL NOTE\n============\nPatient ID: P0010\nDate: 2024-10-20\n\nPATIENT INFORMATION\n------------------\nAge: 77\nGender: Male\nAdmission Date: 2024-10-20\n\nVITAL SIGNS\n----------\nTemperature: 37.9\u00b0C\nHeart Rate: 82 bpm\nRespiratory Rate: 30 /min\nBlood Pressure: 118/70 mmHg\nO2 Saturation: 90%\n\nPRESENTING SYMPTOMS\n-----------------\n- shallow breathing\n- fever\n- malaise\n\nMEDICAL HISTORY\n-------------\nComorbidities: Coronary Artery Disease, COPD\n\nMEDICATIONS\n----------\n- Acetaminophen 650mg every 6 hours as needed\n\nASSESSMENT\n---------\nChest X-ray shows no active pulmonary disease.\n\nPLAN\n----\n1. Symptomatic treatment as needed\n2. Return if symptoms worsen\n3. Regular health maintenance\n",
    "image_path": "demo_dataset\\NORMAL\\IM-0033-0001-0002.jpeg"
  },
  {
    "patient_id": "P0011",
    "basic_info": {
      "age": 55,
      "gender": "Female",
      "admission_date": "2024-10-14"
    },
    "vitals": {
      "temperature": 38.0,
      "heart_rate": 99,
      "respiratory_rate": 30,
      "blood_pressure": "123/90",
      "oxygen_saturation": 89
    },
    "symptoms": [
      "sputum production",
      "chest pain",
      "sweating",
      "fever"
    ],
    "medications": [
      {
        "name": "Guaifenesin",
        "dosage": "400mg",
        "frequency": "every 4 hours as needed"
      }
    ],
    "comorbidities": [
      "COPD"
    ],
    "diagnosis": "Normal",
    "note_text": "\nCLINICAL NOTE\n============\nPatient ID: P0011\nDate: 2024-10-14\n\nPATIENT INFORMATION\n------------------\nAge: 55\nGender: Female\nAdmission Date: 2024-10-14\n\nVITAL SIGNS\n----------\nTemperature: 38.0\u00b0C\nHeart Rate: 99 bpm\nRespiratory Rate: 30 /min\nBlood Pressure: 123/90 mmHg\nO2 Saturation: 89%\n\nPRESENTING SYMPTOMS\n-----------------\n- sputum production\n- chest pain\n- sweating\n- fever\n\nMEDICAL HISTORY\n-------------\nComorbidities: COPD\n\nMEDICATIONS\n----------\n- Guaifenesin 400mg every 4 hours as needed\n\nASSESSMENT\n---------\nChest X-ray shows no active pulmonary disease.\n\nPLAN\n----\n1. Symptomatic treatment as needed\n2. Return if symptoms worsen\n3. Regular health maintenance\n",
    "image_path": "demo_dataset\\NORMAL\\IM-0036-0001.jpeg"
  },
  {
    "patient_id": "P0012",
    "basic_info": {
      "age": 40,
      "gender": "Female",
      "admission_date": "2024-10-16"
    },
    "vitals": {
      "temperature": 38.2,
      "heart_rate": 119,
      "respiratory_rate": 28,
      "blood_pressure": "116/75",
      "oxygen_saturation": 88
    },
    "symptoms": [
      "sputum production",
      "chest pain",
      "shallow breathing",
      "chills"
    ],
    "medications": [
      {
        "name": "Ibuprofen",
        "dosage": "400mg",
        "frequency": "every 6 hours as needed"
      },
      {
        "name": "Guaifenesin",
        "dosage": "400mg",
        "frequency": "every 4 hours as needed"
      }
    ],
    "comorbidities": [
      "Hypertension",
      "Coronary Artery Disease"
    ],
    "diagnosis": "Normal",
    "note_text": "\nCLINICAL NOTE\n============\nPatient ID: P0012\nDate: 2024-10-16\n\nPATIENT INFORMATION\n------------------\nAge: 40\nGender: Female\nAdmission Date: 2024-10-16\n\nVITAL SIGNS\n----------\nTemperature: 38.2\u00b0C\nHeart Rate: 119 bpm\nRespiratory Rate: 28 /min\nBlood Pressure: 116/75 mmHg\nO2 Saturation: 88%\n\nPRESENTING SYMPTOMS\n-----------------\n- sputum production\n- chest pain\n- shallow breathing\n- chills\n\nMEDICAL HISTORY\n-------------\nComorbidities: Hypertension, Coronary Artery Disease\n\nMEDICATIONS\n----------\n- Ibuprofen 400mg every 6 hours as needed\n- Guaifenesin 400mg every 4 hours as needed\n\nASSESSMENT\n---------\nChest X-ray shows no active pulmonary disease.\n\nPLAN\n----\n1. Symptomatic treatment as needed\n2. Return if symptoms worsen\n3. Regular health maintenance\n",
    "image_path": "demo_dataset\\NORMAL\\IM-0037-0001.jpeg"
  },
  {
    "patient_id": "P0013",
    "basic_info": {
      "age": 65,
      "gender": "Male",
      "admission_date": "2024-10-18"
    },
    "vitals": {
      "temperature": 38.0,
      "heart_rate": 115,
      "respiratory_rate": 23,
      "blood_pressure": "132/74",
      "oxygen_saturation": 91
    },
    "symptoms": [
      "shallow breathing",
      "muscle aches"
    ],
    "medications": [
      {
        "name": "Acetaminophen",
        "dosage": "650mg",
        "frequency": "every 6 hours as needed"
      },
      {
        "name": "Guaifenesin",
        "dosage": "400mg",
        "frequency": "every 4 hours as needed"
      }
    ],
    "comorbidities": [],
    "diagnosis": "Normal",
    "note_text": "\nCLINICAL NOTE\n============\nPatient ID: P0013\nDate: 2024-10-18\n\nPATIENT INFORMATION\n------------------\nAge: 65\nGender: Male\nAdmission Date: 2024-10-18\n\nVITAL SIGNS\n----------\nTemperature: 38.0\u00b0C\nHeart Rate: 115 bpm\nRespiratory Rate: 23 /min\nBlood Pressure: 132/74 mmHg\nO2 Saturation: 91%\n\nPRESENTING SYMPTOMS\n-----------------\n- shallow breathing\n- muscle aches\n\nMEDICAL HISTORY\n-------------\nComorbidities: None\n\nMEDICATIONS\n----------\n- Acetaminophen 650mg every 6 hours as needed\n- Guaifenesin 400mg every 4 hours as needed\n\nASSESSMENT\n---------\nChest X-ray shows no active pulmonary disease.\n\nPLAN\n----\n1. Symptomatic treatment as needed\n2. Return if symptoms worsen\n3. Regular health maintenance\n",
    "image_path": "demo_dataset\\NORMAL\\IM-0039-0001.jpeg"
  },
  {
    "patient_id": "P0014",
    "basic_info": {
      "age": 78,
      "gender": "Female",
      "admission_date": "2024-10-17"
    },
    "vitals": {
      "temperature": 39.2,
      "heart_rate": 111,
      "respiratory_rate": 28,
      "blood_pressure": "116/86",
      "oxygen_saturation": 93
    },
    "symptoms": [
      "cough",
      "fever",
      "decreased appetite"
    ],
    "medications": [
      {
        "name": "Ibuprofen",
        "dosage": "400mg",
        "frequency": "every 6 hours as needed"
      }
    ],
    "comorbidities": [],
    "diagnosis": "Normal",
    "note_text": "\nCLINICAL NOTE\n============\nPatient ID: P0014\nDate: 2024-10-17\n\nPATIENT INFORMATION\n------------------\nAge: 78\nGender: Female\nAdmission Date: 2024-10-17\n\nVITAL SIGNS\n----------\nTemperature: 39.2\u00b0C\nHeart Rate: 111 bpm\nRespiratory Rate: 28 /min\nBlood Pressure: 116/86 mmHg\nO2 Saturation: 93%\n\nPRESENTING SYMPTOMS\n-----------------\n- cough\n- fever\n- decreased appetite\n\nMEDICAL HISTORY\n-------------\nComorbidities: None\n\nMEDICATIONS\n----------\n- Ibuprofen 400mg every 6 hours as needed\n\nASSESSMENT\n---------\nChest X-ray shows no active pulmonary disease.\n\nPLAN\n----\n1. Symptomatic treatment as needed\n2. Return if symptoms worsen\n3. Regular health maintenance\n",
    "image_path": "demo_dataset\\NORMAL\\IM-0050-0001.jpeg"
  },
  {
    "patient_id": "P0015",
    "basic_info": {
      "age": 51,
      "gender": "Male",
      "admission_date": "2024-10-25"
    },
    "vitals": {
      "temperature": 38.7,
      "heart_rate": 85,
      "respiratory_rate": 21,
      "blood_pressure": "117/73",
      "oxygen_saturation": 92
    },
    "symptoms": [
      "cough",
      "wheezing",
      "shallow breathing",
      "muscle aches",
      "fatigue"
    ],
    "medications": [
      {
        "name": "Ibuprofen",
        "dosage": "400mg",
        "frequency": "every 6 hours as needed"
      },
      {
        "name": "Guaifenesin",
        "dosage": "400mg",
        "frequency": "every 4 hours as needed"
      }
    ],
    "comorbidities": [],
    "diagnosis": "Normal",
    "note_text": "\nCLINICAL NOTE\n============\nPatient ID: P0015\nDate: 2024-10-25\n\nPATIENT INFORMATION\n------------------\nAge: 51\nGender: Male\nAdmission Date: 2024-10-25\n\nVITAL SIGNS\n----------\nTemperature: 38.7\u00b0C\nHeart Rate: 85 bpm\nRespiratory Rate: 21 /min\nBlood Pressure: 117/73 mmHg\nO2 Saturation: 92%\n\nPRESENTING SYMPTOMS\n-----------------\n- cough\n- wheezing\n- shallow breathing\n- muscle aches\n- fatigue\n\nMEDICAL HISTORY\n-------------\nComorbidities: None\n\nMEDICATIONS\n----------\n- Ibuprofen 400mg every 6 hours as needed\n- Guaifenesin 400mg every 4 hours as needed\n\nASSESSMENT\n---------\nChest X-ray shows no active pulmonary disease.\n\nPLAN\n----\n1. Symptomatic treatment as needed\n2. Return if symptoms worsen\n3. Regular health maintenance\n",
    "image_path": "demo_dataset\\NORMAL\\IM-0059-0001.jpeg"
  },
  {
    "patient_id": "P0016",
    "basic_info": {
      "age": 23,
      "gender": "Male",
      "admission_date": "2024-10-23"
    },
    "vitals": {
      "temperature": 39.1,
      "heart_rate": 107,
      "respiratory_rate": 22,
      "blood_pressure": "112/80",
      "oxygen_saturation": 94
    },
    "symptoms": [
      "dyspnea",
      "sputum production",
      "chest pain",
      "chills",
      "malaise"
    ],
    "medications": [
      {
        "name": "Guaifenesin",
        "dosage": "400mg",
        "frequency": "every 4 hours as needed"
      }
    ],
    "comorbidities": [],
    "diagnosis": "Normal",
    "note_text": "\nCLINICAL NOTE\n============\nPatient ID: P0016\nDate: 2024-10-23\n\nPATIENT INFORMATION\n------------------\nAge: 23\nGender: Male\nAdmission Date: 2024-10-23\n\nVITAL SIGNS\n----------\nTemperature: 39.1\u00b0C\nHeart Rate: 107 bpm\nRespiratory Rate: 22 /min\nBlood Pressure: 112/80 mmHg\nO2 Saturation: 94%\n\nPRESENTING SYMPTOMS\n-----------------\n- dyspnea\n- sputum production\n- chest pain\n- chills\n- malaise\n\nMEDICAL HISTORY\n-------------\nComorbidities: None\n\nMEDICATIONS\n----------\n- Guaifenesin 400mg every 4 hours as needed\n\nASSESSMENT\n---------\nChest X-ray shows no active pulmonary disease.\n\nPLAN\n----\n1. Symptomatic treatment as needed\n2. Return if symptoms worsen\n3. Regular health maintenance\n",
    "image_path": "demo_dataset\\NORMAL\\IM-0061-0001.jpeg"
  },
  {
    "patient_id": "P0017",
    "basic_info": {
      "age": 28,
      "gender": "Male",
      "admission_date": "2024-10-20"
    },
    "vitals": {
      "temperature": 38.8,
      "heart_rate": 99,
      "respiratory_rate": 28,
      "blood_pressure": "125/89",
      "oxygen_saturation": 92
    },
    "symptoms": [
      "tachypnea",
      "dyspnea",
      "chest pain",
      "muscle aches",
      "chills"
    ],
    "medications": [
      {
        "name": "Acetaminophen",
        "dosage": "650mg",
        "frequency": "every 6 hours as needed"
      }
    ],
    "comorbidities": [
      "Coronary Artery Disease"
    ],
    "diagnosis": "Normal",
    "note_text": "\nCLINICAL NOTE\n============\nPatient ID: P0017\nDate: 2024-10-20\n\nPATIENT INFORMATION\n------------------\nAge: 28\nGender: Male\nAdmission Date: 2024-10-20\n\nVITAL SIGNS\n----------\nTemperature: 38.8\u00b0C\nHeart Rate: 99 bpm\nRespiratory Rate: 28 /min\nBlood Pressure: 125/89 mmHg\nO2 Saturation: 92%\n\nPRESENTING SYMPTOMS\n-----------------\n- tachypnea\n- dyspnea\n- chest pain\n- muscle aches\n- chills\n\nMEDICAL HISTORY\n-------------\nComorbidities: Coronary Artery Disease\n\nMEDICATIONS\n----------\n- Acetaminophen 650mg every 6 hours as needed\n\nASSESSMENT\n---------\nChest X-ray shows no active pulmonary disease.\n\nPLAN\n----\n1. Symptomatic treatment as needed\n2. Return if symptoms worsen\n3. Regular health maintenance\n",
    "image_path": "demo_dataset\\NORMAL\\IM-0063-0001.jpeg"
  },
  {
    "patient_id": "P0018",
    "basic_info": {
      "age": 33,
      "gender": "Female",
      "admission_date": "2024-10-22"
    },
    "vitals": {
      "temperature": 37.6,
      "heart_rate": 85,
      "respiratory_rate": 24,
      "blood_pressure": "136/79",
      "oxygen_saturation": 88
    },
    "symptoms": [
      "sputum production",
      "fatigue",
      "sweating"
    ],
    "medications": [
      {
        "name": "Ibuprofen",
        "dosage": "400mg",
        "frequency": "every 6 hours as needed"
      },
      {
        "name": "Acetaminophen",
        "dosage": "650mg",
        "frequency": "every 6 hours as needed"
      }
    ],
    "comorbidities": [
      "Asthma",
      "Hypertension",
      "Obesity"
    ],
    "diagnosis": "Normal",
    "note_text": "\nCLINICAL NOTE\n============\nPatient ID: P0018\nDate: 2024-10-22\n\nPATIENT INFORMATION\n------------------\nAge: 33\nGender: Female\nAdmission Date: 2024-10-22\n\nVITAL SIGNS\n----------\nTemperature: 37.6\u00b0C\nHeart Rate: 85 bpm\nRespiratory Rate: 24 /min\nBlood Pressure: 136/79 mmHg\nO2 Saturation: 88%\n\nPRESENTING SYMPTOMS\n-----------------\n- sputum production\n- fatigue\n- sweating\n\nMEDICAL HISTORY\n-------------\nComorbidities: Asthma, Hypertension, Obesity\n\nMEDICATIONS\n----------\n- Ibuprofen 400mg every 6 hours as needed\n- Acetaminophen 650mg every 6 hours as needed\n\nASSESSMENT\n---------\nChest X-ray shows no active pulmonary disease.\n\nPLAN\n----\n1. Symptomatic treatment as needed\n2. Return if symptoms worsen\n3. Regular health maintenance\n",
    "image_path": "demo_dataset\\NORMAL\\IM-0070-0001.jpeg"
  },
  {
    "patient_id": "P0019",
    "basic_info": {
      "age": 63,
      "gender": "Male",
      "admission_date": "2024-10-15"
    },
    "vitals": {
      "temperature": 39.1,
      "heart_rate": 118,
      "respiratory_rate": 21,
      "blood_pressure": "114/75",
      "oxygen_saturation": 89
    },
    "symptoms": [
      "dyspnea",
      "shallow breathing",
      "chest pain",
      "fever"
    ],
    "medications": [
      {
        "name": "Ibuprofen",
        "dosage": "400mg",
        "frequency": "every 6 hours as needed"
      },
      {
        "name": "Acetaminophen",
        "dosage": "650mg",
        "frequency": "every 6 hours as needed"
      }
    ],
    "comorbidities": [
      "Diabetes Type 2"
    ],
    "diagnosis": "Normal",
    "note_text": "\nCLINICAL NOTE\n============\nPatient ID: P0019\nDate: 2024-10-15\n\nPATIENT INFORMATION\n------------------\nAge: 63\nGender: Male\nAdmission Date: 2024-10-15\n\nVITAL SIGNS\n----------\nTemperature: 39.1\u00b0C\nHeart Rate: 118 bpm\nRespiratory Rate: 21 /min\nBlood Pressure: 114/75 mmHg\nO2 Saturation: 89%\n\nPRESENTING SYMPTOMS\n-----------------\n- dyspnea\n- shallow breathing\n- chest pain\n- fever\n\nMEDICAL HISTORY\n-------------\nComorbidities: Diabetes Type 2\n\nMEDICATIONS\n----------\n- Ibuprofen 400mg every 6 hours as needed\n- Acetaminophen 650mg every 6 hours as needed\n\nASSESSMENT\n---------\nChest X-ray shows no active pulmonary disease.\n\nPLAN\n----\n1. Symptomatic treatment as needed\n2. Return if symptoms worsen\n3. Regular health maintenance\n",
    "image_path": "demo_dataset\\NORMAL\\IM-0071-0001.jpeg"
  },
  {
    "patient_id": "P0020",
    "basic_info": {
      "age": 27,
      "gender": "Female",
      "admission_date": "2024-10-15"
    },
    "vitals": {
      "temperature": 38.2,
      "heart_rate": 87,
      "respiratory_rate": 24,
      "blood_pressure": "129/61",
      "oxygen_saturation": 94
    },
    "symptoms": [
      "shallow breathing",
      "fever",
      "muscle aches"
    ],
    "medications": [
      {
        "name": "Ibuprofen",
        "dosage": "400mg",
        "frequency": "every 6 hours as needed"
      }
    ],
    "comorbidities": [
      "Asthma",
      "Hypertension"
    ],
    "diagnosis": "Normal",
    "note_text": "\nCLINICAL NOTE\n============\nPatient ID: P0020\nDate: 2024-10-15\n\nPATIENT INFORMATION\n------------------\nAge: 27\nGender: Female\nAdmission Date: 2024-10-15\n\nVITAL SIGNS\n----------\nTemperature: 38.2\u00b0C\nHeart Rate: 87 bpm\nRespiratory Rate: 24 /min\nBlood Pressure: 129/61 mmHg\nO2 Saturation: 94%\n\nPRESENTING SYMPTOMS\n-----------------\n- shallow breathing\n- fever\n- muscle aches\n\nMEDICAL HISTORY\n-------------\nComorbidities: Asthma, Hypertension\n\nMEDICATIONS\n----------\n- Ibuprofen 400mg every 6 hours as needed\n\nASSESSMENT\n---------\nChest X-ray shows no active pulmonary disease.\n\nPLAN\n----\n1. Symptomatic treatment as needed\n2. Return if symptoms worsen\n3. Regular health maintenance\n",
    "image_path": "demo_dataset\\NORMAL\\IM-0084-0001.jpeg"
  },
  {
    "patient_id": "P0021",
    "basic_info": {
      "age": 48,
      "gender": "Male",
      "admission_date": "2024-10-22"
    },
    "vitals": {
      "temperature": 37.5,
      "heart_rate": 119,
      "respiratory_rate": 25,
      "blood_pressure": "128/82",
      "oxygen_saturation": 95
    },
    "symptoms": [
      "chest pain",
      "sputum production",
      "sweating"
    ],
    "medications": [
      {
        "name": "Guaifenesin",
        "dosage": "400mg",
        "frequency": "every 4 hours as needed"
      }
    ],
    "comorbidities": [
      "Asthma",
      "Coronary Artery Disease",
      "Obesity"
    ],
    "diagnosis": "Normal",
    "note_text": "\nCLINICAL NOTE\n============\nPatient ID: P0021\nDate: 2024-10-22\n\nPATIENT INFORMATION\n------------------\nAge: 48\nGender: Male\nAdmission Date: 2024-10-22\n\nVITAL SIGNS\n----------\nTemperature: 37.5\u00b0C\nHeart Rate: 119 bpm\nRespiratory Rate: 25 /min\nBlood Pressure: 128/82 mmHg\nO2 Saturation: 95%\n\nPRESENTING SYMPTOMS\n-----------------\n- chest pain\n- sputum production\n- sweating\n\nMEDICAL HISTORY\n-------------\nComorbidities: Asthma, Coronary Artery Disease, Obesity\n\nMEDICATIONS\n----------\n- Guaifenesin 400mg every 4 hours as needed\n\nASSESSMENT\n---------\nChest X-ray shows no active pulmonary disease.\n\nPLAN\n----\n1. Symptomatic treatment as needed\n2. Return if symptoms worsen\n3. Regular health maintenance\n",
    "image_path": "demo_dataset\\NORMAL\\IM-0086-0001.jpeg"
  },
  {
    "patient_id": "P0022",
    "basic_info": {
      "age": 77,
      "gender": "Male",
      "admission_date": "2024-10-25"
    },
    "vitals": {
      "temperature": 38.9,
      "heart_rate": 82,
      "respiratory_rate": 26,
      "blood_pressure": "139/67",
      "oxygen_saturation": 92
    },
    "symptoms": [
      "chest pain",
      "sputum production",
      "shallow breathing",
      "fever",
      "fatigue"
    ],
    "medications": [
      {
        "name": "Acetaminophen",
        "dosage": "650mg",
        "frequency": "every 6 hours as needed"
      },
      {
        "name": "Guaifenesin",
        "dosage": "400mg",
        "frequency": "every 4 hours as needed"
      }
    ],
    "comorbidities": [
      "Obesity"
    ],
    "diagnosis": "Normal",
    "note_text": "\nCLINICAL NOTE\n============\nPatient ID: P0022\nDate: 2024-10-25\n\nPATIENT INFORMATION\n------------------\nAge: 77\nGender: Male\nAdmission Date: 2024-10-25\n\nVITAL SIGNS\n----------\nTemperature: 38.9\u00b0C\nHeart Rate: 82 bpm\nRespiratory Rate: 26 /min\nBlood Pressure: 139/67 mmHg\nO2 Saturation: 92%\n\nPRESENTING SYMPTOMS\n-----------------\n- chest pain\n- sputum production\n- shallow breathing\n- fever\n- fatigue\n\nMEDICAL HISTORY\n-------------\nComorbidities: Obesity\n\nMEDICATIONS\n----------\n- Acetaminophen 650mg every 6 hours as needed\n- Guaifenesin 400mg every 4 hours as needed\n\nASSESSMENT\n---------\nChest X-ray shows no active pulmonary disease.\n\nPLAN\n----\n1. Symptomatic treatment as needed\n2. Return if symptoms worsen\n3. Regular health maintenance\n",
    "image_path": "demo_dataset\\NORMAL\\IM-0097-0001.jpeg"
  },
  {
    "patient_id": "P0023",
    "basic_info": {
      "age": 48,
      "gender": "Male",
      "admission_date": "2024-10-22"
    },
    "vitals": {
      "temperature": 39.0,
      "heart_rate": 103,
      "respiratory_rate": 30,
      "blood_pressure": "124/61",
      "oxygen_saturation": 89
    },
    "symptoms": [
      "shallow breathing",
      "fatigue",
      "fever"
    ],
    "medications": [
      {
        "name": "Acetaminophen",
        "dosage": "650mg",
        "frequency": "every 6 hours as needed"
      }
    ],
    "comorbidities": [],
    "diagnosis": "Normal",
    "note_text": "\nCLINICAL NOTE\n============\nPatient ID: P0023\nDate: 2024-10-22\n\nPATIENT INFORMATION\n------------------\nAge: 48\nGender: Male\nAdmission Date: 2024-10-22\n\nVITAL SIGNS\n----------\nTemperature: 39.0\u00b0C\nHeart Rate: 103 bpm\nRespiratory Rate: 30 /min\nBlood Pressure: 124/61 mmHg\nO2 Saturation: 89%\n\nPRESENTING SYMPTOMS\n-----------------\n- shallow breathing\n- fatigue\n- fever\n\nMEDICAL HISTORY\n-------------\nComorbidities: None\n\nMEDICATIONS\n----------\n- Acetaminophen 650mg every 6 hours as needed\n\nASSESSMENT\n---------\nChest X-ray shows no active pulmonary disease.\n\nPLAN\n----\n1. Symptomatic treatment as needed\n2. Return if symptoms worsen\n3. Regular health maintenance\n",
    "image_path": "demo_dataset\\NORMAL\\IM-0099-0001.jpeg"
  },
  {
    "patient_id": "P0024",
    "basic_info": {
      "age": 73,
      "gender": "Male",
      "admission_date": "2024-10-21"
    },
    "vitals": {
      "temperature": 39.3,
      "heart_rate": 93,
      "respiratory_rate": 26,
      "blood_pressure": "127/61",
      "oxygen_saturation": 93
    },
    "symptoms": [
      "chest pain",
      "cough",
      "sputum production",
      "fatigue"
    ],
    "medications": [
      {
        "name": "Ibuprofen",
        "dosage": "400mg",
        "frequency": "every 6 hours as needed"
      },
      {
        "name": "Guaifenesin",
        "dosage": "400mg",
        "frequency": "every 4 hours as needed"
      }
    ],
    "comorbidities": [],
    "diagnosis": "Normal",
    "note_text": "\nCLINICAL NOTE\n============\nPatient ID: P0024\nDate: 2024-10-21\n\nPATIENT INFORMATION\n------------------\nAge: 73\nGender: Male\nAdmission Date: 2024-10-21\n\nVITAL SIGNS\n----------\nTemperature: 39.3\u00b0C\nHeart Rate: 93 bpm\nRespiratory Rate: 26 /min\nBlood Pressure: 127/61 mmHg\nO2 Saturation: 93%\n\nPRESENTING SYMPTOMS\n-----------------\n- chest pain\n- cough\n- sputum production\n- fatigue\n\nMEDICAL HISTORY\n-------------\nComorbidities: None\n\nMEDICATIONS\n----------\n- Ibuprofen 400mg every 6 hours as needed\n- Guaifenesin 400mg every 4 hours as needed\n\nASSESSMENT\n---------\nChest X-ray shows no active pulmonary disease.\n\nPLAN\n----\n1. Symptomatic treatment as needed\n2. Return if symptoms worsen\n3. Regular health maintenance\n",
    "image_path": "demo_dataset\\NORMAL\\IM-0109-0001.jpeg"
  },
  {
    "patient_id": "P0025",
    "basic_info": {
      "age": 74,
      "gender": "Male",
      "admission_date": "2024-10-24"
    },
    "vitals": {
      "temperature": 37.7,
      "heart_rate": 97,
      "respiratory_rate": 30,
      "blood_pressure": "111/69",
      "oxygen_saturation": 90
    },
    "symptoms": [
      "dyspnea",
      "wheezing",
      "sputum production",
      "malaise",
      "muscle aches"
    ],
    "medications": [
      {
        "name": "Acetaminophen",
        "dosage": "650mg",
        "frequency": "every 6 hours as needed"
      }
    ],
    "comorbidities": [
      "Coronary Artery Disease",
      "COPD"
    ],
    "diagnosis": "Normal",
    "note_text": "\nCLINICAL NOTE\n============\nPatient ID: P0025\nDate: 2024-10-24\n\nPATIENT INFORMATION\n------------------\nAge: 74\nGender: Male\nAdmission Date: 2024-10-24\n\nVITAL SIGNS\n----------\nTemperature: 37.7\u00b0C\nHeart Rate: 97 bpm\nRespiratory Rate: 30 /min\nBlood Pressure: 111/69 mmHg\nO2 Saturation: 90%\n\nPRESENTING SYMPTOMS\n-----------------\n- dyspnea\n- wheezing\n- sputum production\n- malaise\n- muscle aches\n\nMEDICAL HISTORY\n-------------\nComorbidities: Coronary Artery Disease, COPD\n\nMEDICATIONS\n----------\n- Acetaminophen 650mg every 6 hours as needed\n\nASSESSMENT\n---------\nChest X-ray shows no active pulmonary disease.\n\nPLAN\n----\n1. Symptomatic treatment as needed\n2. Return if symptoms worsen\n3. Regular health maintenance\n",
    "image_path": "demo_dataset\\NORMAL\\IM-0111-0001.jpeg"
  },
  {
    "patient_id": "P0026",
    "basic_info": {
      "age": 64,
      "gender": "Female",
      "admission_date": "2024-10-24"
    },
    "vitals": {
      "temperature": 39.1,
      "heart_rate": 117,
      "respiratory_rate": 25,
      "blood_pressure": "135/87",
      "oxygen_saturation": 91
    },
    "symptoms": [
      "shallow breathing",
      "sputum production",
      "malaise"
    ],
    "medications": [
      {
        "name": "Ibuprofen",
        "dosage": "400mg",
        "frequency": "every 6 hours as needed"
      }
    ],
    "comorbidities": [
      "Asthma",
      "Diabetes Type 2",
      "Obesity"
    ],
    "diagnosis": "Normal",
    "note_text": "\nCLINICAL NOTE\n============\nPatient ID: P0026\nDate: 2024-10-24\n\nPATIENT INFORMATION\n------------------\nAge: 64\nGender: Female\nAdmission Date: 2024-10-24\n\nVITAL SIGNS\n----------\nTemperature: 39.1\u00b0C\nHeart Rate: 117 bpm\nRespiratory Rate: 25 /min\nBlood Pressure: 135/87 mmHg\nO2 Saturation: 91%\n\nPRESENTING SYMPTOMS\n-----------------\n- shallow breathing\n- sputum production\n- malaise\n\nMEDICAL HISTORY\n-------------\nComorbidities: Asthma, Diabetes Type 2, Obesity\n\nMEDICATIONS\n----------\n- Ibuprofen 400mg every 6 hours as needed\n\nASSESSMENT\n---------\nChest X-ray shows no active pulmonary disease.\n\nPLAN\n----\n1. Symptomatic treatment as needed\n2. Return if symptoms worsen\n3. Regular health maintenance\n",
    "image_path": "demo_dataset\\NORMAL\\NORMAL2-IM-0027-0001.jpeg"
  },
  {
    "patient_id": "P0027",
    "basic_info": {
      "age": 70,
      "gender": "Female",
      "admission_date": "2024-10-14"
    },
    "vitals": {
      "temperature": 38.3,
      "heart_rate": 96,
      "respiratory_rate": 23,
      "blood_pressure": "135/70",
      "oxygen_saturation": 91
    },
    "symptoms": [
      "chest pain",
      "sweating",
      "decreased appetite"
    ],
    "medications": [
      {
        "name": "Acetaminophen",
        "dosage": "650mg",
        "frequency": "every 6 hours as needed"
      }
    ],
    "comorbidities": [],
    "diagnosis": "Normal",
    "note_text": "\nCLINICAL NOTE\n============\nPatient ID: P0027\nDate: 2024-10-14\n\nPATIENT INFORMATION\n------------------\nAge: 70\nGender: Female\nAdmission Date: 2024-10-14\n\nVITAL SIGNS\n----------\nTemperature: 38.3\u00b0C\nHeart Rate: 96 bpm\nRespiratory Rate: 23 /min\nBlood Pressure: 135/70 mmHg\nO2 Saturation: 91%\n\nPRESENTING SYMPTOMS\n-----------------\n- chest pain\n- sweating\n- decreased appetite\n\nMEDICAL HISTORY\n-------------\nComorbidities: None\n\nMEDICATIONS\n----------\n- Acetaminophen 650mg every 6 hours as needed\n\nASSESSMENT\n---------\nChest X-ray shows no active pulmonary disease.\n\nPLAN\n----\n1. Symptomatic treatment as needed\n2. Return if symptoms worsen\n3. Regular health maintenance\n",
    "image_path": "demo_dataset\\NORMAL\\NORMAL2-IM-0028-0001.jpeg"
  },
  {
    "patient_id": "P0028",
    "basic_info": {
      "age": 82,
      "gender": "Female",
      "admission_date": "2024-10-16"
    },
    "vitals": {
      "temperature": 37.5,
      "heart_rate": 92,
      "respiratory_rate": 29,
      "blood_pressure": "123/72",
      "oxygen_saturation": 94
    },
    "symptoms": [
      "cough",
      "muscle aches",
      "malaise"
    ],
    "medications": [
      {
        "name": "Guaifenesin",
        "dosage": "400mg",
        "frequency": "every 4 hours as needed"
      },
      {
        "name": "Ibuprofen",
        "dosage": "400mg",
        "frequency": "every 6 hours as needed"
      }
    ],
    "comorbidities": [],
    "diagnosis": "Normal",
    "note_text": "\nCLINICAL NOTE\n============\nPatient ID: P0028\nDate: 2024-10-16\n\nPATIENT INFORMATION\n------------------\nAge: 82\nGender: Female\nAdmission Date: 2024-10-16\n\nVITAL SIGNS\n----------\nTemperature: 37.5\u00b0C\nHeart Rate: 92 bpm\nRespiratory Rate: 29 /min\nBlood Pressure: 123/72 mmHg\nO2 Saturation: 94%\n\nPRESENTING SYMPTOMS\n-----------------\n- cough\n- muscle aches\n- malaise\n\nMEDICAL HISTORY\n-------------\nComorbidities: None\n\nMEDICATIONS\n----------\n- Guaifenesin 400mg every 4 hours as needed\n- Ibuprofen 400mg every 6 hours as needed\n\nASSESSMENT\n---------\nChest X-ray shows no active pulmonary disease.\n\nPLAN\n----\n1. Symptomatic treatment as needed\n2. Return if symptoms worsen\n3. Regular health maintenance\n",
    "image_path": "demo_dataset\\NORMAL\\NORMAL2-IM-0035-0001.jpeg"
  },
  {
    "patient_id": "P0029",
    "basic_info": {
      "age": 35,
      "gender": "Female",
      "admission_date": "2024-10-14"
    },
    "vitals": {
      "temperature": 38.8,
      "heart_rate": 91,
      "respiratory_rate": 24,
      "blood_pressure": "139/64",
      "oxygen_saturation": 95
    },
    "symptoms": [
      "shallow breathing",
      "dyspnea",
      "chest pain",
      "fatigue",
      "decreased appetite"
    ],
    "medications": [
      {
        "name": "Guaifenesin",
        "dosage": "400mg",
        "frequency": "every 4 hours as needed"
      },
      {
        "name": "Ibuprofen",
        "dosage": "400mg",
        "frequency": "every 6 hours as needed"
      }
    ],
    "comorbidities": [
      "Asthma",
      "COPD",
      "Obesity"
    ],
    "diagnosis": "Normal",
    "note_text": "\nCLINICAL NOTE\n============\nPatient ID: P0029\nDate: 2024-10-14\n\nPATIENT INFORMATION\n------------------\nAge: 35\nGender: Female\nAdmission Date: 2024-10-14\n\nVITAL SIGNS\n----------\nTemperature: 38.8\u00b0C\nHeart Rate: 91 bpm\nRespiratory Rate: 24 /min\nBlood Pressure: 139/64 mmHg\nO2 Saturation: 95%\n\nPRESENTING SYMPTOMS\n-----------------\n- shallow breathing\n- dyspnea\n- chest pain\n- fatigue\n- decreased appetite\n\nMEDICAL HISTORY\n-------------\nComorbidities: Asthma, COPD, Obesity\n\nMEDICATIONS\n----------\n- Guaifenesin 400mg every 4 hours as needed\n- Ibuprofen 400mg every 6 hours as needed\n\nASSESSMENT\n---------\nChest X-ray shows no active pulmonary disease.\n\nPLAN\n----\n1. Symptomatic treatment as needed\n2. Return if symptoms worsen\n3. Regular health maintenance\n",
    "image_path": "demo_dataset\\NORMAL\\NORMAL2-IM-0041-0001.jpeg"
  },
  {
    "patient_id": "P0030",
    "basic_info": {
      "age": 80,
      "gender": "Male",
      "admission_date": "2024-10-13"
    },
    "vitals": {
      "temperature": 38.7,
      "heart_rate": 103,
      "respiratory_rate": 26,
      "blood_pressure": "118/79",
      "oxygen_saturation": 92
    },
    "symptoms": [
      "cough",
      "fever"
    ],
    "medications": [
      {
        "name": "Acetaminophen",
        "dosage": "650mg",
        "frequency": "every 6 hours as needed"
      }
    ],
    "comorbidities": [
      "COPD",
      "Coronary Artery Disease"
    ],
    "diagnosis": "Normal",
    "note_text": "\nCLINICAL NOTE\n============\nPatient ID: P0030\nDate: 2024-10-13\n\nPATIENT INFORMATION\n------------------\nAge: 80\nGender: Male\nAdmission Date: 2024-10-13\n\nVITAL SIGNS\n----------\nTemperature: 38.7\u00b0C\nHeart Rate: 103 bpm\nRespiratory Rate: 26 /min\nBlood Pressure: 118/79 mmHg\nO2 Saturation: 92%\n\nPRESENTING SYMPTOMS\n-----------------\n- cough\n- fever\n\nMEDICAL HISTORY\n-------------\nComorbidities: COPD, Coronary Artery Disease\n\nMEDICATIONS\n----------\n- Acetaminophen 650mg every 6 hours as needed\n\nASSESSMENT\n---------\nChest X-ray shows no active pulmonary disease.\n\nPLAN\n----\n1. Symptomatic treatment as needed\n2. Return if symptoms worsen\n3. Regular health maintenance\n",
    "image_path": "demo_dataset\\NORMAL\\NORMAL2-IM-0066-0001.jpeg"
  },
  {
    "patient_id": "P0031",
    "basic_info": {
      "age": 80,
      "gender": "Male",
      "admission_date": "2024-10-15"
    },
    "vitals": {
      "temperature": 37.6,
      "heart_rate": 99,
      "respiratory_rate": 24,
      "blood_pressure": "133/66",
      "oxygen_saturation": 90
    },
    "symptoms": [
      "shallow breathing",
      "fatigue",
      "chills"
    ],
    "medications": [
      {
        "name": "Acetaminophen",
        "dosage": "650mg",
        "frequency": "every 6 hours as needed"
      }
    ],
    "comorbidities": [
      "Asthma",
      "Diabetes Type 2",
      "Obesity"
    ],
    "diagnosis": "Normal",
    "note_text": "\nCLINICAL NOTE\n============\nPatient ID: P0031\nDate: 2024-10-15\n\nPATIENT INFORMATION\n------------------\nAge: 80\nGender: Male\nAdmission Date: 2024-10-15\n\nVITAL SIGNS\n----------\nTemperature: 37.6\u00b0C\nHeart Rate: 99 bpm\nRespiratory Rate: 24 /min\nBlood Pressure: 133/66 mmHg\nO2 Saturation: 90%\n\nPRESENTING SYMPTOMS\n-----------------\n- shallow breathing\n- fatigue\n- chills\n\nMEDICAL HISTORY\n-------------\nComorbidities: Asthma, Diabetes Type 2, Obesity\n\nMEDICATIONS\n----------\n- Acetaminophen 650mg every 6 hours as needed\n\nASSESSMENT\n---------\nChest X-ray shows no active pulmonary disease.\n\nPLAN\n----\n1. Symptomatic treatment as needed\n2. Return if symptoms worsen\n3. Regular health maintenance\n",
    "image_path": "demo_dataset\\NORMAL\\NORMAL2-IM-0072-0001.jpeg"
  },
  {
    "patient_id": "P0032",
    "basic_info": {
      "age": 82,
      "gender": "Female",
      "admission_date": "2024-10-13"
    },
    "vitals": {
      "temperature": 38.9,
      "heart_rate": 97,
      "respiratory_rate": 26,
      "blood_pressure": "132/88",
      "oxygen_saturation": 93
    },
    "symptoms": [
      "chest pain",
      "sputum production",
      "muscle aches"
    ],
    "medications": [
      {
        "name": "Acetaminophen",
        "dosage": "650mg",
        "frequency": "every 6 hours as needed"
      }
    ],
    "comorbidities": [],
    "diagnosis": "Normal",
    "note_text": "\nCLINICAL NOTE\n============\nPatient ID: P0032\nDate: 2024-10-13\n\nPATIENT INFORMATION\n------------------\nAge: 82\nGender: Female\nAdmission Date: 2024-10-13\n\nVITAL SIGNS\n----------\nTemperature: 38.9\u00b0C\nHeart Rate: 97 bpm\nRespiratory Rate: 26 /min\nBlood Pressure: 132/88 mmHg\nO2 Saturation: 93%\n\nPRESENTING SYMPTOMS\n-----------------\n- chest pain\n- sputum production\n- muscle aches\n\nMEDICAL HISTORY\n-------------\nComorbidities: None\n\nMEDICATIONS\n----------\n- Acetaminophen 650mg every 6 hours as needed\n\nASSESSMENT\n---------\nChest X-ray shows no active pulmonary disease.\n\nPLAN\n----\n1. Symptomatic treatment as needed\n2. Return if symptoms worsen\n3. Regular health maintenance\n",
    "image_path": "demo_dataset\\NORMAL\\NORMAL2-IM-0092-0001.jpeg"
  },
  {
    "patient_id": "P0033",
    "basic_info": {
      "age": 39,
      "gender": "Male",
      "admission_date": "2024-10-16"
    },
    "vitals": {
      "temperature": 37.8,
      "heart_rate": 107,
      "respiratory_rate": 29,
      "blood_pressure": "129/69",
      "oxygen_saturation": 94
    },
    "symptoms": [
      "shallow breathing",
      "cough",
      "dyspnea",
      "sweating",
      "decreased appetite"
    ],
    "medications": [
      {
        "name": "Acetaminophen",
        "dosage": "650mg",
        "frequency": "every 6 hours as needed"
      },
      {
        "name": "Ibuprofen",
        "dosage": "400mg",
        "frequency": "every 6 hours as needed"
      }
    ],
    "comorbidities": [
      "Obesity"
    ],
    "diagnosis": "Normal",
    "note_text": "\nCLINICAL NOTE\n============\nPatient ID: P0033\nDate: 2024-10-16\n\nPATIENT INFORMATION\n------------------\nAge: 39\nGender: Male\nAdmission Date: 2024-10-16\n\nVITAL SIGNS\n----------\nTemperature: 37.8\u00b0C\nHeart Rate: 107 bpm\nRespiratory Rate: 29 /min\nBlood Pressure: 129/69 mmHg\nO2 Saturation: 94%\n\nPRESENTING SYMPTOMS\n-----------------\n- shallow breathing\n- cough\n- dyspnea\n- sweating\n- decreased appetite\n\nMEDICAL HISTORY\n-------------\nComorbidities: Obesity\n\nMEDICATIONS\n----------\n- Acetaminophen 650mg every 6 hours as needed\n- Ibuprofen 400mg every 6 hours as needed\n\nASSESSMENT\n---------\nChest X-ray shows no active pulmonary disease.\n\nPLAN\n----\n1. Symptomatic treatment as needed\n2. Return if symptoms worsen\n3. Regular health maintenance\n",
    "image_path": "demo_dataset\\NORMAL\\NORMAL2-IM-0096-0001.jpeg"
  },
  {
    "patient_id": "P0034",
    "basic_info": {
      "age": 67,
      "gender": "Male",
      "admission_date": "2024-10-26"
    },
    "vitals": {
      "temperature": 39.2,
      "heart_rate": 108,
      "respiratory_rate": 21,
      "blood_pressure": "128/78",
      "oxygen_saturation": 89
    },
    "symptoms": [
      "tachypnea",
      "decreased appetite",
      "sweating"
    ],
    "medications": [
      {
        "name": "Guaifenesin",
        "dosage": "400mg",
        "frequency": "every 4 hours as needed"
      }
    ],
    "comorbidities": [
      "Obesity"
    ],
    "diagnosis": "Normal",
    "note_text": "\nCLINICAL NOTE\n============\nPatient ID: P0034\nDate: 2024-10-26\n\nPATIENT INFORMATION\n------------------\nAge: 67\nGender: Male\nAdmission Date: 2024-10-26\n\nVITAL SIGNS\n----------\nTemperature: 39.2\u00b0C\nHeart Rate: 108 bpm\nRespiratory Rate: 21 /min\nBlood Pressure: 128/78 mmHg\nO2 Saturation: 89%\n\nPRESENTING SYMPTOMS\n-----------------\n- tachypnea\n- decreased appetite\n- sweating\n\nMEDICAL HISTORY\n-------------\nComorbidities: Obesity\n\nMEDICATIONS\n----------\n- Guaifenesin 400mg every 4 hours as needed\n\nASSESSMENT\n---------\nChest X-ray shows no active pulmonary disease.\n\nPLAN\n----\n1. Symptomatic treatment as needed\n2. Return if symptoms worsen\n3. Regular health maintenance\n",
    "image_path": "demo_dataset\\NORMAL\\NORMAL2-IM-0105-0001.jpeg"
  },
  {
    "patient_id": "P0035",
    "basic_info": {
      "age": 73,
      "gender": "Female",
      "admission_date": "2024-10-23"
    },
    "vitals": {
      "temperature": 39.5,
      "heart_rate": 109,
      "respiratory_rate": 21,
      "blood_pressure": "134/90",
      "oxygen_saturation": 93
    },
    "symptoms": [
      "shallow breathing",
      "cough",
      "muscle aches"
    ],
    "medications": [
      {
        "name": "Ibuprofen",
        "dosage": "400mg",
        "frequency": "every 6 hours as needed"
      }
    ],
    "comorbidities": [
      "Hypertension",
      "Diabetes Type 2",
      "Coronary Artery Disease"
    ],
    "diagnosis": "Normal",
    "note_text": "\nCLINICAL NOTE\n============\nPatient ID: P0035\nDate: 2024-10-23\n\nPATIENT INFORMATION\n------------------\nAge: 73\nGender: Female\nAdmission Date: 2024-10-23\n\nVITAL SIGNS\n----------\nTemperature: 39.5\u00b0C\nHeart Rate: 109 bpm\nRespiratory Rate: 21 /min\nBlood Pressure: 134/90 mmHg\nO2 Saturation: 93%\n\nPRESENTING SYMPTOMS\n-----------------\n- shallow breathing\n- cough\n- muscle aches\n\nMEDICAL HISTORY\n-------------\nComorbidities: Hypertension, Diabetes Type 2, Coronary Artery Disease\n\nMEDICATIONS\n----------\n- Ibuprofen 400mg every 6 hours as needed\n\nASSESSMENT\n---------\nChest X-ray shows no active pulmonary disease.\n\nPLAN\n----\n1. Symptomatic treatment as needed\n2. Return if symptoms worsen\n3. Regular health maintenance\n",
    "image_path": "demo_dataset\\NORMAL\\NORMAL2-IM-0107-0001.jpeg"
  },
  {
    "patient_id": "P0036",
    "basic_info": {
      "age": 37,
      "gender": "Female",
      "admission_date": "2024-10-14"
    },
    "vitals": {
      "temperature": 39.2,
      "heart_rate": 93,
      "respiratory_rate": 21,
      "blood_pressure": "121/76",
      "oxygen_saturation": 88
    },
    "symptoms": [
      "wheezing",
      "malaise",
      "chills"
    ],
    "medications": [
      {
        "name": "Ibuprofen",
        "dosage": "400mg",
        "frequency": "every 6 hours as needed"
      },
      {
        "name": "Acetaminophen",
        "dosage": "650mg",
        "frequency": "every 6 hours as needed"
      }
    ],
    "comorbidities": [
      "Obesity",
      "Asthma"
    ],
    "diagnosis": "Normal",
    "note_text": "\nCLINICAL NOTE\n============\nPatient ID: P0036\nDate: 2024-10-14\n\nPATIENT INFORMATION\n------------------\nAge: 37\nGender: Female\nAdmission Date: 2024-10-14\n\nVITAL SIGNS\n----------\nTemperature: 39.2\u00b0C\nHeart Rate: 93 bpm\nRespiratory Rate: 21 /min\nBlood Pressure: 121/76 mmHg\nO2 Saturation: 88%\n\nPRESENTING SYMPTOMS\n-----------------\n- wheezing\n- malaise\n- chills\n\nMEDICAL HISTORY\n-------------\nComorbidities: Obesity, Asthma\n\nMEDICATIONS\n----------\n- Ibuprofen 400mg every 6 hours as needed\n- Acetaminophen 650mg every 6 hours as needed\n\nASSESSMENT\n---------\nChest X-ray shows no active pulmonary disease.\n\nPLAN\n----\n1. Symptomatic treatment as needed\n2. Return if symptoms worsen\n3. Regular health maintenance\n",
    "image_path": "demo_dataset\\NORMAL\\NORMAL2-IM-0120-0001.jpeg"
  },
  {
    "patient_id": "P0037",
    "basic_info": {
      "age": 76,
      "gender": "Female",
      "admission_date": "2024-10-25"
    },
    "vitals": {
      "temperature": 39.2,
      "heart_rate": 110,
      "respiratory_rate": 28,
      "blood_pressure": "122/69",
      "oxygen_saturation": 90
    },
    "symptoms": [
      "dyspnea",
      "shallow breathing",
      "sputum production",
      "fatigue"
    ],
    "medications": [
      {
        "name": "Guaifenesin",
        "dosage": "400mg",
        "frequency": "every 4 hours as needed"
      },
      {
        "name": "Acetaminophen",
        "dosage": "650mg",
        "frequency": "every 6 hours as needed"
      }
    ],
    "comorbidities": [
      "COPD",
      "Hypertension",
      "Coronary Artery Disease"
    ],
    "diagnosis": "Normal",
    "note_text": "\nCLINICAL NOTE\n============\nPatient ID: P0037\nDate: 2024-10-25\n\nPATIENT INFORMATION\n------------------\nAge: 76\nGender: Female\nAdmission Date: 2024-10-25\n\nVITAL SIGNS\n----------\nTemperature: 39.2\u00b0C\nHeart Rate: 110 bpm\nRespiratory Rate: 28 /min\nBlood Pressure: 122/69 mmHg\nO2 Saturation: 90%\n\nPRESENTING SYMPTOMS\n-----------------\n- dyspnea\n- shallow breathing\n- sputum production\n- fatigue\n\nMEDICAL HISTORY\n-------------\nComorbidities: COPD, Hypertension, Coronary Artery Disease\n\nMEDICATIONS\n----------\n- Guaifenesin 400mg every 4 hours as needed\n- Acetaminophen 650mg every 6 hours as needed\n\nASSESSMENT\n---------\nChest X-ray shows no active pulmonary disease.\n\nPLAN\n----\n1. Symptomatic treatment as needed\n2. Return if symptoms worsen\n3. Regular health maintenance\n",
    "image_path": "demo_dataset\\NORMAL\\NORMAL2-IM-0130-0001.jpeg"
  },
  {
    "patient_id": "P0038",
    "basic_info": {
      "age": 44,
      "gender": "Male",
      "admission_date": "2024-10-15"
    },
    "vitals": {
      "temperature": 38.3,
      "heart_rate": 111,
      "respiratory_rate": 24,
      "blood_pressure": "133/62",
      "oxygen_saturation": 90
    },
    "symptoms": [
      "tachypnea",
      "sputum production",
      "fatigue"
    ],
    "medications": [
      {
        "name": "Ibuprofen",
        "dosage": "400mg",
        "frequency": "every 6 hours as needed"
      }
    ],
    "comorbidities": [
      "Diabetes Type 2",
      "Hypertension",
      "COPD"
    ],
    "diagnosis": "Normal",
    "note_text": "\nCLINICAL NOTE\n============\nPatient ID: P0038\nDate: 2024-10-15\n\nPATIENT INFORMATION\n------------------\nAge: 44\nGender: Male\nAdmission Date: 2024-10-15\n\nVITAL SIGNS\n----------\nTemperature: 38.3\u00b0C\nHeart Rate: 111 bpm\nRespiratory Rate: 24 /min\nBlood Pressure: 133/62 mmHg\nO2 Saturation: 90%\n\nPRESENTING SYMPTOMS\n-----------------\n- tachypnea\n- sputum production\n- fatigue\n\nMEDICAL HISTORY\n-------------\nComorbidities: Diabetes Type 2, Hypertension, COPD\n\nMEDICATIONS\n----------\n- Ibuprofen 400mg every 6 hours as needed\n\nASSESSMENT\n---------\nChest X-ray shows no active pulmonary disease.\n\nPLAN\n----\n1. Symptomatic treatment as needed\n2. Return if symptoms worsen\n3. Regular health maintenance\n",
    "image_path": "demo_dataset\\NORMAL\\NORMAL2-IM-0131-0001.jpeg"
  },
  {
    "patient_id": "P0039",
    "basic_info": {
      "age": 22,
      "gender": "Female",
      "admission_date": "2024-10-21"
    },
    "vitals": {
      "temperature": 39.1,
      "heart_rate": 100,
      "respiratory_rate": 26,
      "blood_pressure": "111/80",
      "oxygen_saturation": 94
    },
    "symptoms": [
      "shallow breathing",
      "sweating"
    ],
    "medications": [
      {
        "name": "Acetaminophen",
        "dosage": "650mg",
        "frequency": "every 6 hours as needed"
      },
      {
        "name": "Ibuprofen",
        "dosage": "400mg",
        "frequency": "every 6 hours as needed"
      }
    ],
    "comorbidities": [
      "COPD"
    ],
    "diagnosis": "Normal",
    "note_text": "\nCLINICAL NOTE\n============\nPatient ID: P0039\nDate: 2024-10-21\n\nPATIENT INFORMATION\n------------------\nAge: 22\nGender: Female\nAdmission Date: 2024-10-21\n\nVITAL SIGNS\n----------\nTemperature: 39.1\u00b0C\nHeart Rate: 100 bpm\nRespiratory Rate: 26 /min\nBlood Pressure: 111/80 mmHg\nO2 Saturation: 94%\n\nPRESENTING SYMPTOMS\n-----------------\n- shallow breathing\n- sweating\n\nMEDICAL HISTORY\n-------------\nComorbidities: COPD\n\nMEDICATIONS\n----------\n- Acetaminophen 650mg every 6 hours as needed\n- Ibuprofen 400mg every 6 hours as needed\n\nASSESSMENT\n---------\nChest X-ray shows no active pulmonary disease.\n\nPLAN\n----\n1. Symptomatic treatment as needed\n2. Return if symptoms worsen\n3. Regular health maintenance\n",
    "image_path": "demo_dataset\\NORMAL\\NORMAL2-IM-0135-0001.jpeg"
  },
  {
    "patient_id": "P0040",
    "basic_info": {
      "age": 58,
      "gender": "Male",
      "admission_date": "2024-10-15"
    },
    "vitals": {
      "temperature": 38.9,
      "heart_rate": 105,
      "respiratory_rate": 24,
      "blood_pressure": "125/72",
      "oxygen_saturation": 89
    },
    "symptoms": [
      "cough",
      "dyspnea",
      "decreased appetite",
      "malaise"
    ],
    "medications": [
      {
        "name": "Ibuprofen",
        "dosage": "400mg",
        "frequency": "every 6 hours as needed"
      }
    ],
    "comorbidities": [
      "Coronary Artery Disease",
      "Chronic Kidney Disease",
      "Asthma"
    ],
    "diagnosis": "Normal",
    "note_text": "\nCLINICAL NOTE\n============\nPatient ID: P0040\nDate: 2024-10-15\n\nPATIENT INFORMATION\n------------------\nAge: 58\nGender: Male\nAdmission Date: 2024-10-15\n\nVITAL SIGNS\n----------\nTemperature: 38.9\u00b0C\nHeart Rate: 105 bpm\nRespiratory Rate: 24 /min\nBlood Pressure: 125/72 mmHg\nO2 Saturation: 89%\n\nPRESENTING SYMPTOMS\n-----------------\n- cough\n- dyspnea\n- decreased appetite\n- malaise\n\nMEDICAL HISTORY\n-------------\nComorbidities: Coronary Artery Disease, Chronic Kidney Disease, Asthma\n\nMEDICATIONS\n----------\n- Ibuprofen 400mg every 6 hours as needed\n\nASSESSMENT\n---------\nChest X-ray shows no active pulmonary disease.\n\nPLAN\n----\n1. Symptomatic treatment as needed\n2. Return if symptoms worsen\n3. Regular health maintenance\n",
    "image_path": "demo_dataset\\NORMAL\\NORMAL2-IM-0141-0001.jpeg"
  },
  {
    "patient_id": "P0041",
    "basic_info": {
      "age": 53,
      "gender": "Male",
      "admission_date": "2024-10-26"
    },
    "vitals": {
      "temperature": 38.0,
      "heart_rate": 91,
      "respiratory_rate": 30,
      "blood_pressure": "120/82",
      "oxygen_saturation": 93
    },
    "symptoms": [
      "shallow breathing",
      "dyspnea",
      "malaise",
      "chills"
    ],
    "medications": [
      {
        "name": "Acetaminophen",
        "dosage": "650mg",
        "frequency": "every 6 hours as needed"
      }
    ],
    "comorbidities": [
      "Chronic Kidney Disease",
      "Diabetes Type 2",
      "COPD"
    ],
    "diagnosis": "Normal",
    "note_text": "\nCLINICAL NOTE\n============\nPatient ID: P0041\nDate: 2024-10-26\n\nPATIENT INFORMATION\n------------------\nAge: 53\nGender: Male\nAdmission Date: 2024-10-26\n\nVITAL SIGNS\n----------\nTemperature: 38.0\u00b0C\nHeart Rate: 91 bpm\nRespiratory Rate: 30 /min\nBlood Pressure: 120/82 mmHg\nO2 Saturation: 93%\n\nPRESENTING SYMPTOMS\n-----------------\n- shallow breathing\n- dyspnea\n- malaise\n- chills\n\nMEDICAL HISTORY\n-------------\nComorbidities: Chronic Kidney Disease, Diabetes Type 2, COPD\n\nMEDICATIONS\n----------\n- Acetaminophen 650mg every 6 hours as needed\n\nASSESSMENT\n---------\nChest X-ray shows no active pulmonary disease.\n\nPLAN\n----\n1. Symptomatic treatment as needed\n2. Return if symptoms worsen\n3. Regular health maintenance\n",
    "image_path": "demo_dataset\\NORMAL\\NORMAL2-IM-0171-0001.jpeg"
  },
  {
    "patient_id": "P0042",
    "basic_info": {
      "age": 71,
      "gender": "Female",
      "admission_date": "2024-10-13"
    },
    "vitals": {
      "temperature": 37.5,
      "heart_rate": 97,
      "respiratory_rate": 28,
      "blood_pressure": "116/89",
      "oxygen_saturation": 91
    },
    "symptoms": [
      "wheezing",
      "shallow breathing",
      "sweating"
    ],
    "medications": [
      {
        "name": "Ibuprofen",
        "dosage": "400mg",
        "frequency": "every 6 hours as needed"
      },
      {
        "name": "Acetaminophen",
        "dosage": "650mg",
        "frequency": "every 6 hours as needed"
      }
    ],
    "comorbidities": [
      "Asthma"
    ],
    "diagnosis": "Normal",
    "note_text": "\nCLINICAL NOTE\n============\nPatient ID: P0042\nDate: 2024-10-13\n\nPATIENT INFORMATION\n------------------\nAge: 71\nGender: Female\nAdmission Date: 2024-10-13\n\nVITAL SIGNS\n----------\nTemperature: 37.5\u00b0C\nHeart Rate: 97 bpm\nRespiratory Rate: 28 /min\nBlood Pressure: 116/89 mmHg\nO2 Saturation: 91%\n\nPRESENTING SYMPTOMS\n-----------------\n- wheezing\n- shallow breathing\n- sweating\n\nMEDICAL HISTORY\n-------------\nComorbidities: Asthma\n\nMEDICATIONS\n----------\n- Ibuprofen 400mg every 6 hours as needed\n- Acetaminophen 650mg every 6 hours as needed\n\nASSESSMENT\n---------\nChest X-ray shows no active pulmonary disease.\n\nPLAN\n----\n1. Symptomatic treatment as needed\n2. Return if symptoms worsen\n3. Regular health maintenance\n",
    "image_path": "demo_dataset\\NORMAL\\NORMAL2-IM-0173-0001-0001.jpeg"
  },
  {
    "patient_id": "P0043",
    "basic_info": {
      "age": 31,
      "gender": "Female",
      "admission_date": "2024-10-15"
    },
    "vitals": {
      "temperature": 38.3,
      "heart_rate": 95,
      "respiratory_rate": 22,
      "blood_pressure": "123/66",
      "oxygen_saturation": 90
    },
    "symptoms": [
      "dyspnea",
      "chills"
    ],
    "medications": [
      {
        "name": "Ibuprofen",
        "dosage": "400mg",
        "frequency": "every 6 hours as needed"
      }
    ],
    "comorbidities": [],
    "diagnosis": "Normal",
    "note_text": "\nCLINICAL NOTE\n============\nPatient ID: P0043\nDate: 2024-10-15\n\nPATIENT INFORMATION\n------------------\nAge: 31\nGender: Female\nAdmission Date: 2024-10-15\n\nVITAL SIGNS\n----------\nTemperature: 38.3\u00b0C\nHeart Rate: 95 bpm\nRespiratory Rate: 22 /min\nBlood Pressure: 123/66 mmHg\nO2 Saturation: 90%\n\nPRESENTING SYMPTOMS\n-----------------\n- dyspnea\n- chills\n\nMEDICAL HISTORY\n-------------\nComorbidities: None\n\nMEDICATIONS\n----------\n- Ibuprofen 400mg every 6 hours as needed\n\nASSESSMENT\n---------\nChest X-ray shows no active pulmonary disease.\n\nPLAN\n----\n1. Symptomatic treatment as needed\n2. Return if symptoms worsen\n3. Regular health maintenance\n",
    "image_path": "demo_dataset\\NORMAL\\NORMAL2-IM-0201-0001.jpeg"
  },
  {
    "patient_id": "P0044",
    "basic_info": {
      "age": 62,
      "gender": "Male",
      "admission_date": "2024-10-13"
    },
    "vitals": {
      "temperature": 37.7,
      "heart_rate": 89,
      "respiratory_rate": 20,
      "blood_pressure": "118/67",
      "oxygen_saturation": 91
    },
    "symptoms": [
      "tachypnea",
      "fatigue"
    ],
    "medications": [
      {
        "name": "Acetaminophen",
        "dosage": "650mg",
        "frequency": "every 6 hours as needed"
      },
      {
        "name": "Ibuprofen",
        "dosage": "400mg",
        "frequency": "every 6 hours as needed"
      }
    ],
    "comorbidities": [
      "Diabetes Type 2"
    ],
    "diagnosis": "Normal",
    "note_text": "\nCLINICAL NOTE\n============\nPatient ID: P0044\nDate: 2024-10-13\n\nPATIENT INFORMATION\n------------------\nAge: 62\nGender: Male\nAdmission Date: 2024-10-13\n\nVITAL SIGNS\n----------\nTemperature: 37.7\u00b0C\nHeart Rate: 89 bpm\nRespiratory Rate: 20 /min\nBlood Pressure: 118/67 mmHg\nO2 Saturation: 91%\n\nPRESENTING SYMPTOMS\n-----------------\n- tachypnea\n- fatigue\n\nMEDICAL HISTORY\n-------------\nComorbidities: Diabetes Type 2\n\nMEDICATIONS\n----------\n- Acetaminophen 650mg every 6 hours as needed\n- Ibuprofen 400mg every 6 hours as needed\n\nASSESSMENT\n---------\nChest X-ray shows no active pulmonary disease.\n\nPLAN\n----\n1. Symptomatic treatment as needed\n2. Return if symptoms worsen\n3. Regular health maintenance\n",
    "image_path": "demo_dataset\\NORMAL\\NORMAL2-IM-0207-0001.jpeg"
  },
  {
    "patient_id": "P0045",
    "basic_info": {
      "age": 63,
      "gender": "Female",
      "admission_date": "2024-10-21"
    },
    "vitals": {
      "temperature": 39.2,
      "heart_rate": 99,
      "respiratory_rate": 24,
      "blood_pressure": "116/81",
      "oxygen_saturation": 94
    },
    "symptoms": [
      "sputum production",
      "tachypnea",
      "decreased appetite",
      "malaise"
    ],
    "medications": [
      {
        "name": "Guaifenesin",
        "dosage": "400mg",
        "frequency": "every 4 hours as needed"
      }
    ],
    "comorbidities": [
      "Coronary Artery Disease",
      "Obesity",
      "Diabetes Type 2"
    ],
    "diagnosis": "Normal",
    "note_text": "\nCLINICAL NOTE\n============\nPatient ID: P0045\nDate: 2024-10-21\n\nPATIENT INFORMATION\n------------------\nAge: 63\nGender: Female\nAdmission Date: 2024-10-21\n\nVITAL SIGNS\n----------\nTemperature: 39.2\u00b0C\nHeart Rate: 99 bpm\nRespiratory Rate: 24 /min\nBlood Pressure: 116/81 mmHg\nO2 Saturation: 94%\n\nPRESENTING SYMPTOMS\n-----------------\n- sputum production\n- tachypnea\n- decreased appetite\n- malaise\n\nMEDICAL HISTORY\n-------------\nComorbidities: Coronary Artery Disease, Obesity, Diabetes Type 2\n\nMEDICATIONS\n----------\n- Guaifenesin 400mg every 4 hours as needed\n\nASSESSMENT\n---------\nChest X-ray shows no active pulmonary disease.\n\nPLAN\n----\n1. Symptomatic treatment as needed\n2. Return if symptoms worsen\n3. Regular health maintenance\n",
    "image_path": "demo_dataset\\NORMAL\\NORMAL2-IM-0213-0001.jpeg"
  },
  {
    "patient_id": "P0046",
    "basic_info": {
      "age": 47,
      "gender": "Female",
      "admission_date": "2024-10-23"
    },
    "vitals": {
      "temperature": 38.1,
      "heart_rate": 92,
      "respiratory_rate": 27,
      "blood_pressure": "123/65",
      "oxygen_saturation": 88
    },
    "symptoms": [
      "tachypnea",
      "dyspnea",
      "fever",
      "decreased appetite"
    ],
    "medications": [
      {
        "name": "Ibuprofen",
        "dosage": "400mg",
        "frequency": "every 6 hours as needed"
      }
    ],
    "comorbidities": [
      "Obesity",
      "Chronic Kidney Disease"
    ],
    "diagnosis": "Normal",
    "note_text": "\nCLINICAL NOTE\n============\nPatient ID: P0046\nDate: 2024-10-23\n\nPATIENT INFORMATION\n------------------\nAge: 47\nGender: Female\nAdmission Date: 2024-10-23\n\nVITAL SIGNS\n----------\nTemperature: 38.1\u00b0C\nHeart Rate: 92 bpm\nRespiratory Rate: 27 /min\nBlood Pressure: 123/65 mmHg\nO2 Saturation: 88%\n\nPRESENTING SYMPTOMS\n-----------------\n- tachypnea\n- dyspnea\n- fever\n- decreased appetite\n\nMEDICAL HISTORY\n-------------\nComorbidities: Obesity, Chronic Kidney Disease\n\nMEDICATIONS\n----------\n- Ibuprofen 400mg every 6 hours as needed\n\nASSESSMENT\n---------\nChest X-ray shows no active pulmonary disease.\n\nPLAN\n----\n1. Symptomatic treatment as needed\n2. Return if symptoms worsen\n3. Regular health maintenance\n",
    "image_path": "demo_dataset\\NORMAL\\NORMAL2-IM-0221-0001.jpeg"
  },
  {
    "patient_id": "P0047",
    "basic_info": {
      "age": 47,
      "gender": "Female",
      "admission_date": "2024-10-22"
    },
    "vitals": {
      "temperature": 39.4,
      "heart_rate": 99,
      "respiratory_rate": 22,
      "blood_pressure": "133/74",
      "oxygen_saturation": 93
    },
    "symptoms": [
      "wheezing",
      "chest pain",
      "malaise",
      "fatigue"
    ],
    "medications": [
      {
        "name": "Guaifenesin",
        "dosage": "400mg",
        "frequency": "every 4 hours as needed"
      }
    ],
    "comorbidities": [
      "COPD"
    ],
    "diagnosis": "Normal",
    "note_text": "\nCLINICAL NOTE\n============\nPatient ID: P0047\nDate: 2024-10-22\n\nPATIENT INFORMATION\n------------------\nAge: 47\nGender: Female\nAdmission Date: 2024-10-22\n\nVITAL SIGNS\n----------\nTemperature: 39.4\u00b0C\nHeart Rate: 99 bpm\nRespiratory Rate: 22 /min\nBlood Pressure: 133/74 mmHg\nO2 Saturation: 93%\n\nPRESENTING SYMPTOMS\n-----------------\n- wheezing\n- chest pain\n- malaise\n- fatigue\n\nMEDICAL HISTORY\n-------------\nComorbidities: COPD\n\nMEDICATIONS\n----------\n- Guaifenesin 400mg every 4 hours as needed\n\nASSESSMENT\n---------\nChest X-ray shows no active pulmonary disease.\n\nPLAN\n----\n1. Symptomatic treatment as needed\n2. Return if symptoms worsen\n3. Regular health maintenance\n",
    "image_path": "demo_dataset\\NORMAL\\NORMAL2-IM-0222-0001.jpeg"
  },
  {
    "patient_id": "P0048",
    "basic_info": {
      "age": 82,
      "gender": "Male",
      "admission_date": "2024-10-16"
    },
    "vitals": {
      "temperature": 38.2,
      "heart_rate": 89,
      "respiratory_rate": 29,
      "blood_pressure": "117/79",
      "oxygen_saturation": 90
    },
    "symptoms": [
      "chest pain",
      "shallow breathing",
      "cough",
      "fever",
      "decreased appetite"
    ],
    "medications": [
      {
        "name": "Guaifenesin",
        "dosage": "400mg",
        "frequency": "every 4 hours as needed"
      }
    ],
    "comorbidities": [
      "Diabetes Type 2",
      "Asthma",
      "Hypertension"
    ],
    "diagnosis": "Normal",
    "note_text": "\nCLINICAL NOTE\n============\nPatient ID: P0048\nDate: 2024-10-16\n\nPATIENT INFORMATION\n------------------\nAge: 82\nGender: Male\nAdmission Date: 2024-10-16\n\nVITAL SIGNS\n----------\nTemperature: 38.2\u00b0C\nHeart Rate: 89 bpm\nRespiratory Rate: 29 /min\nBlood Pressure: 117/79 mmHg\nO2 Saturation: 90%\n\nPRESENTING SYMPTOMS\n-----------------\n- chest pain\n- shallow breathing\n- cough\n- fever\n- decreased appetite\n\nMEDICAL HISTORY\n-------------\nComorbidities: Diabetes Type 2, Asthma, Hypertension\n\nMEDICATIONS\n----------\n- Guaifenesin 400mg every 4 hours as needed\n\nASSESSMENT\n---------\nChest X-ray shows no active pulmonary disease.\n\nPLAN\n----\n1. Symptomatic treatment as needed\n2. Return if symptoms worsen\n3. Regular health maintenance\n",
    "image_path": "demo_dataset\\NORMAL\\NORMAL2-IM-0233-0001.jpeg"
  },
  {
    "patient_id": "P0049",
    "basic_info": {
      "age": 49,
      "gender": "Male",
      "admission_date": "2024-10-19"
    },
    "vitals": {
      "temperature": 38.4,
      "heart_rate": 119,
      "respiratory_rate": 25,
      "blood_pressure": "111/67",
      "oxygen_saturation": 94
    },
    "symptoms": [
      "chest pain",
      "dyspnea",
      "wheezing",
      "sweating",
      "malaise"
    ],
    "medications": [
      {
        "name": "Guaifenesin",
        "dosage": "400mg",
        "frequency": "every 4 hours as needed"
      },
      {
        "name": "Ibuprofen",
        "dosage": "400mg",
        "frequency": "every 6 hours as needed"
      }
    ],
    "comorbidities": [
      "COPD"
    ],
    "diagnosis": "Normal",
    "note_text": "\nCLINICAL NOTE\n============\nPatient ID: P0049\nDate: 2024-10-19\n\nPATIENT INFORMATION\n------------------\nAge: 49\nGender: Male\nAdmission Date: 2024-10-19\n\nVITAL SIGNS\n----------\nTemperature: 38.4\u00b0C\nHeart Rate: 119 bpm\nRespiratory Rate: 25 /min\nBlood Pressure: 111/67 mmHg\nO2 Saturation: 94%\n\nPRESENTING SYMPTOMS\n-----------------\n- chest pain\n- dyspnea\n- wheezing\n- sweating\n- malaise\n\nMEDICAL HISTORY\n-------------\nComorbidities: COPD\n\nMEDICATIONS\n----------\n- Guaifenesin 400mg every 4 hours as needed\n- Ibuprofen 400mg every 6 hours as needed\n\nASSESSMENT\n---------\nChest X-ray shows no active pulmonary disease.\n\nPLAN\n----\n1. Symptomatic treatment as needed\n2. Return if symptoms worsen\n3. Regular health maintenance\n",
    "image_path": "demo_dataset\\NORMAL\\NORMAL2-IM-0251-0001.jpeg"
  },
  {
    "patient_id": "P0050",
    "basic_info": {
      "age": 58,
      "gender": "Male",
      "admission_date": "2024-10-23"
    },
    "vitals": {
      "temperature": 38.4,
      "heart_rate": 84,
      "respiratory_rate": 28,
      "blood_pressure": "125/61",
      "oxygen_saturation": 91
    },
    "symptoms": [
      "tachypnea",
      "sputum production",
      "cough",
      "decreased appetite"
    ],
    "medications": [
      {
        "name": "Ibuprofen",
        "dosage": "400mg",
        "frequency": "every 6 hours as needed"
      },
      {
        "name": "Acetaminophen",
        "dosage": "650mg",
        "frequency": "every 6 hours as needed"
      }
    ],
    "comorbidities": [
      "COPD"
    ],
    "diagnosis": "Normal",
    "note_text": "\nCLINICAL NOTE\n============\nPatient ID: P0050\nDate: 2024-10-23\n\nPATIENT INFORMATION\n------------------\nAge: 58\nGender: Male\nAdmission Date: 2024-10-23\n\nVITAL SIGNS\n----------\nTemperature: 38.4\u00b0C\nHeart Rate: 84 bpm\nRespiratory Rate: 28 /min\nBlood Pressure: 125/61 mmHg\nO2 Saturation: 91%\n\nPRESENTING SYMPTOMS\n-----------------\n- tachypnea\n- sputum production\n- cough\n- decreased appetite\n\nMEDICAL HISTORY\n-------------\nComorbidities: COPD\n\nMEDICATIONS\n----------\n- Ibuprofen 400mg every 6 hours as needed\n- Acetaminophen 650mg every 6 hours as needed\n\nASSESSMENT\n---------\nChest X-ray shows no active pulmonary disease.\n\nPLAN\n----\n1. Symptomatic treatment as needed\n2. Return if symptoms worsen\n3. Regular health maintenance\n",
    "image_path": "demo_dataset\\NORMAL\\NORMAL2-IM-0252-0001.jpeg"
  },
  {
    "patient_id": "P0051",
    "basic_info": {
      "age": 73,
      "gender": "Male",
      "admission_date": "2024-10-18"
    },
    "vitals": {
      "temperature": 38.4,
      "heart_rate": 111,
      "respiratory_rate": 24,
      "blood_pressure": "135/72",
      "oxygen_saturation": 88
    },
    "symptoms": [
      "dyspnea",
      "sweating",
      "decreased appetite"
    ],
    "medications": [
      {
        "name": "Acetaminophen",
        "dosage": "650mg",
        "frequency": "every 6 hours as needed"
      }
    ],
    "comorbidities": [
      "COPD",
      "Asthma",
      "Diabetes Type 2"
    ],
    "diagnosis": "Normal",
    "note_text": "\nCLINICAL NOTE\n============\nPatient ID: P0051\nDate: 2024-10-18\n\nPATIENT INFORMATION\n------------------\nAge: 73\nGender: Male\nAdmission Date: 2024-10-18\n\nVITAL SIGNS\n----------\nTemperature: 38.4\u00b0C\nHeart Rate: 111 bpm\nRespiratory Rate: 24 /min\nBlood Pressure: 135/72 mmHg\nO2 Saturation: 88%\n\nPRESENTING SYMPTOMS\n-----------------\n- dyspnea\n- sweating\n- decreased appetite\n\nMEDICAL HISTORY\n-------------\nComorbidities: COPD, Asthma, Diabetes Type 2\n\nMEDICATIONS\n----------\n- Acetaminophen 650mg every 6 hours as needed\n\nASSESSMENT\n---------\nChest X-ray shows no active pulmonary disease.\n\nPLAN\n----\n1. Symptomatic treatment as needed\n2. Return if symptoms worsen\n3. Regular health maintenance\n",
    "image_path": "demo_dataset\\NORMAL\\NORMAL2-IM-0256-0001.jpeg"
  },
  {
    "patient_id": "P0052",
    "basic_info": {
      "age": 83,
      "gender": "Female",
      "admission_date": "2024-10-17"
    },
    "vitals": {
      "temperature": 37.6,
      "heart_rate": 99,
      "respiratory_rate": 25,
      "blood_pressure": "124/89",
      "oxygen_saturation": 89
    },
    "symptoms": [
      "cough",
      "chills"
    ],
    "medications": [
      {
        "name": "Acetaminophen",
        "dosage": "650mg",
        "frequency": "every 6 hours as needed"
      },
      {
        "name": "Guaifenesin",
        "dosage": "400mg",
        "frequency": "every 4 hours as needed"
      }
    ],
    "comorbidities": [
      "Chronic Kidney Disease",
      "Asthma",
      "Obesity"
    ],
    "diagnosis": "Normal",
    "note_text": "\nCLINICAL NOTE\n============\nPatient ID: P0052\nDate: 2024-10-17\n\nPATIENT INFORMATION\n------------------\nAge: 83\nGender: Female\nAdmission Date: 2024-10-17\n\nVITAL SIGNS\n----------\nTemperature: 37.6\u00b0C\nHeart Rate: 99 bpm\nRespiratory Rate: 25 /min\nBlood Pressure: 124/89 mmHg\nO2 Saturation: 89%\n\nPRESENTING SYMPTOMS\n-----------------\n- cough\n- chills\n\nMEDICAL HISTORY\n-------------\nComorbidities: Chronic Kidney Disease, Asthma, Obesity\n\nMEDICATIONS\n----------\n- Acetaminophen 650mg every 6 hours as needed\n- Guaifenesin 400mg every 4 hours as needed\n\nASSESSMENT\n---------\nChest X-ray shows no active pulmonary disease.\n\nPLAN\n----\n1. Symptomatic treatment as needed\n2. Return if symptoms worsen\n3. Regular health maintenance\n",
    "image_path": "demo_dataset\\NORMAL\\NORMAL2-IM-0271-0001.jpeg"
  },
  {
    "patient_id": "P0053",
    "basic_info": {
      "age": 29,
      "gender": "Female",
      "admission_date": "2024-10-15"
    },
    "vitals": {
      "temperature": 38.4,
      "heart_rate": 115,
      "respiratory_rate": 24,
      "blood_pressure": "139/72",
      "oxygen_saturation": 93
    },
    "symptoms": [
      "tachypnea",
      "shallow breathing",
      "wheezing",
      "decreased appetite",
      "sweating"
    ],
    "medications": [
      {
        "name": "Ibuprofen",
        "dosage": "400mg",
        "frequency": "every 6 hours as needed"
      }
    ],
    "comorbidities": [],
    "diagnosis": "Normal",
    "note_text": "\nCLINICAL NOTE\n============\nPatient ID: P0053\nDate: 2024-10-15\n\nPATIENT INFORMATION\n------------------\nAge: 29\nGender: Female\nAdmission Date: 2024-10-15\n\nVITAL SIGNS\n----------\nTemperature: 38.4\u00b0C\nHeart Rate: 115 bpm\nRespiratory Rate: 24 /min\nBlood Pressure: 139/72 mmHg\nO2 Saturation: 93%\n\nPRESENTING SYMPTOMS\n-----------------\n- tachypnea\n- shallow breathing\n- wheezing\n- decreased appetite\n- sweating\n\nMEDICAL HISTORY\n-------------\nComorbidities: None\n\nMEDICATIONS\n----------\n- Ibuprofen 400mg every 6 hours as needed\n\nASSESSMENT\n---------\nChest X-ray shows no active pulmonary disease.\n\nPLAN\n----\n1. Symptomatic treatment as needed\n2. Return if symptoms worsen\n3. Regular health maintenance\n",
    "image_path": "demo_dataset\\NORMAL\\NORMAL2-IM-0275-0001.jpeg"
  },
  {
    "patient_id": "P0054",
    "basic_info": {
      "age": 27,
      "gender": "Male",
      "admission_date": "2024-10-13"
    },
    "vitals": {
      "temperature": 38.2,
      "heart_rate": 90,
      "respiratory_rate": 21,
      "blood_pressure": "113/72",
      "oxygen_saturation": 92
    },
    "symptoms": [
      "cough",
      "shallow breathing",
      "wheezing",
      "decreased appetite"
    ],
    "medications": [
      {
        "name": "Acetaminophen",
        "dosage": "650mg",
        "frequency": "every 6 hours as needed"
      }
    ],
    "comorbidities": [
      "COPD",
      "Diabetes Type 2",
      "Hypertension"
    ],
    "diagnosis": "Normal",
    "note_text": "\nCLINICAL NOTE\n============\nPatient ID: P0054\nDate: 2024-10-13\n\nPATIENT INFORMATION\n------------------\nAge: 27\nGender: Male\nAdmission Date: 2024-10-13\n\nVITAL SIGNS\n----------\nTemperature: 38.2\u00b0C\nHeart Rate: 90 bpm\nRespiratory Rate: 21 /min\nBlood Pressure: 113/72 mmHg\nO2 Saturation: 92%\n\nPRESENTING SYMPTOMS\n-----------------\n- cough\n- shallow breathing\n- wheezing\n- decreased appetite\n\nMEDICAL HISTORY\n-------------\nComorbidities: COPD, Diabetes Type 2, Hypertension\n\nMEDICATIONS\n----------\n- Acetaminophen 650mg every 6 hours as needed\n\nASSESSMENT\n---------\nChest X-ray shows no active pulmonary disease.\n\nPLAN\n----\n1. Symptomatic treatment as needed\n2. Return if symptoms worsen\n3. Regular health maintenance\n",
    "image_path": "demo_dataset\\NORMAL\\NORMAL2-IM-0282-0001.jpeg"
  },
  {
    "patient_id": "P0055",
    "basic_info": {
      "age": 20,
      "gender": "Female",
      "admission_date": "2024-10-13"
    },
    "vitals": {
      "temperature": 38.8,
      "heart_rate": 99,
      "respiratory_rate": 22,
      "blood_pressure": "117/78",
      "oxygen_saturation": 91
    },
    "symptoms": [
      "dyspnea",
      "shallow breathing",
      "fatigue"
    ],
    "medications": [
      {
        "name": "Guaifenesin",
        "dosage": "400mg",
        "frequency": "every 4 hours as needed"
      },
      {
        "name": "Acetaminophen",
        "dosage": "650mg",
        "frequency": "every 6 hours as needed"
      }
    ],
    "comorbidities": [
      "Diabetes Type 2",
      "Hypertension"
    ],
    "diagnosis": "Normal",
    "note_text": "\nCLINICAL NOTE\n============\nPatient ID: P0055\nDate: 2024-10-13\n\nPATIENT INFORMATION\n------------------\nAge: 20\nGender: Female\nAdmission Date: 2024-10-13\n\nVITAL SIGNS\n----------\nTemperature: 38.8\u00b0C\nHeart Rate: 99 bpm\nRespiratory Rate: 22 /min\nBlood Pressure: 117/78 mmHg\nO2 Saturation: 91%\n\nPRESENTING SYMPTOMS\n-----------------\n- dyspnea\n- shallow breathing\n- fatigue\n\nMEDICAL HISTORY\n-------------\nComorbidities: Diabetes Type 2, Hypertension\n\nMEDICATIONS\n----------\n- Guaifenesin 400mg every 4 hours as needed\n- Acetaminophen 650mg every 6 hours as needed\n\nASSESSMENT\n---------\nChest X-ray shows no active pulmonary disease.\n\nPLAN\n----\n1. Symptomatic treatment as needed\n2. Return if symptoms worsen\n3. Regular health maintenance\n",
    "image_path": "demo_dataset\\NORMAL\\NORMAL2-IM-0285-0001.jpeg"
  },
  {
    "patient_id": "P0056",
    "basic_info": {
      "age": 72,
      "gender": "Female",
      "admission_date": "2024-10-19"
    },
    "vitals": {
      "temperature": 38.6,
      "heart_rate": 81,
      "respiratory_rate": 23,
      "blood_pressure": "112/85",
      "oxygen_saturation": 95
    },
    "symptoms": [
      "wheezing",
      "tachypnea",
      "dyspnea",
      "muscle aches",
      "chills"
    ],
    "medications": [
      {
        "name": "Acetaminophen",
        "dosage": "650mg",
        "frequency": "every 6 hours as needed"
      },
      {
        "name": "Ibuprofen",
        "dosage": "400mg",
        "frequency": "every 6 hours as needed"
      }
    ],
    "comorbidities": [
      "Chronic Kidney Disease",
      "Obesity"
    ],
    "diagnosis": "Normal",
    "note_text": "\nCLINICAL NOTE\n============\nPatient ID: P0056\nDate: 2024-10-19\n\nPATIENT INFORMATION\n------------------\nAge: 72\nGender: Female\nAdmission Date: 2024-10-19\n\nVITAL SIGNS\n----------\nTemperature: 38.6\u00b0C\nHeart Rate: 81 bpm\nRespiratory Rate: 23 /min\nBlood Pressure: 112/85 mmHg\nO2 Saturation: 95%\n\nPRESENTING SYMPTOMS\n-----------------\n- wheezing\n- tachypnea\n- dyspnea\n- muscle aches\n- chills\n\nMEDICAL HISTORY\n-------------\nComorbidities: Chronic Kidney Disease, Obesity\n\nMEDICATIONS\n----------\n- Acetaminophen 650mg every 6 hours as needed\n- Ibuprofen 400mg every 6 hours as needed\n\nASSESSMENT\n---------\nChest X-ray shows no active pulmonary disease.\n\nPLAN\n----\n1. Symptomatic treatment as needed\n2. Return if symptoms worsen\n3. Regular health maintenance\n",
    "image_path": "demo_dataset\\NORMAL\\NORMAL2-IM-0290-0001.jpeg"
  },
  {
    "patient_id": "P0057",
    "basic_info": {
      "age": 26,
      "gender": "Male",
      "admission_date": "2024-10-26"
    },
    "vitals": {
      "temperature": 38.8,
      "heart_rate": 86,
      "respiratory_rate": 23,
      "blood_pressure": "136/70",
      "oxygen_saturation": 94
    },
    "symptoms": [
      "wheezing",
      "fever"
    ],
    "medications": [
      {
        "name": "Ibuprofen",
        "dosage": "400mg",
        "frequency": "every 6 hours as needed"
      },
      {
        "name": "Acetaminophen",
        "dosage": "650mg",
        "frequency": "every 6 hours as needed"
      }
    ],
    "comorbidities": [],
    "diagnosis": "Normal",
    "note_text": "\nCLINICAL NOTE\n============\nPatient ID: P0057\nDate: 2024-10-26\n\nPATIENT INFORMATION\n------------------\nAge: 26\nGender: Male\nAdmission Date: 2024-10-26\n\nVITAL SIGNS\n----------\nTemperature: 38.8\u00b0C\nHeart Rate: 86 bpm\nRespiratory Rate: 23 /min\nBlood Pressure: 136/70 mmHg\nO2 Saturation: 94%\n\nPRESENTING SYMPTOMS\n-----------------\n- wheezing\n- fever\n\nMEDICAL HISTORY\n-------------\nComorbidities: None\n\nMEDICATIONS\n----------\n- Ibuprofen 400mg every 6 hours as needed\n- Acetaminophen 650mg every 6 hours as needed\n\nASSESSMENT\n---------\nChest X-ray shows no active pulmonary disease.\n\nPLAN\n----\n1. Symptomatic treatment as needed\n2. Return if symptoms worsen\n3. Regular health maintenance\n",
    "image_path": "demo_dataset\\NORMAL\\NORMAL2-IM-0297-0001.jpeg"
  },
  {
    "patient_id": "P0058",
    "basic_info": {
      "age": 67,
      "gender": "Female",
      "admission_date": "2024-10-23"
    },
    "vitals": {
      "temperature": 37.7,
      "heart_rate": 111,
      "respiratory_rate": 21,
      "blood_pressure": "136/70",
      "oxygen_saturation": 91
    },
    "symptoms": [
      "chest pain",
      "tachypnea",
      "wheezing",
      "chills",
      "malaise"
    ],
    "medications": [
      {
        "name": "Ibuprofen",
        "dosage": "400mg",
        "frequency": "every 6 hours as needed"
      },
      {
        "name": "Acetaminophen",
        "dosage": "650mg",
        "frequency": "every 6 hours as needed"
      }
    ],
    "comorbidities": [
      "Diabetes Type 2",
      "Asthma"
    ],
    "diagnosis": "Normal",
    "note_text": "\nCLINICAL NOTE\n============\nPatient ID: P0058\nDate: 2024-10-23\n\nPATIENT INFORMATION\n------------------\nAge: 67\nGender: Female\nAdmission Date: 2024-10-23\n\nVITAL SIGNS\n----------\nTemperature: 37.7\u00b0C\nHeart Rate: 111 bpm\nRespiratory Rate: 21 /min\nBlood Pressure: 136/70 mmHg\nO2 Saturation: 91%\n\nPRESENTING SYMPTOMS\n-----------------\n- chest pain\n- tachypnea\n- wheezing\n- chills\n- malaise\n\nMEDICAL HISTORY\n-------------\nComorbidities: Diabetes Type 2, Asthma\n\nMEDICATIONS\n----------\n- Ibuprofen 400mg every 6 hours as needed\n- Acetaminophen 650mg every 6 hours as needed\n\nASSESSMENT\n---------\nChest X-ray shows no active pulmonary disease.\n\nPLAN\n----\n1. Symptomatic treatment as needed\n2. Return if symptoms worsen\n3. Regular health maintenance\n",
    "image_path": "demo_dataset\\NORMAL\\NORMAL2-IM-0301-0001.jpeg"
  },
  {
    "patient_id": "P0059",
    "basic_info": {
      "age": 37,
      "gender": "Female",
      "admission_date": "2024-10-16"
    },
    "vitals": {
      "temperature": 37.9,
      "heart_rate": 103,
      "respiratory_rate": 23,
      "blood_pressure": "118/61",
      "oxygen_saturation": 95
    },
    "symptoms": [
      "wheezing",
      "sputum production",
      "shallow breathing",
      "muscle aches"
    ],
    "medications": [
      {
        "name": "Guaifenesin",
        "dosage": "400mg",
        "frequency": "every 4 hours as needed"
      },
      {
        "name": "Ibuprofen",
        "dosage": "400mg",
        "frequency": "every 6 hours as needed"
      }
    ],
    "comorbidities": [
      "COPD",
      "Diabetes Type 2"
    ],
    "diagnosis": "Normal",
    "note_text": "\nCLINICAL NOTE\n============\nPatient ID: P0059\nDate: 2024-10-16\n\nPATIENT INFORMATION\n------------------\nAge: 37\nGender: Female\nAdmission Date: 2024-10-16\n\nVITAL SIGNS\n----------\nTemperature: 37.9\u00b0C\nHeart Rate: 103 bpm\nRespiratory Rate: 23 /min\nBlood Pressure: 118/61 mmHg\nO2 Saturation: 95%\n\nPRESENTING SYMPTOMS\n-----------------\n- wheezing\n- sputum production\n- shallow breathing\n- muscle aches\n\nMEDICAL HISTORY\n-------------\nComorbidities: COPD, Diabetes Type 2\n\nMEDICATIONS\n----------\n- Guaifenesin 400mg every 4 hours as needed\n- Ibuprofen 400mg every 6 hours as needed\n\nASSESSMENT\n---------\nChest X-ray shows no active pulmonary disease.\n\nPLAN\n----\n1. Symptomatic treatment as needed\n2. Return if symptoms worsen\n3. Regular health maintenance\n",
    "image_path": "demo_dataset\\NORMAL\\NORMAL2-IM-0305-0001.jpeg"
  },
  {
    "patient_id": "P0060",
    "basic_info": {
      "age": 58,
      "gender": "Male",
      "admission_date": "2024-10-15"
    },
    "vitals": {
      "temperature": 38.6,
      "heart_rate": 90,
      "respiratory_rate": 24,
      "blood_pressure": "110/83",
      "oxygen_saturation": 94
    },
    "symptoms": [
      "cough",
      "chills",
      "malaise"
    ],
    "medications": [
      {
        "name": "Acetaminophen",
        "dosage": "650mg",
        "frequency": "every 6 hours as needed"
      }
    ],
    "comorbidities": [
      "Obesity",
      "Hypertension",
      "Asthma"
    ],
    "diagnosis": "Normal",
    "note_text": "\nCLINICAL NOTE\n============\nPatient ID: P0060\nDate: 2024-10-15\n\nPATIENT INFORMATION\n------------------\nAge: 58\nGender: Male\nAdmission Date: 2024-10-15\n\nVITAL SIGNS\n----------\nTemperature: 38.6\u00b0C\nHeart Rate: 90 bpm\nRespiratory Rate: 24 /min\nBlood Pressure: 110/83 mmHg\nO2 Saturation: 94%\n\nPRESENTING SYMPTOMS\n-----------------\n- cough\n- chills\n- malaise\n\nMEDICAL HISTORY\n-------------\nComorbidities: Obesity, Hypertension, Asthma\n\nMEDICATIONS\n----------\n- Acetaminophen 650mg every 6 hours as needed\n\nASSESSMENT\n---------\nChest X-ray shows no active pulmonary disease.\n\nPLAN\n----\n1. Symptomatic treatment as needed\n2. Return if symptoms worsen\n3. Regular health maintenance\n",
    "image_path": "demo_dataset\\NORMAL\\NORMAL2-IM-0307-0001.jpeg"
  },
  {
    "patient_id": "P0061",
    "basic_info": {
      "age": 62,
      "gender": "Male",
      "admission_date": "2024-10-23"
    },
    "vitals": {
      "temperature": 39.2,
      "heart_rate": 93,
      "respiratory_rate": 25,
      "blood_pressure": "114/62",
      "oxygen_saturation": 94
    },
    "symptoms": [
      "wheezing",
      "sweating",
      "fatigue"
    ],
    "medications": [
      {
        "name": "Guaifenesin",
        "dosage": "400mg",
        "frequency": "every 4 hours as needed"
      },
      {
        "name": "Ibuprofen",
        "dosage": "400mg",
        "frequency": "every 6 hours as needed"
      }
    ],
    "comorbidities": [
      "Asthma",
      "Coronary Artery Disease",
      "Obesity"
    ],
    "diagnosis": "Normal",
    "note_text": "\nCLINICAL NOTE\n============\nPatient ID: P0061\nDate: 2024-10-23\n\nPATIENT INFORMATION\n------------------\nAge: 62\nGender: Male\nAdmission Date: 2024-10-23\n\nVITAL SIGNS\n----------\nTemperature: 39.2\u00b0C\nHeart Rate: 93 bpm\nRespiratory Rate: 25 /min\nBlood Pressure: 114/62 mmHg\nO2 Saturation: 94%\n\nPRESENTING SYMPTOMS\n-----------------\n- wheezing\n- sweating\n- fatigue\n\nMEDICAL HISTORY\n-------------\nComorbidities: Asthma, Coronary Artery Disease, Obesity\n\nMEDICATIONS\n----------\n- Guaifenesin 400mg every 4 hours as needed\n- Ibuprofen 400mg every 6 hours as needed\n\nASSESSMENT\n---------\nChest X-ray shows no active pulmonary disease.\n\nPLAN\n----\n1. Symptomatic treatment as needed\n2. Return if symptoms worsen\n3. Regular health maintenance\n",
    "image_path": "demo_dataset\\NORMAL\\NORMAL2-IM-0309-0001.jpeg"
  },
  {
    "patient_id": "P0062",
    "basic_info": {
      "age": 78,
      "gender": "Male",
      "admission_date": "2024-10-21"
    },
    "vitals": {
      "temperature": 38.3,
      "heart_rate": 82,
      "respiratory_rate": 26,
      "blood_pressure": "128/60",
      "oxygen_saturation": 94
    },
    "symptoms": [
      "cough",
      "malaise",
      "fever"
    ],
    "medications": [
      {
        "name": "Acetaminophen",
        "dosage": "650mg",
        "frequency": "every 6 hours as needed"
      },
      {
        "name": "Guaifenesin",
        "dosage": "400mg",
        "frequency": "every 4 hours as needed"
      }
    ],
    "comorbidities": [],
    "diagnosis": "Normal",
    "note_text": "\nCLINICAL NOTE\n============\nPatient ID: P0062\nDate: 2024-10-21\n\nPATIENT INFORMATION\n------------------\nAge: 78\nGender: Male\nAdmission Date: 2024-10-21\n\nVITAL SIGNS\n----------\nTemperature: 38.3\u00b0C\nHeart Rate: 82 bpm\nRespiratory Rate: 26 /min\nBlood Pressure: 128/60 mmHg\nO2 Saturation: 94%\n\nPRESENTING SYMPTOMS\n-----------------\n- cough\n- malaise\n- fever\n\nMEDICAL HISTORY\n-------------\nComorbidities: None\n\nMEDICATIONS\n----------\n- Acetaminophen 650mg every 6 hours as needed\n- Guaifenesin 400mg every 4 hours as needed\n\nASSESSMENT\n---------\nChest X-ray shows no active pulmonary disease.\n\nPLAN\n----\n1. Symptomatic treatment as needed\n2. Return if symptoms worsen\n3. Regular health maintenance\n",
    "image_path": "demo_dataset\\NORMAL\\NORMAL2-IM-0311-0001.jpeg"
  },
  {
    "patient_id": "P0063",
    "basic_info": {
      "age": 74,
      "gender": "Female",
      "admission_date": "2024-10-20"
    },
    "vitals": {
      "temperature": 39.4,
      "heart_rate": 85,
      "respiratory_rate": 22,
      "blood_pressure": "114/84",
      "oxygen_saturation": 95
    },
    "symptoms": [
      "wheezing",
      "fatigue"
    ],
    "medications": [
      {
        "name": "Guaifenesin",
        "dosage": "400mg",
        "frequency": "every 4 hours as needed"
      }
    ],
    "comorbidities": [
      "Coronary Artery Disease",
      "Chronic Kidney Disease",
      "Hypertension"
    ],
    "diagnosis": "Normal",
    "note_text": "\nCLINICAL NOTE\n============\nPatient ID: P0063\nDate: 2024-10-20\n\nPATIENT INFORMATION\n------------------\nAge: 74\nGender: Female\nAdmission Date: 2024-10-20\n\nVITAL SIGNS\n----------\nTemperature: 39.4\u00b0C\nHeart Rate: 85 bpm\nRespiratory Rate: 22 /min\nBlood Pressure: 114/84 mmHg\nO2 Saturation: 95%\n\nPRESENTING SYMPTOMS\n-----------------\n- wheezing\n- fatigue\n\nMEDICAL HISTORY\n-------------\nComorbidities: Coronary Artery Disease, Chronic Kidney Disease, Hypertension\n\nMEDICATIONS\n----------\n- Guaifenesin 400mg every 4 hours as needed\n\nASSESSMENT\n---------\nChest X-ray shows no active pulmonary disease.\n\nPLAN\n----\n1. Symptomatic treatment as needed\n2. Return if symptoms worsen\n3. Regular health maintenance\n",
    "image_path": "demo_dataset\\NORMAL\\NORMAL2-IM-0312-0001.jpeg"
  },
  {
    "patient_id": "P0064",
    "basic_info": {
      "age": 58,
      "gender": "Female",
      "admission_date": "2024-10-20"
    },
    "vitals": {
      "temperature": 38.8,
      "heart_rate": 90,
      "respiratory_rate": 29,
      "blood_pressure": "140/81",
      "oxygen_saturation": 92
    },
    "symptoms": [
      "chest pain",
      "cough",
      "dyspnea",
      "fever",
      "fatigue"
    ],
    "medications": [
      {
        "name": "Acetaminophen",
        "dosage": "650mg",
        "frequency": "every 6 hours as needed"
      },
      {
        "name": "Ibuprofen",
        "dosage": "400mg",
        "frequency": "every 6 hours as needed"
      }
    ],
    "comorbidities": [
      "Diabetes Type 2"
    ],
    "diagnosis": "Normal",
    "note_text": "\nCLINICAL NOTE\n============\nPatient ID: P0064\nDate: 2024-10-20\n\nPATIENT INFORMATION\n------------------\nAge: 58\nGender: Female\nAdmission Date: 2024-10-20\n\nVITAL SIGNS\n----------\nTemperature: 38.8\u00b0C\nHeart Rate: 90 bpm\nRespiratory Rate: 29 /min\nBlood Pressure: 140/81 mmHg\nO2 Saturation: 92%\n\nPRESENTING SYMPTOMS\n-----------------\n- chest pain\n- cough\n- dyspnea\n- fever\n- fatigue\n\nMEDICAL HISTORY\n-------------\nComorbidities: Diabetes Type 2\n\nMEDICATIONS\n----------\n- Acetaminophen 650mg every 6 hours as needed\n- Ibuprofen 400mg every 6 hours as needed\n\nASSESSMENT\n---------\nChest X-ray shows no active pulmonary disease.\n\nPLAN\n----\n1. Symptomatic treatment as needed\n2. Return if symptoms worsen\n3. Regular health maintenance\n",
    "image_path": "demo_dataset\\NORMAL\\NORMAL2-IM-0329-0001.jpeg"
  },
  {
    "patient_id": "P0065",
    "basic_info": {
      "age": 65,
      "gender": "Male",
      "admission_date": "2024-10-25"
    },
    "vitals": {
      "temperature": 37.9,
      "heart_rate": 88,
      "respiratory_rate": 28,
      "blood_pressure": "121/63",
      "oxygen_saturation": 91
    },
    "symptoms": [
      "chest pain",
      "sputum production",
      "sweating",
      "decreased appetite"
    ],
    "medications": [
      {
        "name": "Guaifenesin",
        "dosage": "400mg",
        "frequency": "every 4 hours as needed"
      }
    ],
    "comorbidities": [
      "COPD",
      "Obesity",
      "Asthma"
    ],
    "diagnosis": "Normal",
    "note_text": "\nCLINICAL NOTE\n============\nPatient ID: P0065\nDate: 2024-10-25\n\nPATIENT INFORMATION\n------------------\nAge: 65\nGender: Male\nAdmission Date: 2024-10-25\n\nVITAL SIGNS\n----------\nTemperature: 37.9\u00b0C\nHeart Rate: 88 bpm\nRespiratory Rate: 28 /min\nBlood Pressure: 121/63 mmHg\nO2 Saturation: 91%\n\nPRESENTING SYMPTOMS\n-----------------\n- chest pain\n- sputum production\n- sweating\n- decreased appetite\n\nMEDICAL HISTORY\n-------------\nComorbidities: COPD, Obesity, Asthma\n\nMEDICATIONS\n----------\n- Guaifenesin 400mg every 4 hours as needed\n\nASSESSMENT\n---------\nChest X-ray shows no active pulmonary disease.\n\nPLAN\n----\n1. Symptomatic treatment as needed\n2. Return if symptoms worsen\n3. Regular health maintenance\n",
    "image_path": "demo_dataset\\NORMAL\\NORMAL2-IM-0339-0001.jpeg"
  },
  {
    "patient_id": "P0066",
    "basic_info": {
      "age": 43,
      "gender": "Male",
      "admission_date": "2024-10-22"
    },
    "vitals": {
      "temperature": 39.3,
      "heart_rate": 112,
      "respiratory_rate": 22,
      "blood_pressure": "131/73",
      "oxygen_saturation": 91
    },
    "symptoms": [
      "shallow breathing",
      "tachypnea",
      "sweating",
      "decreased appetite"
    ],
    "medications": [
      {
        "name": "Guaifenesin",
        "dosage": "400mg",
        "frequency": "every 4 hours as needed"
      }
    ],
    "comorbidities": [],
    "diagnosis": "Normal",
    "note_text": "\nCLINICAL NOTE\n============\nPatient ID: P0066\nDate: 2024-10-22\n\nPATIENT INFORMATION\n------------------\nAge: 43\nGender: Male\nAdmission Date: 2024-10-22\n\nVITAL SIGNS\n----------\nTemperature: 39.3\u00b0C\nHeart Rate: 112 bpm\nRespiratory Rate: 22 /min\nBlood Pressure: 131/73 mmHg\nO2 Saturation: 91%\n\nPRESENTING SYMPTOMS\n-----------------\n- shallow breathing\n- tachypnea\n- sweating\n- decreased appetite\n\nMEDICAL HISTORY\n-------------\nComorbidities: None\n\nMEDICATIONS\n----------\n- Guaifenesin 400mg every 4 hours as needed\n\nASSESSMENT\n---------\nChest X-ray shows no active pulmonary disease.\n\nPLAN\n----\n1. Symptomatic treatment as needed\n2. Return if symptoms worsen\n3. Regular health maintenance\n",
    "image_path": "demo_dataset\\NORMAL\\NORMAL2-IM-0341-0001.jpeg"
  },
  {
    "patient_id": "P0067",
    "basic_info": {
      "age": 62,
      "gender": "Male",
      "admission_date": "2024-10-13"
    },
    "vitals": {
      "temperature": 38.5,
      "heart_rate": 88,
      "respiratory_rate": 28,
      "blood_pressure": "124/72",
      "oxygen_saturation": 88
    },
    "symptoms": [
      "cough",
      "chills",
      "decreased appetite"
    ],
    "medications": [
      {
        "name": "Acetaminophen",
        "dosage": "650mg",
        "frequency": "every 6 hours as needed"
      },
      {
        "name": "Guaifenesin",
        "dosage": "400mg",
        "frequency": "every 4 hours as needed"
      }
    ],
    "comorbidities": [
      "COPD"
    ],
    "diagnosis": "Normal",
    "note_text": "\nCLINICAL NOTE\n============\nPatient ID: P0067\nDate: 2024-10-13\n\nPATIENT INFORMATION\n------------------\nAge: 62\nGender: Male\nAdmission Date: 2024-10-13\n\nVITAL SIGNS\n----------\nTemperature: 38.5\u00b0C\nHeart Rate: 88 bpm\nRespiratory Rate: 28 /min\nBlood Pressure: 124/72 mmHg\nO2 Saturation: 88%\n\nPRESENTING SYMPTOMS\n-----------------\n- cough\n- chills\n- decreased appetite\n\nMEDICAL HISTORY\n-------------\nComorbidities: COPD\n\nMEDICATIONS\n----------\n- Acetaminophen 650mg every 6 hours as needed\n- Guaifenesin 400mg every 4 hours as needed\n\nASSESSMENT\n---------\nChest X-ray shows no active pulmonary disease.\n\nPLAN\n----\n1. Symptomatic treatment as needed\n2. Return if symptoms worsen\n3. Regular health maintenance\n",
    "image_path": "demo_dataset\\NORMAL\\NORMAL2-IM-0348-0001.jpeg"
  },
  {
    "patient_id": "P0068",
    "basic_info": {
      "age": 52,
      "gender": "Male",
      "admission_date": "2024-10-13"
    },
    "vitals": {
      "temperature": 38.8,
      "heart_rate": 115,
      "respiratory_rate": 21,
      "blood_pressure": "115/69",
      "oxygen_saturation": 93
    },
    "symptoms": [
      "dyspnea",
      "shallow breathing",
      "wheezing",
      "sweating",
      "muscle aches"
    ],
    "medications": [
      {
        "name": "Guaifenesin",
        "dosage": "400mg",
        "frequency": "every 4 hours as needed"
      },
      {
        "name": "Ibuprofen",
        "dosage": "400mg",
        "frequency": "every 6 hours as needed"
      }
    ],
    "comorbidities": [
      "Chronic Kidney Disease"
    ],
    "diagnosis": "Normal",
    "note_text": "\nCLINICAL NOTE\n============\nPatient ID: P0068\nDate: 2024-10-13\n\nPATIENT INFORMATION\n------------------\nAge: 52\nGender: Male\nAdmission Date: 2024-10-13\n\nVITAL SIGNS\n----------\nTemperature: 38.8\u00b0C\nHeart Rate: 115 bpm\nRespiratory Rate: 21 /min\nBlood Pressure: 115/69 mmHg\nO2 Saturation: 93%\n\nPRESENTING SYMPTOMS\n-----------------\n- dyspnea\n- shallow breathing\n- wheezing\n- sweating\n- muscle aches\n\nMEDICAL HISTORY\n-------------\nComorbidities: Chronic Kidney Disease\n\nMEDICATIONS\n----------\n- Guaifenesin 400mg every 4 hours as needed\n- Ibuprofen 400mg every 6 hours as needed\n\nASSESSMENT\n---------\nChest X-ray shows no active pulmonary disease.\n\nPLAN\n----\n1. Symptomatic treatment as needed\n2. Return if symptoms worsen\n3. Regular health maintenance\n",
    "image_path": "demo_dataset\\NORMAL\\NORMAL2-IM-0354-0001.jpeg"
  },
  {
    "patient_id": "P0069",
    "basic_info": {
      "age": 58,
      "gender": "Male",
      "admission_date": "2024-10-26"
    },
    "vitals": {
      "temperature": 37.8,
      "heart_rate": 94,
      "respiratory_rate": 20,
      "blood_pressure": "136/82",
      "oxygen_saturation": 90
    },
    "symptoms": [
      "wheezing",
      "sputum production",
      "chest pain",
      "muscle aches",
      "malaise"
    ],
    "medications": [
      {
        "name": "Ibuprofen",
        "dosage": "400mg",
        "frequency": "every 6 hours as needed"
      }
    ],
    "comorbidities": [
      "Diabetes Type 2"
    ],
    "diagnosis": "Normal",
    "note_text": "\nCLINICAL NOTE\n============\nPatient ID: P0069\nDate: 2024-10-26\n\nPATIENT INFORMATION\n------------------\nAge: 58\nGender: Male\nAdmission Date: 2024-10-26\n\nVITAL SIGNS\n----------\nTemperature: 37.8\u00b0C\nHeart Rate: 94 bpm\nRespiratory Rate: 20 /min\nBlood Pressure: 136/82 mmHg\nO2 Saturation: 90%\n\nPRESENTING SYMPTOMS\n-----------------\n- wheezing\n- sputum production\n- chest pain\n- muscle aches\n- malaise\n\nMEDICAL HISTORY\n-------------\nComorbidities: Diabetes Type 2\n\nMEDICATIONS\n----------\n- Ibuprofen 400mg every 6 hours as needed\n\nASSESSMENT\n---------\nChest X-ray shows no active pulmonary disease.\n\nPLAN\n----\n1. Symptomatic treatment as needed\n2. Return if symptoms worsen\n3. Regular health maintenance\n",
    "image_path": "demo_dataset\\NORMAL\\NORMAL2-IM-0357-0001.jpeg"
  },
  {
    "patient_id": "P0070",
    "basic_info": {
      "age": 39,
      "gender": "Female",
      "admission_date": "2024-10-17"
    },
    "vitals": {
      "temperature": 38.1,
      "heart_rate": 93,
      "respiratory_rate": 21,
      "blood_pressure": "112/62",
      "oxygen_saturation": 89
    },
    "symptoms": [
      "shallow breathing",
      "cough",
      "chills"
    ],
    "medications": [
      {
        "name": "Acetaminophen",
        "dosage": "650mg",
        "frequency": "every 6 hours as needed"
      }
    ],
    "comorbidities": [
      "Hypertension",
      "Obesity",
      "Asthma"
    ],
    "diagnosis": "Normal",
    "note_text": "\nCLINICAL NOTE\n============\nPatient ID: P0070\nDate: 2024-10-17\n\nPATIENT INFORMATION\n------------------\nAge: 39\nGender: Female\nAdmission Date: 2024-10-17\n\nVITAL SIGNS\n----------\nTemperature: 38.1\u00b0C\nHeart Rate: 93 bpm\nRespiratory Rate: 21 /min\nBlood Pressure: 112/62 mmHg\nO2 Saturation: 89%\n\nPRESENTING SYMPTOMS\n-----------------\n- shallow breathing\n- cough\n- chills\n\nMEDICAL HISTORY\n-------------\nComorbidities: Hypertension, Obesity, Asthma\n\nMEDICATIONS\n----------\n- Acetaminophen 650mg every 6 hours as needed\n\nASSESSMENT\n---------\nChest X-ray shows no active pulmonary disease.\n\nPLAN\n----\n1. Symptomatic treatment as needed\n2. Return if symptoms worsen\n3. Regular health maintenance\n",
    "image_path": "demo_dataset\\NORMAL\\NORMAL2-IM-0360-0001.jpeg"
  },
  {
    "patient_id": "P0071",
    "basic_info": {
      "age": 58,
      "gender": "Male",
      "admission_date": "2024-10-17"
    },
    "vitals": {
      "temperature": 38.4,
      "heart_rate": 106,
      "respiratory_rate": 25,
      "blood_pressure": "120/87",
      "oxygen_saturation": 94
    },
    "symptoms": [
      "chest pain",
      "dyspnea",
      "shallow breathing",
      "chills"
    ],
    "medications": [
      {
        "name": "Acetaminophen",
        "dosage": "650mg",
        "frequency": "every 6 hours as needed"
      },
      {
        "name": "Guaifenesin",
        "dosage": "400mg",
        "frequency": "every 4 hours as needed"
      }
    ],
    "comorbidities": [
      "Obesity",
      "Asthma",
      "COPD"
    ],
    "diagnosis": "Normal",
    "note_text": "\nCLINICAL NOTE\n============\nPatient ID: P0071\nDate: 2024-10-17\n\nPATIENT INFORMATION\n------------------\nAge: 58\nGender: Male\nAdmission Date: 2024-10-17\n\nVITAL SIGNS\n----------\nTemperature: 38.4\u00b0C\nHeart Rate: 106 bpm\nRespiratory Rate: 25 /min\nBlood Pressure: 120/87 mmHg\nO2 Saturation: 94%\n\nPRESENTING SYMPTOMS\n-----------------\n- chest pain\n- dyspnea\n- shallow breathing\n- chills\n\nMEDICAL HISTORY\n-------------\nComorbidities: Obesity, Asthma, COPD\n\nMEDICATIONS\n----------\n- Acetaminophen 650mg every 6 hours as needed\n- Guaifenesin 400mg every 4 hours as needed\n\nASSESSMENT\n---------\nChest X-ray shows no active pulmonary disease.\n\nPLAN\n----\n1. Symptomatic treatment as needed\n2. Return if symptoms worsen\n3. Regular health maintenance\n",
    "image_path": "demo_dataset\\NORMAL\\NORMAL2-IM-0361-0001.jpeg"
  },
  {
    "patient_id": "P0072",
    "basic_info": {
      "age": 76,
      "gender": "Female",
      "admission_date": "2024-10-13"
    },
    "vitals": {
      "temperature": 37.7,
      "heart_rate": 102,
      "respiratory_rate": 25,
      "blood_pressure": "126/81",
      "oxygen_saturation": 92
    },
    "symptoms": [
      "chest pain",
      "shallow breathing",
      "sweating"
    ],
    "medications": [
      {
        "name": "Guaifenesin",
        "dosage": "400mg",
        "frequency": "every 4 hours as needed"
      },
      {
        "name": "Acetaminophen",
        "dosage": "650mg",
        "frequency": "every 6 hours as needed"
      }
    ],
    "comorbidities": [
      "Coronary Artery Disease",
      "Asthma",
      "Obesity"
    ],
    "diagnosis": "Normal",
    "note_text": "\nCLINICAL NOTE\n============\nPatient ID: P0072\nDate: 2024-10-13\n\nPATIENT INFORMATION\n------------------\nAge: 76\nGender: Female\nAdmission Date: 2024-10-13\n\nVITAL SIGNS\n----------\nTemperature: 37.7\u00b0C\nHeart Rate: 102 bpm\nRespiratory Rate: 25 /min\nBlood Pressure: 126/81 mmHg\nO2 Saturation: 92%\n\nPRESENTING SYMPTOMS\n-----------------\n- chest pain\n- shallow breathing\n- sweating\n\nMEDICAL HISTORY\n-------------\nComorbidities: Coronary Artery Disease, Asthma, Obesity\n\nMEDICATIONS\n----------\n- Guaifenesin 400mg every 4 hours as needed\n- Acetaminophen 650mg every 6 hours as needed\n\nASSESSMENT\n---------\nChest X-ray shows no active pulmonary disease.\n\nPLAN\n----\n1. Symptomatic treatment as needed\n2. Return if symptoms worsen\n3. Regular health maintenance\n",
    "image_path": "demo_dataset\\NORMAL\\NORMAL2-IM-0366-0001.jpeg"
  },
  {
    "patient_id": "P0073",
    "basic_info": {
      "age": 72,
      "gender": "Male",
      "admission_date": "2024-10-25"
    },
    "vitals": {
      "temperature": 38.8,
      "heart_rate": 115,
      "respiratory_rate": 28,
      "blood_pressure": "130/83",
      "oxygen_saturation": 91
    },
    "symptoms": [
      "dyspnea",
      "wheezing",
      "sputum production",
      "decreased appetite"
    ],
    "medications": [
      {
        "name": "Acetaminophen",
        "dosage": "650mg",
        "frequency": "every 6 hours as needed"
      },
      {
        "name": "Ibuprofen",
        "dosage": "400mg",
        "frequency": "every 6 hours as needed"
      }
    ],
    "comorbidities": [],
    "diagnosis": "Normal",
    "note_text": "\nCLINICAL NOTE\n============\nPatient ID: P0073\nDate: 2024-10-25\n\nPATIENT INFORMATION\n------------------\nAge: 72\nGender: Male\nAdmission Date: 2024-10-25\n\nVITAL SIGNS\n----------\nTemperature: 38.8\u00b0C\nHeart Rate: 115 bpm\nRespiratory Rate: 28 /min\nBlood Pressure: 130/83 mmHg\nO2 Saturation: 91%\n\nPRESENTING SYMPTOMS\n-----------------\n- dyspnea\n- wheezing\n- sputum production\n- decreased appetite\n\nMEDICAL HISTORY\n-------------\nComorbidities: None\n\nMEDICATIONS\n----------\n- Acetaminophen 650mg every 6 hours as needed\n- Ibuprofen 400mg every 6 hours as needed\n\nASSESSMENT\n---------\nChest X-ray shows no active pulmonary disease.\n\nPLAN\n----\n1. Symptomatic treatment as needed\n2. Return if symptoms worsen\n3. Regular health maintenance\n",
    "image_path": "demo_dataset\\NORMAL\\NORMAL2-IM-0372-0001.jpeg"
  },
  {
    "patient_id": "P0074",
    "basic_info": {
      "age": 62,
      "gender": "Female",
      "admission_date": "2024-10-25"
    },
    "vitals": {
      "temperature": 39.1,
      "heart_rate": 81,
      "respiratory_rate": 29,
      "blood_pressure": "124/65",
      "oxygen_saturation": 91
    },
    "symptoms": [
      "tachypnea",
      "sweating"
    ],
    "medications": [
      {
        "name": "Guaifenesin",
        "dosage": "400mg",
        "frequency": "every 4 hours as needed"
      },
      {
        "name": "Ibuprofen",
        "dosage": "400mg",
        "frequency": "every 6 hours as needed"
      }
    ],
    "comorbidities": [
      "Diabetes Type 2",
      "Chronic Kidney Disease",
      "Asthma"
    ],
    "diagnosis": "Normal",
    "note_text": "\nCLINICAL NOTE\n============\nPatient ID: P0074\nDate: 2024-10-25\n\nPATIENT INFORMATION\n------------------\nAge: 62\nGender: Female\nAdmission Date: 2024-10-25\n\nVITAL SIGNS\n----------\nTemperature: 39.1\u00b0C\nHeart Rate: 81 bpm\nRespiratory Rate: 29 /min\nBlood Pressure: 124/65 mmHg\nO2 Saturation: 91%\n\nPRESENTING SYMPTOMS\n-----------------\n- tachypnea\n- sweating\n\nMEDICAL HISTORY\n-------------\nComorbidities: Diabetes Type 2, Chronic Kidney Disease, Asthma\n\nMEDICATIONS\n----------\n- Guaifenesin 400mg every 4 hours as needed\n- Ibuprofen 400mg every 6 hours as needed\n\nASSESSMENT\n---------\nChest X-ray shows no active pulmonary disease.\n\nPLAN\n----\n1. Symptomatic treatment as needed\n2. Return if symptoms worsen\n3. Regular health maintenance\n",
    "image_path": "demo_dataset\\NORMAL\\NORMAL2-IM-0378-0001.jpeg"
  },
  {
    "patient_id": "P0075",
    "basic_info": {
      "age": 76,
      "gender": "Female",
      "admission_date": "2024-10-22"
    },
    "vitals": {
      "temperature": 37.5,
      "heart_rate": 99,
      "respiratory_rate": 23,
      "blood_pressure": "136/72",
      "oxygen_saturation": 92
    },
    "symptoms": [
      "dyspnea",
      "tachypnea",
      "wheezing",
      "chest pain",
      "malaise",
      "chills",
      "fatigue",
      "muscle aches"
    ],
    "medications": [
      {
        "name": "Levofloxacin",
        "dosage": "750mg",
        "frequency": "once daily"
      },
      {
        "name": "Doxycycline",
        "dosage": "100mg",
        "frequency": "twice daily"
      },
      {
        "name": "Acetaminophen",
        "dosage": "650mg",
        "frequency": "every 6 hours as needed"
      }
    ],
    "comorbidities": [
      "Obesity",
      "Asthma",
      "Hypertension"
    ],
    "diagnosis": "Pneumonia",
    "note_text": "\nCLINICAL NOTE\n============\nPatient ID: P0075\nDate: 2024-10-22\n\nPATIENT INFORMATION\n------------------\nAge: 76\nGender: Female\nAdmission Date: 2024-10-22\n\nVITAL SIGNS\n----------\nTemperature: 37.5\u00b0C\nHeart Rate: 99 bpm\nRespiratory Rate: 23 /min\nBlood Pressure: 136/72 mmHg\nO2 Saturation: 92%\n\nPRESENTING SYMPTOMS\n-----------------\n- dyspnea\n- tachypnea\n- wheezing\n- chest pain\n- malaise\n- chills\n- fatigue\n- muscle aches\n\nMEDICAL HISTORY\n-------------\nComorbidities: Obesity, Asthma, Hypertension\n\nMEDICATIONS\n----------\n- Levofloxacin 750mg once daily\n- Doxycycline 100mg twice daily\n- Acetaminophen 650mg every 6 hours as needed\n\nASSESSMENT\n---------\nPatient presents with clinical and radiological findings consistent with pneumonia.\n\nPLAN\n----\n1. Continue current antibiotic regimen\n2. Monitor vital signs and oxygen saturation\n3. Encourage deep breathing exercises\n4. Follow-up chest X-ray in 2 weeks\n5. Return if symptoms worsen\n",
    "image_path": "demo_dataset\\PNEUMONIA\\person100_bacteria_477.jpeg"
  },
  {
    "patient_id": "P0076",
    "basic_info": {
      "age": 82,
      "gender": "Female",
      "admission_date": "2024-10-20"
    },
    "vitals": {
      "temperature": 37.7,
      "heart_rate": 84,
      "respiratory_rate": 24,
      "blood_pressure": "131/65",
      "oxygen_saturation": 92
    },
    "symptoms": [
      "chest pain",
      "tachypnea",
      "wheezing",
      "dyspnea",
      "fever",
      "chills",
      "decreased appetite",
      "muscle aches"
    ],
    "medications": [
      {
        "name": "Ceftriaxone",
        "dosage": "1g",
        "frequency": "daily"
      },
      {
        "name": "Acetaminophen",
        "dosage": "650mg",
        "frequency": "every 6 hours as needed"
      }
    ],
    "comorbidities": [
      "Asthma",
      "Chronic Kidney Disease"
    ],
    "diagnosis": "Pneumonia",
    "note_text": "\nCLINICAL NOTE\n============\nPatient ID: P0076\nDate: 2024-10-20\n\nPATIENT INFORMATION\n------------------\nAge: 82\nGender: Female\nAdmission Date: 2024-10-20\n\nVITAL SIGNS\n----------\nTemperature: 37.7\u00b0C\nHeart Rate: 84 bpm\nRespiratory Rate: 24 /min\nBlood Pressure: 131/65 mmHg\nO2 Saturation: 92%\n\nPRESENTING SYMPTOMS\n-----------------\n- chest pain\n- tachypnea\n- wheezing\n- dyspnea\n- fever\n- chills\n- decreased appetite\n- muscle aches\n\nMEDICAL HISTORY\n-------------\nComorbidities: Asthma, Chronic Kidney Disease\n\nMEDICATIONS\n----------\n- Ceftriaxone 1g daily\n- Acetaminophen 650mg every 6 hours as needed\n\nASSESSMENT\n---------\nPatient presents with clinical and radiological findings consistent with pneumonia.\n\nPLAN\n----\n1. Continue current antibiotic regimen\n2. Monitor vital signs and oxygen saturation\n3. Encourage deep breathing exercises\n4. Follow-up chest X-ray in 2 weeks\n5. Return if symptoms worsen\n",
    "image_path": "demo_dataset\\PNEUMONIA\\person100_bacteria_478.jpeg"
  },
  {
    "patient_id": "P0077",
    "basic_info": {
      "age": 20,
      "gender": "Male",
      "admission_date": "2024-10-26"
    },
    "vitals": {
      "temperature": 38.9,
      "heart_rate": 87,
      "respiratory_rate": 30,
      "blood_pressure": "137/65",
      "oxygen_saturation": 88
    },
    "symptoms": [
      "sputum production",
      "wheezing",
      "tachypnea",
      "dyspnea",
      "shallow breathing",
      "chills",
      "muscle aches",
      "malaise"
    ],
    "medications": [
      {
        "name": "Amoxicillin",
        "dosage": "500mg",
        "frequency": "three times daily"
      },
      {
        "name": "Azithromycin",
        "dosage": "500mg",
        "frequency": "once daily"
      },
      {
        "name": "Ibuprofen",
        "dosage": "400mg",
        "frequency": "every 6 hours as needed"
      }
    ],
    "comorbidities": [
      "Obesity",
      "Diabetes Type 2"
    ],
    "diagnosis": "Pneumonia",
    "note_text": "\nCLINICAL NOTE\n============\nPatient ID: P0077\nDate: 2024-10-26\n\nPATIENT INFORMATION\n------------------\nAge: 20\nGender: Male\nAdmission Date: 2024-10-26\n\nVITAL SIGNS\n----------\nTemperature: 38.9\u00b0C\nHeart Rate: 87 bpm\nRespiratory Rate: 30 /min\nBlood Pressure: 137/65 mmHg\nO2 Saturation: 88%\n\nPRESENTING SYMPTOMS\n-----------------\n- sputum production\n- wheezing\n- tachypnea\n- dyspnea\n- shallow breathing\n- chills\n- muscle aches\n- malaise\n\nMEDICAL HISTORY\n-------------\nComorbidities: Obesity, Diabetes Type 2\n\nMEDICATIONS\n----------\n- Amoxicillin 500mg three times daily\n- Azithromycin 500mg once daily\n- Ibuprofen 400mg every 6 hours as needed\n\nASSESSMENT\n---------\nPatient presents with clinical and radiological findings consistent with pneumonia.\n\nPLAN\n----\n1. Continue current antibiotic regimen\n2. Monitor vital signs and oxygen saturation\n3. Encourage deep breathing exercises\n4. Follow-up chest X-ray in 2 weeks\n5. Return if symptoms worsen\n",
    "image_path": "demo_dataset\\PNEUMONIA\\person101_bacteria_484.jpeg"
  },
  {
    "patient_id": "P0078",
    "basic_info": {
      "age": 63,
      "gender": "Female",
      "admission_date": "2024-10-25"
    },
    "vitals": {
      "temperature": 39.2,
      "heart_rate": 107,
      "respiratory_rate": 29,
      "blood_pressure": "122/67",
      "oxygen_saturation": 90
    },
    "symptoms": [
      "chest pain",
      "sputum production",
      "dyspnea",
      "wheezing",
      "cough",
      "fever",
      "chills",
      "malaise"
    ],
    "medications": [
      {
        "name": "Doxycycline",
        "dosage": "100mg",
        "frequency": "twice daily"
      },
      {
        "name": "Ibuprofen",
        "dosage": "400mg",
        "frequency": "every 6 hours as needed"
      }
    ],
    "comorbidities": [
      "Chronic Kidney Disease",
      "Coronary Artery Disease",
      "Diabetes Type 2"
    ],
    "diagnosis": "Pneumonia",
    "note_text": "\nCLINICAL NOTE\n============\nPatient ID: P0078\nDate: 2024-10-25\n\nPATIENT INFORMATION\n------------------\nAge: 63\nGender: Female\nAdmission Date: 2024-10-25\n\nVITAL SIGNS\n----------\nTemperature: 39.2\u00b0C\nHeart Rate: 107 bpm\nRespiratory Rate: 29 /min\nBlood Pressure: 122/67 mmHg\nO2 Saturation: 90%\n\nPRESENTING SYMPTOMS\n-----------------\n- chest pain\n- sputum production\n- dyspnea\n- wheezing\n- cough\n- fever\n- chills\n- malaise\n\nMEDICAL HISTORY\n-------------\nComorbidities: Chronic Kidney Disease, Coronary Artery Disease, Diabetes Type 2\n\nMEDICATIONS\n----------\n- Doxycycline 100mg twice daily\n- Ibuprofen 400mg every 6 hours as needed\n\nASSESSMENT\n---------\nPatient presents with clinical and radiological findings consistent with pneumonia.\n\nPLAN\n----\n1. Continue current antibiotic regimen\n2. Monitor vital signs and oxygen saturation\n3. Encourage deep breathing exercises\n4. Follow-up chest X-ray in 2 weeks\n5. Return if symptoms worsen\n",
    "image_path": "demo_dataset\\PNEUMONIA\\person103_bacteria_488.jpeg"
  },
  {
    "patient_id": "P0079",
    "basic_info": {
      "age": 62,
      "gender": "Female",
      "admission_date": "2024-10-24"
    },
    "vitals": {
      "temperature": 39.0,
      "heart_rate": 104,
      "respiratory_rate": 26,
      "blood_pressure": "135/88",
      "oxygen_saturation": 95
    },
    "symptoms": [
      "chest pain",
      "wheezing",
      "sputum production",
      "shallow breathing",
      "dyspnea",
      "fatigue",
      "sweating",
      "malaise"
    ],
    "medications": [
      {
        "name": "Ceftriaxone",
        "dosage": "1g",
        "frequency": "daily"
      },
      {
        "name": "Doxycycline",
        "dosage": "100mg",
        "frequency": "twice daily"
      },
      {
        "name": "Guaifenesin",
        "dosage": "400mg",
        "frequency": "every 4 hours as needed"
      }
    ],
    "comorbidities": [
      "Diabetes Type 2"
    ],
    "diagnosis": "Pneumonia",
    "note_text": "\nCLINICAL NOTE\n============\nPatient ID: P0079\nDate: 2024-10-24\n\nPATIENT INFORMATION\n------------------\nAge: 62\nGender: Female\nAdmission Date: 2024-10-24\n\nVITAL SIGNS\n----------\nTemperature: 39.0\u00b0C\nHeart Rate: 104 bpm\nRespiratory Rate: 26 /min\nBlood Pressure: 135/88 mmHg\nO2 Saturation: 95%\n\nPRESENTING SYMPTOMS\n-----------------\n- chest pain\n- wheezing\n- sputum production\n- shallow breathing\n- dyspnea\n- fatigue\n- sweating\n- malaise\n\nMEDICAL HISTORY\n-------------\nComorbidities: Diabetes Type 2\n\nMEDICATIONS\n----------\n- Ceftriaxone 1g daily\n- Doxycycline 100mg twice daily\n- Guaifenesin 400mg every 4 hours as needed\n\nASSESSMENT\n---------\nPatient presents with clinical and radiological findings consistent with pneumonia.\n\nPLAN\n----\n1. Continue current antibiotic regimen\n2. Monitor vital signs and oxygen saturation\n3. Encourage deep breathing exercises\n4. Follow-up chest X-ray in 2 weeks\n5. Return if symptoms worsen\n",
    "image_path": "demo_dataset\\PNEUMONIA\\person104_bacteria_491.jpeg"
  },
  {
    "patient_id": "P0080",
    "basic_info": {
      "age": 46,
      "gender": "Female",
      "admission_date": "2024-10-24"
    },
    "vitals": {
      "temperature": 39.3,
      "heart_rate": 103,
      "respiratory_rate": 25,
      "blood_pressure": "126/75",
      "oxygen_saturation": 95
    },
    "symptoms": [
      "sputum production",
      "shallow breathing",
      "wheezing",
      "muscle aches",
      "decreased appetite",
      "fatigue"
    ],
    "medications": [
      {
        "name": "Amoxicillin",
        "dosage": "500mg",
        "frequency": "three times daily"
      },
      {
        "name": "Ceftriaxone",
        "dosage": "1g",
        "frequency": "daily"
      },
      {
        "name": "Ibuprofen",
        "dosage": "400mg",
        "frequency": "every 6 hours as needed"
      }
    ],
    "comorbidities": [
      "Diabetes Type 2"
    ],
    "diagnosis": "Pneumonia",
    "note_text": "\nCLINICAL NOTE\n============\nPatient ID: P0080\nDate: 2024-10-24\n\nPATIENT INFORMATION\n------------------\nAge: 46\nGender: Female\nAdmission Date: 2024-10-24\n\nVITAL SIGNS\n----------\nTemperature: 39.3\u00b0C\nHeart Rate: 103 bpm\nRespiratory Rate: 25 /min\nBlood Pressure: 126/75 mmHg\nO2 Saturation: 95%\n\nPRESENTING SYMPTOMS\n-----------------\n- sputum production\n- shallow breathing\n- wheezing\n- muscle aches\n- decreased appetite\n- fatigue\n\nMEDICAL HISTORY\n-------------\nComorbidities: Diabetes Type 2\n\nMEDICATIONS\n----------\n- Amoxicillin 500mg three times daily\n- Ceftriaxone 1g daily\n- Ibuprofen 400mg every 6 hours as needed\n\nASSESSMENT\n---------\nPatient presents with clinical and radiological findings consistent with pneumonia.\n\nPLAN\n----\n1. Continue current antibiotic regimen\n2. Monitor vital signs and oxygen saturation\n3. Encourage deep breathing exercises\n4. Follow-up chest X-ray in 2 weeks\n5. Return if symptoms worsen\n",
    "image_path": "demo_dataset\\PNEUMONIA\\person104_bacteria_492.jpeg"
  },
  {
    "patient_id": "P0081",
    "basic_info": {
      "age": 85,
      "gender": "Female",
      "admission_date": "2024-10-15"
    },
    "vitals": {
      "temperature": 38.4,
      "heart_rate": 112,
      "respiratory_rate": 29,
      "blood_pressure": "111/61",
      "oxygen_saturation": 95
    },
    "symptoms": [
      "shallow breathing",
      "chest pain",
      "sputum production",
      "dyspnea",
      "cough",
      "fatigue",
      "fever",
      "malaise",
      "chills"
    ],
    "medications": [
      {
        "name": "Ceftriaxone",
        "dosage": "1g",
        "frequency": "daily"
      },
      {
        "name": "Acetaminophen",
        "dosage": "650mg",
        "frequency": "every 6 hours as needed"
      },
      {
        "name": "Guaifenesin",
        "dosage": "400mg",
        "frequency": "every 4 hours as needed"
      }
    ],
    "comorbidities": [
      "Chronic Kidney Disease",
      "Asthma"
    ],
    "diagnosis": "Pneumonia",
    "note_text": "\nCLINICAL NOTE\n============\nPatient ID: P0081\nDate: 2024-10-15\n\nPATIENT INFORMATION\n------------------\nAge: 85\nGender: Female\nAdmission Date: 2024-10-15\n\nVITAL SIGNS\n----------\nTemperature: 38.4\u00b0C\nHeart Rate: 112 bpm\nRespiratory Rate: 29 /min\nBlood Pressure: 111/61 mmHg\nO2 Saturation: 95%\n\nPRESENTING SYMPTOMS\n-----------------\n- shallow breathing\n- chest pain\n- sputum production\n- dyspnea\n- cough\n- fatigue\n- fever\n- malaise\n- chills\n\nMEDICAL HISTORY\n-------------\nComorbidities: Chronic Kidney Disease, Asthma\n\nMEDICATIONS\n----------\n- Ceftriaxone 1g daily\n- Acetaminophen 650mg every 6 hours as needed\n- Guaifenesin 400mg every 4 hours as needed\n\nASSESSMENT\n---------\nPatient presents with clinical and radiological findings consistent with pneumonia.\n\nPLAN\n----\n1. Continue current antibiotic regimen\n2. Monitor vital signs and oxygen saturation\n3. Encourage deep breathing exercises\n4. Follow-up chest X-ray in 2 weeks\n5. Return if symptoms worsen\n",
    "image_path": "demo_dataset\\PNEUMONIA\\person108_bacteria_506.jpeg"
  },
  {
    "patient_id": "P0082",
    "basic_info": {
      "age": 35,
      "gender": "Female",
      "admission_date": "2024-10-20"
    },
    "vitals": {
      "temperature": 38.4,
      "heart_rate": 94,
      "respiratory_rate": 29,
      "blood_pressure": "113/76",
      "oxygen_saturation": 88
    },
    "symptoms": [
      "tachypnea",
      "chest pain",
      "cough",
      "fatigue",
      "muscle aches",
      "decreased appetite"
    ],
    "medications": [
      {
        "name": "Amoxicillin",
        "dosage": "500mg",
        "frequency": "three times daily"
      },
      {
        "name": "Acetaminophen",
        "dosage": "650mg",
        "frequency": "every 6 hours as needed"
      }
    ],
    "comorbidities": [
      "Diabetes Type 2",
      "Chronic Kidney Disease",
      "Coronary Artery Disease"
    ],
    "diagnosis": "Pneumonia",
    "note_text": "\nCLINICAL NOTE\n============\nPatient ID: P0082\nDate: 2024-10-20\n\nPATIENT INFORMATION\n------------------\nAge: 35\nGender: Female\nAdmission Date: 2024-10-20\n\nVITAL SIGNS\n----------\nTemperature: 38.4\u00b0C\nHeart Rate: 94 bpm\nRespiratory Rate: 29 /min\nBlood Pressure: 113/76 mmHg\nO2 Saturation: 88%\n\nPRESENTING SYMPTOMS\n-----------------\n- tachypnea\n- chest pain\n- cough\n- fatigue\n- muscle aches\n- decreased appetite\n\nMEDICAL HISTORY\n-------------\nComorbidities: Diabetes Type 2, Chronic Kidney Disease, Coronary Artery Disease\n\nMEDICATIONS\n----------\n- Amoxicillin 500mg three times daily\n- Acetaminophen 650mg every 6 hours as needed\n\nASSESSMENT\n---------\nPatient presents with clinical and radiological findings consistent with pneumonia.\n\nPLAN\n----\n1. Continue current antibiotic regimen\n2. Monitor vital signs and oxygen saturation\n3. Encourage deep breathing exercises\n4. Follow-up chest X-ray in 2 weeks\n5. Return if symptoms worsen\n",
    "image_path": "demo_dataset\\PNEUMONIA\\person108_bacteria_507.jpeg"
  },
  {
    "patient_id": "P0083",
    "basic_info": {
      "age": 46,
      "gender": "Male",
      "admission_date": "2024-10-26"
    },
    "vitals": {
      "temperature": 38.1,
      "heart_rate": 89,
      "respiratory_rate": 27,
      "blood_pressure": "116/79",
      "oxygen_saturation": 93
    },
    "symptoms": [
      "dyspnea",
      "chest pain",
      "cough",
      "shallow breathing",
      "wheezing",
      "sweating",
      "malaise",
      "fever"
    ],
    "medications": [
      {
        "name": "Doxycycline",
        "dosage": "100mg",
        "frequency": "twice daily"
      },
      {
        "name": "Acetaminophen",
        "dosage": "650mg",
        "frequency": "every 6 hours as needed"
      },
      {
        "name": "Guaifenesin",
        "dosage": "400mg",
        "frequency": "every 4 hours as needed"
      }
    ],
    "comorbidities": [
      "Coronary Artery Disease"
    ],
    "diagnosis": "Pneumonia",
    "note_text": "\nCLINICAL NOTE\n============\nPatient ID: P0083\nDate: 2024-10-26\n\nPATIENT INFORMATION\n------------------\nAge: 46\nGender: Male\nAdmission Date: 2024-10-26\n\nVITAL SIGNS\n----------\nTemperature: 38.1\u00b0C\nHeart Rate: 89 bpm\nRespiratory Rate: 27 /min\nBlood Pressure: 116/79 mmHg\nO2 Saturation: 93%\n\nPRESENTING SYMPTOMS\n-----------------\n- dyspnea\n- chest pain\n- cough\n- shallow breathing\n- wheezing\n- sweating\n- malaise\n- fever\n\nMEDICAL HISTORY\n-------------\nComorbidities: Coronary Artery Disease\n\nMEDICATIONS\n----------\n- Doxycycline 100mg twice daily\n- Acetaminophen 650mg every 6 hours as needed\n- Guaifenesin 400mg every 4 hours as needed\n\nASSESSMENT\n---------\nPatient presents with clinical and radiological findings consistent with pneumonia.\n\nPLAN\n----\n1. Continue current antibiotic regimen\n2. Monitor vital signs and oxygen saturation\n3. Encourage deep breathing exercises\n4. Follow-up chest X-ray in 2 weeks\n5. Return if symptoms worsen\n",
    "image_path": "demo_dataset\\PNEUMONIA\\person109_bacteria_512.jpeg"
  },
  {
    "patient_id": "P0084",
    "basic_info": {
      "age": 40,
      "gender": "Male",
      "admission_date": "2024-10-20"
    },
    "vitals": {
      "temperature": 39.3,
      "heart_rate": 118,
      "respiratory_rate": 26,
      "blood_pressure": "128/80",
      "oxygen_saturation": 93
    },
    "symptoms": [
      "sputum production",
      "dyspnea",
      "wheezing",
      "fatigue",
      "sweating"
    ],
    "medications": [
      {
        "name": "Azithromycin",
        "dosage": "500mg",
        "frequency": "once daily"
      },
      {
        "name": "Ibuprofen",
        "dosage": "400mg",
        "frequency": "every 6 hours as needed"
      },
      {
        "name": "Guaifenesin",
        "dosage": "400mg",
        "frequency": "every 4 hours as needed"
      }
    ],
    "comorbidities": [
      "COPD"
    ],
    "diagnosis": "Pneumonia",
    "note_text": "\nCLINICAL NOTE\n============\nPatient ID: P0084\nDate: 2024-10-20\n\nPATIENT INFORMATION\n------------------\nAge: 40\nGender: Male\nAdmission Date: 2024-10-20\n\nVITAL SIGNS\n----------\nTemperature: 39.3\u00b0C\nHeart Rate: 118 bpm\nRespiratory Rate: 26 /min\nBlood Pressure: 128/80 mmHg\nO2 Saturation: 93%\n\nPRESENTING SYMPTOMS\n-----------------\n- sputum production\n- dyspnea\n- wheezing\n- fatigue\n- sweating\n\nMEDICAL HISTORY\n-------------\nComorbidities: COPD\n\nMEDICATIONS\n----------\n- Azithromycin 500mg once daily\n- Ibuprofen 400mg every 6 hours as needed\n- Guaifenesin 400mg every 4 hours as needed\n\nASSESSMENT\n---------\nPatient presents with clinical and radiological findings consistent with pneumonia.\n\nPLAN\n----\n1. Continue current antibiotic regimen\n2. Monitor vital signs and oxygen saturation\n3. Encourage deep breathing exercises\n4. Follow-up chest X-ray in 2 weeks\n5. Return if symptoms worsen\n",
    "image_path": "demo_dataset\\PNEUMONIA\\person109_bacteria_513.jpeg"
  },
  {
    "patient_id": "P0085",
    "basic_info": {
      "age": 59,
      "gender": "Female",
      "admission_date": "2024-10-14"
    },
    "vitals": {
      "temperature": 38.5,
      "heart_rate": 114,
      "respiratory_rate": 22,
      "blood_pressure": "114/85",
      "oxygen_saturation": 94
    },
    "symptoms": [
      "chest pain",
      "dyspnea",
      "sputum production",
      "tachypnea",
      "fever",
      "muscle aches",
      "fatigue",
      "decreased appetite"
    ],
    "medications": [
      {
        "name": "Ceftriaxone",
        "dosage": "1g",
        "frequency": "daily"
      },
      {
        "name": "Acetaminophen",
        "dosage": "650mg",
        "frequency": "every 6 hours as needed"
      },
      {
        "name": "Ibuprofen",
        "dosage": "400mg",
        "frequency": "every 6 hours as needed"
      }
    ],
    "comorbidities": [
      "Diabetes Type 2",
      "Asthma"
    ],
    "diagnosis": "Pneumonia",
    "note_text": "\nCLINICAL NOTE\n============\nPatient ID: P0085\nDate: 2024-10-14\n\nPATIENT INFORMATION\n------------------\nAge: 59\nGender: Female\nAdmission Date: 2024-10-14\n\nVITAL SIGNS\n----------\nTemperature: 38.5\u00b0C\nHeart Rate: 114 bpm\nRespiratory Rate: 22 /min\nBlood Pressure: 114/85 mmHg\nO2 Saturation: 94%\n\nPRESENTING SYMPTOMS\n-----------------\n- chest pain\n- dyspnea\n- sputum production\n- tachypnea\n- fever\n- muscle aches\n- fatigue\n- decreased appetite\n\nMEDICAL HISTORY\n-------------\nComorbidities: Diabetes Type 2, Asthma\n\nMEDICATIONS\n----------\n- Ceftriaxone 1g daily\n- Acetaminophen 650mg every 6 hours as needed\n- Ibuprofen 400mg every 6 hours as needed\n\nASSESSMENT\n---------\nPatient presents with clinical and radiological findings consistent with pneumonia.\n\nPLAN\n----\n1. Continue current antibiotic regimen\n2. Monitor vital signs and oxygen saturation\n3. Encourage deep breathing exercises\n4. Follow-up chest X-ray in 2 weeks\n5. Return if symptoms worsen\n",
    "image_path": "demo_dataset\\PNEUMONIA\\person111_bacteria_533.jpeg"
  },
  {
    "patient_id": "P0086",
    "basic_info": {
      "age": 25,
      "gender": "Female",
      "admission_date": "2024-10-24"
    },
    "vitals": {
      "temperature": 37.7,
      "heart_rate": 120,
      "respiratory_rate": 24,
      "blood_pressure": "137/75",
      "oxygen_saturation": 89
    },
    "symptoms": [
      "wheezing",
      "shallow breathing",
      "dyspnea",
      "fatigue",
      "muscle aches",
      "chills",
      "sweating"
    ],
    "medications": [
      {
        "name": "Azithromycin",
        "dosage": "500mg",
        "frequency": "once daily"
      },
      {
        "name": "Ibuprofen",
        "dosage": "400mg",
        "frequency": "every 6 hours as needed"
      }
    ],
    "comorbidities": [
      "Asthma",
      "Diabetes Type 2"
    ],
    "diagnosis": "Pneumonia",
    "note_text": "\nCLINICAL NOTE\n============\nPatient ID: P0086\nDate: 2024-10-24\n\nPATIENT INFORMATION\n------------------\nAge: 25\nGender: Female\nAdmission Date: 2024-10-24\n\nVITAL SIGNS\n----------\nTemperature: 37.7\u00b0C\nHeart Rate: 120 bpm\nRespiratory Rate: 24 /min\nBlood Pressure: 137/75 mmHg\nO2 Saturation: 89%\n\nPRESENTING SYMPTOMS\n-----------------\n- wheezing\n- shallow breathing\n- dyspnea\n- fatigue\n- muscle aches\n- chills\n- sweating\n\nMEDICAL HISTORY\n-------------\nComorbidities: Asthma, Diabetes Type 2\n\nMEDICATIONS\n----------\n- Azithromycin 500mg once daily\n- Ibuprofen 400mg every 6 hours as needed\n\nASSESSMENT\n---------\nPatient presents with clinical and radiological findings consistent with pneumonia.\n\nPLAN\n----\n1. Continue current antibiotic regimen\n2. Monitor vital signs and oxygen saturation\n3. Encourage deep breathing exercises\n4. Follow-up chest X-ray in 2 weeks\n5. Return if symptoms worsen\n",
    "image_path": "demo_dataset\\PNEUMONIA\\person111_bacteria_536.jpeg"
  },
  {
    "patient_id": "P0087",
    "basic_info": {
      "age": 66,
      "gender": "Female",
      "admission_date": "2024-10-20"
    },
    "vitals": {
      "temperature": 39.2,
      "heart_rate": 91,
      "respiratory_rate": 28,
      "blood_pressure": "128/60",
      "oxygen_saturation": 88
    },
    "symptoms": [
      "sputum production",
      "shallow breathing",
      "tachypnea",
      "fever",
      "sweating",
      "chills",
      "muscle aches"
    ],
    "medications": [
      {
        "name": "Azithromycin",
        "dosage": "500mg",
        "frequency": "once daily"
      },
      {
        "name": "Guaifenesin",
        "dosage": "400mg",
        "frequency": "every 4 hours as needed"
      }
    ],
    "comorbidities": [
      "Hypertension",
      "Diabetes Type 2",
      "COPD"
    ],
    "diagnosis": "Pneumonia",
    "note_text": "\nCLINICAL NOTE\n============\nPatient ID: P0087\nDate: 2024-10-20\n\nPATIENT INFORMATION\n------------------\nAge: 66\nGender: Female\nAdmission Date: 2024-10-20\n\nVITAL SIGNS\n----------\nTemperature: 39.2\u00b0C\nHeart Rate: 91 bpm\nRespiratory Rate: 28 /min\nBlood Pressure: 128/60 mmHg\nO2 Saturation: 88%\n\nPRESENTING SYMPTOMS\n-----------------\n- sputum production\n- shallow breathing\n- tachypnea\n- fever\n- sweating\n- chills\n- muscle aches\n\nMEDICAL HISTORY\n-------------\nComorbidities: Hypertension, Diabetes Type 2, COPD\n\nMEDICATIONS\n----------\n- Azithromycin 500mg once daily\n- Guaifenesin 400mg every 4 hours as needed\n\nASSESSMENT\n---------\nPatient presents with clinical and radiological findings consistent with pneumonia.\n\nPLAN\n----\n1. Continue current antibiotic regimen\n2. Monitor vital signs and oxygen saturation\n3. Encourage deep breathing exercises\n4. Follow-up chest X-ray in 2 weeks\n5. Return if symptoms worsen\n",
    "image_path": "demo_dataset\\PNEUMONIA\\person113_bacteria_540.jpeg"
  },
  {
    "patient_id": "P0088",
    "basic_info": {
      "age": 80,
      "gender": "Female",
      "admission_date": "2024-10-25"
    },
    "vitals": {
      "temperature": 39.0,
      "heart_rate": 114,
      "respiratory_rate": 26,
      "blood_pressure": "136/69",
      "oxygen_saturation": 91
    },
    "symptoms": [
      "shallow breathing",
      "cough",
      "tachypnea",
      "malaise",
      "chills",
      "fever"
    ],
    "medications": [
      {
        "name": "Ceftriaxone",
        "dosage": "1g",
        "frequency": "daily"
      },
      {
        "name": "Ibuprofen",
        "dosage": "400mg",
        "frequency": "every 6 hours as needed"
      }
    ],
    "comorbidities": [
      "Obesity",
      "COPD"
    ],
    "diagnosis": "Pneumonia",
    "note_text": "\nCLINICAL NOTE\n============\nPatient ID: P0088\nDate: 2024-10-25\n\nPATIENT INFORMATION\n------------------\nAge: 80\nGender: Female\nAdmission Date: 2024-10-25\n\nVITAL SIGNS\n----------\nTemperature: 39.0\u00b0C\nHeart Rate: 114 bpm\nRespiratory Rate: 26 /min\nBlood Pressure: 136/69 mmHg\nO2 Saturation: 91%\n\nPRESENTING SYMPTOMS\n-----------------\n- shallow breathing\n- cough\n- tachypnea\n- malaise\n- chills\n- fever\n\nMEDICAL HISTORY\n-------------\nComorbidities: Obesity, COPD\n\nMEDICATIONS\n----------\n- Ceftriaxone 1g daily\n- Ibuprofen 400mg every 6 hours as needed\n\nASSESSMENT\n---------\nPatient presents with clinical and radiological findings consistent with pneumonia.\n\nPLAN\n----\n1. Continue current antibiotic regimen\n2. Monitor vital signs and oxygen saturation\n3. Encourage deep breathing exercises\n4. Follow-up chest X-ray in 2 weeks\n5. Return if symptoms worsen\n",
    "image_path": "demo_dataset\\PNEUMONIA\\person113_bacteria_542.jpeg"
  },
  {
    "patient_id": "P0089",
    "basic_info": {
      "age": 38,
      "gender": "Male",
      "admission_date": "2024-10-21"
    },
    "vitals": {
      "temperature": 37.5,
      "heart_rate": 99,
      "respiratory_rate": 28,
      "blood_pressure": "117/87",
      "oxygen_saturation": 88
    },
    "symptoms": [
      "tachypnea",
      "dyspnea",
      "cough",
      "sweating",
      "chills",
      "decreased appetite",
      "malaise"
    ],
    "medications": [
      {
        "name": "Ceftriaxone",
        "dosage": "1g",
        "frequency": "daily"
      },
      {
        "name": "Acetaminophen",
        "dosage": "650mg",
        "frequency": "every 6 hours as needed"
      },
      {
        "name": "Ibuprofen",
        "dosage": "400mg",
        "frequency": "every 6 hours as needed"
      }
    ],
    "comorbidities": [
      "COPD"
    ],
    "diagnosis": "Pneumonia",
    "note_text": "\nCLINICAL NOTE\n============\nPatient ID: P0089\nDate: 2024-10-21\n\nPATIENT INFORMATION\n------------------\nAge: 38\nGender: Male\nAdmission Date: 2024-10-21\n\nVITAL SIGNS\n----------\nTemperature: 37.5\u00b0C\nHeart Rate: 99 bpm\nRespiratory Rate: 28 /min\nBlood Pressure: 117/87 mmHg\nO2 Saturation: 88%\n\nPRESENTING SYMPTOMS\n-----------------\n- tachypnea\n- dyspnea\n- cough\n- sweating\n- chills\n- decreased appetite\n- malaise\n\nMEDICAL HISTORY\n-------------\nComorbidities: COPD\n\nMEDICATIONS\n----------\n- Ceftriaxone 1g daily\n- Acetaminophen 650mg every 6 hours as needed\n- Ibuprofen 400mg every 6 hours as needed\n\nASSESSMENT\n---------\nPatient presents with clinical and radiological findings consistent with pneumonia.\n\nPLAN\n----\n1. Continue current antibiotic regimen\n2. Monitor vital signs and oxygen saturation\n3. Encourage deep breathing exercises\n4. Follow-up chest X-ray in 2 weeks\n5. Return if symptoms worsen\n",
    "image_path": "demo_dataset\\PNEUMONIA\\person113_bacteria_543.jpeg"
  },
  {
    "patient_id": "P0090",
    "basic_info": {
      "age": 70,
      "gender": "Female",
      "admission_date": "2024-10-24"
    },
    "vitals": {
      "temperature": 37.9,
      "heart_rate": 118,
      "respiratory_rate": 27,
      "blood_pressure": "138/82",
      "oxygen_saturation": 91
    },
    "symptoms": [
      "cough",
      "sputum production",
      "wheezing",
      "dyspnea",
      "decreased appetite",
      "sweating",
      "chills",
      "malaise"
    ],
    "medications": [
      {
        "name": "Amoxicillin",
        "dosage": "500mg",
        "frequency": "three times daily"
      },
      {
        "name": "Azithromycin",
        "dosage": "500mg",
        "frequency": "once daily"
      },
      {
        "name": "Guaifenesin",
        "dosage": "400mg",
        "frequency": "every 4 hours as needed"
      },
      {
        "name": "Ibuprofen",
        "dosage": "400mg",
        "frequency": "every 6 hours as needed"
      }
    ],
    "comorbidities": [
      "Coronary Artery Disease",
      "Obesity",
      "Chronic Kidney Disease"
    ],
    "diagnosis": "Pneumonia",
    "note_text": "\nCLINICAL NOTE\n============\nPatient ID: P0090\nDate: 2024-10-24\n\nPATIENT INFORMATION\n------------------\nAge: 70\nGender: Female\nAdmission Date: 2024-10-24\n\nVITAL SIGNS\n----------\nTemperature: 37.9\u00b0C\nHeart Rate: 118 bpm\nRespiratory Rate: 27 /min\nBlood Pressure: 138/82 mmHg\nO2 Saturation: 91%\n\nPRESENTING SYMPTOMS\n-----------------\n- cough\n- sputum production\n- wheezing\n- dyspnea\n- decreased appetite\n- sweating\n- chills\n- malaise\n\nMEDICAL HISTORY\n-------------\nComorbidities: Coronary Artery Disease, Obesity, Chronic Kidney Disease\n\nMEDICATIONS\n----------\n- Amoxicillin 500mg three times daily\n- Azithromycin 500mg once daily\n- Guaifenesin 400mg every 4 hours as needed\n- Ibuprofen 400mg every 6 hours as needed\n\nASSESSMENT\n---------\nPatient presents with clinical and radiological findings consistent with pneumonia.\n\nPLAN\n----\n1. Continue current antibiotic regimen\n2. Monitor vital signs and oxygen saturation\n3. Encourage deep breathing exercises\n4. Follow-up chest X-ray in 2 weeks\n5. Return if symptoms worsen\n",
    "image_path": "demo_dataset\\PNEUMONIA\\person119_bacteria_567.jpeg"
  },
  {
    "patient_id": "P0091",
    "basic_info": {
      "age": 38,
      "gender": "Male",
      "admission_date": "2024-10-17"
    },
    "vitals": {
      "temperature": 38.7,
      "heart_rate": 112,
      "respiratory_rate": 21,
      "blood_pressure": "115/67",
      "oxygen_saturation": 92
    },
    "symptoms": [
      "sputum production",
      "cough",
      "shallow breathing",
      "decreased appetite",
      "sweating",
      "muscle aches",
      "fever"
    ],
    "medications": [
      {
        "name": "Azithromycin",
        "dosage": "500mg",
        "frequency": "once daily"
      },
      {
        "name": "Levofloxacin",
        "dosage": "750mg",
        "frequency": "once daily"
      },
      {
        "name": "Ibuprofen",
        "dosage": "400mg",
        "frequency": "every 6 hours as needed"
      }
    ],
    "comorbidities": [],
    "diagnosis": "Pneumonia",
    "note_text": "\nCLINICAL NOTE\n============\nPatient ID: P0091\nDate: 2024-10-17\n\nPATIENT INFORMATION\n------------------\nAge: 38\nGender: Male\nAdmission Date: 2024-10-17\n\nVITAL SIGNS\n----------\nTemperature: 38.7\u00b0C\nHeart Rate: 112 bpm\nRespiratory Rate: 21 /min\nBlood Pressure: 115/67 mmHg\nO2 Saturation: 92%\n\nPRESENTING SYMPTOMS\n-----------------\n- sputum production\n- cough\n- shallow breathing\n- decreased appetite\n- sweating\n- muscle aches\n- fever\n\nMEDICAL HISTORY\n-------------\nComorbidities: None\n\nMEDICATIONS\n----------\n- Azithromycin 500mg once daily\n- Levofloxacin 750mg once daily\n- Ibuprofen 400mg every 6 hours as needed\n\nASSESSMENT\n---------\nPatient presents with clinical and radiological findings consistent with pneumonia.\n\nPLAN\n----\n1. Continue current antibiotic regimen\n2. Monitor vital signs and oxygen saturation\n3. Encourage deep breathing exercises\n4. Follow-up chest X-ray in 2 weeks\n5. Return if symptoms worsen\n",
    "image_path": "demo_dataset\\PNEUMONIA\\person120_bacteria_573.jpeg"
  },
  {
    "patient_id": "P0092",
    "basic_info": {
      "age": 25,
      "gender": "Male",
      "admission_date": "2024-10-20"
    },
    "vitals": {
      "temperature": 38.9,
      "heart_rate": 101,
      "respiratory_rate": 27,
      "blood_pressure": "116/78",
      "oxygen_saturation": 94
    },
    "symptoms": [
      "cough",
      "shallow breathing",
      "sputum production",
      "tachypnea",
      "muscle aches",
      "decreased appetite",
      "chills"
    ],
    "medications": [
      {
        "name": "Azithromycin",
        "dosage": "500mg",
        "frequency": "once daily"
      },
      {
        "name": "Amoxicillin",
        "dosage": "500mg",
        "frequency": "three times daily"
      },
      {
        "name": "Acetaminophen",
        "dosage": "650mg",
        "frequency": "every 6 hours as needed"
      }
    ],
    "comorbidities": [],
    "diagnosis": "Pneumonia",
    "note_text": "\nCLINICAL NOTE\n============\nPatient ID: P0092\nDate: 2024-10-20\n\nPATIENT INFORMATION\n------------------\nAge: 25\nGender: Male\nAdmission Date: 2024-10-20\n\nVITAL SIGNS\n----------\nTemperature: 38.9\u00b0C\nHeart Rate: 101 bpm\nRespiratory Rate: 27 /min\nBlood Pressure: 116/78 mmHg\nO2 Saturation: 94%\n\nPRESENTING SYMPTOMS\n-----------------\n- cough\n- shallow breathing\n- sputum production\n- tachypnea\n- muscle aches\n- decreased appetite\n- chills\n\nMEDICAL HISTORY\n-------------\nComorbidities: None\n\nMEDICATIONS\n----------\n- Azithromycin 500mg once daily\n- Amoxicillin 500mg three times daily\n- Acetaminophen 650mg every 6 hours as needed\n\nASSESSMENT\n---------\nPatient presents with clinical and radiological findings consistent with pneumonia.\n\nPLAN\n----\n1. Continue current antibiotic regimen\n2. Monitor vital signs and oxygen saturation\n3. Encourage deep breathing exercises\n4. Follow-up chest X-ray in 2 weeks\n5. Return if symptoms worsen\n",
    "image_path": "demo_dataset\\PNEUMONIA\\person121_bacteria_578.jpeg"
  },
  {
    "patient_id": "P0093",
    "basic_info": {
      "age": 62,
      "gender": "Female",
      "admission_date": "2024-10-13"
    },
    "vitals": {
      "temperature": 37.8,
      "heart_rate": 115,
      "respiratory_rate": 25,
      "blood_pressure": "130/77",
      "oxygen_saturation": 95
    },
    "symptoms": [
      "chest pain",
      "shallow breathing",
      "tachypnea",
      "dyspnea",
      "wheezing",
      "fever",
      "malaise",
      "sweating",
      "chills"
    ],
    "medications": [
      {
        "name": "Levofloxacin",
        "dosage": "750mg",
        "frequency": "once daily"
      },
      {
        "name": "Amoxicillin",
        "dosage": "500mg",
        "frequency": "three times daily"
      },
      {
        "name": "Ibuprofen",
        "dosage": "400mg",
        "frequency": "every 6 hours as needed"
      },
      {
        "name": "Guaifenesin",
        "dosage": "400mg",
        "frequency": "every 4 hours as needed"
      }
    ],
    "comorbidities": [],
    "diagnosis": "Pneumonia",
    "note_text": "\nCLINICAL NOTE\n============\nPatient ID: P0093\nDate: 2024-10-13\n\nPATIENT INFORMATION\n------------------\nAge: 62\nGender: Female\nAdmission Date: 2024-10-13\n\nVITAL SIGNS\n----------\nTemperature: 37.8\u00b0C\nHeart Rate: 115 bpm\nRespiratory Rate: 25 /min\nBlood Pressure: 130/77 mmHg\nO2 Saturation: 95%\n\nPRESENTING SYMPTOMS\n-----------------\n- chest pain\n- shallow breathing\n- tachypnea\n- dyspnea\n- wheezing\n- fever\n- malaise\n- sweating\n- chills\n\nMEDICAL HISTORY\n-------------\nComorbidities: None\n\nMEDICATIONS\n----------\n- Levofloxacin 750mg once daily\n- Amoxicillin 500mg three times daily\n- Ibuprofen 400mg every 6 hours as needed\n- Guaifenesin 400mg every 4 hours as needed\n\nASSESSMENT\n---------\nPatient presents with clinical and radiological findings consistent with pneumonia.\n\nPLAN\n----\n1. Continue current antibiotic regimen\n2. Monitor vital signs and oxygen saturation\n3. Encourage deep breathing exercises\n4. Follow-up chest X-ray in 2 weeks\n5. Return if symptoms worsen\n",
    "image_path": "demo_dataset\\PNEUMONIA\\person121_bacteria_580.jpeg"
  },
  {
    "patient_id": "P0094",
    "basic_info": {
      "age": 54,
      "gender": "Female",
      "admission_date": "2024-10-21"
    },
    "vitals": {
      "temperature": 38.3,
      "heart_rate": 94,
      "respiratory_rate": 26,
      "blood_pressure": "123/77",
      "oxygen_saturation": 89
    },
    "symptoms": [
      "tachypnea",
      "shallow breathing",
      "wheezing",
      "dyspnea",
      "cough",
      "sweating",
      "fatigue",
      "fever"
    ],
    "medications": [
      {
        "name": "Azithromycin",
        "dosage": "500mg",
        "frequency": "once daily"
      },
      {
        "name": "Amoxicillin",
        "dosage": "500mg",
        "frequency": "three times daily"
      },
      {
        "name": "Ibuprofen",
        "dosage": "400mg",
        "frequency": "every 6 hours as needed"
      },
      {
        "name": "Guaifenesin",
        "dosage": "400mg",
        "frequency": "every 4 hours as needed"
      }
    ],
    "comorbidities": [
      "Obesity",
      "Asthma"
    ],
    "diagnosis": "Pneumonia",
    "note_text": "\nCLINICAL NOTE\n============\nPatient ID: P0094\nDate: 2024-10-21\n\nPATIENT INFORMATION\n------------------\nAge: 54\nGender: Female\nAdmission Date: 2024-10-21\n\nVITAL SIGNS\n----------\nTemperature: 38.3\u00b0C\nHeart Rate: 94 bpm\nRespiratory Rate: 26 /min\nBlood Pressure: 123/77 mmHg\nO2 Saturation: 89%\n\nPRESENTING SYMPTOMS\n-----------------\n- tachypnea\n- shallow breathing\n- wheezing\n- dyspnea\n- cough\n- sweating\n- fatigue\n- fever\n\nMEDICAL HISTORY\n-------------\nComorbidities: Obesity, Asthma\n\nMEDICATIONS\n----------\n- Azithromycin 500mg once daily\n- Amoxicillin 500mg three times daily\n- Ibuprofen 400mg every 6 hours as needed\n- Guaifenesin 400mg every 4 hours as needed\n\nASSESSMENT\n---------\nPatient presents with clinical and radiological findings consistent with pneumonia.\n\nPLAN\n----\n1. Continue current antibiotic regimen\n2. Monitor vital signs and oxygen saturation\n3. Encourage deep breathing exercises\n4. Follow-up chest X-ray in 2 weeks\n5. Return if symptoms worsen\n",
    "image_path": "demo_dataset\\PNEUMONIA\\person122_bacteria_585.jpeg"
  },
  {
    "patient_id": "P0095",
    "basic_info": {
      "age": 53,
      "gender": "Male",
      "admission_date": "2024-10-19"
    },
    "vitals": {
      "temperature": 38.2,
      "heart_rate": 92,
      "respiratory_rate": 29,
      "blood_pressure": "134/72",
      "oxygen_saturation": 91
    },
    "symptoms": [
      "cough",
      "shallow breathing",
      "dyspnea",
      "sputum production",
      "chills",
      "fatigue",
      "decreased appetite",
      "fever"
    ],
    "medications": [
      {
        "name": "Doxycycline",
        "dosage": "100mg",
        "frequency": "twice daily"
      },
      {
        "name": "Levofloxacin",
        "dosage": "750mg",
        "frequency": "once daily"
      },
      {
        "name": "Acetaminophen",
        "dosage": "650mg",
        "frequency": "every 6 hours as needed"
      }
    ],
    "comorbidities": [
      "Hypertension",
      "Chronic Kidney Disease",
      "COPD"
    ],
    "diagnosis": "Pneumonia",
    "note_text": "\nCLINICAL NOTE\n============\nPatient ID: P0095\nDate: 2024-10-19\n\nPATIENT INFORMATION\n------------------\nAge: 53\nGender: Male\nAdmission Date: 2024-10-19\n\nVITAL SIGNS\n----------\nTemperature: 38.2\u00b0C\nHeart Rate: 92 bpm\nRespiratory Rate: 29 /min\nBlood Pressure: 134/72 mmHg\nO2 Saturation: 91%\n\nPRESENTING SYMPTOMS\n-----------------\n- cough\n- shallow breathing\n- dyspnea\n- sputum production\n- chills\n- fatigue\n- decreased appetite\n- fever\n\nMEDICAL HISTORY\n-------------\nComorbidities: Hypertension, Chronic Kidney Disease, COPD\n\nMEDICATIONS\n----------\n- Doxycycline 100mg twice daily\n- Levofloxacin 750mg once daily\n- Acetaminophen 650mg every 6 hours as needed\n\nASSESSMENT\n---------\nPatient presents with clinical and radiological findings consistent with pneumonia.\n\nPLAN\n----\n1. Continue current antibiotic regimen\n2. Monitor vital signs and oxygen saturation\n3. Encourage deep breathing exercises\n4. Follow-up chest X-ray in 2 weeks\n5. Return if symptoms worsen\n",
    "image_path": "demo_dataset\\PNEUMONIA\\person126_bacteria_598.jpeg"
  },
  {
    "patient_id": "P0096",
    "basic_info": {
      "age": 76,
      "gender": "Male",
      "admission_date": "2024-10-22"
    },
    "vitals": {
      "temperature": 39.2,
      "heart_rate": 117,
      "respiratory_rate": 28,
      "blood_pressure": "128/67",
      "oxygen_saturation": 92
    },
    "symptoms": [
      "wheezing",
      "dyspnea",
      "shallow breathing",
      "sweating",
      "chills",
      "muscle aches",
      "fatigue"
    ],
    "medications": [
      {
        "name": "Doxycycline",
        "dosage": "100mg",
        "frequency": "twice daily"
      },
      {
        "name": "Ceftriaxone",
        "dosage": "1g",
        "frequency": "daily"
      },
      {
        "name": "Acetaminophen",
        "dosage": "650mg",
        "frequency": "every 6 hours as needed"
      },
      {
        "name": "Ibuprofen",
        "dosage": "400mg",
        "frequency": "every 6 hours as needed"
      }
    ],
    "comorbidities": [
      "Diabetes Type 2",
      "COPD"
    ],
    "diagnosis": "Pneumonia",
    "note_text": "\nCLINICAL NOTE\n============\nPatient ID: P0096\nDate: 2024-10-22\n\nPATIENT INFORMATION\n------------------\nAge: 76\nGender: Male\nAdmission Date: 2024-10-22\n\nVITAL SIGNS\n----------\nTemperature: 39.2\u00b0C\nHeart Rate: 117 bpm\nRespiratory Rate: 28 /min\nBlood Pressure: 128/67 mmHg\nO2 Saturation: 92%\n\nPRESENTING SYMPTOMS\n-----------------\n- wheezing\n- dyspnea\n- shallow breathing\n- sweating\n- chills\n- muscle aches\n- fatigue\n\nMEDICAL HISTORY\n-------------\nComorbidities: Diabetes Type 2, COPD\n\nMEDICATIONS\n----------\n- Doxycycline 100mg twice daily\n- Ceftriaxone 1g daily\n- Acetaminophen 650mg every 6 hours as needed\n- Ibuprofen 400mg every 6 hours as needed\n\nASSESSMENT\n---------\nPatient presents with clinical and radiological findings consistent with pneumonia.\n\nPLAN\n----\n1. Continue current antibiotic regimen\n2. Monitor vital signs and oxygen saturation\n3. Encourage deep breathing exercises\n4. Follow-up chest X-ray in 2 weeks\n5. Return if symptoms worsen\n",
    "image_path": "demo_dataset\\PNEUMONIA\\person126_bacteria_600.jpeg"
  },
  {
    "patient_id": "P0097",
    "basic_info": {
      "age": 58,
      "gender": "Female",
      "admission_date": "2024-10-26"
    },
    "vitals": {
      "temperature": 39.0,
      "heart_rate": 116,
      "respiratory_rate": 27,
      "blood_pressure": "129/61",
      "oxygen_saturation": 89
    },
    "symptoms": [
      "chest pain",
      "wheezing",
      "tachypnea",
      "shallow breathing",
      "dyspnea",
      "muscle aches",
      "fatigue",
      "chills",
      "fever"
    ],
    "medications": [
      {
        "name": "Levofloxacin",
        "dosage": "750mg",
        "frequency": "once daily"
      },
      {
        "name": "Amoxicillin",
        "dosage": "500mg",
        "frequency": "three times daily"
      },
      {
        "name": "Guaifenesin",
        "dosage": "400mg",
        "frequency": "every 4 hours as needed"
      },
      {
        "name": "Ibuprofen",
        "dosage": "400mg",
        "frequency": "every 6 hours as needed"
      }
    ],
    "comorbidities": [
      "Asthma"
    ],
    "diagnosis": "Pneumonia",
    "note_text": "\nCLINICAL NOTE\n============\nPatient ID: P0097\nDate: 2024-10-26\n\nPATIENT INFORMATION\n------------------\nAge: 58\nGender: Female\nAdmission Date: 2024-10-26\n\nVITAL SIGNS\n----------\nTemperature: 39.0\u00b0C\nHeart Rate: 116 bpm\nRespiratory Rate: 27 /min\nBlood Pressure: 129/61 mmHg\nO2 Saturation: 89%\n\nPRESENTING SYMPTOMS\n-----------------\n- chest pain\n- wheezing\n- tachypnea\n- shallow breathing\n- dyspnea\n- muscle aches\n- fatigue\n- chills\n- fever\n\nMEDICAL HISTORY\n-------------\nComorbidities: Asthma\n\nMEDICATIONS\n----------\n- Levofloxacin 750mg once daily\n- Amoxicillin 500mg three times daily\n- Guaifenesin 400mg every 4 hours as needed\n- Ibuprofen 400mg every 6 hours as needed\n\nASSESSMENT\n---------\nPatient presents with clinical and radiological findings consistent with pneumonia.\n\nPLAN\n----\n1. Continue current antibiotic regimen\n2. Monitor vital signs and oxygen saturation\n3. Encourage deep breathing exercises\n4. Follow-up chest X-ray in 2 weeks\n5. Return if symptoms worsen\n",
    "image_path": "demo_dataset\\PNEUMONIA\\person128_bacteria_605.jpeg"
  },
  {
    "patient_id": "P0098",
    "basic_info": {
      "age": 24,
      "gender": "Male",
      "admission_date": "2024-10-14"
    },
    "vitals": {
      "temperature": 38.3,
      "heart_rate": 99,
      "respiratory_rate": 24,
      "blood_pressure": "117/70",
      "oxygen_saturation": 93
    },
    "symptoms": [
      "tachypnea",
      "sputum production",
      "dyspnea",
      "shallow breathing",
      "fever",
      "muscle aches",
      "fatigue",
      "chills"
    ],
    "medications": [
      {
        "name": "Azithromycin",
        "dosage": "500mg",
        "frequency": "once daily"
      },
      {
        "name": "Ibuprofen",
        "dosage": "400mg",
        "frequency": "every 6 hours as needed"
      },
      {
        "name": "Guaifenesin",
        "dosage": "400mg",
        "frequency": "every 4 hours as needed"
      }
    ],
    "comorbidities": [],
    "diagnosis": "Pneumonia",
    "note_text": "\nCLINICAL NOTE\n============\nPatient ID: P0098\nDate: 2024-10-14\n\nPATIENT INFORMATION\n------------------\nAge: 24\nGender: Male\nAdmission Date: 2024-10-14\n\nVITAL SIGNS\n----------\nTemperature: 38.3\u00b0C\nHeart Rate: 99 bpm\nRespiratory Rate: 24 /min\nBlood Pressure: 117/70 mmHg\nO2 Saturation: 93%\n\nPRESENTING SYMPTOMS\n-----------------\n- tachypnea\n- sputum production\n- dyspnea\n- shallow breathing\n- fever\n- muscle aches\n- fatigue\n- chills\n\nMEDICAL HISTORY\n-------------\nComorbidities: None\n\nMEDICATIONS\n----------\n- Azithromycin 500mg once daily\n- Ibuprofen 400mg every 6 hours as needed\n- Guaifenesin 400mg every 4 hours as needed\n\nASSESSMENT\n---------\nPatient presents with clinical and radiological findings consistent with pneumonia.\n\nPLAN\n----\n1. Continue current antibiotic regimen\n2. Monitor vital signs and oxygen saturation\n3. Encourage deep breathing exercises\n4. Follow-up chest X-ray in 2 weeks\n5. Return if symptoms worsen\n",
    "image_path": "demo_dataset\\PNEUMONIA\\person128_bacteria_608.jpeg"
  },
  {
    "patient_id": "P0099",
    "basic_info": {
      "age": 37,
      "gender": "Female",
      "admission_date": "2024-10-21"
    },
    "vitals": {
      "temperature": 39.1,
      "heart_rate": 114,
      "respiratory_rate": 29,
      "blood_pressure": "136/66",
      "oxygen_saturation": 89
    },
    "symptoms": [
      "chest pain",
      "sputum production",
      "shallow breathing",
      "muscle aches",
      "decreased appetite",
      "chills",
      "malaise"
    ],
    "medications": [
      {
        "name": "Amoxicillin",
        "dosage": "500mg",
        "frequency": "three times daily"
      },
      {
        "name": "Ibuprofen",
        "dosage": "400mg",
        "frequency": "every 6 hours as needed"
      },
      {
        "name": "Guaifenesin",
        "dosage": "400mg",
        "frequency": "every 4 hours as needed"
      }
    ],
    "comorbidities": [
      "Asthma",
      "Obesity"
    ],
    "diagnosis": "Pneumonia",
    "note_text": "\nCLINICAL NOTE\n============\nPatient ID: P0099\nDate: 2024-10-21\n\nPATIENT INFORMATION\n------------------\nAge: 37\nGender: Female\nAdmission Date: 2024-10-21\n\nVITAL SIGNS\n----------\nTemperature: 39.1\u00b0C\nHeart Rate: 114 bpm\nRespiratory Rate: 29 /min\nBlood Pressure: 136/66 mmHg\nO2 Saturation: 89%\n\nPRESENTING SYMPTOMS\n-----------------\n- chest pain\n- sputum production\n- shallow breathing\n- muscle aches\n- decreased appetite\n- chills\n- malaise\n\nMEDICAL HISTORY\n-------------\nComorbidities: Asthma, Obesity\n\nMEDICATIONS\n----------\n- Amoxicillin 500mg three times daily\n- Ibuprofen 400mg every 6 hours as needed\n- Guaifenesin 400mg every 4 hours as needed\n\nASSESSMENT\n---------\nPatient presents with clinical and radiological findings consistent with pneumonia.\n\nPLAN\n----\n1. Continue current antibiotic regimen\n2. Monitor vital signs and oxygen saturation\n3. Encourage deep breathing exercises\n4. Follow-up chest X-ray in 2 weeks\n5. Return if symptoms worsen\n",
    "image_path": "demo_dataset\\PNEUMONIA\\person130_bacteria_623.jpeg"
  },
  {
    "patient_id": "P0100",
    "basic_info": {
      "age": 71,
      "gender": "Female",
      "admission_date": "2024-10-24"
    },
    "vitals": {
      "temperature": 39.1,
      "heart_rate": 117,
      "respiratory_rate": 20,
      "blood_pressure": "129/83",
      "oxygen_saturation": 94
    },
    "symptoms": [
      "dyspnea",
      "chest pain",
      "shallow breathing",
      "sputum production",
      "wheezing",
      "fever",
      "muscle aches",
      "decreased appetite",
      "malaise"
    ],
    "medications": [
      {
        "name": "Ceftriaxone",
        "dosage": "1g",
        "frequency": "daily"
      },
      {
        "name": "Guaifenesin",
        "dosage": "400mg",
        "frequency": "every 4 hours as needed"
      },
      {
        "name": "Ibuprofen",
        "dosage": "400mg",
        "frequency": "every 6 hours as needed"
      }
    ],
    "comorbidities": [
      "Diabetes Type 2"
    ],
    "diagnosis": "Pneumonia",
    "note_text": "\nCLINICAL NOTE\n============\nPatient ID: P0100\nDate: 2024-10-24\n\nPATIENT INFORMATION\n------------------\nAge: 71\nGender: Female\nAdmission Date: 2024-10-24\n\nVITAL SIGNS\n----------\nTemperature: 39.1\u00b0C\nHeart Rate: 117 bpm\nRespiratory Rate: 20 /min\nBlood Pressure: 129/83 mmHg\nO2 Saturation: 94%\n\nPRESENTING SYMPTOMS\n-----------------\n- dyspnea\n- chest pain\n- shallow breathing\n- sputum production\n- wheezing\n- fever\n- muscle aches\n- decreased appetite\n- malaise\n\nMEDICAL HISTORY\n-------------\nComorbidities: Diabetes Type 2\n\nMEDICATIONS\n----------\n- Ceftriaxone 1g daily\n- Guaifenesin 400mg every 4 hours as needed\n- Ibuprofen 400mg every 6 hours as needed\n\nASSESSMENT\n---------\nPatient presents with clinical and radiological findings consistent with pneumonia.\n\nPLAN\n----\n1. Continue current antibiotic regimen\n2. Monitor vital signs and oxygen saturation\n3. Encourage deep breathing exercises\n4. Follow-up chest X-ray in 2 weeks\n5. Return if symptoms worsen\n",
    "image_path": "demo_dataset\\PNEUMONIA\\person130_bacteria_628.jpeg"
  },
  {
    "patient_id": "P0101",
    "basic_info": {
      "age": 45,
      "gender": "Male",
      "admission_date": "2024-10-17"
    },
    "vitals": {
      "temperature": 38.5,
      "heart_rate": 103,
      "respiratory_rate": 24,
      "blood_pressure": "114/66",
      "oxygen_saturation": 93
    },
    "symptoms": [
      "chest pain",
      "sputum production",
      "cough",
      "shallow breathing",
      "dyspnea",
      "chills",
      "sweating",
      "malaise"
    ],
    "medications": [
      {
        "name": "Ceftriaxone",
        "dosage": "1g",
        "frequency": "daily"
      },
      {
        "name": "Ibuprofen",
        "dosage": "400mg",
        "frequency": "every 6 hours as needed"
      }
    ],
    "comorbidities": [],
    "diagnosis": "Pneumonia",
    "note_text": "\nCLINICAL NOTE\n============\nPatient ID: P0101\nDate: 2024-10-17\n\nPATIENT INFORMATION\n------------------\nAge: 45\nGender: Male\nAdmission Date: 2024-10-17\n\nVITAL SIGNS\n----------\nTemperature: 38.5\u00b0C\nHeart Rate: 103 bpm\nRespiratory Rate: 24 /min\nBlood Pressure: 114/66 mmHg\nO2 Saturation: 93%\n\nPRESENTING SYMPTOMS\n-----------------\n- chest pain\n- sputum production\n- cough\n- shallow breathing\n- dyspnea\n- chills\n- sweating\n- malaise\n\nMEDICAL HISTORY\n-------------\nComorbidities: None\n\nMEDICATIONS\n----------\n- Ceftriaxone 1g daily\n- Ibuprofen 400mg every 6 hours as needed\n\nASSESSMENT\n---------\nPatient presents with clinical and radiological findings consistent with pneumonia.\n\nPLAN\n----\n1. Continue current antibiotic regimen\n2. Monitor vital signs and oxygen saturation\n3. Encourage deep breathing exercises\n4. Follow-up chest X-ray in 2 weeks\n5. Return if symptoms worsen\n",
    "image_path": "demo_dataset\\PNEUMONIA\\person133_bacteria_635.jpeg"
  },
  {
    "patient_id": "P0102",
    "basic_info": {
      "age": 78,
      "gender": "Male",
      "admission_date": "2024-10-25"
    },
    "vitals": {
      "temperature": 38.9,
      "heart_rate": 90,
      "respiratory_rate": 30,
      "blood_pressure": "128/78",
      "oxygen_saturation": 93
    },
    "symptoms": [
      "wheezing",
      "dyspnea",
      "cough",
      "tachypnea",
      "fatigue",
      "decreased appetite",
      "fever"
    ],
    "medications": [
      {
        "name": "Azithromycin",
        "dosage": "500mg",
        "frequency": "once daily"
      },
      {
        "name": "Ibuprofen",
        "dosage": "400mg",
        "frequency": "every 6 hours as needed"
      },
      {
        "name": "Acetaminophen",
        "dosage": "650mg",
        "frequency": "every 6 hours as needed"
      }
    ],
    "comorbidities": [],
    "diagnosis": "Pneumonia",
    "note_text": "\nCLINICAL NOTE\n============\nPatient ID: P0102\nDate: 2024-10-25\n\nPATIENT INFORMATION\n------------------\nAge: 78\nGender: Male\nAdmission Date: 2024-10-25\n\nVITAL SIGNS\n----------\nTemperature: 38.9\u00b0C\nHeart Rate: 90 bpm\nRespiratory Rate: 30 /min\nBlood Pressure: 128/78 mmHg\nO2 Saturation: 93%\n\nPRESENTING SYMPTOMS\n-----------------\n- wheezing\n- dyspnea\n- cough\n- tachypnea\n- fatigue\n- decreased appetite\n- fever\n\nMEDICAL HISTORY\n-------------\nComorbidities: None\n\nMEDICATIONS\n----------\n- Azithromycin 500mg once daily\n- Ibuprofen 400mg every 6 hours as needed\n- Acetaminophen 650mg every 6 hours as needed\n\nASSESSMENT\n---------\nPatient presents with clinical and radiological findings consistent with pneumonia.\n\nPLAN\n----\n1. Continue current antibiotic regimen\n2. Monitor vital signs and oxygen saturation\n3. Encourage deep breathing exercises\n4. Follow-up chest X-ray in 2 weeks\n5. Return if symptoms worsen\n",
    "image_path": "demo_dataset\\PNEUMONIA\\person133_bacteria_637.jpeg"
  },
  {
    "patient_id": "P0103",
    "basic_info": {
      "age": 35,
      "gender": "Male",
      "admission_date": "2024-10-13"
    },
    "vitals": {
      "temperature": 38.0,
      "heart_rate": 90,
      "respiratory_rate": 29,
      "blood_pressure": "115/65",
      "oxygen_saturation": 93
    },
    "symptoms": [
      "tachypnea",
      "shallow breathing",
      "chest pain",
      "muscle aches",
      "fatigue",
      "fever"
    ],
    "medications": [
      {
        "name": "Amoxicillin",
        "dosage": "500mg",
        "frequency": "three times daily"
      },
      {
        "name": "Acetaminophen",
        "dosage": "650mg",
        "frequency": "every 6 hours as needed"
      },
      {
        "name": "Ibuprofen",
        "dosage": "400mg",
        "frequency": "every 6 hours as needed"
      }
    ],
    "comorbidities": [
      "COPD",
      "Hypertension",
      "Diabetes Type 2"
    ],
    "diagnosis": "Pneumonia",
    "note_text": "\nCLINICAL NOTE\n============\nPatient ID: P0103\nDate: 2024-10-13\n\nPATIENT INFORMATION\n------------------\nAge: 35\nGender: Male\nAdmission Date: 2024-10-13\n\nVITAL SIGNS\n----------\nTemperature: 38.0\u00b0C\nHeart Rate: 90 bpm\nRespiratory Rate: 29 /min\nBlood Pressure: 115/65 mmHg\nO2 Saturation: 93%\n\nPRESENTING SYMPTOMS\n-----------------\n- tachypnea\n- shallow breathing\n- chest pain\n- muscle aches\n- fatigue\n- fever\n\nMEDICAL HISTORY\n-------------\nComorbidities: COPD, Hypertension, Diabetes Type 2\n\nMEDICATIONS\n----------\n- Amoxicillin 500mg three times daily\n- Acetaminophen 650mg every 6 hours as needed\n- Ibuprofen 400mg every 6 hours as needed\n\nASSESSMENT\n---------\nPatient presents with clinical and radiological findings consistent with pneumonia.\n\nPLAN\n----\n1. Continue current antibiotic regimen\n2. Monitor vital signs and oxygen saturation\n3. Encourage deep breathing exercises\n4. Follow-up chest X-ray in 2 weeks\n5. Return if symptoms worsen\n",
    "image_path": "demo_dataset\\PNEUMONIA\\person134_bacteria_642.jpeg"
  },
  {
    "patient_id": "P0104",
    "basic_info": {
      "age": 33,
      "gender": "Female",
      "admission_date": "2024-10-25"
    },
    "vitals": {
      "temperature": 38.5,
      "heart_rate": 90,
      "respiratory_rate": 24,
      "blood_pressure": "136/62",
      "oxygen_saturation": 90
    },
    "symptoms": [
      "wheezing",
      "cough",
      "dyspnea",
      "shallow breathing",
      "muscle aches",
      "sweating"
    ],
    "medications": [
      {
        "name": "Amoxicillin",
        "dosage": "500mg",
        "frequency": "three times daily"
      },
      {
        "name": "Ibuprofen",
        "dosage": "400mg",
        "frequency": "every 6 hours as needed"
      }
    ],
    "comorbidities": [],
    "diagnosis": "Pneumonia",
    "note_text": "\nCLINICAL NOTE\n============\nPatient ID: P0104\nDate: 2024-10-25\n\nPATIENT INFORMATION\n------------------\nAge: 33\nGender: Female\nAdmission Date: 2024-10-25\n\nVITAL SIGNS\n----------\nTemperature: 38.5\u00b0C\nHeart Rate: 90 bpm\nRespiratory Rate: 24 /min\nBlood Pressure: 136/62 mmHg\nO2 Saturation: 90%\n\nPRESENTING SYMPTOMS\n-----------------\n- wheezing\n- cough\n- dyspnea\n- shallow breathing\n- muscle aches\n- sweating\n\nMEDICAL HISTORY\n-------------\nComorbidities: None\n\nMEDICATIONS\n----------\n- Amoxicillin 500mg three times daily\n- Ibuprofen 400mg every 6 hours as needed\n\nASSESSMENT\n---------\nPatient presents with clinical and radiological findings consistent with pneumonia.\n\nPLAN\n----\n1. Continue current antibiotic regimen\n2. Monitor vital signs and oxygen saturation\n3. Encourage deep breathing exercises\n4. Follow-up chest X-ray in 2 weeks\n5. Return if symptoms worsen\n",
    "image_path": "demo_dataset\\PNEUMONIA\\person134_bacteria_643.jpeg"
  },
  {
    "patient_id": "P0105",
    "basic_info": {
      "age": 25,
      "gender": "Female",
      "admission_date": "2024-10-18"
    },
    "vitals": {
      "temperature": 37.7,
      "heart_rate": 116,
      "respiratory_rate": 29,
      "blood_pressure": "120/67",
      "oxygen_saturation": 89
    },
    "symptoms": [
      "wheezing",
      "shallow breathing",
      "tachypnea",
      "dyspnea",
      "cough",
      "decreased appetite",
      "fever"
    ],
    "medications": [
      {
        "name": "Levofloxacin",
        "dosage": "750mg",
        "frequency": "once daily"
      },
      {
        "name": "Guaifenesin",
        "dosage": "400mg",
        "frequency": "every 4 hours as needed"
      }
    ],
    "comorbidities": [
      "Diabetes Type 2",
      "Obesity"
    ],
    "diagnosis": "Pneumonia",
    "note_text": "\nCLINICAL NOTE\n============\nPatient ID: P0105\nDate: 2024-10-18\n\nPATIENT INFORMATION\n------------------\nAge: 25\nGender: Female\nAdmission Date: 2024-10-18\n\nVITAL SIGNS\n----------\nTemperature: 37.7\u00b0C\nHeart Rate: 116 bpm\nRespiratory Rate: 29 /min\nBlood Pressure: 120/67 mmHg\nO2 Saturation: 89%\n\nPRESENTING SYMPTOMS\n-----------------\n- wheezing\n- shallow breathing\n- tachypnea\n- dyspnea\n- cough\n- decreased appetite\n- fever\n\nMEDICAL HISTORY\n-------------\nComorbidities: Diabetes Type 2, Obesity\n\nMEDICATIONS\n----------\n- Levofloxacin 750mg once daily\n- Guaifenesin 400mg every 4 hours as needed\n\nASSESSMENT\n---------\nPatient presents with clinical and radiological findings consistent with pneumonia.\n\nPLAN\n----\n1. Continue current antibiotic regimen\n2. Monitor vital signs and oxygen saturation\n3. Encourage deep breathing exercises\n4. Follow-up chest X-ray in 2 weeks\n5. Return if symptoms worsen\n",
    "image_path": "demo_dataset\\PNEUMONIA\\person134_bacteria_644.jpeg"
  },
  {
    "patient_id": "P0106",
    "basic_info": {
      "age": 60,
      "gender": "Male",
      "admission_date": "2024-10-18"
    },
    "vitals": {
      "temperature": 38.9,
      "heart_rate": 107,
      "respiratory_rate": 21,
      "blood_pressure": "115/78",
      "oxygen_saturation": 91
    },
    "symptoms": [
      "sputum production",
      "wheezing",
      "dyspnea",
      "cough",
      "chest pain",
      "sweating",
      "muscle aches",
      "fever",
      "decreased appetite"
    ],
    "medications": [
      {
        "name": "Azithromycin",
        "dosage": "500mg",
        "frequency": "once daily"
      },
      {
        "name": "Guaifenesin",
        "dosage": "400mg",
        "frequency": "every 4 hours as needed"
      },
      {
        "name": "Ibuprofen",
        "dosage": "400mg",
        "frequency": "every 6 hours as needed"
      }
    ],
    "comorbidities": [],
    "diagnosis": "Pneumonia",
    "note_text": "\nCLINICAL NOTE\n============\nPatient ID: P0106\nDate: 2024-10-18\n\nPATIENT INFORMATION\n------------------\nAge: 60\nGender: Male\nAdmission Date: 2024-10-18\n\nVITAL SIGNS\n----------\nTemperature: 38.9\u00b0C\nHeart Rate: 107 bpm\nRespiratory Rate: 21 /min\nBlood Pressure: 115/78 mmHg\nO2 Saturation: 91%\n\nPRESENTING SYMPTOMS\n-----------------\n- sputum production\n- wheezing\n- dyspnea\n- cough\n- chest pain\n- sweating\n- muscle aches\n- fever\n- decreased appetite\n\nMEDICAL HISTORY\n-------------\nComorbidities: None\n\nMEDICATIONS\n----------\n- Azithromycin 500mg once daily\n- Guaifenesin 400mg every 4 hours as needed\n- Ibuprofen 400mg every 6 hours as needed\n\nASSESSMENT\n---------\nPatient presents with clinical and radiological findings consistent with pneumonia.\n\nPLAN\n----\n1. Continue current antibiotic regimen\n2. Monitor vital signs and oxygen saturation\n3. Encourage deep breathing exercises\n4. Follow-up chest X-ray in 2 weeks\n5. Return if symptoms worsen\n",
    "image_path": "demo_dataset\\PNEUMONIA\\person135_bacteria_647.jpeg"
  },
  {
    "patient_id": "P0107",
    "basic_info": {
      "age": 61,
      "gender": "Male",
      "admission_date": "2024-10-24"
    },
    "vitals": {
      "temperature": 37.9,
      "heart_rate": 118,
      "respiratory_rate": 21,
      "blood_pressure": "119/68",
      "oxygen_saturation": 90
    },
    "symptoms": [
      "sputum production",
      "cough",
      "tachypnea",
      "shallow breathing",
      "sweating",
      "fever",
      "chills",
      "muscle aches"
    ],
    "medications": [
      {
        "name": "Doxycycline",
        "dosage": "100mg",
        "frequency": "twice daily"
      },
      {
        "name": "Ibuprofen",
        "dosage": "400mg",
        "frequency": "every 6 hours as needed"
      }
    ],
    "comorbidities": [
      "Coronary Artery Disease",
      "Diabetes Type 2"
    ],
    "diagnosis": "Pneumonia",
    "note_text": "\nCLINICAL NOTE\n============\nPatient ID: P0107\nDate: 2024-10-24\n\nPATIENT INFORMATION\n------------------\nAge: 61\nGender: Male\nAdmission Date: 2024-10-24\n\nVITAL SIGNS\n----------\nTemperature: 37.9\u00b0C\nHeart Rate: 118 bpm\nRespiratory Rate: 21 /min\nBlood Pressure: 119/68 mmHg\nO2 Saturation: 90%\n\nPRESENTING SYMPTOMS\n-----------------\n- sputum production\n- cough\n- tachypnea\n- shallow breathing\n- sweating\n- fever\n- chills\n- muscle aches\n\nMEDICAL HISTORY\n-------------\nComorbidities: Coronary Artery Disease, Diabetes Type 2\n\nMEDICATIONS\n----------\n- Doxycycline 100mg twice daily\n- Ibuprofen 400mg every 6 hours as needed\n\nASSESSMENT\n---------\nPatient presents with clinical and radiological findings consistent with pneumonia.\n\nPLAN\n----\n1. Continue current antibiotic regimen\n2. Monitor vital signs and oxygen saturation\n3. Encourage deep breathing exercises\n4. Follow-up chest X-ray in 2 weeks\n5. Return if symptoms worsen\n",
    "image_path": "demo_dataset\\PNEUMONIA\\person136_bacteria_648.jpeg"
  },
  {
    "patient_id": "P0108",
    "basic_info": {
      "age": 82,
      "gender": "Male",
      "admission_date": "2024-10-23"
    },
    "vitals": {
      "temperature": 38.1,
      "heart_rate": 97,
      "respiratory_rate": 28,
      "blood_pressure": "118/85",
      "oxygen_saturation": 93
    },
    "symptoms": [
      "shallow breathing",
      "dyspnea",
      "cough",
      "wheezing",
      "malaise",
      "sweating"
    ],
    "medications": [
      {
        "name": "Ceftriaxone",
        "dosage": "1g",
        "frequency": "daily"
      },
      {
        "name": "Acetaminophen",
        "dosage": "650mg",
        "frequency": "every 6 hours as needed"
      }
    ],
    "comorbidities": [
      "Diabetes Type 2",
      "Hypertension"
    ],
    "diagnosis": "Pneumonia",
    "note_text": "\nCLINICAL NOTE\n============\nPatient ID: P0108\nDate: 2024-10-23\n\nPATIENT INFORMATION\n------------------\nAge: 82\nGender: Male\nAdmission Date: 2024-10-23\n\nVITAL SIGNS\n----------\nTemperature: 38.1\u00b0C\nHeart Rate: 97 bpm\nRespiratory Rate: 28 /min\nBlood Pressure: 118/85 mmHg\nO2 Saturation: 93%\n\nPRESENTING SYMPTOMS\n-----------------\n- shallow breathing\n- dyspnea\n- cough\n- wheezing\n- malaise\n- sweating\n\nMEDICAL HISTORY\n-------------\nComorbidities: Diabetes Type 2, Hypertension\n\nMEDICATIONS\n----------\n- Ceftriaxone 1g daily\n- Acetaminophen 650mg every 6 hours as needed\n\nASSESSMENT\n---------\nPatient presents with clinical and radiological findings consistent with pneumonia.\n\nPLAN\n----\n1. Continue current antibiotic regimen\n2. Monitor vital signs and oxygen saturation\n3. Encourage deep breathing exercises\n4. Follow-up chest X-ray in 2 weeks\n5. Return if symptoms worsen\n",
    "image_path": "demo_dataset\\PNEUMONIA\\person136_bacteria_652.jpeg"
  },
  {
    "patient_id": "P0109",
    "basic_info": {
      "age": 21,
      "gender": "Male",
      "admission_date": "2024-10-14"
    },
    "vitals": {
      "temperature": 38.0,
      "heart_rate": 105,
      "respiratory_rate": 27,
      "blood_pressure": "125/84",
      "oxygen_saturation": 92
    },
    "symptoms": [
      "tachypnea",
      "wheezing",
      "dyspnea",
      "chest pain",
      "fever",
      "malaise",
      "sweating",
      "chills"
    ],
    "medications": [
      {
        "name": "Ceftriaxone",
        "dosage": "1g",
        "frequency": "daily"
      },
      {
        "name": "Levofloxacin",
        "dosage": "750mg",
        "frequency": "once daily"
      },
      {
        "name": "Guaifenesin",
        "dosage": "400mg",
        "frequency": "every 4 hours as needed"
      }
    ],
    "comorbidities": [
      "Obesity",
      "Diabetes Type 2"
    ],
    "diagnosis": "Pneumonia",
    "note_text": "\nCLINICAL NOTE\n============\nPatient ID: P0109\nDate: 2024-10-14\n\nPATIENT INFORMATION\n------------------\nAge: 21\nGender: Male\nAdmission Date: 2024-10-14\n\nVITAL SIGNS\n----------\nTemperature: 38.0\u00b0C\nHeart Rate: 105 bpm\nRespiratory Rate: 27 /min\nBlood Pressure: 125/84 mmHg\nO2 Saturation: 92%\n\nPRESENTING SYMPTOMS\n-----------------\n- tachypnea\n- wheezing\n- dyspnea\n- chest pain\n- fever\n- malaise\n- sweating\n- chills\n\nMEDICAL HISTORY\n-------------\nComorbidities: Obesity, Diabetes Type 2\n\nMEDICATIONS\n----------\n- Ceftriaxone 1g daily\n- Levofloxacin 750mg once daily\n- Guaifenesin 400mg every 4 hours as needed\n\nASSESSMENT\n---------\nPatient presents with clinical and radiological findings consistent with pneumonia.\n\nPLAN\n----\n1. Continue current antibiotic regimen\n2. Monitor vital signs and oxygen saturation\n3. Encourage deep breathing exercises\n4. Follow-up chest X-ray in 2 weeks\n5. Return if symptoms worsen\n",
    "image_path": "demo_dataset\\PNEUMONIA\\person139_bacteria_663.jpeg"
  },
  {
    "patient_id": "P0110",
    "basic_info": {
      "age": 81,
      "gender": "Male",
      "admission_date": "2024-10-18"
    },
    "vitals": {
      "temperature": 37.5,
      "heart_rate": 113,
      "respiratory_rate": 25,
      "blood_pressure": "122/88",
      "oxygen_saturation": 91
    },
    "symptoms": [
      "sputum production",
      "shallow breathing",
      "tachypnea",
      "sweating",
      "decreased appetite",
      "chills",
      "fatigue"
    ],
    "medications": [
      {
        "name": "Levofloxacin",
        "dosage": "750mg",
        "frequency": "once daily"
      },
      {
        "name": "Azithromycin",
        "dosage": "500mg",
        "frequency": "once daily"
      },
      {
        "name": "Guaifenesin",
        "dosage": "400mg",
        "frequency": "every 4 hours as needed"
      }
    ],
    "comorbidities": [
      "Hypertension",
      "Chronic Kidney Disease"
    ],
    "diagnosis": "Pneumonia",
    "note_text": "\nCLINICAL NOTE\n============\nPatient ID: P0110\nDate: 2024-10-18\n\nPATIENT INFORMATION\n------------------\nAge: 81\nGender: Male\nAdmission Date: 2024-10-18\n\nVITAL SIGNS\n----------\nTemperature: 37.5\u00b0C\nHeart Rate: 113 bpm\nRespiratory Rate: 25 /min\nBlood Pressure: 122/88 mmHg\nO2 Saturation: 91%\n\nPRESENTING SYMPTOMS\n-----------------\n- sputum production\n- shallow breathing\n- tachypnea\n- sweating\n- decreased appetite\n- chills\n- fatigue\n\nMEDICAL HISTORY\n-------------\nComorbidities: Hypertension, Chronic Kidney Disease\n\nMEDICATIONS\n----------\n- Levofloxacin 750mg once daily\n- Azithromycin 500mg once daily\n- Guaifenesin 400mg every 4 hours as needed\n\nASSESSMENT\n---------\nPatient presents with clinical and radiological findings consistent with pneumonia.\n\nPLAN\n----\n1. Continue current antibiotic regimen\n2. Monitor vital signs and oxygen saturation\n3. Encourage deep breathing exercises\n4. Follow-up chest X-ray in 2 weeks\n5. Return if symptoms worsen\n",
    "image_path": "demo_dataset\\PNEUMONIA\\person141_bacteria_677.jpeg"
  },
  {
    "patient_id": "P0111",
    "basic_info": {
      "age": 48,
      "gender": "Female",
      "admission_date": "2024-10-23"
    },
    "vitals": {
      "temperature": 38.6,
      "heart_rate": 95,
      "respiratory_rate": 28,
      "blood_pressure": "124/71",
      "oxygen_saturation": 90
    },
    "symptoms": [
      "cough",
      "wheezing",
      "chest pain",
      "sputum production",
      "dyspnea",
      "fatigue",
      "muscle aches",
      "sweating"
    ],
    "medications": [
      {
        "name": "Amoxicillin",
        "dosage": "500mg",
        "frequency": "three times daily"
      },
      {
        "name": "Azithromycin",
        "dosage": "500mg",
        "frequency": "once daily"
      },
      {
        "name": "Guaifenesin",
        "dosage": "400mg",
        "frequency": "every 4 hours as needed"
      },
      {
        "name": "Ibuprofen",
        "dosage": "400mg",
        "frequency": "every 6 hours as needed"
      }
    ],
    "comorbidities": [
      "Diabetes Type 2",
      "Coronary Artery Disease"
    ],
    "diagnosis": "Pneumonia",
    "note_text": "\nCLINICAL NOTE\n============\nPatient ID: P0111\nDate: 2024-10-23\n\nPATIENT INFORMATION\n------------------\nAge: 48\nGender: Female\nAdmission Date: 2024-10-23\n\nVITAL SIGNS\n----------\nTemperature: 38.6\u00b0C\nHeart Rate: 95 bpm\nRespiratory Rate: 28 /min\nBlood Pressure: 124/71 mmHg\nO2 Saturation: 90%\n\nPRESENTING SYMPTOMS\n-----------------\n- cough\n- wheezing\n- chest pain\n- sputum production\n- dyspnea\n- fatigue\n- muscle aches\n- sweating\n\nMEDICAL HISTORY\n-------------\nComorbidities: Diabetes Type 2, Coronary Artery Disease\n\nMEDICATIONS\n----------\n- Amoxicillin 500mg three times daily\n- Azithromycin 500mg once daily\n- Guaifenesin 400mg every 4 hours as needed\n- Ibuprofen 400mg every 6 hours as needed\n\nASSESSMENT\n---------\nPatient presents with clinical and radiological findings consistent with pneumonia.\n\nPLAN\n----\n1. Continue current antibiotic regimen\n2. Monitor vital signs and oxygen saturation\n3. Encourage deep breathing exercises\n4. Follow-up chest X-ray in 2 weeks\n5. Return if symptoms worsen\n",
    "image_path": "demo_dataset\\PNEUMONIA\\person142_bacteria_684.jpeg"
  },
  {
    "patient_id": "P0112",
    "basic_info": {
      "age": 61,
      "gender": "Female",
      "admission_date": "2024-10-15"
    },
    "vitals": {
      "temperature": 38.4,
      "heart_rate": 106,
      "respiratory_rate": 22,
      "blood_pressure": "130/90",
      "oxygen_saturation": 93
    },
    "symptoms": [
      "tachypnea",
      "cough",
      "wheezing",
      "muscle aches",
      "sweating"
    ],
    "medications": [
      {
        "name": "Azithromycin",
        "dosage": "500mg",
        "frequency": "once daily"
      },
      {
        "name": "Guaifenesin",
        "dosage": "400mg",
        "frequency": "every 4 hours as needed"
      },
      {
        "name": "Acetaminophen",
        "dosage": "650mg",
        "frequency": "every 6 hours as needed"
      }
    ],
    "comorbidities": [
      "Hypertension"
    ],
    "diagnosis": "Pneumonia",
    "note_text": "\nCLINICAL NOTE\n============\nPatient ID: P0112\nDate: 2024-10-15\n\nPATIENT INFORMATION\n------------------\nAge: 61\nGender: Female\nAdmission Date: 2024-10-15\n\nVITAL SIGNS\n----------\nTemperature: 38.4\u00b0C\nHeart Rate: 106 bpm\nRespiratory Rate: 22 /min\nBlood Pressure: 130/90 mmHg\nO2 Saturation: 93%\n\nPRESENTING SYMPTOMS\n-----------------\n- tachypnea\n- cough\n- wheezing\n- muscle aches\n- sweating\n\nMEDICAL HISTORY\n-------------\nComorbidities: Hypertension\n\nMEDICATIONS\n----------\n- Azithromycin 500mg once daily\n- Guaifenesin 400mg every 4 hours as needed\n- Acetaminophen 650mg every 6 hours as needed\n\nASSESSMENT\n---------\nPatient presents with clinical and radiological findings consistent with pneumonia.\n\nPLAN\n----\n1. Continue current antibiotic regimen\n2. Monitor vital signs and oxygen saturation\n3. Encourage deep breathing exercises\n4. Follow-up chest X-ray in 2 weeks\n5. Return if symptoms worsen\n",
    "image_path": "demo_dataset\\PNEUMONIA\\person146_bacteria_700.jpeg"
  },
  {
    "patient_id": "P0113",
    "basic_info": {
      "age": 22,
      "gender": "Male",
      "admission_date": "2024-10-22"
    },
    "vitals": {
      "temperature": 37.7,
      "heart_rate": 87,
      "respiratory_rate": 29,
      "blood_pressure": "117/70",
      "oxygen_saturation": 90
    },
    "symptoms": [
      "wheezing",
      "cough",
      "tachypnea",
      "dyspnea",
      "sputum production",
      "fatigue",
      "muscle aches",
      "fever",
      "sweating"
    ],
    "medications": [
      {
        "name": "Azithromycin",
        "dosage": "500mg",
        "frequency": "once daily"
      },
      {
        "name": "Guaifenesin",
        "dosage": "400mg",
        "frequency": "every 4 hours as needed"
      }
    ],
    "comorbidities": [
      "Diabetes Type 2",
      "Coronary Artery Disease",
      "Asthma"
    ],
    "diagnosis": "Pneumonia",
    "note_text": "\nCLINICAL NOTE\n============\nPatient ID: P0113\nDate: 2024-10-22\n\nPATIENT INFORMATION\n------------------\nAge: 22\nGender: Male\nAdmission Date: 2024-10-22\n\nVITAL SIGNS\n----------\nTemperature: 37.7\u00b0C\nHeart Rate: 87 bpm\nRespiratory Rate: 29 /min\nBlood Pressure: 117/70 mmHg\nO2 Saturation: 90%\n\nPRESENTING SYMPTOMS\n-----------------\n- wheezing\n- cough\n- tachypnea\n- dyspnea\n- sputum production\n- fatigue\n- muscle aches\n- fever\n- sweating\n\nMEDICAL HISTORY\n-------------\nComorbidities: Diabetes Type 2, Coronary Artery Disease, Asthma\n\nMEDICATIONS\n----------\n- Azithromycin 500mg once daily\n- Guaifenesin 400mg every 4 hours as needed\n\nASSESSMENT\n---------\nPatient presents with clinical and radiological findings consistent with pneumonia.\n\nPLAN\n----\n1. Continue current antibiotic regimen\n2. Monitor vital signs and oxygen saturation\n3. Encourage deep breathing exercises\n4. Follow-up chest X-ray in 2 weeks\n5. Return if symptoms worsen\n",
    "image_path": "demo_dataset\\PNEUMONIA\\person147_bacteria_707.jpeg"
  },
  {
    "patient_id": "P0114",
    "basic_info": {
      "age": 55,
      "gender": "Male",
      "admission_date": "2024-10-13"
    },
    "vitals": {
      "temperature": 38.4,
      "heart_rate": 109,
      "respiratory_rate": 27,
      "blood_pressure": "133/64",
      "oxygen_saturation": 93
    },
    "symptoms": [
      "dyspnea",
      "sputum production",
      "wheezing",
      "fatigue",
      "sweating"
    ],
    "medications": [
      {
        "name": "Azithromycin",
        "dosage": "500mg",
        "frequency": "once daily"
      },
      {
        "name": "Levofloxacin",
        "dosage": "750mg",
        "frequency": "once daily"
      },
      {
        "name": "Acetaminophen",
        "dosage": "650mg",
        "frequency": "every 6 hours as needed"
      },
      {
        "name": "Guaifenesin",
        "dosage": "400mg",
        "frequency": "every 4 hours as needed"
      }
    ],
    "comorbidities": [
      "Chronic Kidney Disease",
      "Obesity"
    ],
    "diagnosis": "Pneumonia",
    "note_text": "\nCLINICAL NOTE\n============\nPatient ID: P0114\nDate: 2024-10-13\n\nPATIENT INFORMATION\n------------------\nAge: 55\nGender: Male\nAdmission Date: 2024-10-13\n\nVITAL SIGNS\n----------\nTemperature: 38.4\u00b0C\nHeart Rate: 109 bpm\nRespiratory Rate: 27 /min\nBlood Pressure: 133/64 mmHg\nO2 Saturation: 93%\n\nPRESENTING SYMPTOMS\n-----------------\n- dyspnea\n- sputum production\n- wheezing\n- fatigue\n- sweating\n\nMEDICAL HISTORY\n-------------\nComorbidities: Chronic Kidney Disease, Obesity\n\nMEDICATIONS\n----------\n- Azithromycin 500mg once daily\n- Levofloxacin 750mg once daily\n- Acetaminophen 650mg every 6 hours as needed\n- Guaifenesin 400mg every 4 hours as needed\n\nASSESSMENT\n---------\nPatient presents with clinical and radiological findings consistent with pneumonia.\n\nPLAN\n----\n1. Continue current antibiotic regimen\n2. Monitor vital signs and oxygen saturation\n3. Encourage deep breathing exercises\n4. Follow-up chest X-ray in 2 weeks\n5. Return if symptoms worsen\n",
    "image_path": "demo_dataset\\PNEUMONIA\\person147_bacteria_711.jpeg"
  },
  {
    "patient_id": "P0115",
    "basic_info": {
      "age": 54,
      "gender": "Male",
      "admission_date": "2024-10-13"
    },
    "vitals": {
      "temperature": 38.1,
      "heart_rate": 114,
      "respiratory_rate": 30,
      "blood_pressure": "110/81",
      "oxygen_saturation": 93
    },
    "symptoms": [
      "sputum production",
      "wheezing",
      "shallow breathing",
      "muscle aches",
      "decreased appetite",
      "fatigue",
      "sweating"
    ],
    "medications": [
      {
        "name": "Doxycycline",
        "dosage": "100mg",
        "frequency": "twice daily"
      },
      {
        "name": "Ibuprofen",
        "dosage": "400mg",
        "frequency": "every 6 hours as needed"
      }
    ],
    "comorbidities": [
      "COPD",
      "Asthma"
    ],
    "diagnosis": "Pneumonia",
    "note_text": "\nCLINICAL NOTE\n============\nPatient ID: P0115\nDate: 2024-10-13\n\nPATIENT INFORMATION\n------------------\nAge: 54\nGender: Male\nAdmission Date: 2024-10-13\n\nVITAL SIGNS\n----------\nTemperature: 38.1\u00b0C\nHeart Rate: 114 bpm\nRespiratory Rate: 30 /min\nBlood Pressure: 110/81 mmHg\nO2 Saturation: 93%\n\nPRESENTING SYMPTOMS\n-----------------\n- sputum production\n- wheezing\n- shallow breathing\n- muscle aches\n- decreased appetite\n- fatigue\n- sweating\n\nMEDICAL HISTORY\n-------------\nComorbidities: COPD, Asthma\n\nMEDICATIONS\n----------\n- Doxycycline 100mg twice daily\n- Ibuprofen 400mg every 6 hours as needed\n\nASSESSMENT\n---------\nPatient presents with clinical and radiological findings consistent with pneumonia.\n\nPLAN\n----\n1. Continue current antibiotic regimen\n2. Monitor vital signs and oxygen saturation\n3. Encourage deep breathing exercises\n4. Follow-up chest X-ray in 2 weeks\n5. Return if symptoms worsen\n",
    "image_path": "demo_dataset\\PNEUMONIA\\person14_virus_44.jpeg"
  },
  {
    "patient_id": "P0116",
    "basic_info": {
      "age": 32,
      "gender": "Female",
      "admission_date": "2024-10-14"
    },
    "vitals": {
      "temperature": 39.0,
      "heart_rate": 113,
      "respiratory_rate": 24,
      "blood_pressure": "138/61",
      "oxygen_saturation": 94
    },
    "symptoms": [
      "shallow breathing",
      "chest pain",
      "wheezing",
      "cough",
      "chills",
      "fatigue"
    ],
    "medications": [
      {
        "name": "Ceftriaxone",
        "dosage": "1g",
        "frequency": "daily"
      },
      {
        "name": "Guaifenesin",
        "dosage": "400mg",
        "frequency": "every 4 hours as needed"
      }
    ],
    "comorbidities": [
      "COPD",
      "Obesity",
      "Asthma"
    ],
    "diagnosis": "Pneumonia",
    "note_text": "\nCLINICAL NOTE\n============\nPatient ID: P0116\nDate: 2024-10-14\n\nPATIENT INFORMATION\n------------------\nAge: 32\nGender: Female\nAdmission Date: 2024-10-14\n\nVITAL SIGNS\n----------\nTemperature: 39.0\u00b0C\nHeart Rate: 113 bpm\nRespiratory Rate: 24 /min\nBlood Pressure: 138/61 mmHg\nO2 Saturation: 94%\n\nPRESENTING SYMPTOMS\n-----------------\n- shallow breathing\n- chest pain\n- wheezing\n- cough\n- chills\n- fatigue\n\nMEDICAL HISTORY\n-------------\nComorbidities: COPD, Obesity, Asthma\n\nMEDICATIONS\n----------\n- Ceftriaxone 1g daily\n- Guaifenesin 400mg every 4 hours as needed\n\nASSESSMENT\n---------\nPatient presents with clinical and radiological findings consistent with pneumonia.\n\nPLAN\n----\n1. Continue current antibiotic regimen\n2. Monitor vital signs and oxygen saturation\n3. Encourage deep breathing exercises\n4. Follow-up chest X-ray in 2 weeks\n5. Return if symptoms worsen\n",
    "image_path": "demo_dataset\\PNEUMONIA\\person150_bacteria_716.jpeg"
  },
  {
    "patient_id": "P0117",
    "basic_info": {
      "age": 39,
      "gender": "Female",
      "admission_date": "2024-10-23"
    },
    "vitals": {
      "temperature": 37.8,
      "heart_rate": 92,
      "respiratory_rate": 27,
      "blood_pressure": "120/90",
      "oxygen_saturation": 91
    },
    "symptoms": [
      "dyspnea",
      "sputum production",
      "wheezing",
      "malaise",
      "chills",
      "fatigue",
      "fever"
    ],
    "medications": [
      {
        "name": "Azithromycin",
        "dosage": "500mg",
        "frequency": "once daily"
      },
      {
        "name": "Acetaminophen",
        "dosage": "650mg",
        "frequency": "every 6 hours as needed"
      }
    ],
    "comorbidities": [
      "Chronic Kidney Disease"
    ],
    "diagnosis": "Pneumonia",
    "note_text": "\nCLINICAL NOTE\n============\nPatient ID: P0117\nDate: 2024-10-23\n\nPATIENT INFORMATION\n------------------\nAge: 39\nGender: Female\nAdmission Date: 2024-10-23\n\nVITAL SIGNS\n----------\nTemperature: 37.8\u00b0C\nHeart Rate: 92 bpm\nRespiratory Rate: 27 /min\nBlood Pressure: 120/90 mmHg\nO2 Saturation: 91%\n\nPRESENTING SYMPTOMS\n-----------------\n- dyspnea\n- sputum production\n- wheezing\n- malaise\n- chills\n- fatigue\n- fever\n\nMEDICAL HISTORY\n-------------\nComorbidities: Chronic Kidney Disease\n\nMEDICATIONS\n----------\n- Azithromycin 500mg once daily\n- Acetaminophen 650mg every 6 hours as needed\n\nASSESSMENT\n---------\nPatient presents with clinical and radiological findings consistent with pneumonia.\n\nPLAN\n----\n1. Continue current antibiotic regimen\n2. Monitor vital signs and oxygen saturation\n3. Encourage deep breathing exercises\n4. Follow-up chest X-ray in 2 weeks\n5. Return if symptoms worsen\n",
    "image_path": "demo_dataset\\PNEUMONIA\\person152_bacteria_720.jpeg"
  },
  {
    "patient_id": "P0118",
    "basic_info": {
      "age": 56,
      "gender": "Female",
      "admission_date": "2024-10-14"
    },
    "vitals": {
      "temperature": 38.9,
      "heart_rate": 110,
      "respiratory_rate": 29,
      "blood_pressure": "137/66",
      "oxygen_saturation": 94
    },
    "symptoms": [
      "sputum production",
      "chest pain",
      "cough",
      "sweating",
      "malaise"
    ],
    "medications": [
      {
        "name": "Ceftriaxone",
        "dosage": "1g",
        "frequency": "daily"
      },
      {
        "name": "Levofloxacin",
        "dosage": "750mg",
        "frequency": "once daily"
      },
      {
        "name": "Ibuprofen",
        "dosage": "400mg",
        "frequency": "every 6 hours as needed"
      }
    ],
    "comorbidities": [
      "Asthma",
      "Obesity"
    ],
    "diagnosis": "Pneumonia",
    "note_text": "\nCLINICAL NOTE\n============\nPatient ID: P0118\nDate: 2024-10-14\n\nPATIENT INFORMATION\n------------------\nAge: 56\nGender: Female\nAdmission Date: 2024-10-14\n\nVITAL SIGNS\n----------\nTemperature: 38.9\u00b0C\nHeart Rate: 110 bpm\nRespiratory Rate: 29 /min\nBlood Pressure: 137/66 mmHg\nO2 Saturation: 94%\n\nPRESENTING SYMPTOMS\n-----------------\n- sputum production\n- chest pain\n- cough\n- sweating\n- malaise\n\nMEDICAL HISTORY\n-------------\nComorbidities: Asthma, Obesity\n\nMEDICATIONS\n----------\n- Ceftriaxone 1g daily\n- Levofloxacin 750mg once daily\n- Ibuprofen 400mg every 6 hours as needed\n\nASSESSMENT\n---------\nPatient presents with clinical and radiological findings consistent with pneumonia.\n\nPLAN\n----\n1. Continue current antibiotic regimen\n2. Monitor vital signs and oxygen saturation\n3. Encourage deep breathing exercises\n4. Follow-up chest X-ray in 2 weeks\n5. Return if symptoms worsen\n",
    "image_path": "demo_dataset\\PNEUMONIA\\person152_bacteria_721.jpeg"
  },
  {
    "patient_id": "P0119",
    "basic_info": {
      "age": 20,
      "gender": "Female",
      "admission_date": "2024-10-23"
    },
    "vitals": {
      "temperature": 37.9,
      "heart_rate": 86,
      "respiratory_rate": 29,
      "blood_pressure": "116/63",
      "oxygen_saturation": 93
    },
    "symptoms": [
      "sputum production",
      "shallow breathing",
      "cough",
      "sweating",
      "decreased appetite",
      "fatigue"
    ],
    "medications": [
      {
        "name": "Doxycycline",
        "dosage": "100mg",
        "frequency": "twice daily"
      },
      {
        "name": "Levofloxacin",
        "dosage": "750mg",
        "frequency": "once daily"
      },
      {
        "name": "Guaifenesin",
        "dosage": "400mg",
        "frequency": "every 4 hours as needed"
      }
    ],
    "comorbidities": [
      "Coronary Artery Disease",
      "Diabetes Type 2",
      "Obesity"
    ],
    "diagnosis": "Pneumonia",
    "note_text": "\nCLINICAL NOTE\n============\nPatient ID: P0119\nDate: 2024-10-23\n\nPATIENT INFORMATION\n------------------\nAge: 20\nGender: Female\nAdmission Date: 2024-10-23\n\nVITAL SIGNS\n----------\nTemperature: 37.9\u00b0C\nHeart Rate: 86 bpm\nRespiratory Rate: 29 /min\nBlood Pressure: 116/63 mmHg\nO2 Saturation: 93%\n\nPRESENTING SYMPTOMS\n-----------------\n- sputum production\n- shallow breathing\n- cough\n- sweating\n- decreased appetite\n- fatigue\n\nMEDICAL HISTORY\n-------------\nComorbidities: Coronary Artery Disease, Diabetes Type 2, Obesity\n\nMEDICATIONS\n----------\n- Doxycycline 100mg twice daily\n- Levofloxacin 750mg once daily\n- Guaifenesin 400mg every 4 hours as needed\n\nASSESSMENT\n---------\nPatient presents with clinical and radiological findings consistent with pneumonia.\n\nPLAN\n----\n1. Continue current antibiotic regimen\n2. Monitor vital signs and oxygen saturation\n3. Encourage deep breathing exercises\n4. Follow-up chest X-ray in 2 weeks\n5. Return if symptoms worsen\n",
    "image_path": "demo_dataset\\PNEUMONIA\\person152_bacteria_723.jpeg"
  },
  {
    "patient_id": "P0120",
    "basic_info": {
      "age": 78,
      "gender": "Female",
      "admission_date": "2024-10-21"
    },
    "vitals": {
      "temperature": 37.8,
      "heart_rate": 114,
      "respiratory_rate": 24,
      "blood_pressure": "118/88",
      "oxygen_saturation": 93
    },
    "symptoms": [
      "cough",
      "tachypnea",
      "sputum production",
      "shallow breathing",
      "malaise",
      "chills",
      "decreased appetite",
      "sweating"
    ],
    "medications": [
      {
        "name": "Azithromycin",
        "dosage": "500mg",
        "frequency": "once daily"
      },
      {
        "name": "Amoxicillin",
        "dosage": "500mg",
        "frequency": "three times daily"
      },
      {
        "name": "Ibuprofen",
        "dosage": "400mg",
        "frequency": "every 6 hours as needed"
      },
      {
        "name": "Acetaminophen",
        "dosage": "650mg",
        "frequency": "every 6 hours as needed"
      }
    ],
    "comorbidities": [],
    "diagnosis": "Pneumonia",
    "note_text": "\nCLINICAL NOTE\n============\nPatient ID: P0120\nDate: 2024-10-21\n\nPATIENT INFORMATION\n------------------\nAge: 78\nGender: Female\nAdmission Date: 2024-10-21\n\nVITAL SIGNS\n----------\nTemperature: 37.8\u00b0C\nHeart Rate: 114 bpm\nRespiratory Rate: 24 /min\nBlood Pressure: 118/88 mmHg\nO2 Saturation: 93%\n\nPRESENTING SYMPTOMS\n-----------------\n- cough\n- tachypnea\n- sputum production\n- shallow breathing\n- malaise\n- chills\n- decreased appetite\n- sweating\n\nMEDICAL HISTORY\n-------------\nComorbidities: None\n\nMEDICATIONS\n----------\n- Azithromycin 500mg once daily\n- Amoxicillin 500mg three times daily\n- Ibuprofen 400mg every 6 hours as needed\n- Acetaminophen 650mg every 6 hours as needed\n\nASSESSMENT\n---------\nPatient presents with clinical and radiological findings consistent with pneumonia.\n\nPLAN\n----\n1. Continue current antibiotic regimen\n2. Monitor vital signs and oxygen saturation\n3. Encourage deep breathing exercises\n4. Follow-up chest X-ray in 2 weeks\n5. Return if symptoms worsen\n",
    "image_path": "demo_dataset\\PNEUMONIA\\person154_bacteria_728.jpeg"
  },
  {
    "patient_id": "P0121",
    "basic_info": {
      "age": 49,
      "gender": "Female",
      "admission_date": "2024-10-22"
    },
    "vitals": {
      "temperature": 38.2,
      "heart_rate": 97,
      "respiratory_rate": 23,
      "blood_pressure": "132/65",
      "oxygen_saturation": 89
    },
    "symptoms": [
      "wheezing",
      "chest pain",
      "dyspnea",
      "cough",
      "tachypnea",
      "chills",
      "muscle aches"
    ],
    "medications": [
      {
        "name": "Doxycycline",
        "dosage": "100mg",
        "frequency": "twice daily"
      },
      {
        "name": "Ceftriaxone",
        "dosage": "1g",
        "frequency": "daily"
      },
      {
        "name": "Guaifenesin",
        "dosage": "400mg",
        "frequency": "every 4 hours as needed"
      },
      {
        "name": "Acetaminophen",
        "dosage": "650mg",
        "frequency": "every 6 hours as needed"
      }
    ],
    "comorbidities": [],
    "diagnosis": "Pneumonia",
    "note_text": "\nCLINICAL NOTE\n============\nPatient ID: P0121\nDate: 2024-10-22\n\nPATIENT INFORMATION\n------------------\nAge: 49\nGender: Female\nAdmission Date: 2024-10-22\n\nVITAL SIGNS\n----------\nTemperature: 38.2\u00b0C\nHeart Rate: 97 bpm\nRespiratory Rate: 23 /min\nBlood Pressure: 132/65 mmHg\nO2 Saturation: 89%\n\nPRESENTING SYMPTOMS\n-----------------\n- wheezing\n- chest pain\n- dyspnea\n- cough\n- tachypnea\n- chills\n- muscle aches\n\nMEDICAL HISTORY\n-------------\nComorbidities: None\n\nMEDICATIONS\n----------\n- Doxycycline 100mg twice daily\n- Ceftriaxone 1g daily\n- Guaifenesin 400mg every 4 hours as needed\n- Acetaminophen 650mg every 6 hours as needed\n\nASSESSMENT\n---------\nPatient presents with clinical and radiological findings consistent with pneumonia.\n\nPLAN\n----\n1. Continue current antibiotic regimen\n2. Monitor vital signs and oxygen saturation\n3. Encourage deep breathing exercises\n4. Follow-up chest X-ray in 2 weeks\n5. Return if symptoms worsen\n",
    "image_path": "demo_dataset\\PNEUMONIA\\person155_bacteria_730.jpeg"
  },
  {
    "patient_id": "P0122",
    "basic_info": {
      "age": 37,
      "gender": "Female",
      "admission_date": "2024-10-19"
    },
    "vitals": {
      "temperature": 38.6,
      "heart_rate": 107,
      "respiratory_rate": 20,
      "blood_pressure": "130/63",
      "oxygen_saturation": 90
    },
    "symptoms": [
      "wheezing",
      "tachypnea",
      "cough",
      "chest pain",
      "muscle aches",
      "decreased appetite",
      "fever"
    ],
    "medications": [
      {
        "name": "Doxycycline",
        "dosage": "100mg",
        "frequency": "twice daily"
      },
      {
        "name": "Ceftriaxone",
        "dosage": "1g",
        "frequency": "daily"
      },
      {
        "name": "Ibuprofen",
        "dosage": "400mg",
        "frequency": "every 6 hours as needed"
      }
    ],
    "comorbidities": [
      "Asthma"
    ],
    "diagnosis": "Pneumonia",
    "note_text": "\nCLINICAL NOTE\n============\nPatient ID: P0122\nDate: 2024-10-19\n\nPATIENT INFORMATION\n------------------\nAge: 37\nGender: Female\nAdmission Date: 2024-10-19\n\nVITAL SIGNS\n----------\nTemperature: 38.6\u00b0C\nHeart Rate: 107 bpm\nRespiratory Rate: 20 /min\nBlood Pressure: 130/63 mmHg\nO2 Saturation: 90%\n\nPRESENTING SYMPTOMS\n-----------------\n- wheezing\n- tachypnea\n- cough\n- chest pain\n- muscle aches\n- decreased appetite\n- fever\n\nMEDICAL HISTORY\n-------------\nComorbidities: Asthma\n\nMEDICATIONS\n----------\n- Doxycycline 100mg twice daily\n- Ceftriaxone 1g daily\n- Ibuprofen 400mg every 6 hours as needed\n\nASSESSMENT\n---------\nPatient presents with clinical and radiological findings consistent with pneumonia.\n\nPLAN\n----\n1. Continue current antibiotic regimen\n2. Monitor vital signs and oxygen saturation\n3. Encourage deep breathing exercises\n4. Follow-up chest X-ray in 2 weeks\n5. Return if symptoms worsen\n",
    "image_path": "demo_dataset\\PNEUMONIA\\person157_bacteria_739.jpeg"
  },
  {
    "patient_id": "P0123",
    "basic_info": {
      "age": 61,
      "gender": "Male",
      "admission_date": "2024-10-25"
    },
    "vitals": {
      "temperature": 38.5,
      "heart_rate": 109,
      "respiratory_rate": 26,
      "blood_pressure": "123/70",
      "oxygen_saturation": 94
    },
    "symptoms": [
      "sputum production",
      "chest pain",
      "shallow breathing",
      "fever",
      "malaise"
    ],
    "medications": [
      {
        "name": "Ceftriaxone",
        "dosage": "1g",
        "frequency": "daily"
      },
      {
        "name": "Doxycycline",
        "dosage": "100mg",
        "frequency": "twice daily"
      },
      {
        "name": "Acetaminophen",
        "dosage": "650mg",
        "frequency": "every 6 hours as needed"
      },
      {
        "name": "Ibuprofen",
        "dosage": "400mg",
        "frequency": "every 6 hours as needed"
      }
    ],
    "comorbidities": [
      "Coronary Artery Disease"
    ],
    "diagnosis": "Pneumonia",
    "note_text": "\nCLINICAL NOTE\n============\nPatient ID: P0123\nDate: 2024-10-25\n\nPATIENT INFORMATION\n------------------\nAge: 61\nGender: Male\nAdmission Date: 2024-10-25\n\nVITAL SIGNS\n----------\nTemperature: 38.5\u00b0C\nHeart Rate: 109 bpm\nRespiratory Rate: 26 /min\nBlood Pressure: 123/70 mmHg\nO2 Saturation: 94%\n\nPRESENTING SYMPTOMS\n-----------------\n- sputum production\n- chest pain\n- shallow breathing\n- fever\n- malaise\n\nMEDICAL HISTORY\n-------------\nComorbidities: Coronary Artery Disease\n\nMEDICATIONS\n----------\n- Ceftriaxone 1g daily\n- Doxycycline 100mg twice daily\n- Acetaminophen 650mg every 6 hours as needed\n- Ibuprofen 400mg every 6 hours as needed\n\nASSESSMENT\n---------\nPatient presents with clinical and radiological findings consistent with pneumonia.\n\nPLAN\n----\n1. Continue current antibiotic regimen\n2. Monitor vital signs and oxygen saturation\n3. Encourage deep breathing exercises\n4. Follow-up chest X-ray in 2 weeks\n5. Return if symptoms worsen\n",
    "image_path": "demo_dataset\\PNEUMONIA\\person158_bacteria_743.jpeg"
  },
  {
    "patient_id": "P0124",
    "basic_info": {
      "age": 69,
      "gender": "Female",
      "admission_date": "2024-10-20"
    },
    "vitals": {
      "temperature": 39.0,
      "heart_rate": 107,
      "respiratory_rate": 22,
      "blood_pressure": "129/69",
      "oxygen_saturation": 95
    },
    "symptoms": [
      "cough",
      "shallow breathing",
      "sputum production",
      "chills",
      "fatigue",
      "fever",
      "decreased appetite"
    ],
    "medications": [
      {
        "name": "Azithromycin",
        "dosage": "500mg",
        "frequency": "once daily"
      },
      {
        "name": "Acetaminophen",
        "dosage": "650mg",
        "frequency": "every 6 hours as needed"
      },
      {
        "name": "Ibuprofen",
        "dosage": "400mg",
        "frequency": "every 6 hours as needed"
      }
    ],
    "comorbidities": [],
    "diagnosis": "Pneumonia",
    "note_text": "\nCLINICAL NOTE\n============\nPatient ID: P0124\nDate: 2024-10-20\n\nPATIENT INFORMATION\n------------------\nAge: 69\nGender: Female\nAdmission Date: 2024-10-20\n\nVITAL SIGNS\n----------\nTemperature: 39.0\u00b0C\nHeart Rate: 107 bpm\nRespiratory Rate: 22 /min\nBlood Pressure: 129/69 mmHg\nO2 Saturation: 95%\n\nPRESENTING SYMPTOMS\n-----------------\n- cough\n- shallow breathing\n- sputum production\n- chills\n- fatigue\n- fever\n- decreased appetite\n\nMEDICAL HISTORY\n-------------\nComorbidities: None\n\nMEDICATIONS\n----------\n- Azithromycin 500mg once daily\n- Acetaminophen 650mg every 6 hours as needed\n- Ibuprofen 400mg every 6 hours as needed\n\nASSESSMENT\n---------\nPatient presents with clinical and radiological findings consistent with pneumonia.\n\nPLAN\n----\n1. Continue current antibiotic regimen\n2. Monitor vital signs and oxygen saturation\n3. Encourage deep breathing exercises\n4. Follow-up chest X-ray in 2 weeks\n5. Return if symptoms worsen\n",
    "image_path": "demo_dataset\\PNEUMONIA\\person158_bacteria_744.jpeg"
  },
  {
    "patient_id": "P0125",
    "basic_info": {
      "age": 53,
      "gender": "Male",
      "admission_date": "2024-10-26"
    },
    "vitals": {
      "temperature": 39.2,
      "heart_rate": 81,
      "respiratory_rate": 21,
      "blood_pressure": "123/81",
      "oxygen_saturation": 90
    },
    "symptoms": [
      "dyspnea",
      "sputum production",
      "chest pain",
      "tachypnea",
      "shallow breathing",
      "malaise",
      "fatigue",
      "fever"
    ],
    "medications": [
      {
        "name": "Amoxicillin",
        "dosage": "500mg",
        "frequency": "three times daily"
      },
      {
        "name": "Levofloxacin",
        "dosage": "750mg",
        "frequency": "once daily"
      },
      {
        "name": "Acetaminophen",
        "dosage": "650mg",
        "frequency": "every 6 hours as needed"
      },
      {
        "name": "Guaifenesin",
        "dosage": "400mg",
        "frequency": "every 4 hours as needed"
      }
    ],
    "comorbidities": [
      "Hypertension"
    ],
    "diagnosis": "Pneumonia",
    "note_text": "\nCLINICAL NOTE\n============\nPatient ID: P0125\nDate: 2024-10-26\n\nPATIENT INFORMATION\n------------------\nAge: 53\nGender: Male\nAdmission Date: 2024-10-26\n\nVITAL SIGNS\n----------\nTemperature: 39.2\u00b0C\nHeart Rate: 81 bpm\nRespiratory Rate: 21 /min\nBlood Pressure: 123/81 mmHg\nO2 Saturation: 90%\n\nPRESENTING SYMPTOMS\n-----------------\n- dyspnea\n- sputum production\n- chest pain\n- tachypnea\n- shallow breathing\n- malaise\n- fatigue\n- fever\n\nMEDICAL HISTORY\n-------------\nComorbidities: Hypertension\n\nMEDICATIONS\n----------\n- Amoxicillin 500mg three times daily\n- Levofloxacin 750mg once daily\n- Acetaminophen 650mg every 6 hours as needed\n- Guaifenesin 400mg every 4 hours as needed\n\nASSESSMENT\n---------\nPatient presents with clinical and radiological findings consistent with pneumonia.\n\nPLAN\n----\n1. Continue current antibiotic regimen\n2. Monitor vital signs and oxygen saturation\n3. Encourage deep breathing exercises\n4. Follow-up chest X-ray in 2 weeks\n5. Return if symptoms worsen\n",
    "image_path": "demo_dataset\\PNEUMONIA\\person158_bacteria_745.jpeg"
  },
  {
    "patient_id": "P0126",
    "basic_info": {
      "age": 30,
      "gender": "Male",
      "admission_date": "2024-10-13"
    },
    "vitals": {
      "temperature": 37.7,
      "heart_rate": 99,
      "respiratory_rate": 23,
      "blood_pressure": "129/81",
      "oxygen_saturation": 94
    },
    "symptoms": [
      "tachypnea",
      "sputum production",
      "cough",
      "dyspnea",
      "fatigue",
      "decreased appetite",
      "malaise"
    ],
    "medications": [
      {
        "name": "Doxycycline",
        "dosage": "100mg",
        "frequency": "twice daily"
      },
      {
        "name": "Azithromycin",
        "dosage": "500mg",
        "frequency": "once daily"
      },
      {
        "name": "Guaifenesin",
        "dosage": "400mg",
        "frequency": "every 4 hours as needed"
      },
      {
        "name": "Ibuprofen",
        "dosage": "400mg",
        "frequency": "every 6 hours as needed"
      }
    ],
    "comorbidities": [
      "COPD",
      "Obesity",
      "Hypertension"
    ],
    "diagnosis": "Pneumonia",
    "note_text": "\nCLINICAL NOTE\n============\nPatient ID: P0126\nDate: 2024-10-13\n\nPATIENT INFORMATION\n------------------\nAge: 30\nGender: Male\nAdmission Date: 2024-10-13\n\nVITAL SIGNS\n----------\nTemperature: 37.7\u00b0C\nHeart Rate: 99 bpm\nRespiratory Rate: 23 /min\nBlood Pressure: 129/81 mmHg\nO2 Saturation: 94%\n\nPRESENTING SYMPTOMS\n-----------------\n- tachypnea\n- sputum production\n- cough\n- dyspnea\n- fatigue\n- decreased appetite\n- malaise\n\nMEDICAL HISTORY\n-------------\nComorbidities: COPD, Obesity, Hypertension\n\nMEDICATIONS\n----------\n- Doxycycline 100mg twice daily\n- Azithromycin 500mg once daily\n- Guaifenesin 400mg every 4 hours as needed\n- Ibuprofen 400mg every 6 hours as needed\n\nASSESSMENT\n---------\nPatient presents with clinical and radiological findings consistent with pneumonia.\n\nPLAN\n----\n1. Continue current antibiotic regimen\n2. Monitor vital signs and oxygen saturation\n3. Encourage deep breathing exercises\n4. Follow-up chest X-ray in 2 weeks\n5. Return if symptoms worsen\n",
    "image_path": "demo_dataset\\PNEUMONIA\\person159_bacteria_747.jpeg"
  },
  {
    "patient_id": "P0127",
    "basic_info": {
      "age": 84,
      "gender": "Male",
      "admission_date": "2024-10-13"
    },
    "vitals": {
      "temperature": 39.3,
      "heart_rate": 102,
      "respiratory_rate": 29,
      "blood_pressure": "130/77",
      "oxygen_saturation": 91
    },
    "symptoms": [
      "wheezing",
      "shallow breathing",
      "dyspnea",
      "chest pain",
      "fever",
      "fatigue",
      "muscle aches",
      "sweating"
    ],
    "medications": [
      {
        "name": "Ceftriaxone",
        "dosage": "1g",
        "frequency": "daily"
      },
      {
        "name": "Amoxicillin",
        "dosage": "500mg",
        "frequency": "three times daily"
      },
      {
        "name": "Ibuprofen",
        "dosage": "400mg",
        "frequency": "every 6 hours as needed"
      }
    ],
    "comorbidities": [],
    "diagnosis": "Pneumonia",
    "note_text": "\nCLINICAL NOTE\n============\nPatient ID: P0127\nDate: 2024-10-13\n\nPATIENT INFORMATION\n------------------\nAge: 84\nGender: Male\nAdmission Date: 2024-10-13\n\nVITAL SIGNS\n----------\nTemperature: 39.3\u00b0C\nHeart Rate: 102 bpm\nRespiratory Rate: 29 /min\nBlood Pressure: 130/77 mmHg\nO2 Saturation: 91%\n\nPRESENTING SYMPTOMS\n-----------------\n- wheezing\n- shallow breathing\n- dyspnea\n- chest pain\n- fever\n- fatigue\n- muscle aches\n- sweating\n\nMEDICAL HISTORY\n-------------\nComorbidities: None\n\nMEDICATIONS\n----------\n- Ceftriaxone 1g daily\n- Amoxicillin 500mg three times daily\n- Ibuprofen 400mg every 6 hours as needed\n\nASSESSMENT\n---------\nPatient presents with clinical and radiological findings consistent with pneumonia.\n\nPLAN\n----\n1. Continue current antibiotic regimen\n2. Monitor vital signs and oxygen saturation\n3. Encourage deep breathing exercises\n4. Follow-up chest X-ray in 2 weeks\n5. Return if symptoms worsen\n",
    "image_path": "demo_dataset\\PNEUMONIA\\person15_virus_46.jpeg"
  },
  {
    "patient_id": "P0128",
    "basic_info": {
      "age": 37,
      "gender": "Male",
      "admission_date": "2024-10-19"
    },
    "vitals": {
      "temperature": 38.9,
      "heart_rate": 104,
      "respiratory_rate": 28,
      "blood_pressure": "131/85",
      "oxygen_saturation": 90
    },
    "symptoms": [
      "wheezing",
      "dyspnea",
      "chest pain",
      "shallow breathing",
      "sweating",
      "chills",
      "malaise",
      "decreased appetite"
    ],
    "medications": [
      {
        "name": "Azithromycin",
        "dosage": "500mg",
        "frequency": "once daily"
      },
      {
        "name": "Amoxicillin",
        "dosage": "500mg",
        "frequency": "three times daily"
      },
      {
        "name": "Guaifenesin",
        "dosage": "400mg",
        "frequency": "every 4 hours as needed"
      }
    ],
    "comorbidities": [
      "Chronic Kidney Disease",
      "Asthma"
    ],
    "diagnosis": "Pneumonia",
    "note_text": "\nCLINICAL NOTE\n============\nPatient ID: P0128\nDate: 2024-10-19\n\nPATIENT INFORMATION\n------------------\nAge: 37\nGender: Male\nAdmission Date: 2024-10-19\n\nVITAL SIGNS\n----------\nTemperature: 38.9\u00b0C\nHeart Rate: 104 bpm\nRespiratory Rate: 28 /min\nBlood Pressure: 131/85 mmHg\nO2 Saturation: 90%\n\nPRESENTING SYMPTOMS\n-----------------\n- wheezing\n- dyspnea\n- chest pain\n- shallow breathing\n- sweating\n- chills\n- malaise\n- decreased appetite\n\nMEDICAL HISTORY\n-------------\nComorbidities: Chronic Kidney Disease, Asthma\n\nMEDICATIONS\n----------\n- Azithromycin 500mg once daily\n- Amoxicillin 500mg three times daily\n- Guaifenesin 400mg every 4 hours as needed\n\nASSESSMENT\n---------\nPatient presents with clinical and radiological findings consistent with pneumonia.\n\nPLAN\n----\n1. Continue current antibiotic regimen\n2. Monitor vital signs and oxygen saturation\n3. Encourage deep breathing exercises\n4. Follow-up chest X-ray in 2 weeks\n5. Return if symptoms worsen\n",
    "image_path": "demo_dataset\\PNEUMONIA\\person1612_virus_2797.jpeg"
  },
  {
    "patient_id": "P0129",
    "basic_info": {
      "age": 63,
      "gender": "Female",
      "admission_date": "2024-10-24"
    },
    "vitals": {
      "temperature": 38.0,
      "heart_rate": 94,
      "respiratory_rate": 28,
      "blood_pressure": "112/70",
      "oxygen_saturation": 90
    },
    "symptoms": [
      "shallow breathing",
      "tachypnea",
      "wheezing",
      "fatigue",
      "fever",
      "decreased appetite"
    ],
    "medications": [
      {
        "name": "Amoxicillin",
        "dosage": "500mg",
        "frequency": "three times daily"
      },
      {
        "name": "Acetaminophen",
        "dosage": "650mg",
        "frequency": "every 6 hours as needed"
      },
      {
        "name": "Ibuprofen",
        "dosage": "400mg",
        "frequency": "every 6 hours as needed"
      }
    ],
    "comorbidities": [
      "Diabetes Type 2"
    ],
    "diagnosis": "Pneumonia",
    "note_text": "\nCLINICAL NOTE\n============\nPatient ID: P0129\nDate: 2024-10-24\n\nPATIENT INFORMATION\n------------------\nAge: 63\nGender: Female\nAdmission Date: 2024-10-24\n\nVITAL SIGNS\n----------\nTemperature: 38.0\u00b0C\nHeart Rate: 94 bpm\nRespiratory Rate: 28 /min\nBlood Pressure: 112/70 mmHg\nO2 Saturation: 90%\n\nPRESENTING SYMPTOMS\n-----------------\n- shallow breathing\n- tachypnea\n- wheezing\n- fatigue\n- fever\n- decreased appetite\n\nMEDICAL HISTORY\n-------------\nComorbidities: Diabetes Type 2\n\nMEDICATIONS\n----------\n- Amoxicillin 500mg three times daily\n- Acetaminophen 650mg every 6 hours as needed\n- Ibuprofen 400mg every 6 hours as needed\n\nASSESSMENT\n---------\nPatient presents with clinical and radiological findings consistent with pneumonia.\n\nPLAN\n----\n1. Continue current antibiotic regimen\n2. Monitor vital signs and oxygen saturation\n3. Encourage deep breathing exercises\n4. Follow-up chest X-ray in 2 weeks\n5. Return if symptoms worsen\n",
    "image_path": "demo_dataset\\PNEUMONIA\\person1612_virus_2798.jpeg"
  },
  {
    "patient_id": "P0130",
    "basic_info": {
      "age": 80,
      "gender": "Female",
      "admission_date": "2024-10-24"
    },
    "vitals": {
      "temperature": 38.7,
      "heart_rate": 94,
      "respiratory_rate": 20,
      "blood_pressure": "118/82",
      "oxygen_saturation": 93
    },
    "symptoms": [
      "sputum production",
      "chest pain",
      "shallow breathing",
      "dyspnea",
      "fever",
      "fatigue",
      "decreased appetite",
      "malaise"
    ],
    "medications": [
      {
        "name": "Azithromycin",
        "dosage": "500mg",
        "frequency": "once daily"
      },
      {
        "name": "Ibuprofen",
        "dosage": "400mg",
        "frequency": "every 6 hours as needed"
      }
    ],
    "comorbidities": [],
    "diagnosis": "Pneumonia",
    "note_text": "\nCLINICAL NOTE\n============\nPatient ID: P0130\nDate: 2024-10-24\n\nPATIENT INFORMATION\n------------------\nAge: 80\nGender: Female\nAdmission Date: 2024-10-24\n\nVITAL SIGNS\n----------\nTemperature: 38.7\u00b0C\nHeart Rate: 94 bpm\nRespiratory Rate: 20 /min\nBlood Pressure: 118/82 mmHg\nO2 Saturation: 93%\n\nPRESENTING SYMPTOMS\n-----------------\n- sputum production\n- chest pain\n- shallow breathing\n- dyspnea\n- fever\n- fatigue\n- decreased appetite\n- malaise\n\nMEDICAL HISTORY\n-------------\nComorbidities: None\n\nMEDICATIONS\n----------\n- Azithromycin 500mg once daily\n- Ibuprofen 400mg every 6 hours as needed\n\nASSESSMENT\n---------\nPatient presents with clinical and radiological findings consistent with pneumonia.\n\nPLAN\n----\n1. Continue current antibiotic regimen\n2. Monitor vital signs and oxygen saturation\n3. Encourage deep breathing exercises\n4. Follow-up chest X-ray in 2 weeks\n5. Return if symptoms worsen\n",
    "image_path": "demo_dataset\\PNEUMONIA\\person1619_virus_2806.jpeg"
  },
  {
    "patient_id": "P0131",
    "basic_info": {
      "age": 31,
      "gender": "Male",
      "admission_date": "2024-10-17"
    },
    "vitals": {
      "temperature": 39.4,
      "heart_rate": 108,
      "respiratory_rate": 25,
      "blood_pressure": "119/63",
      "oxygen_saturation": 89
    },
    "symptoms": [
      "dyspnea",
      "cough",
      "shallow breathing",
      "malaise",
      "decreased appetite"
    ],
    "medications": [
      {
        "name": "Azithromycin",
        "dosage": "500mg",
        "frequency": "once daily"
      },
      {
        "name": "Guaifenesin",
        "dosage": "400mg",
        "frequency": "every 4 hours as needed"
      },
      {
        "name": "Ibuprofen",
        "dosage": "400mg",
        "frequency": "every 6 hours as needed"
      }
    ],
    "comorbidities": [
      "Coronary Artery Disease",
      "Chronic Kidney Disease",
      "Obesity"
    ],
    "diagnosis": "Pneumonia",
    "note_text": "\nCLINICAL NOTE\n============\nPatient ID: P0131\nDate: 2024-10-17\n\nPATIENT INFORMATION\n------------------\nAge: 31\nGender: Male\nAdmission Date: 2024-10-17\n\nVITAL SIGNS\n----------\nTemperature: 39.4\u00b0C\nHeart Rate: 108 bpm\nRespiratory Rate: 25 /min\nBlood Pressure: 119/63 mmHg\nO2 Saturation: 89%\n\nPRESENTING SYMPTOMS\n-----------------\n- dyspnea\n- cough\n- shallow breathing\n- malaise\n- decreased appetite\n\nMEDICAL HISTORY\n-------------\nComorbidities: Coronary Artery Disease, Chronic Kidney Disease, Obesity\n\nMEDICATIONS\n----------\n- Azithromycin 500mg once daily\n- Guaifenesin 400mg every 4 hours as needed\n- Ibuprofen 400mg every 6 hours as needed\n\nASSESSMENT\n---------\nPatient presents with clinical and radiological findings consistent with pneumonia.\n\nPLAN\n----\n1. Continue current antibiotic regimen\n2. Monitor vital signs and oxygen saturation\n3. Encourage deep breathing exercises\n4. Follow-up chest X-ray in 2 weeks\n5. Return if symptoms worsen\n",
    "image_path": "demo_dataset\\PNEUMONIA\\person1626_virus_2818.jpeg"
  },
  {
    "patient_id": "P0132",
    "basic_info": {
      "age": 83,
      "gender": "Female",
      "admission_date": "2024-10-14"
    },
    "vitals": {
      "temperature": 39.2,
      "heart_rate": 118,
      "respiratory_rate": 22,
      "blood_pressure": "129/66",
      "oxygen_saturation": 94
    },
    "symptoms": [
      "shallow breathing",
      "chest pain",
      "tachypnea",
      "cough",
      "malaise",
      "chills",
      "fever"
    ],
    "medications": [
      {
        "name": "Amoxicillin",
        "dosage": "500mg",
        "frequency": "three times daily"
      },
      {
        "name": "Ibuprofen",
        "dosage": "400mg",
        "frequency": "every 6 hours as needed"
      },
      {
        "name": "Guaifenesin",
        "dosage": "400mg",
        "frequency": "every 4 hours as needed"
      }
    ],
    "comorbidities": [
      "Diabetes Type 2"
    ],
    "diagnosis": "Pneumonia",
    "note_text": "\nCLINICAL NOTE\n============\nPatient ID: P0132\nDate: 2024-10-14\n\nPATIENT INFORMATION\n------------------\nAge: 83\nGender: Female\nAdmission Date: 2024-10-14\n\nVITAL SIGNS\n----------\nTemperature: 39.2\u00b0C\nHeart Rate: 118 bpm\nRespiratory Rate: 22 /min\nBlood Pressure: 129/66 mmHg\nO2 Saturation: 94%\n\nPRESENTING SYMPTOMS\n-----------------\n- shallow breathing\n- chest pain\n- tachypnea\n- cough\n- malaise\n- chills\n- fever\n\nMEDICAL HISTORY\n-------------\nComorbidities: Diabetes Type 2\n\nMEDICATIONS\n----------\n- Amoxicillin 500mg three times daily\n- Ibuprofen 400mg every 6 hours as needed\n- Guaifenesin 400mg every 4 hours as needed\n\nASSESSMENT\n---------\nPatient presents with clinical and radiological findings consistent with pneumonia.\n\nPLAN\n----\n1. Continue current antibiotic regimen\n2. Monitor vital signs and oxygen saturation\n3. Encourage deep breathing exercises\n4. Follow-up chest X-ray in 2 weeks\n5. Return if symptoms worsen\n",
    "image_path": "demo_dataset\\PNEUMONIA\\person1635_virus_2831.jpeg"
  },
  {
    "patient_id": "P0133",
    "basic_info": {
      "age": 77,
      "gender": "Male",
      "admission_date": "2024-10-26"
    },
    "vitals": {
      "temperature": 39.3,
      "heart_rate": 81,
      "respiratory_rate": 26,
      "blood_pressure": "121/84",
      "oxygen_saturation": 94
    },
    "symptoms": [
      "shallow breathing",
      "dyspnea",
      "cough",
      "sputum production",
      "fatigue",
      "malaise",
      "chills",
      "decreased appetite"
    ],
    "medications": [
      {
        "name": "Azithromycin",
        "dosage": "500mg",
        "frequency": "once daily"
      },
      {
        "name": "Ibuprofen",
        "dosage": "400mg",
        "frequency": "every 6 hours as needed"
      },
      {
        "name": "Guaifenesin",
        "dosage": "400mg",
        "frequency": "every 4 hours as needed"
      }
    ],
    "comorbidities": [
      "Hypertension",
      "Asthma",
      "Diabetes Type 2"
    ],
    "diagnosis": "Pneumonia",
    "note_text": "\nCLINICAL NOTE\n============\nPatient ID: P0133\nDate: 2024-10-26\n\nPATIENT INFORMATION\n------------------\nAge: 77\nGender: Male\nAdmission Date: 2024-10-26\n\nVITAL SIGNS\n----------\nTemperature: 39.3\u00b0C\nHeart Rate: 81 bpm\nRespiratory Rate: 26 /min\nBlood Pressure: 121/84 mmHg\nO2 Saturation: 94%\n\nPRESENTING SYMPTOMS\n-----------------\n- shallow breathing\n- dyspnea\n- cough\n- sputum production\n- fatigue\n- malaise\n- chills\n- decreased appetite\n\nMEDICAL HISTORY\n-------------\nComorbidities: Hypertension, Asthma, Diabetes Type 2\n\nMEDICATIONS\n----------\n- Azithromycin 500mg once daily\n- Ibuprofen 400mg every 6 hours as needed\n- Guaifenesin 400mg every 4 hours as needed\n\nASSESSMENT\n---------\nPatient presents with clinical and radiological findings consistent with pneumonia.\n\nPLAN\n----\n1. Continue current antibiotic regimen\n2. Monitor vital signs and oxygen saturation\n3. Encourage deep breathing exercises\n4. Follow-up chest X-ray in 2 weeks\n5. Return if symptoms worsen\n",
    "image_path": "demo_dataset\\PNEUMONIA\\person1640_virus_2839.jpeg"
  },
  {
    "patient_id": "P0134",
    "basic_info": {
      "age": 46,
      "gender": "Male",
      "admission_date": "2024-10-14"
    },
    "vitals": {
      "temperature": 39.4,
      "heart_rate": 86,
      "respiratory_rate": 24,
      "blood_pressure": "124/70",
      "oxygen_saturation": 95
    },
    "symptoms": [
      "chest pain",
      "sputum production",
      "shallow breathing",
      "muscle aches",
      "malaise",
      "chills",
      "fatigue"
    ],
    "medications": [
      {
        "name": "Levofloxacin",
        "dosage": "750mg",
        "frequency": "once daily"
      },
      {
        "name": "Guaifenesin",
        "dosage": "400mg",
        "frequency": "every 4 hours as needed"
      }
    ],
    "comorbidities": [
      "Diabetes Type 2"
    ],
    "diagnosis": "Pneumonia",
    "note_text": "\nCLINICAL NOTE\n============\nPatient ID: P0134\nDate: 2024-10-14\n\nPATIENT INFORMATION\n------------------\nAge: 46\nGender: Male\nAdmission Date: 2024-10-14\n\nVITAL SIGNS\n----------\nTemperature: 39.4\u00b0C\nHeart Rate: 86 bpm\nRespiratory Rate: 24 /min\nBlood Pressure: 124/70 mmHg\nO2 Saturation: 95%\n\nPRESENTING SYMPTOMS\n-----------------\n- chest pain\n- sputum production\n- shallow breathing\n- muscle aches\n- malaise\n- chills\n- fatigue\n\nMEDICAL HISTORY\n-------------\nComorbidities: Diabetes Type 2\n\nMEDICATIONS\n----------\n- Levofloxacin 750mg once daily\n- Guaifenesin 400mg every 4 hours as needed\n\nASSESSMENT\n---------\nPatient presents with clinical and radiological findings consistent with pneumonia.\n\nPLAN\n----\n1. Continue current antibiotic regimen\n2. Monitor vital signs and oxygen saturation\n3. Encourage deep breathing exercises\n4. Follow-up chest X-ray in 2 weeks\n5. Return if symptoms worsen\n",
    "image_path": "demo_dataset\\PNEUMONIA\\person1642_virus_2842.jpeg"
  },
  {
    "patient_id": "P0135",
    "basic_info": {
      "age": 37,
      "gender": "Female",
      "admission_date": "2024-10-16"
    },
    "vitals": {
      "temperature": 38.7,
      "heart_rate": 105,
      "respiratory_rate": 22,
      "blood_pressure": "121/62",
      "oxygen_saturation": 91
    },
    "symptoms": [
      "chest pain",
      "cough",
      "shallow breathing",
      "dyspnea",
      "fever",
      "malaise",
      "decreased appetite"
    ],
    "medications": [
      {
        "name": "Ceftriaxone",
        "dosage": "1g",
        "frequency": "daily"
      },
      {
        "name": "Ibuprofen",
        "dosage": "400mg",
        "frequency": "every 6 hours as needed"
      },
      {
        "name": "Guaifenesin",
        "dosage": "400mg",
        "frequency": "every 4 hours as needed"
      }
    ],
    "comorbidities": [],
    "diagnosis": "Pneumonia",
    "note_text": "\nCLINICAL NOTE\n============\nPatient ID: P0135\nDate: 2024-10-16\n\nPATIENT INFORMATION\n------------------\nAge: 37\nGender: Female\nAdmission Date: 2024-10-16\n\nVITAL SIGNS\n----------\nTemperature: 38.7\u00b0C\nHeart Rate: 105 bpm\nRespiratory Rate: 22 /min\nBlood Pressure: 121/62 mmHg\nO2 Saturation: 91%\n\nPRESENTING SYMPTOMS\n-----------------\n- chest pain\n- cough\n- shallow breathing\n- dyspnea\n- fever\n- malaise\n- decreased appetite\n\nMEDICAL HISTORY\n-------------\nComorbidities: None\n\nMEDICATIONS\n----------\n- Ceftriaxone 1g daily\n- Ibuprofen 400mg every 6 hours as needed\n- Guaifenesin 400mg every 4 hours as needed\n\nASSESSMENT\n---------\nPatient presents with clinical and radiological findings consistent with pneumonia.\n\nPLAN\n----\n1. Continue current antibiotic regimen\n2. Monitor vital signs and oxygen saturation\n3. Encourage deep breathing exercises\n4. Follow-up chest X-ray in 2 weeks\n5. Return if symptoms worsen\n",
    "image_path": "demo_dataset\\PNEUMONIA\\person1645_virus_2845.jpeg"
  },
  {
    "patient_id": "P0136",
    "basic_info": {
      "age": 84,
      "gender": "Male",
      "admission_date": "2024-10-16"
    },
    "vitals": {
      "temperature": 37.6,
      "heart_rate": 88,
      "respiratory_rate": 26,
      "blood_pressure": "130/85",
      "oxygen_saturation": 92
    },
    "symptoms": [
      "shallow breathing",
      "chest pain",
      "tachypnea",
      "chills",
      "muscle aches"
    ],
    "medications": [
      {
        "name": "Levofloxacin",
        "dosage": "750mg",
        "frequency": "once daily"
      },
      {
        "name": "Doxycycline",
        "dosage": "100mg",
        "frequency": "twice daily"
      },
      {
        "name": "Guaifenesin",
        "dosage": "400mg",
        "frequency": "every 4 hours as needed"
      },
      {
        "name": "Ibuprofen",
        "dosage": "400mg",
        "frequency": "every 6 hours as needed"
      }
    ],
    "comorbidities": [
      "Chronic Kidney Disease",
      "Diabetes Type 2"
    ],
    "diagnosis": "Pneumonia",
    "note_text": "\nCLINICAL NOTE\n============\nPatient ID: P0136\nDate: 2024-10-16\n\nPATIENT INFORMATION\n------------------\nAge: 84\nGender: Male\nAdmission Date: 2024-10-16\n\nVITAL SIGNS\n----------\nTemperature: 37.6\u00b0C\nHeart Rate: 88 bpm\nRespiratory Rate: 26 /min\nBlood Pressure: 130/85 mmHg\nO2 Saturation: 92%\n\nPRESENTING SYMPTOMS\n-----------------\n- shallow breathing\n- chest pain\n- tachypnea\n- chills\n- muscle aches\n\nMEDICAL HISTORY\n-------------\nComorbidities: Chronic Kidney Disease, Diabetes Type 2\n\nMEDICATIONS\n----------\n- Levofloxacin 750mg once daily\n- Doxycycline 100mg twice daily\n- Guaifenesin 400mg every 4 hours as needed\n- Ibuprofen 400mg every 6 hours as needed\n\nASSESSMENT\n---------\nPatient presents with clinical and radiological findings consistent with pneumonia.\n\nPLAN\n----\n1. Continue current antibiotic regimen\n2. Monitor vital signs and oxygen saturation\n3. Encourage deep breathing exercises\n4. Follow-up chest X-ray in 2 weeks\n5. Return if symptoms worsen\n",
    "image_path": "demo_dataset\\PNEUMONIA\\person1650_virus_2852.jpeg"
  },
  {
    "patient_id": "P0137",
    "basic_info": {
      "age": 27,
      "gender": "Male",
      "admission_date": "2024-10-25"
    },
    "vitals": {
      "temperature": 37.7,
      "heart_rate": 81,
      "respiratory_rate": 29,
      "blood_pressure": "125/70",
      "oxygen_saturation": 92
    },
    "symptoms": [
      "tachypnea",
      "dyspnea",
      "chest pain",
      "chills",
      "muscle aches",
      "fever",
      "malaise"
    ],
    "medications": [
      {
        "name": "Amoxicillin",
        "dosage": "500mg",
        "frequency": "three times daily"
      },
      {
        "name": "Azithromycin",
        "dosage": "500mg",
        "frequency": "once daily"
      },
      {
        "name": "Guaifenesin",
        "dosage": "400mg",
        "frequency": "every 4 hours as needed"
      }
    ],
    "comorbidities": [
      "Diabetes Type 2",
      "Hypertension"
    ],
    "diagnosis": "Pneumonia",
    "note_text": "\nCLINICAL NOTE\n============\nPatient ID: P0137\nDate: 2024-10-25\n\nPATIENT INFORMATION\n------------------\nAge: 27\nGender: Male\nAdmission Date: 2024-10-25\n\nVITAL SIGNS\n----------\nTemperature: 37.7\u00b0C\nHeart Rate: 81 bpm\nRespiratory Rate: 29 /min\nBlood Pressure: 125/70 mmHg\nO2 Saturation: 92%\n\nPRESENTING SYMPTOMS\n-----------------\n- tachypnea\n- dyspnea\n- chest pain\n- chills\n- muscle aches\n- fever\n- malaise\n\nMEDICAL HISTORY\n-------------\nComorbidities: Diabetes Type 2, Hypertension\n\nMEDICATIONS\n----------\n- Amoxicillin 500mg three times daily\n- Azithromycin 500mg once daily\n- Guaifenesin 400mg every 4 hours as needed\n\nASSESSMENT\n---------\nPatient presents with clinical and radiological findings consistent with pneumonia.\n\nPLAN\n----\n1. Continue current antibiotic regimen\n2. Monitor vital signs and oxygen saturation\n3. Encourage deep breathing exercises\n4. Follow-up chest X-ray in 2 weeks\n5. Return if symptoms worsen\n",
    "image_path": "demo_dataset\\PNEUMONIA\\person1653_virus_2859.jpeg"
  },
  {
    "patient_id": "P0138",
    "basic_info": {
      "age": 63,
      "gender": "Male",
      "admission_date": "2024-10-24"
    },
    "vitals": {
      "temperature": 38.4,
      "heart_rate": 93,
      "respiratory_rate": 29,
      "blood_pressure": "118/82",
      "oxygen_saturation": 93
    },
    "symptoms": [
      "sputum production",
      "cough",
      "dyspnea",
      "fatigue",
      "chills",
      "fever",
      "muscle aches"
    ],
    "medications": [
      {
        "name": "Levofloxacin",
        "dosage": "750mg",
        "frequency": "once daily"
      },
      {
        "name": "Guaifenesin",
        "dosage": "400mg",
        "frequency": "every 4 hours as needed"
      }
    ],
    "comorbidities": [
      "Diabetes Type 2",
      "Obesity"
    ],
    "diagnosis": "Pneumonia",
    "note_text": "\nCLINICAL NOTE\n============\nPatient ID: P0138\nDate: 2024-10-24\n\nPATIENT INFORMATION\n------------------\nAge: 63\nGender: Male\nAdmission Date: 2024-10-24\n\nVITAL SIGNS\n----------\nTemperature: 38.4\u00b0C\nHeart Rate: 93 bpm\nRespiratory Rate: 29 /min\nBlood Pressure: 118/82 mmHg\nO2 Saturation: 93%\n\nPRESENTING SYMPTOMS\n-----------------\n- sputum production\n- cough\n- dyspnea\n- fatigue\n- chills\n- fever\n- muscle aches\n\nMEDICAL HISTORY\n-------------\nComorbidities: Diabetes Type 2, Obesity\n\nMEDICATIONS\n----------\n- Levofloxacin 750mg once daily\n- Guaifenesin 400mg every 4 hours as needed\n\nASSESSMENT\n---------\nPatient presents with clinical and radiological findings consistent with pneumonia.\n\nPLAN\n----\n1. Continue current antibiotic regimen\n2. Monitor vital signs and oxygen saturation\n3. Encourage deep breathing exercises\n4. Follow-up chest X-ray in 2 weeks\n5. Return if symptoms worsen\n",
    "image_path": "demo_dataset\\PNEUMONIA\\person1656_virus_2862.jpeg"
  },
  {
    "patient_id": "P0139",
    "basic_info": {
      "age": 20,
      "gender": "Female",
      "admission_date": "2024-10-26"
    },
    "vitals": {
      "temperature": 38.2,
      "heart_rate": 118,
      "respiratory_rate": 25,
      "blood_pressure": "128/67",
      "oxygen_saturation": 89
    },
    "symptoms": [
      "chest pain",
      "cough",
      "wheezing",
      "sweating",
      "fatigue",
      "decreased appetite"
    ],
    "medications": [
      {
        "name": "Ceftriaxone",
        "dosage": "1g",
        "frequency": "daily"
      },
      {
        "name": "Acetaminophen",
        "dosage": "650mg",
        "frequency": "every 6 hours as needed"
      },
      {
        "name": "Guaifenesin",
        "dosage": "400mg",
        "frequency": "every 4 hours as needed"
      }
    ],
    "comorbidities": [
      "Asthma",
      "Obesity"
    ],
    "diagnosis": "Pneumonia",
    "note_text": "\nCLINICAL NOTE\n============\nPatient ID: P0139\nDate: 2024-10-26\n\nPATIENT INFORMATION\n------------------\nAge: 20\nGender: Female\nAdmission Date: 2024-10-26\n\nVITAL SIGNS\n----------\nTemperature: 38.2\u00b0C\nHeart Rate: 118 bpm\nRespiratory Rate: 25 /min\nBlood Pressure: 128/67 mmHg\nO2 Saturation: 89%\n\nPRESENTING SYMPTOMS\n-----------------\n- chest pain\n- cough\n- wheezing\n- sweating\n- fatigue\n- decreased appetite\n\nMEDICAL HISTORY\n-------------\nComorbidities: Asthma, Obesity\n\nMEDICATIONS\n----------\n- Ceftriaxone 1g daily\n- Acetaminophen 650mg every 6 hours as needed\n- Guaifenesin 400mg every 4 hours as needed\n\nASSESSMENT\n---------\nPatient presents with clinical and radiological findings consistent with pneumonia.\n\nPLAN\n----\n1. Continue current antibiotic regimen\n2. Monitor vital signs and oxygen saturation\n3. Encourage deep breathing exercises\n4. Follow-up chest X-ray in 2 weeks\n5. Return if symptoms worsen\n",
    "image_path": "demo_dataset\\PNEUMONIA\\person1657_virus_2864.jpeg"
  },
  {
    "patient_id": "P0140",
    "basic_info": {
      "age": 35,
      "gender": "Female",
      "admission_date": "2024-10-18"
    },
    "vitals": {
      "temperature": 38.4,
      "heart_rate": 109,
      "respiratory_rate": 24,
      "blood_pressure": "133/69",
      "oxygen_saturation": 93
    },
    "symptoms": [
      "dyspnea",
      "chest pain",
      "shallow breathing",
      "wheezing",
      "cough",
      "decreased appetite",
      "muscle aches",
      "malaise"
    ],
    "medications": [
      {
        "name": "Ceftriaxone",
        "dosage": "1g",
        "frequency": "daily"
      },
      {
        "name": "Acetaminophen",
        "dosage": "650mg",
        "frequency": "every 6 hours as needed"
      },
      {
        "name": "Ibuprofen",
        "dosage": "400mg",
        "frequency": "every 6 hours as needed"
      }
    ],
    "comorbidities": [
      "Coronary Artery Disease",
      "Chronic Kidney Disease"
    ],
    "diagnosis": "Pneumonia",
    "note_text": "\nCLINICAL NOTE\n============\nPatient ID: P0140\nDate: 2024-10-18\n\nPATIENT INFORMATION\n------------------\nAge: 35\nGender: Female\nAdmission Date: 2024-10-18\n\nVITAL SIGNS\n----------\nTemperature: 38.4\u00b0C\nHeart Rate: 109 bpm\nRespiratory Rate: 24 /min\nBlood Pressure: 133/69 mmHg\nO2 Saturation: 93%\n\nPRESENTING SYMPTOMS\n-----------------\n- dyspnea\n- chest pain\n- shallow breathing\n- wheezing\n- cough\n- decreased appetite\n- muscle aches\n- malaise\n\nMEDICAL HISTORY\n-------------\nComorbidities: Coronary Artery Disease, Chronic Kidney Disease\n\nMEDICATIONS\n----------\n- Ceftriaxone 1g daily\n- Acetaminophen 650mg every 6 hours as needed\n- Ibuprofen 400mg every 6 hours as needed\n\nASSESSMENT\n---------\nPatient presents with clinical and radiological findings consistent with pneumonia.\n\nPLAN\n----\n1. Continue current antibiotic regimen\n2. Monitor vital signs and oxygen saturation\n3. Encourage deep breathing exercises\n4. Follow-up chest X-ray in 2 weeks\n5. Return if symptoms worsen\n",
    "image_path": "demo_dataset\\PNEUMONIA\\person1663_virus_2876.jpeg"
  },
  {
    "patient_id": "P0141",
    "basic_info": {
      "age": 50,
      "gender": "Female",
      "admission_date": "2024-10-21"
    },
    "vitals": {
      "temperature": 38.8,
      "heart_rate": 89,
      "respiratory_rate": 21,
      "blood_pressure": "116/69",
      "oxygen_saturation": 92
    },
    "symptoms": [
      "dyspnea",
      "tachypnea",
      "cough",
      "sputum production",
      "malaise",
      "fever",
      "decreased appetite"
    ],
    "medications": [
      {
        "name": "Ceftriaxone",
        "dosage": "1g",
        "frequency": "daily"
      },
      {
        "name": "Azithromycin",
        "dosage": "500mg",
        "frequency": "once daily"
      },
      {
        "name": "Acetaminophen",
        "dosage": "650mg",
        "frequency": "every 6 hours as needed"
      }
    ],
    "comorbidities": [
      "Diabetes Type 2",
      "Hypertension",
      "COPD"
    ],
    "diagnosis": "Pneumonia",
    "note_text": "\nCLINICAL NOTE\n============\nPatient ID: P0141\nDate: 2024-10-21\n\nPATIENT INFORMATION\n------------------\nAge: 50\nGender: Female\nAdmission Date: 2024-10-21\n\nVITAL SIGNS\n----------\nTemperature: 38.8\u00b0C\nHeart Rate: 89 bpm\nRespiratory Rate: 21 /min\nBlood Pressure: 116/69 mmHg\nO2 Saturation: 92%\n\nPRESENTING SYMPTOMS\n-----------------\n- dyspnea\n- tachypnea\n- cough\n- sputum production\n- malaise\n- fever\n- decreased appetite\n\nMEDICAL HISTORY\n-------------\nComorbidities: Diabetes Type 2, Hypertension, COPD\n\nMEDICATIONS\n----------\n- Ceftriaxone 1g daily\n- Azithromycin 500mg once daily\n- Acetaminophen 650mg every 6 hours as needed\n\nASSESSMENT\n---------\nPatient presents with clinical and radiological findings consistent with pneumonia.\n\nPLAN\n----\n1. Continue current antibiotic regimen\n2. Monitor vital signs and oxygen saturation\n3. Encourage deep breathing exercises\n4. Follow-up chest X-ray in 2 weeks\n5. Return if symptoms worsen\n",
    "image_path": "demo_dataset\\PNEUMONIA\\person1664_virus_2877.jpeg"
  },
  {
    "patient_id": "P0142",
    "basic_info": {
      "age": 32,
      "gender": "Female",
      "admission_date": "2024-10-16"
    },
    "vitals": {
      "temperature": 38.8,
      "heart_rate": 96,
      "respiratory_rate": 23,
      "blood_pressure": "118/86",
      "oxygen_saturation": 94
    },
    "symptoms": [
      "cough",
      "sputum production",
      "dyspnea",
      "chest pain",
      "malaise",
      "fatigue",
      "decreased appetite",
      "muscle aches"
    ],
    "medications": [
      {
        "name": "Ceftriaxone",
        "dosage": "1g",
        "frequency": "daily"
      },
      {
        "name": "Levofloxacin",
        "dosage": "750mg",
        "frequency": "once daily"
      },
      {
        "name": "Guaifenesin",
        "dosage": "400mg",
        "frequency": "every 4 hours as needed"
      },
      {
        "name": "Ibuprofen",
        "dosage": "400mg",
        "frequency": "every 6 hours as needed"
      }
    ],
    "comorbidities": [
      "Diabetes Type 2"
    ],
    "diagnosis": "Pneumonia",
    "note_text": "\nCLINICAL NOTE\n============\nPatient ID: P0142\nDate: 2024-10-16\n\nPATIENT INFORMATION\n------------------\nAge: 32\nGender: Female\nAdmission Date: 2024-10-16\n\nVITAL SIGNS\n----------\nTemperature: 38.8\u00b0C\nHeart Rate: 96 bpm\nRespiratory Rate: 23 /min\nBlood Pressure: 118/86 mmHg\nO2 Saturation: 94%\n\nPRESENTING SYMPTOMS\n-----------------\n- cough\n- sputum production\n- dyspnea\n- chest pain\n- malaise\n- fatigue\n- decreased appetite\n- muscle aches\n\nMEDICAL HISTORY\n-------------\nComorbidities: Diabetes Type 2\n\nMEDICATIONS\n----------\n- Ceftriaxone 1g daily\n- Levofloxacin 750mg once daily\n- Guaifenesin 400mg every 4 hours as needed\n- Ibuprofen 400mg every 6 hours as needed\n\nASSESSMENT\n---------\nPatient presents with clinical and radiological findings consistent with pneumonia.\n\nPLAN\n----\n1. Continue current antibiotic regimen\n2. Monitor vital signs and oxygen saturation\n3. Encourage deep breathing exercises\n4. Follow-up chest X-ray in 2 weeks\n5. Return if symptoms worsen\n",
    "image_path": "demo_dataset\\PNEUMONIA\\person1667_virus_2881.jpeg"
  },
  {
    "patient_id": "P0143",
    "basic_info": {
      "age": 41,
      "gender": "Female",
      "admission_date": "2024-10-24"
    },
    "vitals": {
      "temperature": 39.0,
      "heart_rate": 99,
      "respiratory_rate": 28,
      "blood_pressure": "132/66",
      "oxygen_saturation": 90
    },
    "symptoms": [
      "cough",
      "chest pain",
      "shallow breathing",
      "dyspnea",
      "wheezing",
      "malaise",
      "fever"
    ],
    "medications": [
      {
        "name": "Ceftriaxone",
        "dosage": "1g",
        "frequency": "daily"
      },
      {
        "name": "Doxycycline",
        "dosage": "100mg",
        "frequency": "twice daily"
      },
      {
        "name": "Ibuprofen",
        "dosage": "400mg",
        "frequency": "every 6 hours as needed"
      }
    ],
    "comorbidities": [
      "Coronary Artery Disease",
      "Asthma"
    ],
    "diagnosis": "Pneumonia",
    "note_text": "\nCLINICAL NOTE\n============\nPatient ID: P0143\nDate: 2024-10-24\n\nPATIENT INFORMATION\n------------------\nAge: 41\nGender: Female\nAdmission Date: 2024-10-24\n\nVITAL SIGNS\n----------\nTemperature: 39.0\u00b0C\nHeart Rate: 99 bpm\nRespiratory Rate: 28 /min\nBlood Pressure: 132/66 mmHg\nO2 Saturation: 90%\n\nPRESENTING SYMPTOMS\n-----------------\n- cough\n- chest pain\n- shallow breathing\n- dyspnea\n- wheezing\n- malaise\n- fever\n\nMEDICAL HISTORY\n-------------\nComorbidities: Coronary Artery Disease, Asthma\n\nMEDICATIONS\n----------\n- Ceftriaxone 1g daily\n- Doxycycline 100mg twice daily\n- Ibuprofen 400mg every 6 hours as needed\n\nASSESSMENT\n---------\nPatient presents with clinical and radiological findings consistent with pneumonia.\n\nPLAN\n----\n1. Continue current antibiotic regimen\n2. Monitor vital signs and oxygen saturation\n3. Encourage deep breathing exercises\n4. Follow-up chest X-ray in 2 weeks\n5. Return if symptoms worsen\n",
    "image_path": "demo_dataset\\PNEUMONIA\\person1668_virus_2882.jpeg"
  },
  {
    "patient_id": "P0144",
    "basic_info": {
      "age": 65,
      "gender": "Male",
      "admission_date": "2024-10-13"
    },
    "vitals": {
      "temperature": 39.3,
      "heart_rate": 103,
      "respiratory_rate": 25,
      "blood_pressure": "129/73",
      "oxygen_saturation": 93
    },
    "symptoms": [
      "cough",
      "dyspnea",
      "tachypnea",
      "chills",
      "sweating"
    ],
    "medications": [
      {
        "name": "Levofloxacin",
        "dosage": "750mg",
        "frequency": "once daily"
      },
      {
        "name": "Azithromycin",
        "dosage": "500mg",
        "frequency": "once daily"
      },
      {
        "name": "Guaifenesin",
        "dosage": "400mg",
        "frequency": "every 4 hours as needed"
      }
    ],
    "comorbidities": [],
    "diagnosis": "Pneumonia",
    "note_text": "\nCLINICAL NOTE\n============\nPatient ID: P0144\nDate: 2024-10-13\n\nPATIENT INFORMATION\n------------------\nAge: 65\nGender: Male\nAdmission Date: 2024-10-13\n\nVITAL SIGNS\n----------\nTemperature: 39.3\u00b0C\nHeart Rate: 103 bpm\nRespiratory Rate: 25 /min\nBlood Pressure: 129/73 mmHg\nO2 Saturation: 93%\n\nPRESENTING SYMPTOMS\n-----------------\n- cough\n- dyspnea\n- tachypnea\n- chills\n- sweating\n\nMEDICAL HISTORY\n-------------\nComorbidities: None\n\nMEDICATIONS\n----------\n- Levofloxacin 750mg once daily\n- Azithromycin 500mg once daily\n- Guaifenesin 400mg every 4 hours as needed\n\nASSESSMENT\n---------\nPatient presents with clinical and radiological findings consistent with pneumonia.\n\nPLAN\n----\n1. Continue current antibiotic regimen\n2. Monitor vital signs and oxygen saturation\n3. Encourage deep breathing exercises\n4. Follow-up chest X-ray in 2 weeks\n5. Return if symptoms worsen\n",
    "image_path": "demo_dataset\\PNEUMONIA\\person1670_virus_2886.jpeg"
  },
  {
    "patient_id": "P0145",
    "basic_info": {
      "age": 38,
      "gender": "Male",
      "admission_date": "2024-10-20"
    },
    "vitals": {
      "temperature": 37.8,
      "heart_rate": 113,
      "respiratory_rate": 26,
      "blood_pressure": "122/76",
      "oxygen_saturation": 91
    },
    "symptoms": [
      "sputum production",
      "wheezing",
      "shallow breathing",
      "sweating",
      "malaise",
      "muscle aches"
    ],
    "medications": [
      {
        "name": "Doxycycline",
        "dosage": "100mg",
        "frequency": "twice daily"
      },
      {
        "name": "Azithromycin",
        "dosage": "500mg",
        "frequency": "once daily"
      },
      {
        "name": "Acetaminophen",
        "dosage": "650mg",
        "frequency": "every 6 hours as needed"
      },
      {
        "name": "Guaifenesin",
        "dosage": "400mg",
        "frequency": "every 4 hours as needed"
      }
    ],
    "comorbidities": [
      "Coronary Artery Disease",
      "Asthma",
      "COPD"
    ],
    "diagnosis": "Pneumonia",
    "note_text": "\nCLINICAL NOTE\n============\nPatient ID: P0145\nDate: 2024-10-20\n\nPATIENT INFORMATION\n------------------\nAge: 38\nGender: Male\nAdmission Date: 2024-10-20\n\nVITAL SIGNS\n----------\nTemperature: 37.8\u00b0C\nHeart Rate: 113 bpm\nRespiratory Rate: 26 /min\nBlood Pressure: 122/76 mmHg\nO2 Saturation: 91%\n\nPRESENTING SYMPTOMS\n-----------------\n- sputum production\n- wheezing\n- shallow breathing\n- sweating\n- malaise\n- muscle aches\n\nMEDICAL HISTORY\n-------------\nComorbidities: Coronary Artery Disease, Asthma, COPD\n\nMEDICATIONS\n----------\n- Doxycycline 100mg twice daily\n- Azithromycin 500mg once daily\n- Acetaminophen 650mg every 6 hours as needed\n- Guaifenesin 400mg every 4 hours as needed\n\nASSESSMENT\n---------\nPatient presents with clinical and radiological findings consistent with pneumonia.\n\nPLAN\n----\n1. Continue current antibiotic regimen\n2. Monitor vital signs and oxygen saturation\n3. Encourage deep breathing exercises\n4. Follow-up chest X-ray in 2 weeks\n5. Return if symptoms worsen\n",
    "image_path": "demo_dataset\\PNEUMONIA\\person1676_virus_2892.jpeg"
  },
  {
    "patient_id": "P0146",
    "basic_info": {
      "age": 34,
      "gender": "Male",
      "admission_date": "2024-10-23"
    },
    "vitals": {
      "temperature": 37.6,
      "heart_rate": 89,
      "respiratory_rate": 22,
      "blood_pressure": "118/65",
      "oxygen_saturation": 89
    },
    "symptoms": [
      "dyspnea",
      "sputum production",
      "tachypnea",
      "shallow breathing",
      "wheezing",
      "fever",
      "sweating",
      "fatigue"
    ],
    "medications": [
      {
        "name": "Amoxicillin",
        "dosage": "500mg",
        "frequency": "three times daily"
      },
      {
        "name": "Acetaminophen",
        "dosage": "650mg",
        "frequency": "every 6 hours as needed"
      },
      {
        "name": "Guaifenesin",
        "dosage": "400mg",
        "frequency": "every 4 hours as needed"
      }
    ],
    "comorbidities": [],
    "diagnosis": "Pneumonia",
    "note_text": "\nCLINICAL NOTE\n============\nPatient ID: P0146\nDate: 2024-10-23\n\nPATIENT INFORMATION\n------------------\nAge: 34\nGender: Male\nAdmission Date: 2024-10-23\n\nVITAL SIGNS\n----------\nTemperature: 37.6\u00b0C\nHeart Rate: 89 bpm\nRespiratory Rate: 22 /min\nBlood Pressure: 118/65 mmHg\nO2 Saturation: 89%\n\nPRESENTING SYMPTOMS\n-----------------\n- dyspnea\n- sputum production\n- tachypnea\n- shallow breathing\n- wheezing\n- fever\n- sweating\n- fatigue\n\nMEDICAL HISTORY\n-------------\nComorbidities: None\n\nMEDICATIONS\n----------\n- Amoxicillin 500mg three times daily\n- Acetaminophen 650mg every 6 hours as needed\n- Guaifenesin 400mg every 4 hours as needed\n\nASSESSMENT\n---------\nPatient presents with clinical and radiological findings consistent with pneumonia.\n\nPLAN\n----\n1. Continue current antibiotic regimen\n2. Monitor vital signs and oxygen saturation\n3. Encourage deep breathing exercises\n4. Follow-up chest X-ray in 2 weeks\n5. Return if symptoms worsen\n",
    "image_path": "demo_dataset\\PNEUMONIA\\person1679_virus_2896.jpeg"
  },
  {
    "patient_id": "P0147",
    "basic_info": {
      "age": 81,
      "gender": "Female",
      "admission_date": "2024-10-20"
    },
    "vitals": {
      "temperature": 39.3,
      "heart_rate": 101,
      "respiratory_rate": 27,
      "blood_pressure": "136/77",
      "oxygen_saturation": 92
    },
    "symptoms": [
      "dyspnea",
      "tachypnea",
      "shallow breathing",
      "sputum production",
      "wheezing",
      "decreased appetite",
      "malaise",
      "chills"
    ],
    "medications": [
      {
        "name": "Azithromycin",
        "dosage": "500mg",
        "frequency": "once daily"
      },
      {
        "name": "Acetaminophen",
        "dosage": "650mg",
        "frequency": "every 6 hours as needed"
      }
    ],
    "comorbidities": [
      "Coronary Artery Disease",
      "Hypertension",
      "Asthma"
    ],
    "diagnosis": "Pneumonia",
    "note_text": "\nCLINICAL NOTE\n============\nPatient ID: P0147\nDate: 2024-10-20\n\nPATIENT INFORMATION\n------------------\nAge: 81\nGender: Female\nAdmission Date: 2024-10-20\n\nVITAL SIGNS\n----------\nTemperature: 39.3\u00b0C\nHeart Rate: 101 bpm\nRespiratory Rate: 27 /min\nBlood Pressure: 136/77 mmHg\nO2 Saturation: 92%\n\nPRESENTING SYMPTOMS\n-----------------\n- dyspnea\n- tachypnea\n- shallow breathing\n- sputum production\n- wheezing\n- decreased appetite\n- malaise\n- chills\n\nMEDICAL HISTORY\n-------------\nComorbidities: Coronary Artery Disease, Hypertension, Asthma\n\nMEDICATIONS\n----------\n- Azithromycin 500mg once daily\n- Acetaminophen 650mg every 6 hours as needed\n\nASSESSMENT\n---------\nPatient presents with clinical and radiological findings consistent with pneumonia.\n\nPLAN\n----\n1. Continue current antibiotic regimen\n2. Monitor vital signs and oxygen saturation\n3. Encourage deep breathing exercises\n4. Follow-up chest X-ray in 2 weeks\n5. Return if symptoms worsen\n",
    "image_path": "demo_dataset\\PNEUMONIA\\person1682_virus_2899.jpeg"
  },
  {
    "patient_id": "P0148",
    "basic_info": {
      "age": 63,
      "gender": "Female",
      "admission_date": "2024-10-23"
    },
    "vitals": {
      "temperature": 38.0,
      "heart_rate": 110,
      "respiratory_rate": 21,
      "blood_pressure": "137/68",
      "oxygen_saturation": 90
    },
    "symptoms": [
      "wheezing",
      "sputum production",
      "tachypnea",
      "chest pain",
      "shallow breathing",
      "muscle aches",
      "decreased appetite",
      "sweating",
      "chills"
    ],
    "medications": [
      {
        "name": "Azithromycin",
        "dosage": "500mg",
        "frequency": "once daily"
      },
      {
        "name": "Acetaminophen",
        "dosage": "650mg",
        "frequency": "every 6 hours as needed"
      }
    ],
    "comorbidities": [
      "Chronic Kidney Disease",
      "Coronary Artery Disease"
    ],
    "diagnosis": "Pneumonia",
    "note_text": "\nCLINICAL NOTE\n============\nPatient ID: P0148\nDate: 2024-10-23\n\nPATIENT INFORMATION\n------------------\nAge: 63\nGender: Female\nAdmission Date: 2024-10-23\n\nVITAL SIGNS\n----------\nTemperature: 38.0\u00b0C\nHeart Rate: 110 bpm\nRespiratory Rate: 21 /min\nBlood Pressure: 137/68 mmHg\nO2 Saturation: 90%\n\nPRESENTING SYMPTOMS\n-----------------\n- wheezing\n- sputum production\n- tachypnea\n- chest pain\n- shallow breathing\n- muscle aches\n- decreased appetite\n- sweating\n- chills\n\nMEDICAL HISTORY\n-------------\nComorbidities: Chronic Kidney Disease, Coronary Artery Disease\n\nMEDICATIONS\n----------\n- Azithromycin 500mg once daily\n- Acetaminophen 650mg every 6 hours as needed\n\nASSESSMENT\n---------\nPatient presents with clinical and radiological findings consistent with pneumonia.\n\nPLAN\n----\n1. Continue current antibiotic regimen\n2. Monitor vital signs and oxygen saturation\n3. Encourage deep breathing exercises\n4. Follow-up chest X-ray in 2 weeks\n5. Return if symptoms worsen\n",
    "image_path": "demo_dataset\\PNEUMONIA\\person171_bacteria_826.jpeg"
  },
  {
    "patient_id": "P0149",
    "basic_info": {
      "age": 31,
      "gender": "Male",
      "admission_date": "2024-10-17"
    },
    "vitals": {
      "temperature": 38.3,
      "heart_rate": 116,
      "respiratory_rate": 23,
      "blood_pressure": "130/82",
      "oxygen_saturation": 91
    },
    "symptoms": [
      "chest pain",
      "cough",
      "dyspnea",
      "decreased appetite",
      "chills",
      "fatigue",
      "malaise"
    ],
    "medications": [
      {
        "name": "Ceftriaxone",
        "dosage": "1g",
        "frequency": "daily"
      },
      {
        "name": "Ibuprofen",
        "dosage": "400mg",
        "frequency": "every 6 hours as needed"
      }
    ],
    "comorbidities": [],
    "diagnosis": "Pneumonia",
    "note_text": "\nCLINICAL NOTE\n============\nPatient ID: P0149\nDate: 2024-10-17\n\nPATIENT INFORMATION\n------------------\nAge: 31\nGender: Male\nAdmission Date: 2024-10-17\n\nVITAL SIGNS\n----------\nTemperature: 38.3\u00b0C\nHeart Rate: 116 bpm\nRespiratory Rate: 23 /min\nBlood Pressure: 130/82 mmHg\nO2 Saturation: 91%\n\nPRESENTING SYMPTOMS\n-----------------\n- chest pain\n- cough\n- dyspnea\n- decreased appetite\n- chills\n- fatigue\n- malaise\n\nMEDICAL HISTORY\n-------------\nComorbidities: None\n\nMEDICATIONS\n----------\n- Ceftriaxone 1g daily\n- Ibuprofen 400mg every 6 hours as needed\n\nASSESSMENT\n---------\nPatient presents with clinical and radiological findings consistent with pneumonia.\n\nPLAN\n----\n1. Continue current antibiotic regimen\n2. Monitor vital signs and oxygen saturation\n3. Encourage deep breathing exercises\n4. Follow-up chest X-ray in 2 weeks\n5. Return if symptoms worsen\n",
    "image_path": "demo_dataset\\PNEUMONIA\\person175_bacteria_835.jpeg"
  },
  {
    "patient_id": "P0150",
    "basic_info": {
      "age": 84,
      "gender": "Male",
      "admission_date": "2024-10-18"
    },
    "vitals": {
      "temperature": 39.0,
      "heart_rate": 117,
      "respiratory_rate": 25,
      "blood_pressure": "132/84",
      "oxygen_saturation": 91
    },
    "symptoms": [
      "tachypnea",
      "wheezing",
      "dyspnea",
      "cough",
      "muscle aches",
      "malaise"
    ],
    "medications": [
      {
        "name": "Amoxicillin",
        "dosage": "500mg",
        "frequency": "three times daily"
      },
      {
        "name": "Acetaminophen",
        "dosage": "650mg",
        "frequency": "every 6 hours as needed"
      },
      {
        "name": "Guaifenesin",
        "dosage": "400mg",
        "frequency": "every 4 hours as needed"
      }
    ],
    "comorbidities": [
      "Asthma"
    ],
    "diagnosis": "Pneumonia",
    "note_text": "\nCLINICAL NOTE\n============\nPatient ID: P0150\nDate: 2024-10-18\n\nPATIENT INFORMATION\n------------------\nAge: 84\nGender: Male\nAdmission Date: 2024-10-18\n\nVITAL SIGNS\n----------\nTemperature: 39.0\u00b0C\nHeart Rate: 117 bpm\nRespiratory Rate: 25 /min\nBlood Pressure: 132/84 mmHg\nO2 Saturation: 91%\n\nPRESENTING SYMPTOMS\n-----------------\n- tachypnea\n- wheezing\n- dyspnea\n- cough\n- muscle aches\n- malaise\n\nMEDICAL HISTORY\n-------------\nComorbidities: Asthma\n\nMEDICATIONS\n----------\n- Amoxicillin 500mg three times daily\n- Acetaminophen 650mg every 6 hours as needed\n- Guaifenesin 400mg every 4 hours as needed\n\nASSESSMENT\n---------\nPatient presents with clinical and radiological findings consistent with pneumonia.\n\nPLAN\n----\n1. Continue current antibiotic regimen\n2. Monitor vital signs and oxygen saturation\n3. Encourage deep breathing exercises\n4. Follow-up chest X-ray in 2 weeks\n5. Return if symptoms worsen\n",
    "image_path": "demo_dataset\\PNEUMONIA\\person18_virus_49.jpeg"
  },
  {
    "patient_id": "P0151",
    "basic_info": {
      "age": 30,
      "gender": "Male",
      "admission_date": "2024-10-24"
    },
    "vitals": {
      "temperature": 37.6,
      "heart_rate": 91,
      "respiratory_rate": 25,
      "blood_pressure": "139/61",
      "oxygen_saturation": 94
    },
    "symptoms": [
      "shallow breathing",
      "dyspnea",
      "chest pain",
      "tachypnea",
      "decreased appetite",
      "sweating"
    ],
    "medications": [
      {
        "name": "Ceftriaxone",
        "dosage": "1g",
        "frequency": "daily"
      },
      {
        "name": "Doxycycline",
        "dosage": "100mg",
        "frequency": "twice daily"
      },
      {
        "name": "Guaifenesin",
        "dosage": "400mg",
        "frequency": "every 4 hours as needed"
      }
    ],
    "comorbidities": [],
    "diagnosis": "Pneumonia",
    "note_text": "\nCLINICAL NOTE\n============\nPatient ID: P0151\nDate: 2024-10-24\n\nPATIENT INFORMATION\n------------------\nAge: 30\nGender: Male\nAdmission Date: 2024-10-24\n\nVITAL SIGNS\n----------\nTemperature: 37.6\u00b0C\nHeart Rate: 91 bpm\nRespiratory Rate: 25 /min\nBlood Pressure: 139/61 mmHg\nO2 Saturation: 94%\n\nPRESENTING SYMPTOMS\n-----------------\n- shallow breathing\n- dyspnea\n- chest pain\n- tachypnea\n- decreased appetite\n- sweating\n\nMEDICAL HISTORY\n-------------\nComorbidities: None\n\nMEDICATIONS\n----------\n- Ceftriaxone 1g daily\n- Doxycycline 100mg twice daily\n- Guaifenesin 400mg every 4 hours as needed\n\nASSESSMENT\n---------\nPatient presents with clinical and radiological findings consistent with pneumonia.\n\nPLAN\n----\n1. Continue current antibiotic regimen\n2. Monitor vital signs and oxygen saturation\n3. Encourage deep breathing exercises\n4. Follow-up chest X-ray in 2 weeks\n5. Return if symptoms worsen\n",
    "image_path": "demo_dataset\\PNEUMONIA\\person1_virus_12.jpeg"
  },
  {
    "patient_id": "P0152",
    "basic_info": {
      "age": 82,
      "gender": "Male",
      "admission_date": "2024-10-20"
    },
    "vitals": {
      "temperature": 39.2,
      "heart_rate": 105,
      "respiratory_rate": 24,
      "blood_pressure": "120/87",
      "oxygen_saturation": 90
    },
    "symptoms": [
      "cough",
      "chest pain",
      "dyspnea",
      "tachypnea",
      "decreased appetite",
      "muscle aches",
      "fatigue",
      "chills"
    ],
    "medications": [
      {
        "name": "Amoxicillin",
        "dosage": "500mg",
        "frequency": "three times daily"
      },
      {
        "name": "Ibuprofen",
        "dosage": "400mg",
        "frequency": "every 6 hours as needed"
      },
      {
        "name": "Guaifenesin",
        "dosage": "400mg",
        "frequency": "every 4 hours as needed"
      }
    ],
    "comorbidities": [
      "Hypertension",
      "Chronic Kidney Disease"
    ],
    "diagnosis": "Pneumonia",
    "note_text": "\nCLINICAL NOTE\n============\nPatient ID: P0152\nDate: 2024-10-20\n\nPATIENT INFORMATION\n------------------\nAge: 82\nGender: Male\nAdmission Date: 2024-10-20\n\nVITAL SIGNS\n----------\nTemperature: 39.2\u00b0C\nHeart Rate: 105 bpm\nRespiratory Rate: 24 /min\nBlood Pressure: 120/87 mmHg\nO2 Saturation: 90%\n\nPRESENTING SYMPTOMS\n-----------------\n- cough\n- chest pain\n- dyspnea\n- tachypnea\n- decreased appetite\n- muscle aches\n- fatigue\n- chills\n\nMEDICAL HISTORY\n-------------\nComorbidities: Hypertension, Chronic Kidney Disease\n\nMEDICATIONS\n----------\n- Amoxicillin 500mg three times daily\n- Ibuprofen 400mg every 6 hours as needed\n- Guaifenesin 400mg every 4 hours as needed\n\nASSESSMENT\n---------\nPatient presents with clinical and radiological findings consistent with pneumonia.\n\nPLAN\n----\n1. Continue current antibiotic regimen\n2. Monitor vital signs and oxygen saturation\n3. Encourage deep breathing exercises\n4. Follow-up chest X-ray in 2 weeks\n5. Return if symptoms worsen\n",
    "image_path": "demo_dataset\\PNEUMONIA\\person1_virus_7.jpeg"
  },
  {
    "patient_id": "P0153",
    "basic_info": {
      "age": 33,
      "gender": "Male",
      "admission_date": "2024-10-20"
    },
    "vitals": {
      "temperature": 38.9,
      "heart_rate": 87,
      "respiratory_rate": 21,
      "blood_pressure": "119/77",
      "oxygen_saturation": 90
    },
    "symptoms": [
      "sputum production",
      "chest pain",
      "tachypnea",
      "sweating",
      "malaise"
    ],
    "medications": [
      {
        "name": "Doxycycline",
        "dosage": "100mg",
        "frequency": "twice daily"
      },
      {
        "name": "Amoxicillin",
        "dosage": "500mg",
        "frequency": "three times daily"
      },
      {
        "name": "Guaifenesin",
        "dosage": "400mg",
        "frequency": "every 4 hours as needed"
      },
      {
        "name": "Acetaminophen",
        "dosage": "650mg",
        "frequency": "every 6 hours as needed"
      }
    ],
    "comorbidities": [
      "Asthma",
      "Coronary Artery Disease"
    ],
    "diagnosis": "Pneumonia",
    "note_text": "\nCLINICAL NOTE\n============\nPatient ID: P0153\nDate: 2024-10-20\n\nPATIENT INFORMATION\n------------------\nAge: 33\nGender: Male\nAdmission Date: 2024-10-20\n\nVITAL SIGNS\n----------\nTemperature: 38.9\u00b0C\nHeart Rate: 87 bpm\nRespiratory Rate: 21 /min\nBlood Pressure: 119/77 mmHg\nO2 Saturation: 90%\n\nPRESENTING SYMPTOMS\n-----------------\n- sputum production\n- chest pain\n- tachypnea\n- sweating\n- malaise\n\nMEDICAL HISTORY\n-------------\nComorbidities: Asthma, Coronary Artery Disease\n\nMEDICATIONS\n----------\n- Doxycycline 100mg twice daily\n- Amoxicillin 500mg three times daily\n- Guaifenesin 400mg every 4 hours as needed\n- Acetaminophen 650mg every 6 hours as needed\n\nASSESSMENT\n---------\nPatient presents with clinical and radiological findings consistent with pneumonia.\n\nPLAN\n----\n1. Continue current antibiotic regimen\n2. Monitor vital signs and oxygen saturation\n3. Encourage deep breathing exercises\n4. Follow-up chest X-ray in 2 weeks\n5. Return if symptoms worsen\n",
    "image_path": "demo_dataset\\PNEUMONIA\\person21_virus_52.jpeg"
  },
  {
    "patient_id": "P0154",
    "basic_info": {
      "age": 30,
      "gender": "Female",
      "admission_date": "2024-10-15"
    },
    "vitals": {
      "temperature": 39.4,
      "heart_rate": 94,
      "respiratory_rate": 28,
      "blood_pressure": "114/88",
      "oxygen_saturation": 94
    },
    "symptoms": [
      "wheezing",
      "sputum production",
      "cough",
      "shallow breathing",
      "dyspnea",
      "malaise",
      "decreased appetite"
    ],
    "medications": [
      {
        "name": "Ceftriaxone",
        "dosage": "1g",
        "frequency": "daily"
      },
      {
        "name": "Guaifenesin",
        "dosage": "400mg",
        "frequency": "every 4 hours as needed"
      }
    ],
    "comorbidities": [
      "Coronary Artery Disease",
      "Chronic Kidney Disease"
    ],
    "diagnosis": "Pneumonia",
    "note_text": "\nCLINICAL NOTE\n============\nPatient ID: P0154\nDate: 2024-10-15\n\nPATIENT INFORMATION\n------------------\nAge: 30\nGender: Female\nAdmission Date: 2024-10-15\n\nVITAL SIGNS\n----------\nTemperature: 39.4\u00b0C\nHeart Rate: 94 bpm\nRespiratory Rate: 28 /min\nBlood Pressure: 114/88 mmHg\nO2 Saturation: 94%\n\nPRESENTING SYMPTOMS\n-----------------\n- wheezing\n- sputum production\n- cough\n- shallow breathing\n- dyspnea\n- malaise\n- decreased appetite\n\nMEDICAL HISTORY\n-------------\nComorbidities: Coronary Artery Disease, Chronic Kidney Disease\n\nMEDICATIONS\n----------\n- Ceftriaxone 1g daily\n- Guaifenesin 400mg every 4 hours as needed\n\nASSESSMENT\n---------\nPatient presents with clinical and radiological findings consistent with pneumonia.\n\nPLAN\n----\n1. Continue current antibiotic regimen\n2. Monitor vital signs and oxygen saturation\n3. Encourage deep breathing exercises\n4. Follow-up chest X-ray in 2 weeks\n5. Return if symptoms worsen\n",
    "image_path": "demo_dataset\\PNEUMONIA\\person24_virus_58.jpeg"
  },
  {
    "patient_id": "P0155",
    "basic_info": {
      "age": 23,
      "gender": "Male",
      "admission_date": "2024-10-14"
    },
    "vitals": {
      "temperature": 37.9,
      "heart_rate": 110,
      "respiratory_rate": 26,
      "blood_pressure": "134/60",
      "oxygen_saturation": 88
    },
    "symptoms": [
      "sputum production",
      "tachypnea",
      "shallow breathing",
      "chest pain",
      "malaise",
      "fatigue"
    ],
    "medications": [
      {
        "name": "Doxycycline",
        "dosage": "100mg",
        "frequency": "twice daily"
      },
      {
        "name": "Ceftriaxone",
        "dosage": "1g",
        "frequency": "daily"
      },
      {
        "name": "Ibuprofen",
        "dosage": "400mg",
        "frequency": "every 6 hours as needed"
      }
    ],
    "comorbidities": [
      "Hypertension",
      "Asthma",
      "COPD"
    ],
    "diagnosis": "Pneumonia",
    "note_text": "\nCLINICAL NOTE\n============\nPatient ID: P0155\nDate: 2024-10-14\n\nPATIENT INFORMATION\n------------------\nAge: 23\nGender: Male\nAdmission Date: 2024-10-14\n\nVITAL SIGNS\n----------\nTemperature: 37.9\u00b0C\nHeart Rate: 110 bpm\nRespiratory Rate: 26 /min\nBlood Pressure: 134/60 mmHg\nO2 Saturation: 88%\n\nPRESENTING SYMPTOMS\n-----------------\n- sputum production\n- tachypnea\n- shallow breathing\n- chest pain\n- malaise\n- fatigue\n\nMEDICAL HISTORY\n-------------\nComorbidities: Hypertension, Asthma, COPD\n\nMEDICATIONS\n----------\n- Doxycycline 100mg twice daily\n- Ceftriaxone 1g daily\n- Ibuprofen 400mg every 6 hours as needed\n\nASSESSMENT\n---------\nPatient presents with clinical and radiological findings consistent with pneumonia.\n\nPLAN\n----\n1. Continue current antibiotic regimen\n2. Monitor vital signs and oxygen saturation\n3. Encourage deep breathing exercises\n4. Follow-up chest X-ray in 2 weeks\n5. Return if symptoms worsen\n",
    "image_path": "demo_dataset\\PNEUMONIA\\person28_virus_62.jpeg"
  },
  {
    "patient_id": "P0156",
    "basic_info": {
      "age": 34,
      "gender": "Male",
      "admission_date": "2024-10-23"
    },
    "vitals": {
      "temperature": 38.0,
      "heart_rate": 87,
      "respiratory_rate": 23,
      "blood_pressure": "140/84",
      "oxygen_saturation": 93
    },
    "symptoms": [
      "tachypnea",
      "dyspnea",
      "chest pain",
      "cough",
      "sputum production",
      "sweating",
      "chills"
    ],
    "medications": [
      {
        "name": "Amoxicillin",
        "dosage": "500mg",
        "frequency": "three times daily"
      },
      {
        "name": "Levofloxacin",
        "dosage": "750mg",
        "frequency": "once daily"
      },
      {
        "name": "Ibuprofen",
        "dosage": "400mg",
        "frequency": "every 6 hours as needed"
      },
      {
        "name": "Acetaminophen",
        "dosage": "650mg",
        "frequency": "every 6 hours as needed"
      }
    ],
    "comorbidities": [],
    "diagnosis": "Pneumonia",
    "note_text": "\nCLINICAL NOTE\n============\nPatient ID: P0156\nDate: 2024-10-23\n\nPATIENT INFORMATION\n------------------\nAge: 34\nGender: Male\nAdmission Date: 2024-10-23\n\nVITAL SIGNS\n----------\nTemperature: 38.0\u00b0C\nHeart Rate: 87 bpm\nRespiratory Rate: 23 /min\nBlood Pressure: 140/84 mmHg\nO2 Saturation: 93%\n\nPRESENTING SYMPTOMS\n-----------------\n- tachypnea\n- dyspnea\n- chest pain\n- cough\n- sputum production\n- sweating\n- chills\n\nMEDICAL HISTORY\n-------------\nComorbidities: None\n\nMEDICATIONS\n----------\n- Amoxicillin 500mg three times daily\n- Levofloxacin 750mg once daily\n- Ibuprofen 400mg every 6 hours as needed\n- Acetaminophen 650mg every 6 hours as needed\n\nASSESSMENT\n---------\nPatient presents with clinical and radiological findings consistent with pneumonia.\n\nPLAN\n----\n1. Continue current antibiotic regimen\n2. Monitor vital signs and oxygen saturation\n3. Encourage deep breathing exercises\n4. Follow-up chest X-ray in 2 weeks\n5. Return if symptoms worsen\n",
    "image_path": "demo_dataset\\PNEUMONIA\\person28_virus_63.jpeg"
  },
  {
    "patient_id": "P0157",
    "basic_info": {
      "age": 51,
      "gender": "Male",
      "admission_date": "2024-10-16"
    },
    "vitals": {
      "temperature": 37.8,
      "heart_rate": 82,
      "respiratory_rate": 24,
      "blood_pressure": "140/75",
      "oxygen_saturation": 93
    },
    "symptoms": [
      "wheezing",
      "chest pain",
      "shallow breathing",
      "decreased appetite",
      "sweating",
      "fever"
    ],
    "medications": [
      {
        "name": "Doxycycline",
        "dosage": "100mg",
        "frequency": "twice daily"
      },
      {
        "name": "Azithromycin",
        "dosage": "500mg",
        "frequency": "once daily"
      },
      {
        "name": "Ibuprofen",
        "dosage": "400mg",
        "frequency": "every 6 hours as needed"
      },
      {
        "name": "Acetaminophen",
        "dosage": "650mg",
        "frequency": "every 6 hours as needed"
      }
    ],
    "comorbidities": [
      "Coronary Artery Disease",
      "Asthma",
      "Diabetes Type 2"
    ],
    "diagnosis": "Pneumonia",
    "note_text": "\nCLINICAL NOTE\n============\nPatient ID: P0157\nDate: 2024-10-16\n\nPATIENT INFORMATION\n------------------\nAge: 51\nGender: Male\nAdmission Date: 2024-10-16\n\nVITAL SIGNS\n----------\nTemperature: 37.8\u00b0C\nHeart Rate: 82 bpm\nRespiratory Rate: 24 /min\nBlood Pressure: 140/75 mmHg\nO2 Saturation: 93%\n\nPRESENTING SYMPTOMS\n-----------------\n- wheezing\n- chest pain\n- shallow breathing\n- decreased appetite\n- sweating\n- fever\n\nMEDICAL HISTORY\n-------------\nComorbidities: Coronary Artery Disease, Asthma, Diabetes Type 2\n\nMEDICATIONS\n----------\n- Doxycycline 100mg twice daily\n- Azithromycin 500mg once daily\n- Ibuprofen 400mg every 6 hours as needed\n- Acetaminophen 650mg every 6 hours as needed\n\nASSESSMENT\n---------\nPatient presents with clinical and radiological findings consistent with pneumonia.\n\nPLAN\n----\n1. Continue current antibiotic regimen\n2. Monitor vital signs and oxygen saturation\n3. Encourage deep breathing exercises\n4. Follow-up chest X-ray in 2 weeks\n5. Return if symptoms worsen\n",
    "image_path": "demo_dataset\\PNEUMONIA\\person30_virus_69.jpeg"
  },
  {
    "patient_id": "P0158",
    "basic_info": {
      "age": 70,
      "gender": "Male",
      "admission_date": "2024-10-18"
    },
    "vitals": {
      "temperature": 37.8,
      "heart_rate": 105,
      "respiratory_rate": 22,
      "blood_pressure": "113/73",
      "oxygen_saturation": 88
    },
    "symptoms": [
      "sputum production",
      "wheezing",
      "chest pain",
      "shallow breathing",
      "tachypnea",
      "muscle aches",
      "malaise",
      "fatigue",
      "decreased appetite"
    ],
    "medications": [
      {
        "name": "Ceftriaxone",
        "dosage": "1g",
        "frequency": "daily"
      },
      {
        "name": "Amoxicillin",
        "dosage": "500mg",
        "frequency": "three times daily"
      },
      {
        "name": "Acetaminophen",
        "dosage": "650mg",
        "frequency": "every 6 hours as needed"
      }
    ],
    "comorbidities": [
      "COPD"
    ],
    "diagnosis": "Pneumonia",
    "note_text": "\nCLINICAL NOTE\n============\nPatient ID: P0158\nDate: 2024-10-18\n\nPATIENT INFORMATION\n------------------\nAge: 70\nGender: Male\nAdmission Date: 2024-10-18\n\nVITAL SIGNS\n----------\nTemperature: 37.8\u00b0C\nHeart Rate: 105 bpm\nRespiratory Rate: 22 /min\nBlood Pressure: 113/73 mmHg\nO2 Saturation: 88%\n\nPRESENTING SYMPTOMS\n-----------------\n- sputum production\n- wheezing\n- chest pain\n- shallow breathing\n- tachypnea\n- muscle aches\n- malaise\n- fatigue\n- decreased appetite\n\nMEDICAL HISTORY\n-------------\nComorbidities: COPD\n\nMEDICATIONS\n----------\n- Ceftriaxone 1g daily\n- Amoxicillin 500mg three times daily\n- Acetaminophen 650mg every 6 hours as needed\n\nASSESSMENT\n---------\nPatient presents with clinical and radiological findings consistent with pneumonia.\n\nPLAN\n----\n1. Continue current antibiotic regimen\n2. Monitor vital signs and oxygen saturation\n3. Encourage deep breathing exercises\n4. Follow-up chest X-ray in 2 weeks\n5. Return if symptoms worsen\n",
    "image_path": "demo_dataset\\PNEUMONIA\\person31_virus_70.jpeg"
  },
  {
    "patient_id": "P0159",
    "basic_info": {
      "age": 21,
      "gender": "Male",
      "admission_date": "2024-10-25"
    },
    "vitals": {
      "temperature": 38.7,
      "heart_rate": 118,
      "respiratory_rate": 25,
      "blood_pressure": "134/84",
      "oxygen_saturation": 92
    },
    "symptoms": [
      "chest pain",
      "sputum production",
      "tachypnea",
      "wheezing",
      "dyspnea",
      "muscle aches",
      "fever",
      "chills"
    ],
    "medications": [
      {
        "name": "Azithromycin",
        "dosage": "500mg",
        "frequency": "once daily"
      },
      {
        "name": "Levofloxacin",
        "dosage": "750mg",
        "frequency": "once daily"
      },
      {
        "name": "Guaifenesin",
        "dosage": "400mg",
        "frequency": "every 4 hours as needed"
      }
    ],
    "comorbidities": [],
    "diagnosis": "Pneumonia",
    "note_text": "\nCLINICAL NOTE\n============\nPatient ID: P0159\nDate: 2024-10-25\n\nPATIENT INFORMATION\n------------------\nAge: 21\nGender: Male\nAdmission Date: 2024-10-25\n\nVITAL SIGNS\n----------\nTemperature: 38.7\u00b0C\nHeart Rate: 118 bpm\nRespiratory Rate: 25 /min\nBlood Pressure: 134/84 mmHg\nO2 Saturation: 92%\n\nPRESENTING SYMPTOMS\n-----------------\n- chest pain\n- sputum production\n- tachypnea\n- wheezing\n- dyspnea\n- muscle aches\n- fever\n- chills\n\nMEDICAL HISTORY\n-------------\nComorbidities: None\n\nMEDICATIONS\n----------\n- Azithromycin 500mg once daily\n- Levofloxacin 750mg once daily\n- Guaifenesin 400mg every 4 hours as needed\n\nASSESSMENT\n---------\nPatient presents with clinical and radiological findings consistent with pneumonia.\n\nPLAN\n----\n1. Continue current antibiotic regimen\n2. Monitor vital signs and oxygen saturation\n3. Encourage deep breathing exercises\n4. Follow-up chest X-ray in 2 weeks\n5. Return if symptoms worsen\n",
    "image_path": "demo_dataset\\PNEUMONIA\\person32_virus_71.jpeg"
  },
  {
    "patient_id": "P0160",
    "basic_info": {
      "age": 48,
      "gender": "Male",
      "admission_date": "2024-10-23"
    },
    "vitals": {
      "temperature": 39.3,
      "heart_rate": 82,
      "respiratory_rate": 22,
      "blood_pressure": "118/62",
      "oxygen_saturation": 91
    },
    "symptoms": [
      "shallow breathing",
      "wheezing",
      "dyspnea",
      "malaise",
      "decreased appetite"
    ],
    "medications": [
      {
        "name": "Doxycycline",
        "dosage": "100mg",
        "frequency": "twice daily"
      },
      {
        "name": "Azithromycin",
        "dosage": "500mg",
        "frequency": "once daily"
      },
      {
        "name": "Guaifenesin",
        "dosage": "400mg",
        "frequency": "every 4 hours as needed"
      },
      {
        "name": "Ibuprofen",
        "dosage": "400mg",
        "frequency": "every 6 hours as needed"
      }
    ],
    "comorbidities": [
      "Coronary Artery Disease",
      "COPD"
    ],
    "diagnosis": "Pneumonia",
    "note_text": "\nCLINICAL NOTE\n============\nPatient ID: P0160\nDate: 2024-10-23\n\nPATIENT INFORMATION\n------------------\nAge: 48\nGender: Male\nAdmission Date: 2024-10-23\n\nVITAL SIGNS\n----------\nTemperature: 39.3\u00b0C\nHeart Rate: 82 bpm\nRespiratory Rate: 22 /min\nBlood Pressure: 118/62 mmHg\nO2 Saturation: 91%\n\nPRESENTING SYMPTOMS\n-----------------\n- shallow breathing\n- wheezing\n- dyspnea\n- malaise\n- decreased appetite\n\nMEDICAL HISTORY\n-------------\nComorbidities: Coronary Artery Disease, COPD\n\nMEDICATIONS\n----------\n- Doxycycline 100mg twice daily\n- Azithromycin 500mg once daily\n- Guaifenesin 400mg every 4 hours as needed\n- Ibuprofen 400mg every 6 hours as needed\n\nASSESSMENT\n---------\nPatient presents with clinical and radiological findings consistent with pneumonia.\n\nPLAN\n----\n1. Continue current antibiotic regimen\n2. Monitor vital signs and oxygen saturation\n3. Encourage deep breathing exercises\n4. Follow-up chest X-ray in 2 weeks\n5. Return if symptoms worsen\n",
    "image_path": "demo_dataset\\PNEUMONIA\\person36_virus_81.jpeg"
  },
  {
    "patient_id": "P0161",
    "basic_info": {
      "age": 60,
      "gender": "Male",
      "admission_date": "2024-10-15"
    },
    "vitals": {
      "temperature": 39.1,
      "heart_rate": 108,
      "respiratory_rate": 27,
      "blood_pressure": "126/67",
      "oxygen_saturation": 89
    },
    "symptoms": [
      "sputum production",
      "dyspnea",
      "chest pain",
      "sweating",
      "malaise",
      "decreased appetite",
      "chills"
    ],
    "medications": [
      {
        "name": "Levofloxacin",
        "dosage": "750mg",
        "frequency": "once daily"
      },
      {
        "name": "Ceftriaxone",
        "dosage": "1g",
        "frequency": "daily"
      },
      {
        "name": "Ibuprofen",
        "dosage": "400mg",
        "frequency": "every 6 hours as needed"
      },
      {
        "name": "Acetaminophen",
        "dosage": "650mg",
        "frequency": "every 6 hours as needed"
      }
    ],
    "comorbidities": [
      "Hypertension",
      "COPD",
      "Chronic Kidney Disease"
    ],
    "diagnosis": "Pneumonia",
    "note_text": "\nCLINICAL NOTE\n============\nPatient ID: P0161\nDate: 2024-10-15\n\nPATIENT INFORMATION\n------------------\nAge: 60\nGender: Male\nAdmission Date: 2024-10-15\n\nVITAL SIGNS\n----------\nTemperature: 39.1\u00b0C\nHeart Rate: 108 bpm\nRespiratory Rate: 27 /min\nBlood Pressure: 126/67 mmHg\nO2 Saturation: 89%\n\nPRESENTING SYMPTOMS\n-----------------\n- sputum production\n- dyspnea\n- chest pain\n- sweating\n- malaise\n- decreased appetite\n- chills\n\nMEDICAL HISTORY\n-------------\nComorbidities: Hypertension, COPD, Chronic Kidney Disease\n\nMEDICATIONS\n----------\n- Levofloxacin 750mg once daily\n- Ceftriaxone 1g daily\n- Ibuprofen 400mg every 6 hours as needed\n- Acetaminophen 650mg every 6 hours as needed\n\nASSESSMENT\n---------\nPatient presents with clinical and radiological findings consistent with pneumonia.\n\nPLAN\n----\n1. Continue current antibiotic regimen\n2. Monitor vital signs and oxygen saturation\n3. Encourage deep breathing exercises\n4. Follow-up chest X-ray in 2 weeks\n5. Return if symptoms worsen\n",
    "image_path": "demo_dataset\\PNEUMONIA\\person37_virus_82.jpeg"
  },
  {
    "patient_id": "P0162",
    "basic_info": {
      "age": 40,
      "gender": "Male",
      "admission_date": "2024-10-26"
    },
    "vitals": {
      "temperature": 38.7,
      "heart_rate": 119,
      "respiratory_rate": 29,
      "blood_pressure": "117/70",
      "oxygen_saturation": 91
    },
    "symptoms": [
      "wheezing",
      "tachypnea",
      "cough",
      "chest pain",
      "decreased appetite",
      "fatigue",
      "fever"
    ],
    "medications": [
      {
        "name": "Doxycycline",
        "dosage": "100mg",
        "frequency": "twice daily"
      },
      {
        "name": "Ibuprofen",
        "dosage": "400mg",
        "frequency": "every 6 hours as needed"
      }
    ],
    "comorbidities": [
      "COPD"
    ],
    "diagnosis": "Pneumonia",
    "note_text": "\nCLINICAL NOTE\n============\nPatient ID: P0162\nDate: 2024-10-26\n\nPATIENT INFORMATION\n------------------\nAge: 40\nGender: Male\nAdmission Date: 2024-10-26\n\nVITAL SIGNS\n----------\nTemperature: 38.7\u00b0C\nHeart Rate: 119 bpm\nRespiratory Rate: 29 /min\nBlood Pressure: 117/70 mmHg\nO2 Saturation: 91%\n\nPRESENTING SYMPTOMS\n-----------------\n- wheezing\n- tachypnea\n- cough\n- chest pain\n- decreased appetite\n- fatigue\n- fever\n\nMEDICAL HISTORY\n-------------\nComorbidities: COPD\n\nMEDICATIONS\n----------\n- Doxycycline 100mg twice daily\n- Ibuprofen 400mg every 6 hours as needed\n\nASSESSMENT\n---------\nPatient presents with clinical and radiological findings consistent with pneumonia.\n\nPLAN\n----\n1. Continue current antibiotic regimen\n2. Monitor vital signs and oxygen saturation\n3. Encourage deep breathing exercises\n4. Follow-up chest X-ray in 2 weeks\n5. Return if symptoms worsen\n",
    "image_path": "demo_dataset\\PNEUMONIA\\person42_virus_89.jpeg"
  },
  {
    "patient_id": "P0163",
    "basic_info": {
      "age": 83,
      "gender": "Male",
      "admission_date": "2024-10-15"
    },
    "vitals": {
      "temperature": 38.0,
      "heart_rate": 92,
      "respiratory_rate": 25,
      "blood_pressure": "133/64",
      "oxygen_saturation": 95
    },
    "symptoms": [
      "dyspnea",
      "wheezing",
      "chest pain",
      "fatigue",
      "chills",
      "decreased appetite",
      "sweating"
    ],
    "medications": [
      {
        "name": "Azithromycin",
        "dosage": "500mg",
        "frequency": "once daily"
      },
      {
        "name": "Acetaminophen",
        "dosage": "650mg",
        "frequency": "every 6 hours as needed"
      }
    ],
    "comorbidities": [],
    "diagnosis": "Pneumonia",
    "note_text": "\nCLINICAL NOTE\n============\nPatient ID: P0163\nDate: 2024-10-15\n\nPATIENT INFORMATION\n------------------\nAge: 83\nGender: Male\nAdmission Date: 2024-10-15\n\nVITAL SIGNS\n----------\nTemperature: 38.0\u00b0C\nHeart Rate: 92 bpm\nRespiratory Rate: 25 /min\nBlood Pressure: 133/64 mmHg\nO2 Saturation: 95%\n\nPRESENTING SYMPTOMS\n-----------------\n- dyspnea\n- wheezing\n- chest pain\n- fatigue\n- chills\n- decreased appetite\n- sweating\n\nMEDICAL HISTORY\n-------------\nComorbidities: None\n\nMEDICATIONS\n----------\n- Azithromycin 500mg once daily\n- Acetaminophen 650mg every 6 hours as needed\n\nASSESSMENT\n---------\nPatient presents with clinical and radiological findings consistent with pneumonia.\n\nPLAN\n----\n1. Continue current antibiotic regimen\n2. Monitor vital signs and oxygen saturation\n3. Encourage deep breathing exercises\n4. Follow-up chest X-ray in 2 weeks\n5. Return if symptoms worsen\n",
    "image_path": "demo_dataset\\PNEUMONIA\\person45_virus_95.jpeg"
  },
  {
    "patient_id": "P0164",
    "basic_info": {
      "age": 71,
      "gender": "Female",
      "admission_date": "2024-10-23"
    },
    "vitals": {
      "temperature": 38.7,
      "heart_rate": 95,
      "respiratory_rate": 20,
      "blood_pressure": "132/88",
      "oxygen_saturation": 94
    },
    "symptoms": [
      "shallow breathing",
      "tachypnea",
      "sputum production",
      "muscle aches",
      "malaise"
    ],
    "medications": [
      {
        "name": "Levofloxacin",
        "dosage": "750mg",
        "frequency": "once daily"
      },
      {
        "name": "Doxycycline",
        "dosage": "100mg",
        "frequency": "twice daily"
      },
      {
        "name": "Guaifenesin",
        "dosage": "400mg",
        "frequency": "every 4 hours as needed"
      },
      {
        "name": "Ibuprofen",
        "dosage": "400mg",
        "frequency": "every 6 hours as needed"
      }
    ],
    "comorbidities": [
      "COPD"
    ],
    "diagnosis": "Pneumonia",
    "note_text": "\nCLINICAL NOTE\n============\nPatient ID: P0164\nDate: 2024-10-23\n\nPATIENT INFORMATION\n------------------\nAge: 71\nGender: Female\nAdmission Date: 2024-10-23\n\nVITAL SIGNS\n----------\nTemperature: 38.7\u00b0C\nHeart Rate: 95 bpm\nRespiratory Rate: 20 /min\nBlood Pressure: 132/88 mmHg\nO2 Saturation: 94%\n\nPRESENTING SYMPTOMS\n-----------------\n- shallow breathing\n- tachypnea\n- sputum production\n- muscle aches\n- malaise\n\nMEDICAL HISTORY\n-------------\nComorbidities: COPD\n\nMEDICATIONS\n----------\n- Levofloxacin 750mg once daily\n- Doxycycline 100mg twice daily\n- Guaifenesin 400mg every 4 hours as needed\n- Ibuprofen 400mg every 6 hours as needed\n\nASSESSMENT\n---------\nPatient presents with clinical and radiological findings consistent with pneumonia.\n\nPLAN\n----\n1. Continue current antibiotic regimen\n2. Monitor vital signs and oxygen saturation\n3. Encourage deep breathing exercises\n4. Follow-up chest X-ray in 2 weeks\n5. Return if symptoms worsen\n",
    "image_path": "demo_dataset\\PNEUMONIA\\person51_virus_105.jpeg"
  },
  {
    "patient_id": "P0165",
    "basic_info": {
      "age": 29,
      "gender": "Male",
      "admission_date": "2024-10-17"
    },
    "vitals": {
      "temperature": 38.9,
      "heart_rate": 85,
      "respiratory_rate": 25,
      "blood_pressure": "130/78",
      "oxygen_saturation": 91
    },
    "symptoms": [
      "dyspnea",
      "wheezing",
      "shallow breathing",
      "sputum production",
      "sweating",
      "decreased appetite",
      "chills"
    ],
    "medications": [
      {
        "name": "Amoxicillin",
        "dosage": "500mg",
        "frequency": "three times daily"
      },
      {
        "name": "Guaifenesin",
        "dosage": "400mg",
        "frequency": "every 4 hours as needed"
      },
      {
        "name": "Acetaminophen",
        "dosage": "650mg",
        "frequency": "every 6 hours as needed"
      }
    ],
    "comorbidities": [
      "Chronic Kidney Disease",
      "Asthma"
    ],
    "diagnosis": "Pneumonia",
    "note_text": "\nCLINICAL NOTE\n============\nPatient ID: P0165\nDate: 2024-10-17\n\nPATIENT INFORMATION\n------------------\nAge: 29\nGender: Male\nAdmission Date: 2024-10-17\n\nVITAL SIGNS\n----------\nTemperature: 38.9\u00b0C\nHeart Rate: 85 bpm\nRespiratory Rate: 25 /min\nBlood Pressure: 130/78 mmHg\nO2 Saturation: 91%\n\nPRESENTING SYMPTOMS\n-----------------\n- dyspnea\n- wheezing\n- shallow breathing\n- sputum production\n- sweating\n- decreased appetite\n- chills\n\nMEDICAL HISTORY\n-------------\nComorbidities: Chronic Kidney Disease, Asthma\n\nMEDICATIONS\n----------\n- Amoxicillin 500mg three times daily\n- Guaifenesin 400mg every 4 hours as needed\n- Acetaminophen 650mg every 6 hours as needed\n\nASSESSMENT\n---------\nPatient presents with clinical and radiological findings consistent with pneumonia.\n\nPLAN\n----\n1. Continue current antibiotic regimen\n2. Monitor vital signs and oxygen saturation\n3. Encourage deep breathing exercises\n4. Follow-up chest X-ray in 2 weeks\n5. Return if symptoms worsen\n",
    "image_path": "demo_dataset\\PNEUMONIA\\person53_virus_108.jpeg"
  },
  {
    "patient_id": "P0166",
    "basic_info": {
      "age": 55,
      "gender": "Female",
      "admission_date": "2024-10-22"
    },
    "vitals": {
      "temperature": 37.5,
      "heart_rate": 102,
      "respiratory_rate": 29,
      "blood_pressure": "130/69",
      "oxygen_saturation": 93
    },
    "symptoms": [
      "dyspnea",
      "cough",
      "shallow breathing",
      "muscle aches",
      "malaise",
      "decreased appetite",
      "fever"
    ],
    "medications": [
      {
        "name": "Levofloxacin",
        "dosage": "750mg",
        "frequency": "once daily"
      },
      {
        "name": "Amoxicillin",
        "dosage": "500mg",
        "frequency": "three times daily"
      },
      {
        "name": "Guaifenesin",
        "dosage": "400mg",
        "frequency": "every 4 hours as needed"
      }
    ],
    "comorbidities": [
      "Hypertension",
      "Asthma",
      "Chronic Kidney Disease"
    ],
    "diagnosis": "Pneumonia",
    "note_text": "\nCLINICAL NOTE\n============\nPatient ID: P0166\nDate: 2024-10-22\n\nPATIENT INFORMATION\n------------------\nAge: 55\nGender: Female\nAdmission Date: 2024-10-22\n\nVITAL SIGNS\n----------\nTemperature: 37.5\u00b0C\nHeart Rate: 102 bpm\nRespiratory Rate: 29 /min\nBlood Pressure: 130/69 mmHg\nO2 Saturation: 93%\n\nPRESENTING SYMPTOMS\n-----------------\n- dyspnea\n- cough\n- shallow breathing\n- muscle aches\n- malaise\n- decreased appetite\n- fever\n\nMEDICAL HISTORY\n-------------\nComorbidities: Hypertension, Asthma, Chronic Kidney Disease\n\nMEDICATIONS\n----------\n- Levofloxacin 750mg once daily\n- Amoxicillin 500mg three times daily\n- Guaifenesin 400mg every 4 hours as needed\n\nASSESSMENT\n---------\nPatient presents with clinical and radiological findings consistent with pneumonia.\n\nPLAN\n----\n1. Continue current antibiotic regimen\n2. Monitor vital signs and oxygen saturation\n3. Encourage deep breathing exercises\n4. Follow-up chest X-ray in 2 weeks\n5. Return if symptoms worsen\n",
    "image_path": "demo_dataset\\PNEUMONIA\\person57_virus_113.jpeg"
  },
  {
    "patient_id": "P0167",
    "basic_info": {
      "age": 66,
      "gender": "Male",
      "admission_date": "2024-10-13"
    },
    "vitals": {
      "temperature": 38.0,
      "heart_rate": 88,
      "respiratory_rate": 27,
      "blood_pressure": "123/60",
      "oxygen_saturation": 93
    },
    "symptoms": [
      "wheezing",
      "sputum production",
      "dyspnea",
      "fever",
      "muscle aches"
    ],
    "medications": [
      {
        "name": "Doxycycline",
        "dosage": "100mg",
        "frequency": "twice daily"
      },
      {
        "name": "Levofloxacin",
        "dosage": "750mg",
        "frequency": "once daily"
      },
      {
        "name": "Acetaminophen",
        "dosage": "650mg",
        "frequency": "every 6 hours as needed"
      },
      {
        "name": "Ibuprofen",
        "dosage": "400mg",
        "frequency": "every 6 hours as needed"
      }
    ],
    "comorbidities": [
      "Hypertension",
      "Asthma",
      "Obesity"
    ],
    "diagnosis": "Pneumonia",
    "note_text": "\nCLINICAL NOTE\n============\nPatient ID: P0167\nDate: 2024-10-13\n\nPATIENT INFORMATION\n------------------\nAge: 66\nGender: Male\nAdmission Date: 2024-10-13\n\nVITAL SIGNS\n----------\nTemperature: 38.0\u00b0C\nHeart Rate: 88 bpm\nRespiratory Rate: 27 /min\nBlood Pressure: 123/60 mmHg\nO2 Saturation: 93%\n\nPRESENTING SYMPTOMS\n-----------------\n- wheezing\n- sputum production\n- dyspnea\n- fever\n- muscle aches\n\nMEDICAL HISTORY\n-------------\nComorbidities: Hypertension, Asthma, Obesity\n\nMEDICATIONS\n----------\n- Doxycycline 100mg twice daily\n- Levofloxacin 750mg once daily\n- Acetaminophen 650mg every 6 hours as needed\n- Ibuprofen 400mg every 6 hours as needed\n\nASSESSMENT\n---------\nPatient presents with clinical and radiological findings consistent with pneumonia.\n\nPLAN\n----\n1. Continue current antibiotic regimen\n2. Monitor vital signs and oxygen saturation\n3. Encourage deep breathing exercises\n4. Follow-up chest X-ray in 2 weeks\n5. Return if symptoms worsen\n",
    "image_path": "demo_dataset\\PNEUMONIA\\person60_virus_117.jpeg"
  },
  {
    "patient_id": "P0168",
    "basic_info": {
      "age": 26,
      "gender": "Female",
      "admission_date": "2024-10-20"
    },
    "vitals": {
      "temperature": 37.5,
      "heart_rate": 113,
      "respiratory_rate": 23,
      "blood_pressure": "136/70",
      "oxygen_saturation": 94
    },
    "symptoms": [
      "sputum production",
      "chest pain",
      "shallow breathing",
      "cough",
      "tachypnea",
      "muscle aches",
      "chills",
      "fatigue",
      "sweating"
    ],
    "medications": [
      {
        "name": "Ceftriaxone",
        "dosage": "1g",
        "frequency": "daily"
      },
      {
        "name": "Ibuprofen",
        "dosage": "400mg",
        "frequency": "every 6 hours as needed"
      },
      {
        "name": "Guaifenesin",
        "dosage": "400mg",
        "frequency": "every 4 hours as needed"
      }
    ],
    "comorbidities": [],
    "diagnosis": "Pneumonia",
    "note_text": "\nCLINICAL NOTE\n============\nPatient ID: P0168\nDate: 2024-10-20\n\nPATIENT INFORMATION\n------------------\nAge: 26\nGender: Female\nAdmission Date: 2024-10-20\n\nVITAL SIGNS\n----------\nTemperature: 37.5\u00b0C\nHeart Rate: 113 bpm\nRespiratory Rate: 23 /min\nBlood Pressure: 136/70 mmHg\nO2 Saturation: 94%\n\nPRESENTING SYMPTOMS\n-----------------\n- sputum production\n- chest pain\n- shallow breathing\n- cough\n- tachypnea\n- muscle aches\n- chills\n- fatigue\n- sweating\n\nMEDICAL HISTORY\n-------------\nComorbidities: None\n\nMEDICATIONS\n----------\n- Ceftriaxone 1g daily\n- Ibuprofen 400mg every 6 hours as needed\n- Guaifenesin 400mg every 4 hours as needed\n\nASSESSMENT\n---------\nPatient presents with clinical and radiological findings consistent with pneumonia.\n\nPLAN\n----\n1. Continue current antibiotic regimen\n2. Monitor vital signs and oxygen saturation\n3. Encourage deep breathing exercises\n4. Follow-up chest X-ray in 2 weeks\n5. Return if symptoms worsen\n",
    "image_path": "demo_dataset\\PNEUMONIA\\person65_virus_123.jpeg"
  },
  {
    "patient_id": "P0169",
    "basic_info": {
      "age": 47,
      "gender": "Male",
      "admission_date": "2024-10-24"
    },
    "vitals": {
      "temperature": 39.2,
      "heart_rate": 116,
      "respiratory_rate": 23,
      "blood_pressure": "113/73",
      "oxygen_saturation": 90
    },
    "symptoms": [
      "tachypnea",
      "cough",
      "chest pain",
      "muscle aches",
      "fatigue"
    ],
    "medications": [
      {
        "name": "Doxycycline",
        "dosage": "100mg",
        "frequency": "twice daily"
      },
      {
        "name": "Azithromycin",
        "dosage": "500mg",
        "frequency": "once daily"
      },
      {
        "name": "Acetaminophen",
        "dosage": "650mg",
        "frequency": "every 6 hours as needed"
      }
    ],
    "comorbidities": [
      "Coronary Artery Disease",
      "Diabetes Type 2",
      "Chronic Kidney Disease"
    ],
    "diagnosis": "Pneumonia",
    "note_text": "\nCLINICAL NOTE\n============\nPatient ID: P0169\nDate: 2024-10-24\n\nPATIENT INFORMATION\n------------------\nAge: 47\nGender: Male\nAdmission Date: 2024-10-24\n\nVITAL SIGNS\n----------\nTemperature: 39.2\u00b0C\nHeart Rate: 116 bpm\nRespiratory Rate: 23 /min\nBlood Pressure: 113/73 mmHg\nO2 Saturation: 90%\n\nPRESENTING SYMPTOMS\n-----------------\n- tachypnea\n- cough\n- chest pain\n- muscle aches\n- fatigue\n\nMEDICAL HISTORY\n-------------\nComorbidities: Coronary Artery Disease, Diabetes Type 2, Chronic Kidney Disease\n\nMEDICATIONS\n----------\n- Doxycycline 100mg twice daily\n- Azithromycin 500mg once daily\n- Acetaminophen 650mg every 6 hours as needed\n\nASSESSMENT\n---------\nPatient presents with clinical and radiological findings consistent with pneumonia.\n\nPLAN\n----\n1. Continue current antibiotic regimen\n2. Monitor vital signs and oxygen saturation\n3. Encourage deep breathing exercises\n4. Follow-up chest X-ray in 2 weeks\n5. Return if symptoms worsen\n",
    "image_path": "demo_dataset\\PNEUMONIA\\person76_virus_138.jpeg"
  },
  {
    "patient_id": "P0170",
    "basic_info": {
      "age": 47,
      "gender": "Male",
      "admission_date": "2024-10-13"
    },
    "vitals": {
      "temperature": 38.6,
      "heart_rate": 109,
      "respiratory_rate": 22,
      "blood_pressure": "121/77",
      "oxygen_saturation": 90
    },
    "symptoms": [
      "dyspnea",
      "tachypnea",
      "wheezing",
      "malaise",
      "fatigue",
      "fever",
      "sweating"
    ],
    "medications": [
      {
        "name": "Azithromycin",
        "dosage": "500mg",
        "frequency": "once daily"
      },
      {
        "name": "Guaifenesin",
        "dosage": "400mg",
        "frequency": "every 4 hours as needed"
      }
    ],
    "comorbidities": [
      "Hypertension"
    ],
    "diagnosis": "Pneumonia",
    "note_text": "\nCLINICAL NOTE\n============\nPatient ID: P0170\nDate: 2024-10-13\n\nPATIENT INFORMATION\n------------------\nAge: 47\nGender: Male\nAdmission Date: 2024-10-13\n\nVITAL SIGNS\n----------\nTemperature: 38.6\u00b0C\nHeart Rate: 109 bpm\nRespiratory Rate: 22 /min\nBlood Pressure: 121/77 mmHg\nO2 Saturation: 90%\n\nPRESENTING SYMPTOMS\n-----------------\n- dyspnea\n- tachypnea\n- wheezing\n- malaise\n- fatigue\n- fever\n- sweating\n\nMEDICAL HISTORY\n-------------\nComorbidities: Hypertension\n\nMEDICATIONS\n----------\n- Azithromycin 500mg once daily\n- Guaifenesin 400mg every 4 hours as needed\n\nASSESSMENT\n---------\nPatient presents with clinical and radiological findings consistent with pneumonia.\n\nPLAN\n----\n1. Continue current antibiotic regimen\n2. Monitor vital signs and oxygen saturation\n3. Encourage deep breathing exercises\n4. Follow-up chest X-ray in 2 weeks\n5. Return if symptoms worsen\n",
    "image_path": "demo_dataset\\PNEUMONIA\\person77_virus_139.jpeg"
  },
  {
    "patient_id": "P0171",
    "basic_info": {
      "age": 79,
      "gender": "Female",
      "admission_date": "2024-10-22"
    },
    "vitals": {
      "temperature": 39.5,
      "heart_rate": 82,
      "respiratory_rate": 21,
      "blood_pressure": "129/67",
      "oxygen_saturation": 89
    },
    "symptoms": [
      "tachypnea",
      "wheezing",
      "sputum production",
      "chest pain",
      "malaise",
      "fever",
      "fatigue"
    ],
    "medications": [
      {
        "name": "Ceftriaxone",
        "dosage": "1g",
        "frequency": "daily"
      },
      {
        "name": "Levofloxacin",
        "dosage": "750mg",
        "frequency": "once daily"
      },
      {
        "name": "Ibuprofen",
        "dosage": "400mg",
        "frequency": "every 6 hours as needed"
      }
    ],
    "comorbidities": [
      "COPD",
      "Coronary Artery Disease",
      "Diabetes Type 2"
    ],
    "diagnosis": "Pneumonia",
    "note_text": "\nCLINICAL NOTE\n============\nPatient ID: P0171\nDate: 2024-10-22\n\nPATIENT INFORMATION\n------------------\nAge: 79\nGender: Female\nAdmission Date: 2024-10-22\n\nVITAL SIGNS\n----------\nTemperature: 39.5\u00b0C\nHeart Rate: 82 bpm\nRespiratory Rate: 21 /min\nBlood Pressure: 129/67 mmHg\nO2 Saturation: 89%\n\nPRESENTING SYMPTOMS\n-----------------\n- tachypnea\n- wheezing\n- sputum production\n- chest pain\n- malaise\n- fever\n- fatigue\n\nMEDICAL HISTORY\n-------------\nComorbidities: COPD, Coronary Artery Disease, Diabetes Type 2\n\nMEDICATIONS\n----------\n- Ceftriaxone 1g daily\n- Levofloxacin 750mg once daily\n- Ibuprofen 400mg every 6 hours as needed\n\nASSESSMENT\n---------\nPatient presents with clinical and radiological findings consistent with pneumonia.\n\nPLAN\n----\n1. Continue current antibiotic regimen\n2. Monitor vital signs and oxygen saturation\n3. Encourage deep breathing exercises\n4. Follow-up chest X-ray in 2 weeks\n5. Return if symptoms worsen\n",
    "image_path": "demo_dataset\\PNEUMONIA\\person78_bacteria_385.jpeg"
  },
  {
    "patient_id": "P0172",
    "basic_info": {
      "age": 78,
      "gender": "Male",
      "admission_date": "2024-10-21"
    },
    "vitals": {
      "temperature": 39.1,
      "heart_rate": 82,
      "respiratory_rate": 26,
      "blood_pressure": "138/62",
      "oxygen_saturation": 93
    },
    "symptoms": [
      "wheezing",
      "dyspnea",
      "shallow breathing",
      "chest pain",
      "tachypnea",
      "fatigue",
      "malaise",
      "chills"
    ],
    "medications": [
      {
        "name": "Levofloxacin",
        "dosage": "750mg",
        "frequency": "once daily"
      },
      {
        "name": "Ceftriaxone",
        "dosage": "1g",
        "frequency": "daily"
      },
      {
        "name": "Ibuprofen",
        "dosage": "400mg",
        "frequency": "every 6 hours as needed"
      },
      {
        "name": "Guaifenesin",
        "dosage": "400mg",
        "frequency": "every 4 hours as needed"
      }
    ],
    "comorbidities": [
      "Obesity",
      "Diabetes Type 2"
    ],
    "diagnosis": "Pneumonia",
    "note_text": "\nCLINICAL NOTE\n============\nPatient ID: P0172\nDate: 2024-10-21\n\nPATIENT INFORMATION\n------------------\nAge: 78\nGender: Male\nAdmission Date: 2024-10-21\n\nVITAL SIGNS\n----------\nTemperature: 39.1\u00b0C\nHeart Rate: 82 bpm\nRespiratory Rate: 26 /min\nBlood Pressure: 138/62 mmHg\nO2 Saturation: 93%\n\nPRESENTING SYMPTOMS\n-----------------\n- wheezing\n- dyspnea\n- shallow breathing\n- chest pain\n- tachypnea\n- fatigue\n- malaise\n- chills\n\nMEDICAL HISTORY\n-------------\nComorbidities: Obesity, Diabetes Type 2\n\nMEDICATIONS\n----------\n- Levofloxacin 750mg once daily\n- Ceftriaxone 1g daily\n- Ibuprofen 400mg every 6 hours as needed\n- Guaifenesin 400mg every 4 hours as needed\n\nASSESSMENT\n---------\nPatient presents with clinical and radiological findings consistent with pneumonia.\n\nPLAN\n----\n1. Continue current antibiotic regimen\n2. Monitor vital signs and oxygen saturation\n3. Encourage deep breathing exercises\n4. Follow-up chest X-ray in 2 weeks\n5. Return if symptoms worsen\n",
    "image_path": "demo_dataset\\PNEUMONIA\\person78_virus_140.jpeg"
  },
  {
    "patient_id": "P0173",
    "basic_info": {
      "age": 28,
      "gender": "Male",
      "admission_date": "2024-10-21"
    },
    "vitals": {
      "temperature": 37.9,
      "heart_rate": 87,
      "respiratory_rate": 28,
      "blood_pressure": "132/69",
      "oxygen_saturation": 90
    },
    "symptoms": [
      "tachypnea",
      "wheezing",
      "cough",
      "shallow breathing",
      "chest pain",
      "sweating",
      "fatigue",
      "fever"
    ],
    "medications": [
      {
        "name": "Amoxicillin",
        "dosage": "500mg",
        "frequency": "three times daily"
      },
      {
        "name": "Levofloxacin",
        "dosage": "750mg",
        "frequency": "once daily"
      },
      {
        "name": "Acetaminophen",
        "dosage": "650mg",
        "frequency": "every 6 hours as needed"
      }
    ],
    "comorbidities": [
      "Obesity",
      "Diabetes Type 2"
    ],
    "diagnosis": "Pneumonia",
    "note_text": "\nCLINICAL NOTE\n============\nPatient ID: P0173\nDate: 2024-10-21\n\nPATIENT INFORMATION\n------------------\nAge: 28\nGender: Male\nAdmission Date: 2024-10-21\n\nVITAL SIGNS\n----------\nTemperature: 37.9\u00b0C\nHeart Rate: 87 bpm\nRespiratory Rate: 28 /min\nBlood Pressure: 132/69 mmHg\nO2 Saturation: 90%\n\nPRESENTING SYMPTOMS\n-----------------\n- tachypnea\n- wheezing\n- cough\n- shallow breathing\n- chest pain\n- sweating\n- fatigue\n- fever\n\nMEDICAL HISTORY\n-------------\nComorbidities: Obesity, Diabetes Type 2\n\nMEDICATIONS\n----------\n- Amoxicillin 500mg three times daily\n- Levofloxacin 750mg once daily\n- Acetaminophen 650mg every 6 hours as needed\n\nASSESSMENT\n---------\nPatient presents with clinical and radiological findings consistent with pneumonia.\n\nPLAN\n----\n1. Continue current antibiotic regimen\n2. Monitor vital signs and oxygen saturation\n3. Encourage deep breathing exercises\n4. Follow-up chest X-ray in 2 weeks\n5. Return if symptoms worsen\n",
    "image_path": "demo_dataset\\PNEUMONIA\\person80_bacteria_389.jpeg"
  },
  {
    "patient_id": "P0174",
    "basic_info": {
      "age": 53,
      "gender": "Female",
      "admission_date": "2024-10-17"
    },
    "vitals": {
      "temperature": 39.1,
      "heart_rate": 111,
      "respiratory_rate": 28,
      "blood_pressure": "117/82",
      "oxygen_saturation": 93
    },
    "symptoms": [
      "dyspnea",
      "shallow breathing",
      "cough",
      "wheezing",
      "chest pain",
      "decreased appetite",
      "muscle aches",
      "fever",
      "malaise"
    ],
    "medications": [
      {
        "name": "Amoxicillin",
        "dosage": "500mg",
        "frequency": "three times daily"
      },
      {
        "name": "Acetaminophen",
        "dosage": "650mg",
        "frequency": "every 6 hours as needed"
      },
      {
        "name": "Ibuprofen",
        "dosage": "400mg",
        "frequency": "every 6 hours as needed"
      }
    ],
    "comorbidities": [
      "Coronary Artery Disease"
    ],
    "diagnosis": "Pneumonia",
    "note_text": "\nCLINICAL NOTE\n============\nPatient ID: P0174\nDate: 2024-10-17\n\nPATIENT INFORMATION\n------------------\nAge: 53\nGender: Female\nAdmission Date: 2024-10-17\n\nVITAL SIGNS\n----------\nTemperature: 39.1\u00b0C\nHeart Rate: 111 bpm\nRespiratory Rate: 28 /min\nBlood Pressure: 117/82 mmHg\nO2 Saturation: 93%\n\nPRESENTING SYMPTOMS\n-----------------\n- dyspnea\n- shallow breathing\n- cough\n- wheezing\n- chest pain\n- decreased appetite\n- muscle aches\n- fever\n- malaise\n\nMEDICAL HISTORY\n-------------\nComorbidities: Coronary Artery Disease\n\nMEDICATIONS\n----------\n- Amoxicillin 500mg three times daily\n- Acetaminophen 650mg every 6 hours as needed\n- Ibuprofen 400mg every 6 hours as needed\n\nASSESSMENT\n---------\nPatient presents with clinical and radiological findings consistent with pneumonia.\n\nPLAN\n----\n1. Continue current antibiotic regimen\n2. Monitor vital signs and oxygen saturation\n3. Encourage deep breathing exercises\n4. Follow-up chest X-ray in 2 weeks\n5. Return if symptoms worsen\n",
    "image_path": "demo_dataset\\PNEUMONIA\\person80_bacteria_392.jpeg"
  },
  {
    "patient_id": "P0175",
    "basic_info": {
      "age": 57,
      "gender": "Female",
      "admission_date": "2024-10-25"
    },
    "vitals": {
      "temperature": 38.9,
      "heart_rate": 114,
      "respiratory_rate": 21,
      "blood_pressure": "132/74",
      "oxygen_saturation": 88
    },
    "symptoms": [
      "wheezing",
      "tachypnea",
      "chest pain",
      "dyspnea",
      "cough",
      "sweating",
      "decreased appetite",
      "fatigue",
      "fever"
    ],
    "medications": [
      {
        "name": "Amoxicillin",
        "dosage": "500mg",
        "frequency": "three times daily"
      },
      {
        "name": "Ibuprofen",
        "dosage": "400mg",
        "frequency": "every 6 hours as needed"
      }
    ],
    "comorbidities": [
      "Coronary Artery Disease",
      "Chronic Kidney Disease",
      "COPD"
    ],
    "diagnosis": "Pneumonia",
    "note_text": "\nCLINICAL NOTE\n============\nPatient ID: P0175\nDate: 2024-10-25\n\nPATIENT INFORMATION\n------------------\nAge: 57\nGender: Female\nAdmission Date: 2024-10-25\n\nVITAL SIGNS\n----------\nTemperature: 38.9\u00b0C\nHeart Rate: 114 bpm\nRespiratory Rate: 21 /min\nBlood Pressure: 132/74 mmHg\nO2 Saturation: 88%\n\nPRESENTING SYMPTOMS\n-----------------\n- wheezing\n- tachypnea\n- chest pain\n- dyspnea\n- cough\n- sweating\n- decreased appetite\n- fatigue\n- fever\n\nMEDICAL HISTORY\n-------------\nComorbidities: Coronary Artery Disease, Chronic Kidney Disease, COPD\n\nMEDICATIONS\n----------\n- Amoxicillin 500mg three times daily\n- Ibuprofen 400mg every 6 hours as needed\n\nASSESSMENT\n---------\nPatient presents with clinical and radiological findings consistent with pneumonia.\n\nPLAN\n----\n1. Continue current antibiotic regimen\n2. Monitor vital signs and oxygen saturation\n3. Encourage deep breathing exercises\n4. Follow-up chest X-ray in 2 weeks\n5. Return if symptoms worsen\n",
    "image_path": "demo_dataset\\PNEUMONIA\\person81_bacteria_396.jpeg"
  },
  {
    "patient_id": "P0176",
    "basic_info": {
      "age": 75,
      "gender": "Male",
      "admission_date": "2024-10-14"
    },
    "vitals": {
      "temperature": 38.2,
      "heart_rate": 98,
      "respiratory_rate": 30,
      "blood_pressure": "117/66",
      "oxygen_saturation": 95
    },
    "symptoms": [
      "chest pain",
      "cough",
      "sputum production",
      "wheezing",
      "sweating",
      "decreased appetite",
      "fever",
      "fatigue"
    ],
    "medications": [
      {
        "name": "Doxycycline",
        "dosage": "100mg",
        "frequency": "twice daily"
      },
      {
        "name": "Azithromycin",
        "dosage": "500mg",
        "frequency": "once daily"
      },
      {
        "name": "Acetaminophen",
        "dosage": "650mg",
        "frequency": "every 6 hours as needed"
      },
      {
        "name": "Ibuprofen",
        "dosage": "400mg",
        "frequency": "every 6 hours as needed"
      }
    ],
    "comorbidities": [
      "Obesity",
      "Chronic Kidney Disease",
      "Diabetes Type 2"
    ],
    "diagnosis": "Pneumonia",
    "note_text": "\nCLINICAL NOTE\n============\nPatient ID: P0176\nDate: 2024-10-14\n\nPATIENT INFORMATION\n------------------\nAge: 75\nGender: Male\nAdmission Date: 2024-10-14\n\nVITAL SIGNS\n----------\nTemperature: 38.2\u00b0C\nHeart Rate: 98 bpm\nRespiratory Rate: 30 /min\nBlood Pressure: 117/66 mmHg\nO2 Saturation: 95%\n\nPRESENTING SYMPTOMS\n-----------------\n- chest pain\n- cough\n- sputum production\n- wheezing\n- sweating\n- decreased appetite\n- fever\n- fatigue\n\nMEDICAL HISTORY\n-------------\nComorbidities: Obesity, Chronic Kidney Disease, Diabetes Type 2\n\nMEDICATIONS\n----------\n- Doxycycline 100mg twice daily\n- Azithromycin 500mg once daily\n- Acetaminophen 650mg every 6 hours as needed\n- Ibuprofen 400mg every 6 hours as needed\n\nASSESSMENT\n---------\nPatient presents with clinical and radiological findings consistent with pneumonia.\n\nPLAN\n----\n1. Continue current antibiotic regimen\n2. Monitor vital signs and oxygen saturation\n3. Encourage deep breathing exercises\n4. Follow-up chest X-ray in 2 weeks\n5. Return if symptoms worsen\n",
    "image_path": "demo_dataset\\PNEUMONIA\\person81_bacteria_398.jpeg"
  },
  {
    "patient_id": "P0177",
    "basic_info": {
      "age": 33,
      "gender": "Male",
      "admission_date": "2024-10-19"
    },
    "vitals": {
      "temperature": 37.9,
      "heart_rate": 93,
      "respiratory_rate": 29,
      "blood_pressure": "117/66",
      "oxygen_saturation": 93
    },
    "symptoms": [
      "wheezing",
      "sputum production",
      "chest pain",
      "sweating",
      "muscle aches"
    ],
    "medications": [
      {
        "name": "Azithromycin",
        "dosage": "500mg",
        "frequency": "once daily"
      },
      {
        "name": "Ceftriaxone",
        "dosage": "1g",
        "frequency": "daily"
      },
      {
        "name": "Acetaminophen",
        "dosage": "650mg",
        "frequency": "every 6 hours as needed"
      }
    ],
    "comorbidities": [
      "Coronary Artery Disease",
      "Chronic Kidney Disease",
      "Hypertension"
    ],
    "diagnosis": "Pneumonia",
    "note_text": "\nCLINICAL NOTE\n============\nPatient ID: P0177\nDate: 2024-10-19\n\nPATIENT INFORMATION\n------------------\nAge: 33\nGender: Male\nAdmission Date: 2024-10-19\n\nVITAL SIGNS\n----------\nTemperature: 37.9\u00b0C\nHeart Rate: 93 bpm\nRespiratory Rate: 29 /min\nBlood Pressure: 117/66 mmHg\nO2 Saturation: 93%\n\nPRESENTING SYMPTOMS\n-----------------\n- wheezing\n- sputum production\n- chest pain\n- sweating\n- muscle aches\n\nMEDICAL HISTORY\n-------------\nComorbidities: Coronary Artery Disease, Chronic Kidney Disease, Hypertension\n\nMEDICATIONS\n----------\n- Azithromycin 500mg once daily\n- Ceftriaxone 1g daily\n- Acetaminophen 650mg every 6 hours as needed\n\nASSESSMENT\n---------\nPatient presents with clinical and radiological findings consistent with pneumonia.\n\nPLAN\n----\n1. Continue current antibiotic regimen\n2. Monitor vital signs and oxygen saturation\n3. Encourage deep breathing exercises\n4. Follow-up chest X-ray in 2 weeks\n5. Return if symptoms worsen\n",
    "image_path": "demo_dataset\\PNEUMONIA\\person82_bacteria_402.jpeg"
  },
  {
    "patient_id": "P0178",
    "basic_info": {
      "age": 65,
      "gender": "Male",
      "admission_date": "2024-10-16"
    },
    "vitals": {
      "temperature": 38.8,
      "heart_rate": 87,
      "respiratory_rate": 29,
      "blood_pressure": "119/71",
      "oxygen_saturation": 88
    },
    "symptoms": [
      "dyspnea",
      "tachypnea",
      "shallow breathing",
      "cough",
      "muscle aches",
      "malaise",
      "sweating",
      "fatigue"
    ],
    "medications": [
      {
        "name": "Ceftriaxone",
        "dosage": "1g",
        "frequency": "daily"
      },
      {
        "name": "Guaifenesin",
        "dosage": "400mg",
        "frequency": "every 4 hours as needed"
      }
    ],
    "comorbidities": [],
    "diagnosis": "Pneumonia",
    "note_text": "\nCLINICAL NOTE\n============\nPatient ID: P0178\nDate: 2024-10-16\n\nPATIENT INFORMATION\n------------------\nAge: 65\nGender: Male\nAdmission Date: 2024-10-16\n\nVITAL SIGNS\n----------\nTemperature: 38.8\u00b0C\nHeart Rate: 87 bpm\nRespiratory Rate: 29 /min\nBlood Pressure: 119/71 mmHg\nO2 Saturation: 88%\n\nPRESENTING SYMPTOMS\n-----------------\n- dyspnea\n- tachypnea\n- shallow breathing\n- cough\n- muscle aches\n- malaise\n- sweating\n- fatigue\n\nMEDICAL HISTORY\n-------------\nComorbidities: None\n\nMEDICATIONS\n----------\n- Ceftriaxone 1g daily\n- Guaifenesin 400mg every 4 hours as needed\n\nASSESSMENT\n---------\nPatient presents with clinical and radiological findings consistent with pneumonia.\n\nPLAN\n----\n1. Continue current antibiotic regimen\n2. Monitor vital signs and oxygen saturation\n3. Encourage deep breathing exercises\n4. Follow-up chest X-ray in 2 weeks\n5. Return if symptoms worsen\n",
    "image_path": "demo_dataset\\PNEUMONIA\\person82_bacteria_403.jpeg"
  },
  {
    "patient_id": "P0179",
    "basic_info": {
      "age": 61,
      "gender": "Male",
      "admission_date": "2024-10-18"
    },
    "vitals": {
      "temperature": 38.9,
      "heart_rate": 113,
      "respiratory_rate": 23,
      "blood_pressure": "132/62",
      "oxygen_saturation": 95
    },
    "symptoms": [
      "shallow breathing",
      "cough",
      "sputum production",
      "wheezing",
      "chest pain",
      "fever",
      "decreased appetite",
      "malaise",
      "fatigue"
    ],
    "medications": [
      {
        "name": "Levofloxacin",
        "dosage": "750mg",
        "frequency": "once daily"
      },
      {
        "name": "Ceftriaxone",
        "dosage": "1g",
        "frequency": "daily"
      },
      {
        "name": "Acetaminophen",
        "dosage": "650mg",
        "frequency": "every 6 hours as needed"
      },
      {
        "name": "Guaifenesin",
        "dosage": "400mg",
        "frequency": "every 4 hours as needed"
      }
    ],
    "comorbidities": [],
    "diagnosis": "Pneumonia",
    "note_text": "\nCLINICAL NOTE\n============\nPatient ID: P0179\nDate: 2024-10-18\n\nPATIENT INFORMATION\n------------------\nAge: 61\nGender: Male\nAdmission Date: 2024-10-18\n\nVITAL SIGNS\n----------\nTemperature: 38.9\u00b0C\nHeart Rate: 113 bpm\nRespiratory Rate: 23 /min\nBlood Pressure: 132/62 mmHg\nO2 Saturation: 95%\n\nPRESENTING SYMPTOMS\n-----------------\n- shallow breathing\n- cough\n- sputum production\n- wheezing\n- chest pain\n- fever\n- decreased appetite\n- malaise\n- fatigue\n\nMEDICAL HISTORY\n-------------\nComorbidities: None\n\nMEDICATIONS\n----------\n- Levofloxacin 750mg once daily\n- Ceftriaxone 1g daily\n- Acetaminophen 650mg every 6 hours as needed\n- Guaifenesin 400mg every 4 hours as needed\n\nASSESSMENT\n---------\nPatient presents with clinical and radiological findings consistent with pneumonia.\n\nPLAN\n----\n1. Continue current antibiotic regimen\n2. Monitor vital signs and oxygen saturation\n3. Encourage deep breathing exercises\n4. Follow-up chest X-ray in 2 weeks\n5. Return if symptoms worsen\n",
    "image_path": "demo_dataset\\PNEUMONIA\\person82_bacteria_405.jpeg"
  },
  {
    "patient_id": "P0180",
    "basic_info": {
      "age": 84,
      "gender": "Female",
      "admission_date": "2024-10-26"
    },
    "vitals": {
      "temperature": 38.9,
      "heart_rate": 116,
      "respiratory_rate": 23,
      "blood_pressure": "137/82",
      "oxygen_saturation": 94
    },
    "symptoms": [
      "tachypnea",
      "cough",
      "shallow breathing",
      "wheezing",
      "fatigue",
      "chills",
      "malaise",
      "sweating"
    ],
    "medications": [
      {
        "name": "Doxycycline",
        "dosage": "100mg",
        "frequency": "twice daily"
      },
      {
        "name": "Ibuprofen",
        "dosage": "400mg",
        "frequency": "every 6 hours as needed"
      }
    ],
    "comorbidities": [
      "COPD",
      "Obesity"
    ],
    "diagnosis": "Pneumonia",
    "note_text": "\nCLINICAL NOTE\n============\nPatient ID: P0180\nDate: 2024-10-26\n\nPATIENT INFORMATION\n------------------\nAge: 84\nGender: Female\nAdmission Date: 2024-10-26\n\nVITAL SIGNS\n----------\nTemperature: 38.9\u00b0C\nHeart Rate: 116 bpm\nRespiratory Rate: 23 /min\nBlood Pressure: 137/82 mmHg\nO2 Saturation: 94%\n\nPRESENTING SYMPTOMS\n-----------------\n- tachypnea\n- cough\n- shallow breathing\n- wheezing\n- fatigue\n- chills\n- malaise\n- sweating\n\nMEDICAL HISTORY\n-------------\nComorbidities: COPD, Obesity\n\nMEDICATIONS\n----------\n- Doxycycline 100mg twice daily\n- Ibuprofen 400mg every 6 hours as needed\n\nASSESSMENT\n---------\nPatient presents with clinical and radiological findings consistent with pneumonia.\n\nPLAN\n----\n1. Continue current antibiotic regimen\n2. Monitor vital signs and oxygen saturation\n3. Encourage deep breathing exercises\n4. Follow-up chest X-ray in 2 weeks\n5. Return if symptoms worsen\n",
    "image_path": "demo_dataset\\PNEUMONIA\\person83_bacteria_409.jpeg"
  },
  {
    "patient_id": "P0181",
    "basic_info": {
      "age": 50,
      "gender": "Male",
      "admission_date": "2024-10-22"
    },
    "vitals": {
      "temperature": 37.6,
      "heart_rate": 111,
      "respiratory_rate": 22,
      "blood_pressure": "136/72",
      "oxygen_saturation": 90
    },
    "symptoms": [
      "sputum production",
      "cough",
      "shallow breathing",
      "wheezing",
      "malaise",
      "fever"
    ],
    "medications": [
      {
        "name": "Levofloxacin",
        "dosage": "750mg",
        "frequency": "once daily"
      },
      {
        "name": "Azithromycin",
        "dosage": "500mg",
        "frequency": "once daily"
      },
      {
        "name": "Guaifenesin",
        "dosage": "400mg",
        "frequency": "every 4 hours as needed"
      },
      {
        "name": "Ibuprofen",
        "dosage": "400mg",
        "frequency": "every 6 hours as needed"
      }
    ],
    "comorbidities": [],
    "diagnosis": "Pneumonia",
    "note_text": "\nCLINICAL NOTE\n============\nPatient ID: P0181\nDate: 2024-10-22\n\nPATIENT INFORMATION\n------------------\nAge: 50\nGender: Male\nAdmission Date: 2024-10-22\n\nVITAL SIGNS\n----------\nTemperature: 37.6\u00b0C\nHeart Rate: 111 bpm\nRespiratory Rate: 22 /min\nBlood Pressure: 136/72 mmHg\nO2 Saturation: 90%\n\nPRESENTING SYMPTOMS\n-----------------\n- sputum production\n- cough\n- shallow breathing\n- wheezing\n- malaise\n- fever\n\nMEDICAL HISTORY\n-------------\nComorbidities: None\n\nMEDICATIONS\n----------\n- Levofloxacin 750mg once daily\n- Azithromycin 500mg once daily\n- Guaifenesin 400mg every 4 hours as needed\n- Ibuprofen 400mg every 6 hours as needed\n\nASSESSMENT\n---------\nPatient presents with clinical and radiological findings consistent with pneumonia.\n\nPLAN\n----\n1. Continue current antibiotic regimen\n2. Monitor vital signs and oxygen saturation\n3. Encourage deep breathing exercises\n4. Follow-up chest X-ray in 2 weeks\n5. Return if symptoms worsen\n",
    "image_path": "demo_dataset\\PNEUMONIA\\person83_bacteria_410.jpeg"
  },
  {
    "patient_id": "P0182",
    "basic_info": {
      "age": 80,
      "gender": "Female",
      "admission_date": "2024-10-21"
    },
    "vitals": {
      "temperature": 37.9,
      "heart_rate": 95,
      "respiratory_rate": 20,
      "blood_pressure": "119/86",
      "oxygen_saturation": 89
    },
    "symptoms": [
      "tachypnea",
      "sputum production",
      "cough",
      "decreased appetite",
      "muscle aches",
      "malaise"
    ],
    "medications": [
      {
        "name": "Levofloxacin",
        "dosage": "750mg",
        "frequency": "once daily"
      },
      {
        "name": "Guaifenesin",
        "dosage": "400mg",
        "frequency": "every 4 hours as needed"
      }
    ],
    "comorbidities": [
      "Obesity"
    ],
    "diagnosis": "Pneumonia",
    "note_text": "\nCLINICAL NOTE\n============\nPatient ID: P0182\nDate: 2024-10-21\n\nPATIENT INFORMATION\n------------------\nAge: 80\nGender: Female\nAdmission Date: 2024-10-21\n\nVITAL SIGNS\n----------\nTemperature: 37.9\u00b0C\nHeart Rate: 95 bpm\nRespiratory Rate: 20 /min\nBlood Pressure: 119/86 mmHg\nO2 Saturation: 89%\n\nPRESENTING SYMPTOMS\n-----------------\n- tachypnea\n- sputum production\n- cough\n- decreased appetite\n- muscle aches\n- malaise\n\nMEDICAL HISTORY\n-------------\nComorbidities: Obesity\n\nMEDICATIONS\n----------\n- Levofloxacin 750mg once daily\n- Guaifenesin 400mg every 4 hours as needed\n\nASSESSMENT\n---------\nPatient presents with clinical and radiological findings consistent with pneumonia.\n\nPLAN\n----\n1. Continue current antibiotic regimen\n2. Monitor vital signs and oxygen saturation\n3. Encourage deep breathing exercises\n4. Follow-up chest X-ray in 2 weeks\n5. Return if symptoms worsen\n",
    "image_path": "demo_dataset\\PNEUMONIA\\person85_bacteria_421.jpeg"
  },
  {
    "patient_id": "P0183",
    "basic_info": {
      "age": 43,
      "gender": "Female",
      "admission_date": "2024-10-25"
    },
    "vitals": {
      "temperature": 39.2,
      "heart_rate": 111,
      "respiratory_rate": 27,
      "blood_pressure": "121/83",
      "oxygen_saturation": 93
    },
    "symptoms": [
      "cough",
      "chest pain",
      "dyspnea",
      "shallow breathing",
      "wheezing",
      "fatigue",
      "decreased appetite",
      "fever",
      "malaise"
    ],
    "medications": [
      {
        "name": "Doxycycline",
        "dosage": "100mg",
        "frequency": "twice daily"
      },
      {
        "name": "Amoxicillin",
        "dosage": "500mg",
        "frequency": "three times daily"
      },
      {
        "name": "Ibuprofen",
        "dosage": "400mg",
        "frequency": "every 6 hours as needed"
      },
      {
        "name": "Guaifenesin",
        "dosage": "400mg",
        "frequency": "every 4 hours as needed"
      }
    ],
    "comorbidities": [
      "COPD",
      "Obesity",
      "Diabetes Type 2"
    ],
    "diagnosis": "Pneumonia",
    "note_text": "\nCLINICAL NOTE\n============\nPatient ID: P0183\nDate: 2024-10-25\n\nPATIENT INFORMATION\n------------------\nAge: 43\nGender: Female\nAdmission Date: 2024-10-25\n\nVITAL SIGNS\n----------\nTemperature: 39.2\u00b0C\nHeart Rate: 111 bpm\nRespiratory Rate: 27 /min\nBlood Pressure: 121/83 mmHg\nO2 Saturation: 93%\n\nPRESENTING SYMPTOMS\n-----------------\n- cough\n- chest pain\n- dyspnea\n- shallow breathing\n- wheezing\n- fatigue\n- decreased appetite\n- fever\n- malaise\n\nMEDICAL HISTORY\n-------------\nComorbidities: COPD, Obesity, Diabetes Type 2\n\nMEDICATIONS\n----------\n- Doxycycline 100mg twice daily\n- Amoxicillin 500mg three times daily\n- Ibuprofen 400mg every 6 hours as needed\n- Guaifenesin 400mg every 4 hours as needed\n\nASSESSMENT\n---------\nPatient presents with clinical and radiological findings consistent with pneumonia.\n\nPLAN\n----\n1. Continue current antibiotic regimen\n2. Monitor vital signs and oxygen saturation\n3. Encourage deep breathing exercises\n4. Follow-up chest X-ray in 2 weeks\n5. Return if symptoms worsen\n",
    "image_path": "demo_dataset\\PNEUMONIA\\person85_bacteria_422.jpeg"
  },
  {
    "patient_id": "P0184",
    "basic_info": {
      "age": 46,
      "gender": "Male",
      "admission_date": "2024-10-21"
    },
    "vitals": {
      "temperature": 39.1,
      "heart_rate": 109,
      "respiratory_rate": 23,
      "blood_pressure": "132/69",
      "oxygen_saturation": 94
    },
    "symptoms": [
      "shallow breathing",
      "cough",
      "wheezing",
      "fever",
      "muscle aches"
    ],
    "medications": [
      {
        "name": "Ceftriaxone",
        "dosage": "1g",
        "frequency": "daily"
      },
      {
        "name": "Ibuprofen",
        "dosage": "400mg",
        "frequency": "every 6 hours as needed"
      }
    ],
    "comorbidities": [
      "COPD",
      "Hypertension"
    ],
    "diagnosis": "Pneumonia",
    "note_text": "\nCLINICAL NOTE\n============\nPatient ID: P0184\nDate: 2024-10-21\n\nPATIENT INFORMATION\n------------------\nAge: 46\nGender: Male\nAdmission Date: 2024-10-21\n\nVITAL SIGNS\n----------\nTemperature: 39.1\u00b0C\nHeart Rate: 109 bpm\nRespiratory Rate: 23 /min\nBlood Pressure: 132/69 mmHg\nO2 Saturation: 94%\n\nPRESENTING SYMPTOMS\n-----------------\n- shallow breathing\n- cough\n- wheezing\n- fever\n- muscle aches\n\nMEDICAL HISTORY\n-------------\nComorbidities: COPD, Hypertension\n\nMEDICATIONS\n----------\n- Ceftriaxone 1g daily\n- Ibuprofen 400mg every 6 hours as needed\n\nASSESSMENT\n---------\nPatient presents with clinical and radiological findings consistent with pneumonia.\n\nPLAN\n----\n1. Continue current antibiotic regimen\n2. Monitor vital signs and oxygen saturation\n3. Encourage deep breathing exercises\n4. Follow-up chest X-ray in 2 weeks\n5. Return if symptoms worsen\n",
    "image_path": "demo_dataset\\PNEUMONIA\\person85_bacteria_423.jpeg"
  },
  {
    "patient_id": "P0185",
    "basic_info": {
      "age": 45,
      "gender": "Female",
      "admission_date": "2024-10-23"
    },
    "vitals": {
      "temperature": 37.7,
      "heart_rate": 107,
      "respiratory_rate": 26,
      "blood_pressure": "135/80",
      "oxygen_saturation": 88
    },
    "symptoms": [
      "wheezing",
      "cough",
      "shallow breathing",
      "tachypnea",
      "decreased appetite",
      "chills",
      "muscle aches",
      "fever"
    ],
    "medications": [
      {
        "name": "Ceftriaxone",
        "dosage": "1g",
        "frequency": "daily"
      },
      {
        "name": "Ibuprofen",
        "dosage": "400mg",
        "frequency": "every 6 hours as needed"
      }
    ],
    "comorbidities": [
      "COPD",
      "Coronary Artery Disease",
      "Chronic Kidney Disease"
    ],
    "diagnosis": "Pneumonia",
    "note_text": "\nCLINICAL NOTE\n============\nPatient ID: P0185\nDate: 2024-10-23\n\nPATIENT INFORMATION\n------------------\nAge: 45\nGender: Female\nAdmission Date: 2024-10-23\n\nVITAL SIGNS\n----------\nTemperature: 37.7\u00b0C\nHeart Rate: 107 bpm\nRespiratory Rate: 26 /min\nBlood Pressure: 135/80 mmHg\nO2 Saturation: 88%\n\nPRESENTING SYMPTOMS\n-----------------\n- wheezing\n- cough\n- shallow breathing\n- tachypnea\n- decreased appetite\n- chills\n- muscle aches\n- fever\n\nMEDICAL HISTORY\n-------------\nComorbidities: COPD, Coronary Artery Disease, Chronic Kidney Disease\n\nMEDICATIONS\n----------\n- Ceftriaxone 1g daily\n- Ibuprofen 400mg every 6 hours as needed\n\nASSESSMENT\n---------\nPatient presents with clinical and radiological findings consistent with pneumonia.\n\nPLAN\n----\n1. Continue current antibiotic regimen\n2. Monitor vital signs and oxygen saturation\n3. Encourage deep breathing exercises\n4. Follow-up chest X-ray in 2 weeks\n5. Return if symptoms worsen\n",
    "image_path": "demo_dataset\\PNEUMONIA\\person85_bacteria_424.jpeg"
  },
  {
    "patient_id": "P0186",
    "basic_info": {
      "age": 29,
      "gender": "Female",
      "admission_date": "2024-10-18"
    },
    "vitals": {
      "temperature": 38.0,
      "heart_rate": 97,
      "respiratory_rate": 22,
      "blood_pressure": "127/72",
      "oxygen_saturation": 94
    },
    "symptoms": [
      "shallow breathing",
      "wheezing",
      "cough",
      "muscle aches",
      "fever",
      "chills",
      "fatigue"
    ],
    "medications": [
      {
        "name": "Doxycycline",
        "dosage": "100mg",
        "frequency": "twice daily"
      },
      {
        "name": "Amoxicillin",
        "dosage": "500mg",
        "frequency": "three times daily"
      },
      {
        "name": "Acetaminophen",
        "dosage": "650mg",
        "frequency": "every 6 hours as needed"
      },
      {
        "name": "Ibuprofen",
        "dosage": "400mg",
        "frequency": "every 6 hours as needed"
      }
    ],
    "comorbidities": [
      "Asthma"
    ],
    "diagnosis": "Pneumonia",
    "note_text": "\nCLINICAL NOTE\n============\nPatient ID: P0186\nDate: 2024-10-18\n\nPATIENT INFORMATION\n------------------\nAge: 29\nGender: Female\nAdmission Date: 2024-10-18\n\nVITAL SIGNS\n----------\nTemperature: 38.0\u00b0C\nHeart Rate: 97 bpm\nRespiratory Rate: 22 /min\nBlood Pressure: 127/72 mmHg\nO2 Saturation: 94%\n\nPRESENTING SYMPTOMS\n-----------------\n- shallow breathing\n- wheezing\n- cough\n- muscle aches\n- fever\n- chills\n- fatigue\n\nMEDICAL HISTORY\n-------------\nComorbidities: Asthma\n\nMEDICATIONS\n----------\n- Doxycycline 100mg twice daily\n- Amoxicillin 500mg three times daily\n- Acetaminophen 650mg every 6 hours as needed\n- Ibuprofen 400mg every 6 hours as needed\n\nASSESSMENT\n---------\nPatient presents with clinical and radiological findings consistent with pneumonia.\n\nPLAN\n----\n1. Continue current antibiotic regimen\n2. Monitor vital signs and oxygen saturation\n3. Encourage deep breathing exercises\n4. Follow-up chest X-ray in 2 weeks\n5. Return if symptoms worsen\n",
    "image_path": "demo_dataset\\PNEUMONIA\\person87_bacteria_433.jpeg"
  },
  {
    "patient_id": "P0187",
    "basic_info": {
      "age": 68,
      "gender": "Male",
      "admission_date": "2024-10-24"
    },
    "vitals": {
      "temperature": 38.0,
      "heart_rate": 111,
      "respiratory_rate": 20,
      "blood_pressure": "121/76",
      "oxygen_saturation": 94
    },
    "symptoms": [
      "dyspnea",
      "cough",
      "chest pain",
      "wheezing",
      "shallow breathing",
      "sweating",
      "decreased appetite"
    ],
    "medications": [
      {
        "name": "Amoxicillin",
        "dosage": "500mg",
        "frequency": "three times daily"
      },
      {
        "name": "Guaifenesin",
        "dosage": "400mg",
        "frequency": "every 4 hours as needed"
      },
      {
        "name": "Ibuprofen",
        "dosage": "400mg",
        "frequency": "every 6 hours as needed"
      }
    ],
    "comorbidities": [
      "Coronary Artery Disease",
      "Obesity",
      "COPD"
    ],
    "diagnosis": "Pneumonia",
    "note_text": "\nCLINICAL NOTE\n============\nPatient ID: P0187\nDate: 2024-10-24\n\nPATIENT INFORMATION\n------------------\nAge: 68\nGender: Male\nAdmission Date: 2024-10-24\n\nVITAL SIGNS\n----------\nTemperature: 38.0\u00b0C\nHeart Rate: 111 bpm\nRespiratory Rate: 20 /min\nBlood Pressure: 121/76 mmHg\nO2 Saturation: 94%\n\nPRESENTING SYMPTOMS\n-----------------\n- dyspnea\n- cough\n- chest pain\n- wheezing\n- shallow breathing\n- sweating\n- decreased appetite\n\nMEDICAL HISTORY\n-------------\nComorbidities: Coronary Artery Disease, Obesity, COPD\n\nMEDICATIONS\n----------\n- Amoxicillin 500mg three times daily\n- Guaifenesin 400mg every 4 hours as needed\n- Ibuprofen 400mg every 6 hours as needed\n\nASSESSMENT\n---------\nPatient presents with clinical and radiological findings consistent with pneumonia.\n\nPLAN\n----\n1. Continue current antibiotic regimen\n2. Monitor vital signs and oxygen saturation\n3. Encourage deep breathing exercises\n4. Follow-up chest X-ray in 2 weeks\n5. Return if symptoms worsen\n",
    "image_path": "demo_dataset\\PNEUMONIA\\person87_bacteria_434.jpeg"
  },
  {
    "patient_id": "P0188",
    "basic_info": {
      "age": 24,
      "gender": "Female",
      "admission_date": "2024-10-13"
    },
    "vitals": {
      "temperature": 39.3,
      "heart_rate": 93,
      "respiratory_rate": 20,
      "blood_pressure": "111/66",
      "oxygen_saturation": 92
    },
    "symptoms": [
      "tachypnea",
      "dyspnea",
      "sputum production",
      "fever",
      "fatigue",
      "decreased appetite"
    ],
    "medications": [
      {
        "name": "Azithromycin",
        "dosage": "500mg",
        "frequency": "once daily"
      },
      {
        "name": "Acetaminophen",
        "dosage": "650mg",
        "frequency": "every 6 hours as needed"
      },
      {
        "name": "Ibuprofen",
        "dosage": "400mg",
        "frequency": "every 6 hours as needed"
      }
    ],
    "comorbidities": [
      "Coronary Artery Disease"
    ],
    "diagnosis": "Pneumonia",
    "note_text": "\nCLINICAL NOTE\n============\nPatient ID: P0188\nDate: 2024-10-13\n\nPATIENT INFORMATION\n------------------\nAge: 24\nGender: Female\nAdmission Date: 2024-10-13\n\nVITAL SIGNS\n----------\nTemperature: 39.3\u00b0C\nHeart Rate: 93 bpm\nRespiratory Rate: 20 /min\nBlood Pressure: 111/66 mmHg\nO2 Saturation: 92%\n\nPRESENTING SYMPTOMS\n-----------------\n- tachypnea\n- dyspnea\n- sputum production\n- fever\n- fatigue\n- decreased appetite\n\nMEDICAL HISTORY\n-------------\nComorbidities: Coronary Artery Disease\n\nMEDICATIONS\n----------\n- Azithromycin 500mg once daily\n- Acetaminophen 650mg every 6 hours as needed\n- Ibuprofen 400mg every 6 hours as needed\n\nASSESSMENT\n---------\nPatient presents with clinical and radiological findings consistent with pneumonia.\n\nPLAN\n----\n1. Continue current antibiotic regimen\n2. Monitor vital signs and oxygen saturation\n3. Encourage deep breathing exercises\n4. Follow-up chest X-ray in 2 weeks\n5. Return if symptoms worsen\n",
    "image_path": "demo_dataset\\PNEUMONIA\\person88_bacteria_437.jpeg"
  },
  {
    "patient_id": "P0189",
    "basic_info": {
      "age": 30,
      "gender": "Female",
      "admission_date": "2024-10-22"
    },
    "vitals": {
      "temperature": 38.2,
      "heart_rate": 87,
      "respiratory_rate": 29,
      "blood_pressure": "121/85",
      "oxygen_saturation": 91
    },
    "symptoms": [
      "wheezing",
      "dyspnea",
      "tachypnea",
      "shallow breathing",
      "cough",
      "muscle aches",
      "sweating",
      "fever"
    ],
    "medications": [
      {
        "name": "Amoxicillin",
        "dosage": "500mg",
        "frequency": "three times daily"
      },
      {
        "name": "Doxycycline",
        "dosage": "100mg",
        "frequency": "twice daily"
      },
      {
        "name": "Acetaminophen",
        "dosage": "650mg",
        "frequency": "every 6 hours as needed"
      },
      {
        "name": "Guaifenesin",
        "dosage": "400mg",
        "frequency": "every 4 hours as needed"
      }
    ],
    "comorbidities": [
      "Chronic Kidney Disease",
      "Obesity",
      "Asthma"
    ],
    "diagnosis": "Pneumonia",
    "note_text": "\nCLINICAL NOTE\n============\nPatient ID: P0189\nDate: 2024-10-22\n\nPATIENT INFORMATION\n------------------\nAge: 30\nGender: Female\nAdmission Date: 2024-10-22\n\nVITAL SIGNS\n----------\nTemperature: 38.2\u00b0C\nHeart Rate: 87 bpm\nRespiratory Rate: 29 /min\nBlood Pressure: 121/85 mmHg\nO2 Saturation: 91%\n\nPRESENTING SYMPTOMS\n-----------------\n- wheezing\n- dyspnea\n- tachypnea\n- shallow breathing\n- cough\n- muscle aches\n- sweating\n- fever\n\nMEDICAL HISTORY\n-------------\nComorbidities: Chronic Kidney Disease, Obesity, Asthma\n\nMEDICATIONS\n----------\n- Amoxicillin 500mg three times daily\n- Doxycycline 100mg twice daily\n- Acetaminophen 650mg every 6 hours as needed\n- Guaifenesin 400mg every 4 hours as needed\n\nASSESSMENT\n---------\nPatient presents with clinical and radiological findings consistent with pneumonia.\n\nPLAN\n----\n1. Continue current antibiotic regimen\n2. Monitor vital signs and oxygen saturation\n3. Encourage deep breathing exercises\n4. Follow-up chest X-ray in 2 weeks\n5. Return if symptoms worsen\n",
    "image_path": "demo_dataset\\PNEUMONIA\\person89_bacteria_440.jpeg"
  },
  {
    "patient_id": "P0190",
    "basic_info": {
      "age": 45,
      "gender": "Female",
      "admission_date": "2024-10-19"
    },
    "vitals": {
      "temperature": 39.1,
      "heart_rate": 81,
      "respiratory_rate": 21,
      "blood_pressure": "131/90",
      "oxygen_saturation": 93
    },
    "symptoms": [
      "shallow breathing",
      "sputum production",
      "chest pain",
      "sweating",
      "muscle aches",
      "chills"
    ],
    "medications": [
      {
        "name": "Azithromycin",
        "dosage": "500mg",
        "frequency": "once daily"
      },
      {
        "name": "Guaifenesin",
        "dosage": "400mg",
        "frequency": "every 4 hours as needed"
      },
      {
        "name": "Ibuprofen",
        "dosage": "400mg",
        "frequency": "every 6 hours as needed"
      }
    ],
    "comorbidities": [
      "Diabetes Type 2"
    ],
    "diagnosis": "Pneumonia",
    "note_text": "\nCLINICAL NOTE\n============\nPatient ID: P0190\nDate: 2024-10-19\n\nPATIENT INFORMATION\n------------------\nAge: 45\nGender: Female\nAdmission Date: 2024-10-19\n\nVITAL SIGNS\n----------\nTemperature: 39.1\u00b0C\nHeart Rate: 81 bpm\nRespiratory Rate: 21 /min\nBlood Pressure: 131/90 mmHg\nO2 Saturation: 93%\n\nPRESENTING SYMPTOMS\n-----------------\n- shallow breathing\n- sputum production\n- chest pain\n- sweating\n- muscle aches\n- chills\n\nMEDICAL HISTORY\n-------------\nComorbidities: Diabetes Type 2\n\nMEDICATIONS\n----------\n- Azithromycin 500mg once daily\n- Guaifenesin 400mg every 4 hours as needed\n- Ibuprofen 400mg every 6 hours as needed\n\nASSESSMENT\n---------\nPatient presents with clinical and radiological findings consistent with pneumonia.\n\nPLAN\n----\n1. Continue current antibiotic regimen\n2. Monitor vital signs and oxygen saturation\n3. Encourage deep breathing exercises\n4. Follow-up chest X-ray in 2 weeks\n5. Return if symptoms worsen\n",
    "image_path": "demo_dataset\\PNEUMONIA\\person8_virus_27.jpeg"
  },
  {
    "patient_id": "P0191",
    "basic_info": {
      "age": 63,
      "gender": "Male",
      "admission_date": "2024-10-23"
    },
    "vitals": {
      "temperature": 39.1,
      "heart_rate": 86,
      "respiratory_rate": 29,
      "blood_pressure": "133/80",
      "oxygen_saturation": 88
    },
    "symptoms": [
      "tachypnea",
      "shallow breathing",
      "cough",
      "dyspnea",
      "fatigue",
      "fever",
      "decreased appetite"
    ],
    "medications": [
      {
        "name": "Levofloxacin",
        "dosage": "750mg",
        "frequency": "once daily"
      },
      {
        "name": "Ibuprofen",
        "dosage": "400mg",
        "frequency": "every 6 hours as needed"
      }
    ],
    "comorbidities": [
      "Diabetes Type 2"
    ],
    "diagnosis": "Pneumonia",
    "note_text": "\nCLINICAL NOTE\n============\nPatient ID: P0191\nDate: 2024-10-23\n\nPATIENT INFORMATION\n------------------\nAge: 63\nGender: Male\nAdmission Date: 2024-10-23\n\nVITAL SIGNS\n----------\nTemperature: 39.1\u00b0C\nHeart Rate: 86 bpm\nRespiratory Rate: 29 /min\nBlood Pressure: 133/80 mmHg\nO2 Saturation: 88%\n\nPRESENTING SYMPTOMS\n-----------------\n- tachypnea\n- shallow breathing\n- cough\n- dyspnea\n- fatigue\n- fever\n- decreased appetite\n\nMEDICAL HISTORY\n-------------\nComorbidities: Diabetes Type 2\n\nMEDICATIONS\n----------\n- Levofloxacin 750mg once daily\n- Ibuprofen 400mg every 6 hours as needed\n\nASSESSMENT\n---------\nPatient presents with clinical and radiological findings consistent with pneumonia.\n\nPLAN\n----\n1. Continue current antibiotic regimen\n2. Monitor vital signs and oxygen saturation\n3. Encourage deep breathing exercises\n4. Follow-up chest X-ray in 2 weeks\n5. Return if symptoms worsen\n",
    "image_path": "demo_dataset\\PNEUMONIA\\person90_bacteria_442.jpeg"
  },
  {
    "patient_id": "P0192",
    "basic_info": {
      "age": 33,
      "gender": "Female",
      "admission_date": "2024-10-23"
    },
    "vitals": {
      "temperature": 37.7,
      "heart_rate": 97,
      "respiratory_rate": 21,
      "blood_pressure": "124/62",
      "oxygen_saturation": 92
    },
    "symptoms": [
      "cough",
      "shallow breathing",
      "tachypnea",
      "malaise",
      "chills",
      "fever"
    ],
    "medications": [
      {
        "name": "Ceftriaxone",
        "dosage": "1g",
        "frequency": "daily"
      },
      {
        "name": "Acetaminophen",
        "dosage": "650mg",
        "frequency": "every 6 hours as needed"
      }
    ],
    "comorbidities": [],
    "diagnosis": "Pneumonia",
    "note_text": "\nCLINICAL NOTE\n============\nPatient ID: P0192\nDate: 2024-10-23\n\nPATIENT INFORMATION\n------------------\nAge: 33\nGender: Female\nAdmission Date: 2024-10-23\n\nVITAL SIGNS\n----------\nTemperature: 37.7\u00b0C\nHeart Rate: 97 bpm\nRespiratory Rate: 21 /min\nBlood Pressure: 124/62 mmHg\nO2 Saturation: 92%\n\nPRESENTING SYMPTOMS\n-----------------\n- cough\n- shallow breathing\n- tachypnea\n- malaise\n- chills\n- fever\n\nMEDICAL HISTORY\n-------------\nComorbidities: None\n\nMEDICATIONS\n----------\n- Ceftriaxone 1g daily\n- Acetaminophen 650mg every 6 hours as needed\n\nASSESSMENT\n---------\nPatient presents with clinical and radiological findings consistent with pneumonia.\n\nPLAN\n----\n1. Continue current antibiotic regimen\n2. Monitor vital signs and oxygen saturation\n3. Encourage deep breathing exercises\n4. Follow-up chest X-ray in 2 weeks\n5. Return if symptoms worsen\n",
    "image_path": "demo_dataset\\PNEUMONIA\\person91_bacteria_449.jpeg"
  },
  {
    "patient_id": "P0193",
    "basic_info": {
      "age": 52,
      "gender": "Female",
      "admission_date": "2024-10-19"
    },
    "vitals": {
      "temperature": 39.1,
      "heart_rate": 98,
      "respiratory_rate": 25,
      "blood_pressure": "118/78",
      "oxygen_saturation": 90
    },
    "symptoms": [
      "shallow breathing",
      "dyspnea",
      "sputum production",
      "muscle aches",
      "malaise"
    ],
    "medications": [
      {
        "name": "Ceftriaxone",
        "dosage": "1g",
        "frequency": "daily"
      },
      {
        "name": "Guaifenesin",
        "dosage": "400mg",
        "frequency": "every 4 hours as needed"
      }
    ],
    "comorbidities": [],
    "diagnosis": "Pneumonia",
    "note_text": "\nCLINICAL NOTE\n============\nPatient ID: P0193\nDate: 2024-10-19\n\nPATIENT INFORMATION\n------------------\nAge: 52\nGender: Female\nAdmission Date: 2024-10-19\n\nVITAL SIGNS\n----------\nTemperature: 39.1\u00b0C\nHeart Rate: 98 bpm\nRespiratory Rate: 25 /min\nBlood Pressure: 118/78 mmHg\nO2 Saturation: 90%\n\nPRESENTING SYMPTOMS\n-----------------\n- shallow breathing\n- dyspnea\n- sputum production\n- muscle aches\n- malaise\n\nMEDICAL HISTORY\n-------------\nComorbidities: None\n\nMEDICATIONS\n----------\n- Ceftriaxone 1g daily\n- Guaifenesin 400mg every 4 hours as needed\n\nASSESSMENT\n---------\nPatient presents with clinical and radiological findings consistent with pneumonia.\n\nPLAN\n----\n1. Continue current antibiotic regimen\n2. Monitor vital signs and oxygen saturation\n3. Encourage deep breathing exercises\n4. Follow-up chest X-ray in 2 weeks\n5. Return if symptoms worsen\n",
    "image_path": "demo_dataset\\PNEUMONIA\\person92_bacteria_450.jpeg"
  },
  {
    "patient_id": "P0194",
    "basic_info": {
      "age": 69,
      "gender": "Female",
      "admission_date": "2024-10-25"
    },
    "vitals": {
      "temperature": 39.4,
      "heart_rate": 92,
      "respiratory_rate": 22,
      "blood_pressure": "115/78",
      "oxygen_saturation": 89
    },
    "symptoms": [
      "cough",
      "tachypnea",
      "sputum production",
      "fatigue",
      "fever",
      "decreased appetite"
    ],
    "medications": [
      {
        "name": "Azithromycin",
        "dosage": "500mg",
        "frequency": "once daily"
      },
      {
        "name": "Doxycycline",
        "dosage": "100mg",
        "frequency": "twice daily"
      },
      {
        "name": "Guaifenesin",
        "dosage": "400mg",
        "frequency": "every 4 hours as needed"
      },
      {
        "name": "Ibuprofen",
        "dosage": "400mg",
        "frequency": "every 6 hours as needed"
      }
    ],
    "comorbidities": [
      "COPD",
      "Diabetes Type 2"
    ],
    "diagnosis": "Pneumonia",
    "note_text": "\nCLINICAL NOTE\n============\nPatient ID: P0194\nDate: 2024-10-25\n\nPATIENT INFORMATION\n------------------\nAge: 69\nGender: Female\nAdmission Date: 2024-10-25\n\nVITAL SIGNS\n----------\nTemperature: 39.4\u00b0C\nHeart Rate: 92 bpm\nRespiratory Rate: 22 /min\nBlood Pressure: 115/78 mmHg\nO2 Saturation: 89%\n\nPRESENTING SYMPTOMS\n-----------------\n- cough\n- tachypnea\n- sputum production\n- fatigue\n- fever\n- decreased appetite\n\nMEDICAL HISTORY\n-------------\nComorbidities: COPD, Diabetes Type 2\n\nMEDICATIONS\n----------\n- Azithromycin 500mg once daily\n- Doxycycline 100mg twice daily\n- Guaifenesin 400mg every 4 hours as needed\n- Ibuprofen 400mg every 6 hours as needed\n\nASSESSMENT\n---------\nPatient presents with clinical and radiological findings consistent with pneumonia.\n\nPLAN\n----\n1. Continue current antibiotic regimen\n2. Monitor vital signs and oxygen saturation\n3. Encourage deep breathing exercises\n4. Follow-up chest X-ray in 2 weeks\n5. Return if symptoms worsen\n",
    "image_path": "demo_dataset\\PNEUMONIA\\person93_bacteria_454.jpeg"
  },
  {
    "patient_id": "P0195",
    "basic_info": {
      "age": 75,
      "gender": "Female",
      "admission_date": "2024-10-24"
    },
    "vitals": {
      "temperature": 39.3,
      "heart_rate": 83,
      "respiratory_rate": 25,
      "blood_pressure": "113/85",
      "oxygen_saturation": 90
    },
    "symptoms": [
      "sputum production",
      "wheezing",
      "shallow breathing",
      "sweating",
      "decreased appetite",
      "fever",
      "chills"
    ],
    "medications": [
      {
        "name": "Doxycycline",
        "dosage": "100mg",
        "frequency": "twice daily"
      },
      {
        "name": "Amoxicillin",
        "dosage": "500mg",
        "frequency": "three times daily"
      },
      {
        "name": "Guaifenesin",
        "dosage": "400mg",
        "frequency": "every 4 hours as needed"
      }
    ],
    "comorbidities": [
      "Obesity"
    ],
    "diagnosis": "Pneumonia",
    "note_text": "\nCLINICAL NOTE\n============\nPatient ID: P0195\nDate: 2024-10-24\n\nPATIENT INFORMATION\n------------------\nAge: 75\nGender: Female\nAdmission Date: 2024-10-24\n\nVITAL SIGNS\n----------\nTemperature: 39.3\u00b0C\nHeart Rate: 83 bpm\nRespiratory Rate: 25 /min\nBlood Pressure: 113/85 mmHg\nO2 Saturation: 90%\n\nPRESENTING SYMPTOMS\n-----------------\n- sputum production\n- wheezing\n- shallow breathing\n- sweating\n- decreased appetite\n- fever\n- chills\n\nMEDICAL HISTORY\n-------------\nComorbidities: Obesity\n\nMEDICATIONS\n----------\n- Doxycycline 100mg twice daily\n- Amoxicillin 500mg three times daily\n- Guaifenesin 400mg every 4 hours as needed\n\nASSESSMENT\n---------\nPatient presents with clinical and radiological findings consistent with pneumonia.\n\nPLAN\n----\n1. Continue current antibiotic regimen\n2. Monitor vital signs and oxygen saturation\n3. Encourage deep breathing exercises\n4. Follow-up chest X-ray in 2 weeks\n5. Return if symptoms worsen\n",
    "image_path": "demo_dataset\\PNEUMONIA\\person96_bacteria_464.jpeg"
  },
  {
    "patient_id": "P0196",
    "basic_info": {
      "age": 60,
      "gender": "Male",
      "admission_date": "2024-10-18"
    },
    "vitals": {
      "temperature": 38.1,
      "heart_rate": 103,
      "respiratory_rate": 27,
      "blood_pressure": "125/61",
      "oxygen_saturation": 90
    },
    "symptoms": [
      "tachypnea",
      "dyspnea",
      "sputum production",
      "wheezing",
      "shallow breathing",
      "fever",
      "malaise",
      "muscle aches",
      "fatigue"
    ],
    "medications": [
      {
        "name": "Azithromycin",
        "dosage": "500mg",
        "frequency": "once daily"
      },
      {
        "name": "Guaifenesin",
        "dosage": "400mg",
        "frequency": "every 4 hours as needed"
      },
      {
        "name": "Ibuprofen",
        "dosage": "400mg",
        "frequency": "every 6 hours as needed"
      }
    ],
    "comorbidities": [
      "COPD",
      "Obesity"
    ],
    "diagnosis": "Pneumonia",
    "note_text": "\nCLINICAL NOTE\n============\nPatient ID: P0196\nDate: 2024-10-18\n\nPATIENT INFORMATION\n------------------\nAge: 60\nGender: Male\nAdmission Date: 2024-10-18\n\nVITAL SIGNS\n----------\nTemperature: 38.1\u00b0C\nHeart Rate: 103 bpm\nRespiratory Rate: 27 /min\nBlood Pressure: 125/61 mmHg\nO2 Saturation: 90%\n\nPRESENTING SYMPTOMS\n-----------------\n- tachypnea\n- dyspnea\n- sputum production\n- wheezing\n- shallow breathing\n- fever\n- malaise\n- muscle aches\n- fatigue\n\nMEDICAL HISTORY\n-------------\nComorbidities: COPD, Obesity\n\nMEDICATIONS\n----------\n- Azithromycin 500mg once daily\n- Guaifenesin 400mg every 4 hours as needed\n- Ibuprofen 400mg every 6 hours as needed\n\nASSESSMENT\n---------\nPatient presents with clinical and radiological findings consistent with pneumonia.\n\nPLAN\n----\n1. Continue current antibiotic regimen\n2. Monitor vital signs and oxygen saturation\n3. Encourage deep breathing exercises\n4. Follow-up chest X-ray in 2 weeks\n5. Return if symptoms worsen\n",
    "image_path": "demo_dataset\\PNEUMONIA\\person96_bacteria_466.jpeg"
  },
  {
    "patient_id": "P0197",
    "basic_info": {
      "age": 47,
      "gender": "Male",
      "admission_date": "2024-10-19"
    },
    "vitals": {
      "temperature": 39.0,
      "heart_rate": 116,
      "respiratory_rate": 26,
      "blood_pressure": "121/76",
      "oxygen_saturation": 93
    },
    "symptoms": [
      "dyspnea",
      "wheezing",
      "chest pain",
      "sputum production",
      "cough",
      "fever",
      "chills"
    ],
    "medications": [
      {
        "name": "Doxycycline",
        "dosage": "100mg",
        "frequency": "twice daily"
      },
      {
        "name": "Ceftriaxone",
        "dosage": "1g",
        "frequency": "daily"
      },
      {
        "name": "Acetaminophen",
        "dosage": "650mg",
        "frequency": "every 6 hours as needed"
      }
    ],
    "comorbidities": [
      "Coronary Artery Disease",
      "Hypertension",
      "Chronic Kidney Disease"
    ],
    "diagnosis": "Pneumonia",
    "note_text": "\nCLINICAL NOTE\n============\nPatient ID: P0197\nDate: 2024-10-19\n\nPATIENT INFORMATION\n------------------\nAge: 47\nGender: Male\nAdmission Date: 2024-10-19\n\nVITAL SIGNS\n----------\nTemperature: 39.0\u00b0C\nHeart Rate: 116 bpm\nRespiratory Rate: 26 /min\nBlood Pressure: 121/76 mmHg\nO2 Saturation: 93%\n\nPRESENTING SYMPTOMS\n-----------------\n- dyspnea\n- wheezing\n- chest pain\n- sputum production\n- cough\n- fever\n- chills\n\nMEDICAL HISTORY\n-------------\nComorbidities: Coronary Artery Disease, Hypertension, Chronic Kidney Disease\n\nMEDICATIONS\n----------\n- Doxycycline 100mg twice daily\n- Ceftriaxone 1g daily\n- Acetaminophen 650mg every 6 hours as needed\n\nASSESSMENT\n---------\nPatient presents with clinical and radiological findings consistent with pneumonia.\n\nPLAN\n----\n1. Continue current antibiotic regimen\n2. Monitor vital signs and oxygen saturation\n3. Encourage deep breathing exercises\n4. Follow-up chest X-ray in 2 weeks\n5. Return if symptoms worsen\n",
    "image_path": "demo_dataset\\PNEUMONIA\\person97_bacteria_468.jpeg"
  },
  {
    "patient_id": "P0198",
    "basic_info": {
      "age": 20,
      "gender": "Male",
      "admission_date": "2024-10-21"
    },
    "vitals": {
      "temperature": 38.8,
      "heart_rate": 104,
      "respiratory_rate": 27,
      "blood_pressure": "126/81",
      "oxygen_saturation": 88
    },
    "symptoms": [
      "tachypnea",
      "cough",
      "sputum production",
      "dyspnea",
      "wheezing",
      "chills",
      "muscle aches",
      "sweating"
    ],
    "medications": [
      {
        "name": "Amoxicillin",
        "dosage": "500mg",
        "frequency": "three times daily"
      },
      {
        "name": "Ibuprofen",
        "dosage": "400mg",
        "frequency": "every 6 hours as needed"
      },
      {
        "name": "Guaifenesin",
        "dosage": "400mg",
        "frequency": "every 4 hours as needed"
      }
    ],
    "comorbidities": [
      "COPD",
      "Obesity",
      "Asthma"
    ],
    "diagnosis": "Pneumonia",
    "note_text": "\nCLINICAL NOTE\n============\nPatient ID: P0198\nDate: 2024-10-21\n\nPATIENT INFORMATION\n------------------\nAge: 20\nGender: Male\nAdmission Date: 2024-10-21\n\nVITAL SIGNS\n----------\nTemperature: 38.8\u00b0C\nHeart Rate: 104 bpm\nRespiratory Rate: 27 /min\nBlood Pressure: 126/81 mmHg\nO2 Saturation: 88%\n\nPRESENTING SYMPTOMS\n-----------------\n- tachypnea\n- cough\n- sputum production\n- dyspnea\n- wheezing\n- chills\n- muscle aches\n- sweating\n\nMEDICAL HISTORY\n-------------\nComorbidities: COPD, Obesity, Asthma\n\nMEDICATIONS\n----------\n- Amoxicillin 500mg three times daily\n- Ibuprofen 400mg every 6 hours as needed\n- Guaifenesin 400mg every 4 hours as needed\n\nASSESSMENT\n---------\nPatient presents with clinical and radiological findings consistent with pneumonia.\n\nPLAN\n----\n1. Continue current antibiotic regimen\n2. Monitor vital signs and oxygen saturation\n3. Encourage deep breathing exercises\n4. Follow-up chest X-ray in 2 weeks\n5. Return if symptoms worsen\n",
    "image_path": "demo_dataset\\PNEUMONIA\\person99_bacteria_473.jpeg"
  },
  {
    "patient_id": "P0199",
    "basic_info": {
      "age": 60,
      "gender": "Male",
      "admission_date": "2024-10-25"
    },
    "vitals": {
      "temperature": 39.0,
      "heart_rate": 109,
      "respiratory_rate": 29,
      "blood_pressure": "114/79",
      "oxygen_saturation": 91
    },
    "symptoms": [
      "chest pain",
      "wheezing",
      "dyspnea",
      "chills",
      "fatigue",
      "sweating",
      "muscle aches"
    ],
    "medications": [
      {
        "name": "Doxycycline",
        "dosage": "100mg",
        "frequency": "twice daily"
      },
      {
        "name": "Acetaminophen",
        "dosage": "650mg",
        "frequency": "every 6 hours as needed"
      },
      {
        "name": "Ibuprofen",
        "dosage": "400mg",
        "frequency": "every 6 hours as needed"
      }
    ],
    "comorbidities": [
      "COPD",
      "Hypertension"
    ],
    "diagnosis": "Pneumonia",
    "note_text": "\nCLINICAL NOTE\n============\nPatient ID: P0199\nDate: 2024-10-25\n\nPATIENT INFORMATION\n------------------\nAge: 60\nGender: Male\nAdmission Date: 2024-10-25\n\nVITAL SIGNS\n----------\nTemperature: 39.0\u00b0C\nHeart Rate: 109 bpm\nRespiratory Rate: 29 /min\nBlood Pressure: 114/79 mmHg\nO2 Saturation: 91%\n\nPRESENTING SYMPTOMS\n-----------------\n- chest pain\n- wheezing\n- dyspnea\n- chills\n- fatigue\n- sweating\n- muscle aches\n\nMEDICAL HISTORY\n-------------\nComorbidities: COPD, Hypertension\n\nMEDICATIONS\n----------\n- Doxycycline 100mg twice daily\n- Acetaminophen 650mg every 6 hours as needed\n- Ibuprofen 400mg every 6 hours as needed\n\nASSESSMENT\n---------\nPatient presents with clinical and radiological findings consistent with pneumonia.\n\nPLAN\n----\n1. Continue current antibiotic regimen\n2. Monitor vital signs and oxygen saturation\n3. Encourage deep breathing exercises\n4. Follow-up chest X-ray in 2 weeks\n5. Return if symptoms worsen\n",
    "image_path": "demo_dataset\\PNEUMONIA\\person99_bacteria_474.jpeg"
  }
]